{
  "hyperparameters": {
    "k": 5,
    "chunk_type": "paragraphs",
    "chunk_size": 10
  },
  "chroma_db_size": 231,
  "total_time": 148.3551697731018,
  "timestamp": "2025-03-28T01:09:48.018393",
  "results": [
    {
      "question": "Under what conditions does ownership of the Drawings and Specifications transfer to the Owner?**",
      "llm_response": "Ownership of the Drawings and Specifications transfers to the Owner upon payment of all fees due and owing to the Architect for professional services under the Agreement. After payment, all rights, title, and interest in the Drawings and Specifications prepared by the Architect and its consultants become the property of the Owner.",
      "ground_truth_answer": "Ownership transfers to the Owner upon full payment of fees owed to the Architect.",
      "retrieved_context": [
        "(2) the form of agreement between the Owner and Contracto r; and (3) the Conditions of the Contract for Construction (General, Supplementary and other Conditions); and (4) compi le a project manual that include s the Conditions of the Contract for Construction and may includ e bidding requirements and samp le form s. \u00a7 3.4.4 Prior to the conc lusion of the Construction Document s Phase, the Architect shall submit the Construction Document s to the Owner and the Construction Manager . The Architect shall meet with the Owner and Construction Manager to review the Construction Document s at fifty percent (50%) and ninety-five percent (95%) completion. \u00a7 3.4.5 Upon receipt of the Construction Manager ' s information and estimate at the conclusion of the Construction Document s Phase, the Architect shall take action as required under Section 6. 7 and request the Owner 's approval of the Constr uction Documents. \u00a7 3.4.6 The Architect shall prepare early bidding packag es for each Project in conjunction with Construction Manager 's requirements to includ e site, foundations, structu ral steel and under-sl ab utiliti es. AlA Document 8132\"'- 2009 (formerly B141'MCMa -1992). Copyright\u00a9 1992 and 2009 by The American Institute of Architects. All right s reserved . WARN ING: This AlA ~ \u00b7 Document is protected by U.S. Copyright Law and International Treaties . Unauthorized reproduction or distribution of this A l A ~ \u00b7 9 Document , or any portion of it, may result In severe civil and crimina l penalties , and will be prosecuted to the maximum extent possib le under the law. This document was produced by AlA software at 13:26:47 on 08/01/2017 under Order No.2341018896 _1 which expire s on 01/01 /2018 , and is not for resale. User Notes : (1232093781) I nit. \u00a7 3.5 Bidding Phase Services \u00a7 3.5.1 General Following the Owner's approval ofthe Construction Documents , the Architect shall assist the Owner and Construction Manager in (I) obtaining competitive bids ; (2) confirming responsiveness of bids; (3) determining the successful bidder , if any; and (4) awarding the contracts for construction, including early bidding packages in conjunction with Construction Managers ' requirements. \u00a7 3.5.2 Competitive Bidding \u00a7 3.5.2 .1 Bidding Documents shall consist ofbidding requirements and proposed Contract Documents. \u00a7 3.5.2.2 The Architec t shall assist the Owner and Construction Manager in bidding the Project by .1 facilitating the reproduction of Bidding Documents for distribution to prospective bidders, .2 participating in a pre-bid conference for prospective bidders , and .3 preparing responses to question s fi\u00b7om prospective bidders and providing clarifications and interpretations ofthe Bidding Documents in the form of addenda. \u00a7 3.5.2.3 The Architect shall consider reque sts for substitutions, if the Bidding Documents permit subst itution s, and shall consult with the Construction Manager and prepare and distribute addenda identifYing approved subst itutions to all prospective bidders. (Paragraphs delet ed) \u00a7 3.6 Construction Phase Services \u00a7 3.6.1 General \u00a7 3.6.1.1 The Architect shall provide administration of the Contract between the Owner and the Contractor as set forth below and in the modified AlA Document A232\u2122 -2009, General Conditions of the Contract for Construction, Construction Manager as Adviser Edition. If the Owner and Contrac tor modifY AlA Document 232-2009, those modification s shall not affect the Architect's services under this Agreement, unless the Ovvner and Architect amend this Agreement. \u00a7 3.6.1.2 The Architect shall advise and cons ult with the Owner and Construction Manager during the Construction Phase Services unti I final pa)~nent to the Contractors are due and all punch list item s are complete and the Certification of Substantial Completions for each Project is issue d. The Architect shall have authority to act on behalf of the Owner only to the extent provided in this Agreement. The Architect shall not have control over, charge of, or responsibility for the construction means, methods, techniques, sequences or procedures, or for safety precautions and programs in connection with the Work , nor shall the Architect be responsib le for the Contractor's failure to perform the Work in accordance with the requirement s of the Contract Documents. The Architect shall be responsible for the Archi tect's negligent acts or omissions, but shall not have control over or charge of, and shall not be responsible for, acts or omiss ions of the Construction Manager, or the Contractor or of any other persons or entities performing portions of the Work. \u00a7 3.6.1.3 Subject to Section 4.3, the Architect's responsibility to provide Construction Phase Services commences with the award of the Cont ract for Construction and terminates on the date the Architect issues the final Certificate for Pa~nent and after the one (I) year Contractor Warranty period. \u00a7 3.6.2 Evaluations of the Work \u00a7 3.6.2.1 The Architect shall visit the site at intervals appropriate to the stage of construction, to become generally familiar with the progress and quality of the portion ofthe Work completed, and to determine , in general, if the Work observed is being performed in a manner indicatin g that the Work, when fully completed , will be in accordance with the Contract Documents. The Architect shall also attend the Owner/ Architect /Construction Manager meetings and shall be available with reasonable promptness as needed to address other issues related to the progres s of construction . However , the Architect shall not be required to make exhaustive or continuous on-site inspections to check the quality or quantity of the Work. On the basis of the site visits, the Architect shall keep the Owner informed about the progress and quality of the portion of the Work completed, and report to the Owner and the Construction Manager (I) known deviations from the Contract Documents and from the most recent construction schedule, and (2) defect s and deficiencie s observed in the Work . AlA Document B1321M-2009 (formerly 8141 TMCMa- 1992). Copyright\u00a9 1992 and 2009 by The American Institute of Arch itects . All rights reserved. WARNING: This AlA\"' Document is protected by U.S. Copyr ight Law and Internat ional Treaties . Unauthor ized reproduction or distribution of this AlA ~ 1 O Document , or any portion of it, may result in severe civil and crim inal pena lties, and will be prose cuted to the maximu m extent possible under the Jaw. This document was produced by AlA software at 13:26:47 on 08/01/2017 under Order No.2341018896_1 which expires on 01/01/2018 , and is not for resale. UserNotes: (1232093781) I nit. \u00a7 3.6.2.2 The Architect has the authority to reject Work that does not conform to the Contract Documents and shall notify the Construction Manager about the rejection . Whenever the Architect considers it necessary or advisable for implementing the intent of the Contract Document s, the Architect , upon written authorization from the Owner and notification to the Construction Manager. shall have the authority to require inspection or testing ofthe Work in accordance with the provisions of the Contract Document s, whether or not such Work is fabricated , installed or completed. However , neither this authority of the Architect nor a decision made in good faith either to exercise or not to exercise such authority shall give rise to a duty or responsibility of the Architect to the Contractor, Subcontractors, materia l and equipment suppliers , their agent s or employees or other persons or entitie s performing portions of the Work . \u00a7 3.6.2.3 (Stricken) \u00a7 3.6.2.4 Interpretations and decisions of the Architect shall be consi stent with the intent of and reasonably inferab le fi\u00b7om the Contract Documents and shall be in writing or in the form of drawings approved by the Construction Manager . When making such interpretations and decisions, the Architect shall endeavor to secure faithful performance by both Owner and Contractor , shall not show partiality to either , and shall not be liable for results of interpretations or decisions rendered in good faith. The Architect's decisions on matter s relating to aesthetic effect shall be final if consistent with the intent expressed in the Contract Documents . The Architect shall assist the Owner in matters relating to aesthetic effect and determine what course of action is consistent with the intent expressed in the Conn\u00b7act Documents. The Owner and Consn \u00b7uction Manager , however , shall have final authority on all matter s relating to aesthetic effect. \u00a7 3.6.2.5 The Architect shall render decisions on Claims between the Owner and Contractor as provided in the Conn \u00b7act Documents. \u00a7 3.6.3 Certificates for Paymen t to Contr actor \u00a7 3.6.3.1 The Architect shall review and certify an application tor payment not more fi\u00b7equently than monthly. Within seven (7) days after the Architect receive s an application for pa;ment forwarded rrom the Cons truction Manager , the Architect shall review and certify the application as follows: .1 Where there is only one Cont ractor responsib le for performing the Work, the Architect shall review the Contractor's Application and Certificate for Payment that the Construction Manager has previously reviewed and certified . The Architect shall certify the amount due the Contractor and shall issue a Certificate for Payment in such amount. .2 Where there are Multiple Prime Contracto rs responsible for performing different portion s of the Project, the Architect shall review a Project Application and Project Certificate for Payment , with a Summary ofConn \u00b7actor s' Application s for Payment, that the Construction Manager has previou sly prepar ed, reviewed and certified. The Architect shall certify the amounts due the Contractor s and shall issue a Project Certificate for Payment in the total of such amounts. \u00a7 3.6.3.2 The Architect's certification for payment shall constitute a representation to the Owner , based on (I) the Architect's evaluation of the Work as provided in Section 3.6.2, (2) the data comprisi ng the Contractor 's Application for Payment or the data compri sing the Project Application for Payment , and (3) the recommendation of the Construction Manager, that, to the best of the Architect 's knowledge , information and belief , the Work has progressed to the point indicated and that the quality of the Work is in accordance with the Cont ract Documents. The foregoing representations are subject (I) to an evaluation of the Work for confo rmance with the Contract Documen ts upon Substantial Comp letion, (2) to results of subsequent tests and inspections, (3) to correction of min or deviation s from the Contract Document s prior to comp letion , and ( 4) to specific qualifications expressed by the Architect. The Architect shall maintain a record of the Contractor 's Application s for Payment. \u00a7 3.6.3.3 The issuance of a Certificate for Payment or a Project Certificate for Payment shall not be a representat ion that the Architect has (1) made exhaustive or continuous on-site inspections to check the qualit y or quantity of the Work , (2) reviewed construction mean s, methods, techniques , sequence s or procedure s, (3) reviewed copies of requi sitions received from Subcontractors and material supplier s and other data requested by the Owner to substantiate the Contractor's right to payment , or (4) ascertained how or for what purpose the Contracto r has used money previously paid on account of the Contract Sum. AlA Document 8132\"'- 2009 (formerly 8141 \"'CMa -1992). Copyright \u00a9 1992 and 2009 by The American Institute of Arch itects. All rights reserved. WARNING : This AlA ~ Document is protected by U.S. Copyr ight Law and Internat ional Treaties . Unauthorized reprod uction or distributio n of this A l A ~ \u00b7 11 Document , or any portio n of it, may result in severe civil and criminal penalties, and will be prosecu ted to the maxim um exten t possible under the law. This document was produced by AlA softv.lare at 13:26:47 on 0810112017 under Order No.2341 018896_1 which expires on 0110112018 , and is not for resale. User Notes : (123209378 1) I nit. \u00a7 3.6.3.4 The Architect shall maintain a record of the application s and certificate s for payment. \u00a7 3.6.4 Submittals \u00a7 3.6.4.1 The Architect shall review the Construction Manager ' s Project submittal schedu le and shall not unre asonab ly delay or withhold approval. The Architect ' s action in reviewing submitt als transmitted by the Construction Manager shall be taken in accordance with the approved submittal schedule or, in the absence of an approved submittal schedule , with reasonable promptne ss while allowing sufficient time in the Architect's professional judgment to permit adequate review. \u00a7 3.6.4.2 In accordance with the Architect-approved Project submittal schedule , and after the Construction Manager reviews, approves and transmit s the submittal s, the Architect shall review and approve or take other appropriate action upon the Contractor's submittal s such as Shop Drawing s, Product Data and Samples, but only for the limited purpose of checking for conformance with information given and the design concept expre ssed in the Contract Document s. Review of such submittal s is not for the purpose of determ ining the accuracy and completeness of other in formation such as dimensions, quantiti es, and installation or perfor mance of equipment or systems, which are the Contractor ' s responsibilit y. The Architect' s review shall not constitute approval of safety precautions or. unless otherwise specifica lly stated by the Architect , of any construction mean s, method s, techniques, sequences or proce dures. The Architect's approva l of a spec ific item shall not indicate approval of an assembl y of which the item is a component. \u00a7 3.6.4 .3 If the Contract Document s spec ificall y require the Contractor to provide profess ional design services or certifications by a design profe ssional related to systems , materia ls or equipment , the Architect shall specify the appropriate performance and design criter ia that such services must satisfy. The Architect shall review shop drawings and other submittal s related to the Work designed or certified by the design professional retained by the Contractor that bear such profe ssional 's seal and signature when submitted to the Architect. The Architect shall be entitled to rely upon the adequacy. accuracy and completeness of the services, certifications and approvals performed or provided by such design professional s. \u00a7 3.6.4.4 A Her receipt of the Construction Manager' s recommendation s. the Archi .tect shall review and respond to requests fl.)r information about the Contract Documents. The Architect , in consultat ion with the Construction Manager , sha ll set forth in the Contract Docume nts the requirements for requ ests for information. Requests for information shall include , at a minimum , a detai led written statement that indicate s the specific Drawings or Specifications in need of clarifi cation and the nature of the clarification reque sted. The Architect ' s response to such reque sts sh all be made in writi ng w ithin any time limit s agreed upon, or otherwise with reasona ble promptn ess. If appropria te, the Architect shall prepare and issue supplemen tal Drawings and Specifications in response to reque sts for inform ation. \u00a7 3.6.4.5 The Architect shall maintain a record of submitta ls and copies of submittal s transmitted by the Const ruction Manager in accordance with the requir ements of the Contract Document s. \u00a7 3.6.5 Changes in the Work \u00a7 3.6.5.1 T he Architect shall review and sign, or take other appropria te action, on Change Orders and Construction Chan ge Directives prepared by the Construction Mana ger for the Owner's approval and execution in accordance with the Contract Documents . \u00a7 3.6.5.2 The Architect may autho rize minor change s in the Work that are consistent with the intent of the Contract Documents and do not involve an adjustment in the Contract Sum or an exten sion of the Contract Time. Such chan ges shall be effected by written order issued by the Architect through the Construction Manager . \u00a7 3.6.5.3 The Arch itect shall maintain records relative to changes in the Work. \u00a7 3.6.6 Project Completion \u00a7 3.6.6.1 The Architect , assisted by the Construction Man ager, shall conduct inspections to detennin e the date or dates of Substantial Completion and the date of final comp letion; issue Certificate s of Substantia l Completion prepared by the Construction Manager; receive from the Construction Manager and review written wan\u00b7anties and related documents requ ired by the Contract Document s and assembled by the Contractor; and, after receipt of a final AlA Document 6132\"\u2022- 2009 (formerly 6141 \"'CMa -1992) . Copyright \u00a9 1992 and 2009 by The American Institute of Architects . All rights reserved . WARNING : This AlA! Document is protected by U.S. Copyright Law and International Treaties. Unauthor ized reproductio n or distribution of this AlA' ' 12 Document , or any portion of it, may result in severe civil and criminal penalties , and will be prosecuted to the maximum extent possible under the law. This document was produced by AlA software at 13;26:47 on 08/01/2017 unde r Order No.23410188 96_1 which expires on 01/01/2018 . and is not for resale User Notes: {1232093781) I nit. Contractor's Application and Certificate for Payment or a tina! Project Application and Project Certificate for Payment fi\u00b7mn the Construction Manager , issue a final Certificate for Payment based upon a final inspection indicating the Work comp lies with the requirements of the Contract Documents . \u00a7 3.6.6.2 The Architect 's inspections shall be conducted with the Owner and Construction Manager to check conformance of the Work with the requirements of the Contrac t Documents and to verify the accuracy and completeness of the list submitted by the Construc tion Manager and Contractor of Work to be completed or corrected. \u00a7 3.6.6.3 When the Work is found to be substantially complete by the Construction Manager and Architect, and after certification by the Construction Manager and the Architect, the Architect shall inform the Ow\u00b7ner about the balance of the Contract Sum remaining to be paid the Contractor, including the amount to be retained fi\u00b7om the Contract Sum , if any, for final completion or correction of the Work . \u00a7 3.6.6.4 Upon requ est of the Owner, and prior to the expiration of one (I) year from the date of Substantial Completion, the Architect shall, without additional compensation, conduct a meeting with the Ovvner to review the facilit y operations and performance. ARTICLE 4 ADDITIONAL SERVICES \u00a7 4.1 Unless specifically identified as a Basic Service, any services not included in Basic Services but required for the Project are additional services. The Owner must provide prior written consent before the Architect commences Additional Services. If the Owner provides consent to the Additional Services, the Owner shall compensate the Architect as provided in Section 11.2. Services Responsibility Location of Service Description (Architect, Owner (Section 4.2 below or in an exhibit or allached to this docume111 and Not Provided) ident if/ed below) (Row deleted) (Row deleted) AlA Document B132 TM-2009 (formerly B141fMCMa -1992). Copyright\u00a9 1992 and 2009 by The American Institute of Architects. All rights reserved. WARN ING: This AlA' ' Document is protected by U.S. Copyright Law and Internationa l Treaties . Unauthorized reproduction or distr ibution of this AlA\"' 13 Document , or any portion of it, may result in severe civil and crimina l penalties , and will be prosecuted to the maximum extent poss ible under the law. This document was produced by AlA software at13:26:47 on 08/01 /2017 under Order No.2341018896_1 which expires on 01/01/2018 , and is not for resale. User Notes : (1232093 781) I nit. \u00a7 4.2 Addit ional Service s may be provided after execution of this Agreement , without invalidating the Ag reement. Except for service s required due to th e fault of the Architect, any Additional Servic es provided in accordan ce \u2022.vith this Article 4 shall entitle the Architect to compen sation pursuant to Section 11.3, and an appropriate adjustment in the Archit ect' s schedule . If the Architect believes it is entitled to additional comp ensation for services the Architect believes are needed or for other services reque sted by the Owner, the Arch itect shall notifY the Owner in writing with reasonable promptnes s and ( I) ex plain the basis of the Architecfs belief that such services are outside the scope of Basic Serv ices, and (2) provide an estimate of the probable cost of such service s and probabl e impact , if any, on the Architect ' s schedu le. The Architect shall not provide services for which the Architect believe s it is entit led to additional compensation until the Architect receives the Owner's written authorization , which authorization will either (1) acknowledge that the Architect is entit led to additional compen sation, or (2) deny that the Architect is entitled to additional compensation , and direct the Architect to proceed with the service s, in which case the Architect may pursue a claim for additiona l compe nsation under Article 8. (Para graphs delete d) ARTICLE 5 OWNER 'S RESPONSIBILITIES \u00a7 5.1 U nless otherwise provided for under this Agreeme nt, the Owner shall provid e information in a timel y manner regarding requiremen ts for and limitation s on the Project , including a written program which shall set forth the Owner ' s object ives, sch edule , constraint s and criteria , including space requirement s and relation ships, flexibility, expandabi lity, special equipment, systems and site requirements . \u00a7 5.2 The Owner has retained a Construction Manager to provide services, duties and respon sibilitie s as described in the modified AlA Document C 132-2009 , Standard Form of Agreement Between Owner and Constructio n Manager. The Owner shall provide the Archit ect a copy of the executed agreement between the Owner and the Construct ion Manager. \u00a7 5.3 The Owner shall furnish the service s of a Construction Manager that shall be respon sible for creating the overall Project schedu le. The Owner shall adjust the Project schedule, if necessa ry. as the Project proceed s. \u00a7 5.4 The Owner shall establish and periodically up date the Owner' s budget tor the Project . includin g (I) the budget t o r the Cost of the Work as defined in Section 6.1. (2) the Own er' s other costs, and (3) reasonable contingencie s related to all of these costs. The Owne r sha ll furni sh the services of a Construction Man ager that shall be responsible for preparing all estimates of the Cost of the Work. If the Own er significantly increa ses or decre ases the Owner ' s budget for the Cost of the Work , the Owner shall notify the Archit ect and the Construction Manager . \u00a7 5.4.1 The Own er acknowledge s that accelerated, phased or fast-track schedul ing provid es a benefit , but also carri es with it associated risks. Such risks include the Owner incuJTing costs for the Arch itect to coordinate and redesign portion s of the Project affected by procuring or installing element s of the Project prior to the completion of all relevant Construction Document s. and costs for the Contractor to remove and replace previou sly installed Work . lfthe Owner select s accelerated , phased or fast-track scheduling , the Owne r agree s to include in the budget for the Project sufficient conti ngencies to cover such costs. \u00a7 5.5 The Owner shall identify a representative authorized to act on the Owner' s behalf with respect to the Project. The Owner shall render decisions and approve the Architect's submittals in a timely manner in order to avoid unrea sonable delay in the orderly and sequential progre ss of the Architect's services. \u00a7 5.6 The Owner shall furnish surveys to describe physical characteristics, legal limitation s and utility location s for the site of the Project , and a written legal descript ion of the site. The surveys and legal information shall include, as applicable , grades and lines of street s, alleys, pavements and adjoining property and structure s; designated wetlands; adjacent drainage; rights-of-way, restriction s, easement s, encroachment s, zoning , deed restriction s, boundar ies and contours of the site; locations , dimensions and nece ssary data with respect to existing buildings , other improvement s and trees ; and information concerning available utility services and lines , both public and private , above and below grade, including inverts and depths. All the infonnat ion on the survey shall be referenced to a Project benchmark . \u00a7 5.7 The Owne r shall furni sh services of geotechni cal engineers, which may include but are not limit ed to test boring s, test pits, determination s of soil bearing values, percolation tests, evaluation s of hazardou s materials, seismic evaluation , ground corrosion tests and resistivity tests, including neces sary operation s for anticipating subsoil conditions , with written report s and appropriate recommendation s. The Architect shall assist the Ovme r in AlA Document 8132\"' -2009 (fonnerly 8141 tMCMa -1992). Copyright \u00a9 1992 and 2009 by The American Institute of Architects. All rights reserved. WARN ING: This AlA ~\u00b7 Document is protected by U.S. Copyright Law and International Treaties . Unauthorized reproduction or distribution of this A l A ~ 14 Document , or any portion of it, may result in severe civil and crimina l pena lties, and will be prosecuted to the maximum extent poss ible under the law. This document was produced by AlA software at 13:26:47 on 08/01/2017 under Order No.2341018896_1 which expires on 01/01/2018 , and is not for resale. User Notes : (1232093781) I nit. ascertaining the information nece ssary relative to all geotechnical services and shall. on behalf oft he Owner. solic it quotations for such work. The Architect shall review quotations received and forward them to the Owner with recommendations . \u00a7 5.8 The Owner shall coordinate the services of its own consultants with those services provided by the Architect. Upon the Architect's request , the Owner shall fum ish copies of the scope of services in the contracts between the Owner and the Owner 's consultant s. The Owne r shall furnish the services of consulta nts other than those designated in this Agreement, or authorize the Architect to furnish them as an Additional Service, when the Architect request s such service s and demonstrates that they are reasonabl y required by the scope of the Project . The Owner shall require that its consulta nts maintain professional liability insurance and other liability insurance as appropriate to the services provided. \u00a7 5.9 The Owner shall furnish tests, inspection s and rep01ts required by law or the Contract Document s, such as structural , mechanical, and chemical tests. tests for air and water pollution , and tests for hazardou s materials . \u00a7 5.10 The Owner shall furnish all legal, insurance and accounting service s, including auditing services, that may be reasonably necessary at any time for the Project to meet the Owner's needs and interests. \u00a7 5.11 The Owner shall provide prompt written notice to the Architect and Construct ion Manager ifthe Owner becomes aware of any fault or defect in the Project , including errors, omis sions or incon sistencies in the Architect's Instrument s of Service. \u00a7 5.12 Except as otherwise provid ed in the Contract Document s or when direct communications have been specially authorized , the Owner shall endeavor to communicate with the Contracto rs through the Construction Manager, and shall contemporaneously provide the same communication s to the Architect about matters arising out of or relating to the Contract Documents. Communication s by and with the Architect's consultant s shall be through the Architect. \u00a7 5.13 Before executing the Contracts for Construction , the Owner shall coordinate the Architect's duties and responsibilitie s set forth in the Contract s for Construction with the Architect\"s services set forth in this Agreement. The Owner shall provide the Architect a copy of the exec uted agreement between the Owner and Contractor , including the modified General Condition s of the Contract for Construction. \u00a7 5.14 The Owner shall provide the Architect access to the Project site prior to commencement of the Work and shall obligate the Construction Manager and Contractor to provide the Architect access to the Work wherever it is in preparation or progres s. ARTICLE 6 COST OF THE WORK \u00a7 6.1 For purposes of this A!:,rreement , the Cost ofthe Work shall be the total cost to the Owner of to construct all element s of the Project designed or specified and shall include the Contractors' general conditions costs, overhead and profit; however, all element s composing the Cost oft he Work for the Proje ct may not be coordinated by Architect and may be purchase directly by Owner. The Cost of the Work include s the compensation of the Construction Manager and Construction Manager 's consu ltants during the Construction Phase only, including compensation for reimbur sable expenses at the job site, if any. The Cost of the Work does not include the compensation of the Architect, the costs of the land, rights-of-way , financing, contingencies for changes in the Work or other costs that are the responsibility of the Owner . \u00a7 6.2 The Owner 's budget for the Cost of the Work is provided herein, and may be adjusted throughout the Project as required under Sections 5.4 and 6.4. Evaluations of the Owner's budget for the Cost of the Work represent the Architect 's judgment as a design profe ssional. \u00a7 6.3 The Owner shall require the Construction Man ager to include appropriate contingencies for design , bidding or negotiating , price escalation , and market conditions in estimates of the Cost of the Work . The Architect shall be entitled to rely on the accu racy and completeness of estimates of the Cost of the Work the Construction Manager prepares as the Architect progre sses with its Basic Services. The Architect shall prepare , as an Additional Service, revisions to the Drawings , Specifications or other docu ments required due to the Construction Manager' s inaccuracies or incompleteness in preparin g cost estimates. The Architect may review the Construction Manager 's AlA Document 8132rM- 2009 (formerly 8141 TMCMa -1992) . Copyright\u00a9 1992 and 2009 by The American Institute or Architects. All rights reserved . WARNING : This AlA\" Document is protected by U.S. Copyright Law and International Treaties. Unauthorized reproduction or distribution of this AlA\u2022 15 Document , or any portion of it, may result in severe civil and criminal penalties , and will be prosecuted to the maximum extent possible under the law. This document was produced by AlA sortware at 13:26 :47 on 08/01/2017 under Order No.23410 1889 6_1 which expires on 01/01/2018 , and is notror resale . User Notes : (12320937 81) I nit. estimate s solely for the Architecf s guidance in completion of its services , however. the Archi tect shall report to the Owner any material inaccuracies and incon sistencie s noted during any such review. \u00a7 6.3.1 (Stricken) \u00a7 6.4 If, prior to the conclusion of the Design Development Phase, the Construct ion Manager's estimate ofthe Cost of the Work exceeds the Owner's budget for the Cost of the Work, the Architect, in consultation with the Construction Manager, shall make approp riate recommendations to the Owner to adjust the Project 's size, quality or budget , and the Owner shall cooperate with the Architect in making such adjustments. \u00a7 6.5 If the estimate of the Cost of the Work at the conclusion of the Design Developm ent Phase exceed s the Owner 's budget for the Cost of the Work , the Owner shall .1 give written approval of an increase in the budget for the Cost ofthe Work; .2 in consul tation with the Arch itect and Constr uction Manager, revise the Pr~ject pro&rram , scope, or qualit y as required to reduce the Cost of the Work ; or .3 implement any other mutually acceptable alternative. \u00a7 6.6 If the Owner chooses to proceed under Section 6.5.2, the Architect, without additional compen sation, shall incorporate the required modifica tions in the Construction Documents Phase as nece ssary to comply with the Owner' s budget for the Cost of the Work at the conc lusion of the Design Developm ent Phase Service s, or the budget as adjusted under Section 6.5.1. The Architect' s modification of the Construction Documents shall be the limit of the Architect's respo nsibility as a Basic Service under this Article 6. \u00a7 6.7 After incorporation of modifications under Section 6.6, the Architect shall, make any required revisions to the Drawings , Specificatio ns or other document s nece ssitated by subsequent cost estim ates that exceed the Owner's budget for the Cost of the Work, except when the exce ss is due to changes initiated by the Archite ct in scope. basic systems. or the kinds and quality of material s, finishes or equipment. ARTICLE 7 COPYRIGHTS AND LICENSES \u00a7 7.1 The Architect and the Owner wanant that in transmitting the Drawings and Specitication s, or any other information , the h\u00b7ansmitting party is the copyrig ht owner of such information or has permi ssion fi\u00b7om the copyr ight owner to transmit such informati on for its use on the Project. If the Owner and Architect intend to transmit the Drawing s and Specifications or any other information or documentation in digital form , they shall endeavor to establish nece ssary protocols governing such transmi ssions. \u00a7 7.2 The Architect and the Architect's consultants shall be deemed the author s and owners of their respective the Drawing s and Spec ifications , includin g the Drawing s and Specifications, and shall retain all common law, statutory and other reserved rights, including copyright s. Subm ission or distribution of the Drawin gs and Spec ifications to meet official regulator y requirement s or for similar purpo ses in connection with the Project is not",
        "I nit. Document 8132\u2122-2009 Standard Form of Agreement Between Owner and Architect, C onstruction Manager as Adviser Edition AGREEMENT made as of the _ _ day of\" ___ \" in the y ear 2017. (in words, indicate day, month and year.) BETWEEN the Architect' s client identified as the Owner: (Nam e, legal status, address and other information) MSD ofWashington Towns hip 8550 Woodfield Crossing Blvd . Indianapo lis, IN 46240 (317) 205-3333 (E>..i 77189) (317)-205-3385 (Fax) and the Arch itect: (Nam e, legal status, address and other it?formation) for the followin g Project: (Nam e, location and detailed descriplilm) The Construct ion Mana ger: (Name, l egal status. address and olher il?formation) The Owner and Architec t agree as follows. ADDITIONS AND DELETIONS : The author of this docume nt has added informat ion needed for its completion. The author may also have revised the text of the or iginal AlA standa rd form. An Additions and Delet ions Report that notes added information as well as revisions to the standard form text is available from the author and should be reviewed . A vertical line in the left margin of this document indicates where the author has adde d necessary informa tion and where the author has added to or deleted from the original AlA text. This docum ent h as important legal consequences . Consultation with an attorney is enco uraged with respect to its complet ion or modif ication. This document is intended to be used in conjunction with AlA Documen ts A 1 32T\"'-2009, Standard Form of Agreemen t Between Owner and Contractor . Cons truction Manage r as Adviser Edition; A232 T\"'-2009 , General Conditions of the Contract for Construction, Cons truction Manager as Adviser Edition; and C132\u2122-2009, Standard Form of Agreement Between Owne r and Construction Manager as Adviser . AlA Document A232\u2122-2009 is adopted in this document by reference. Do not use with other genera l condition s unless this document is modi fied. AlA D ocument B132'M- 2009 (forme rly 8141 TMCMa-1992). Copy right\u00a9 1992 and 2009 by The American Institute of Architects. All rights reserved . WARN ING: This AlA\" Document is protected by U.S. Copy right Law and Internat ional Treaties . Unauthor ized reproduction or distribution of this AIAf, 1 Document, or any portion of it, may result in severe civil and criminal pena lties, and wi ll be prosecuted to the maximum extent possible under the law. This document was produ ced by AlA software at 13:26:47 on 08/01/2017 under Order No.2341018896 _1 which expires on 01/01/2018 , and is not for resale. User Note s: (1232093781) I nit. TABLE OF ARTICLES 1 INITIAL INFORMATION 2 ARCHITECT'S RESPONSIBILITIES 3 SCOPE OF ARCHITECT'S BASIC SERVICES 4 ADDITIONAL SERVICES 5 OWNER 'S RESPONSIBILITIES 6 COST OF THE WORK 7 COPYRIGHTS AND LICENSES 8 CLAIMS AND DISPUTES 9 TERMINATION OR SUSPENSION 10 MISCELLANEOUS PROVISIONS 11 COMPENSATION 12 SPECIAL TERMS AND CONDITIONS 13 SCOPE OF THE AGREEMENT ARTICLE 1 INITIAL INFORMATION \u00a7 1.1 This Agree ment is based on the Initia l Information set forth in this Section 1.1. (Note the disposition for the following items by inserting the requested if!f'ormati on or a s tatemem such as \"not applicable ,\" \"unknown at time of exec ution\" or \"to be determin ed later by mutual agreement.\") \u00a7 1.1.1 The Own er's program for the Project: (Jdent(fy docu ment ation or state the mann er in which the program will be develope d.) \u00a7 1.1.2 The Project's physical characteristics: (Jdent(fy or desc ribe. if appropriat e, size, location, dimensions , or o ther pe rtinent inf ormation , such as geotechni cal reports; site, boundmy and topographi c surveys; traffic and utility studies ; availabili ty of publi c and privat e utilities and services; legal description oft he s ite; etc.) \u00a7 1.1.3 The Own er's budge t for the Cost of the Work, as defined in Section 6.1: (Provide total and, if known , a line item breakd own.) \u00a7 1.1.4 The Owner 's anticipated d esign and construction schedule: .1 Design phase milestone dates, if any: .2 Commence ment of construction: AlA Document 8132 '\"-2009 (formerly B141'\"CMa -1992) . Copyri ght\u00a9 1992 and 2009 by The American Institu te of Architects. All rights reserved . WARNING : This AlA ~ Document is protecte d by U.S. Copyright Law and International Treaties. Unauthori zed reproduc tion or distributio n of this A lA ~ \u00b7 2 Document , or any portion of it, may result In severe civil and crim inal pena lties, and will be prosec uted to the maximum extent poss ible under the law. This document was produced by AlA softwar e a\\13:26:47 on 08/01/2017 under Order No.2341018896 _1 which expires on 01/01/2018, and is not for resale. User Note s: (1232093781) I nit. .3 Substantial Completion date or milestone dates: .4 Other: TBD \u00a7 1.1.5 The Owner intends to retain a Construc tion Manager adviser and: (Note that. if Multiple Prime Contractors are used. the term \"Contractor\" as referr ed to throughou t this Agreement will be as if plural in number.) [) Contractor (which includes other sepa rate Contractors as determined by Owner) [X] Multiple Prime Contractors (\"Contractors\") [ ] Unknown at time of execution \u00a7 1.1.6 The Owner's requirements for accelerated or fast-track scheduling , multiple bid package s, or phased construction are set forth below : (List numb er and type of bid/procurem ent packages.) \u00a7 1.1.7 Other Project information: (!dent!f.i ' special characteristics or needs r!f\"the Project not provided elsewhere. such as environmentally responsibl e design or historic preservation requir emems.) \u00a7 1.1.8 The Owner identifie s the following representative in accordance with Section 5.4: (List name . address and other informa tion. Mr. Marvin Murdock Owners Representative MSD of Washington Towns h ip 8550 Woodfield Crossing Blvd. Indianapoli s, IN 46240 (317) 205-3333 (Ext 77189) (317 205-3385 (Fax) In the event that the Owner's Designated Representative is terminated, or otherwise unavailable, the Owner shall designate a replacement repre sentative in writing. \u00a7 1.1.9 The persons or entities, in addition to the Owner 's representative , who are required to review the Architect's submittals to the Owner are as follows: (List name , address and other information.) CONSTRUCTION MANAGER \u00a7 1.1.1 0 The Owner will retain the following consultant s and shall endeavor to comply with all equal employment opportunity programs and as required by Article I 0.15 herein: (List name, legal status. address and other if1formation.) AlA Document B132TM- 2009 (formerly 8141 \" 'CMa -1992). Copyright\u00a9 1992 and 2009 by The American Institute of Architects. All rights reserved. WARNING : This AlA ~ \u00b7 Document is protected by U.S. Copyright Law and International Treaties . Unauthor ized reproduction or distribution of this AlA\" 3 Document , or any portion of it, may result in severe civil and crimina l penal ties, and will be prosecuted to the maximum extent poss ible under the law. This document was produced by AlA software at 13:26:47 on 08/01/2017 under Order No.2341018896_1 which expires on 01/01/2018 , and is not for resale. User Notes : (1232093781) I nit. .1 Construction Manager: The Construct ion Manager is identified on the cover page . . 2 Cost Consultant (if in additi on to the Construction Manager): ({(a Cost Consu/ta/11 is reta ined, appropriat e references to the Cost Consu ltallf shoul d be in serted in Sections 3.2.6, 3 .2.7, 3.3.2, 3. 3.3. 3 . ./.5, 3.4.6, 5.4. 6.3, 6.3.1, 6 . .f and 1 1.6.) .3 La nd Surveyor: .4 Geotechnical Engineer: .5 Civ il Engineer: .6 Other consultants: (List any other consult ants retained by the Own er, such as a Proje ct or Program Manag er, or sche duling consultant.) \u00a7 1.1.11 The Architec t identifies the following repre sentativ e in accordance with Section 2.3: (List nam e, address and other informa tion.) \u00a7 1.1.12 The Architect w ill retain the consultants identified in Sections 1.1.1 2.1 and 1.1.1 2.2: (List name. legal status, addr ess and other il!/imnation) \u00a7 1.1.12.1 Consultants retained under Basic S ervices: .1 Associate Architect and Interior Design: .2 C ivil Eng ineer: .3 Landscape Architect: .4 Structur al Enginee r .5 Mechanical and Technolo gy Design: .6 Plumbing and Electrical Design: .7 E ducational Programmin g: AlA Document B132 TM-2009 (fonner ly 8141 TMCMa -1992). Copyright\u00a9 1992 and 2009 by The American Institute of Ar chitects. All rights reserved . WARNING: Th is AIAo; Document is protected by U.S. Copyr ight Law and International Treaties. Unauthorized reproduct ion or distr ibution of this AlA\" 4 Document, or any p ortio n of it, may result in severe civ il a nd criminal penalties, and will be prosecuted to the maximum extent poss ible under the law. This docum ent was produ ced by AlA s oftwa re a\\13:26:47 on 0810112017 under Order No.2341 0188 96_1 which expires on 01101/2018, and is not for resale. User Notes: (1232093781) I nit. .8 Food Servi ce Design: \u00a7 1.1.12.2 Consultan ts retained under Additiona l Services: NONE \u00a7 1.1.13 Other Initial Information on which the Agreement is based: TBD \u00a7 1.2 The Owner and Architect may rely on the Initial Information. Both partie s, however , recognize that such information may materially change . The Architect shall be entitled to rely on the accuracy and completene ss of information furni shed by the Owner unless the Architect had cause to not so rely. The Architect shall provide prompt written notice to the Owner if the Architect becom es awar e of any error s, omissions or incon sistenci es in such information . Ifthe Owner observes or otherw ise becom es aware of any defect in the Project , it shall give prompt written notice thereof to the Arch itect. ARTICLE 2 ARCHITECT'S RESPONSIBILITIES \u00a7 2.1 The Architect shall provide the profe ssiona l service s as s et forth in this Agreement and described in The General Condition s of the Contract for Construction as modified and supp lemented AlA Document A232 (2009 Edition) and incorporated by referenc e as if set forth herein in full. \u00a7 2.2 The Architect' s services shall be performed consi stent with professional skill and care ordinari ly provided by Architects with experience with projects similar to these Projects practicing in the s ame or similar localit y and under the same or similar circumstance s and consistent with the orderly progress of the Work. The Architect shall submit for the Owner 's approval and the Construction Manager 's information a schedule for the performance of the Architect's services which may be adjusted as the Project s proceed. and shall include a11owances tor periods of time required to r the Owner and Construction Manager's review and for approval of submi ssions by authorit ies having jurisdiction over the Proje cts. Time limit s established herein shall not. exce pt for reasonable c ause. be excee ded by the Architect. The Own er sha11 be entitled to r easonabl y rely on the accuracy and completeness of services and information provid ed by the Archite ct. \u00a7 2.3 The Archit ect shall provide its services in conjunction with the services of a Construction Manager as described in the modified AlA Document C132nL2009 , Standard Form of Agreement Between Owner and Construction Manage r. The Architect shall not be responsible for action s taken by the Construction Manager. \u00a7 2.4 The Architect shall identi fy a representative authorized to act on beha lf of the Archit ect with respect to the Project. \u00a7 2.5 Except with the Owner ' s knowl edge and consent, the Archit ect shall not engage in any activity, or accept any emplo yment, interest or contribution that would reasonably appear to compromise the Arch itect's profe ssional judgment with respect to this Project . (Paragraph s delete d) \u00a72.61NSURANCE \u00a72.6.1 The Architect shall purcha se and maintain from an insurance compan y or insurance compani es lawfull y authori zed to do business in Indiana policie s of insuranc e acceptab le to the Own er, in a form and substanc e reasonably satisfacto ry to the Ow ner, which affor d the coverages set forth in Section 2.6.2 below . This insurance shall be written for not Jess than the limit s of liability specified in Section 2.6.2 or required by law, whichev er coverage is greater . Certified copie s of all insurance polici es or, with the Owner 's consent, Certificate s of Insurance acceptab le to the Owner shall be gi ven to the Own er prior to comm encement of the services. E ach policy must be endor sed to provide that the policy will not be cancelled or allowed to expire until at least thirty (30) days' prior written notice has been provided to th e Ovvner. \u00a72.6.2 The required coverage s and limits which the Archit ect is required to obtain are as follow s: AlA Document 6132\"'- 2009 (formerly 6141 r\"CMa-1992) . Copyright \u00a9 1992 and 2009 by The Americ an Institute of Ar chitects. All right s reserved. WARN ING: This AlA ~ Document is protected by U.S. Copyright Law and International Treaties . Unauthorized reproduction or distribution of this AlA' 5 Document, or any portion of it, may result In severe civil and criminal penaltie s, and will be prosecuted to the maximum extent possible under the law. This document was produced by AlA software at 13: 26:47 on 08/01/20 17 under Order No.2341 018896 _1 which expires on 01/01/2018 , and is not for resale User Note s: (1232 093781) I nit. .1 COMMERCIAL GENERAL LIABILITY a. b. c. Genera l Aggregate (including Completed Operations) Each occurrence Genera l Aggregate Bodily Injur y & Property Damage (Combin ed Single Limit I Per OccuJTen ce) $ 1 ,000,000.00 Personal I Advert ising Injur y (Per Occun-ence) $2,000,000 .00 $1,000.000.00 $2,000.000 .00 $1,000,000.00 The Commerc ial General Liabi lity Policy must be endorsed to provide that the general aggregate amount applies separa tely to each of Architect 's separate projects. ISO Endor sement CG2503 Per Project Endorsement or its equiva lent shall be used to satisfy this requirement. . . 2 COMME RCIAL AUTO LIABILITY (Owned, Non -Owne d and Hired) Bodil y Injury & Prop erty Dama ge (Per Occurren ce) $1,000 ,000.00 .3 WORK ER'S COMPENSATION AND EMPLOYERS' LIABILITY .4 Cove rage A (Worker's Compensation)- Statutory Minimwn Requirement s Cove rage B (Emp loyers Liability) -$500,000/each acciden t; $500,000 Disease- each employee; $500,000 Disease policy limit. EXCESS LIABILITY (Umbrella Form) Each Occun-enc e $5,000,000.00 .5 PROF ESSIONAL LIABILITY INSURANCE . TI1e Architect shall can-y and maintain during the contin uance of this Agreement , professional liability insurance in the amount of$5.000 ,000 for single limit claims and $5.00 0,000 in the aggregate. The Architect's policy of insurance sha ll contain pri or acts cove rage sufficie nt to cover all services perfo rmed by the Architect for this Project. Upon Owner's request. Architect shall give prompt written notice to Owner of any and all claim s made against this policy during the period in which this polic y is required to be maint ained pursuant to this Agreement. If the insurance is written on a claim s-made basis and cove rage is cancell ed at any time, the Ar chitect will obtain, at its cost, an extended repor ting endor semen t which provide s continuing coverage for claim s based upon alleged acts or omissions durin g the term of the Agreement until all applicable statute of limitation periods have expired. All cove rage provided above shall be endorsed to include the Owner , as Additional Insured excep t for the Worker 's Compen sation/Emp loyer's Liabilit y and Profe ssional Liability policie s. ISO forms CG 2010 07 04 and CG 2037 or equivalent endor sement form s must be used on the comme rcial general liabilit y polic y to provide additional insured st atus to the Owner. and shall include cove rage for comp leted operation s. The policie s for which the Owne r is named as additional insured shall provide primary and non-contributin g coverage and any valid and collect ible insurance cmTied separa tely by the Owner shall be in excess of the limit s provide d by such policie s and shall be non-contributor y. All insurance requirements and limits contained in this Section 2.6 apply to all of Architect's consultants and the Archit ect is responsib le to verify those insuranc e requirements and limit s, or seek approva l throu gh the Architect from the Owner for alternative cove rage or reduced limit s. TI1e commercial general liability, automobil e liabilit y, and workman's compensation policie s must be endor sed to provide a waiver of subrogation in favor of Own er. \u00a72.6.3 The Architect hereby agree s to deliver to the Owner, within ten (1 0) days of the date of the Owner -Archit ect Agreement and prior to bringing any equipment or personnel onto the site of the Work or the Project site, certified copies of all insurance policie s procured by the Arch itect under or pursuant to this Section or, with consent of the Owner , Certificates oflnsurance in form and substance satisfactory to the Own er evidencing the required coverages with limit s not less than those specified in the Agreement. \u00a7 2.6.4 In no event shall any failure of the Owner to recei ve certified copies or certificate s of policie s required under this Sectio n or to demand receipt of such certified copies or certificates prior to the Arch itect's commencing the services be construed as a waiver by the Owner of the Architect's obligation s to obtain insmance pursuant to this AlA Docume nt B132'M -2009 (formerly 8141 TMCMa- 1992). Copyrig ht \u00a9 1992 and 2009 by The American Institute of Architects. All right s reserved . WARNING : This AlA\" Docum ent is protected by U.S. Copyright Law and Internationa l Treaties. Unauthor ized reprod uction or distribution of this AIAfe 6 Document, or any portion of it, may result in seve re civil and criminal pena lties, and will be prosec uted to th e maxim um exte nt possible under the law. This documen t was produ ced by AlA software at 13:26:47 on 08101/2017 under Order No.2341 018896 _1 w hich expires on 01/01120 18, and is not for resale. User Note s: (123209378 1) I nit. Section 2.6. The obligat ion to procure and maintain any insurance required is a s eparate responsibility of the Architect and indepe ndent of the duty to furnish a cettified copy or cetiificate of such insurance policie s. \u00a7 2.6.5 The Architect's policies of insurance shall contain prior acts coverage sufficient to cover all service s performed by the Arcitect for this Project and shall provide primary and non-contributory coverage. Any insurance by the Owner shall be considered excess and non-contributory. Deductibles shall be paid by the Architect. Upon Owner ' s reque st, Architect shall give prompt written notice to Owner of any and all claims made against this polic y during the period in which this polic y is required to be maintained pursuant to this Agreement. (Paragraph delete d) ARTICLE 3 SCOPE OF ARCHITECT'S BASIC SERVICES \u00a7 3.1 The Architect's Basic Services consi st of those described in A1iicle 3 and inclu de usual and customary struc tural, mechanical , and electrical engineer ing services. Service s not set forth in this Article 3 are Additiona l Services. \u00a7 3.1.1 The Architect shall manage the Arch itect's services, consult with the Owner and the Construct ion Mana ger, research applicabl e design criteria, attend Project meetings, communicate with member s of the Proje ct team and repmi prot;,rre ss to the Owner. \u00a7 3.1.2 The Architect shall coordinate its ser vices with those services provided by the Owner, the Construction Manager and the Owner's other consultant s. The Architect shall be entitled to rely on the accuracy and completene ss of services and information furni shed by the Owne r, the Construction Manager , and the Owner ' s other consultant s. The Archi tect shall provide prompt written notice to the Owner ifthe Arch itect become s aware of any error, omission or incon sistency in such services or information . \u00a7 3.1.3 As s oon as practicable after the date ofthis Agreement , the Architect shall submit to the Owner and the Cons truction Manager a schedule ofth e Architect's service s for inclusion in the Project sched ule prepar ed by the Construction Mana ger. The sched ule of the Arch itect' s service s shall include design mile stone dates . anticipated dates when cost estimates or design reviews may occur, and allowance s for period s of time required (I) for the Owner 's review. (2) for the Construction Manager's review. (3) for the performanc e of the Owner's consultant s, and (4) for approval of submi ssions by authorities having jurisdiction over the Proje ct. \u00a7 3.1.4 The Architect shall subm it information to the Construction Manager and participat e in developin g and revising the Proje ct sched ule as it relates to the Archi tect's service s. \u00a7 3.1.5 Once the Own er and the Architect agree to the time limits established by the Project schedule, the Own er and the Archite ct shall not exceed them , except for reasonable cause. \u00a7 3.1.6 The Archi tect shall not be responsible for an Owner 's directive or substitution , or for the Owner 's acceptance of non-conforming Work , made without the Architect's approval. \u00a7 3.1.7 The Architect shall, at appropriat e time s, in coordinat ion w ith the Construction Mana ger, contact the gove rnmental authoriti es required to approve the Construction Documents and the entities providing utility servic es to the Project. In designin g the Project , the Arch itect shall respond to applicable design requ irements impo sed by such governmental authoritie s and by such entities providin g utility services. \u00a7 3.1.8 The Arch itect shall assist the Owner and Construction Manager in connection with the Owner 's responsibilit y for filing document s required for the approval of governmental author ities having jurisdiction over the Project. \u00a7 3.2 Schematic Design Phase Services \u00a7 3.2.1 The Architect shall review and validate the program of space requirement s and other information fumi shed by the Owner and Construction Mana ger, and shall review laws, codes, and regulation s applicable to the Architect's service s. The Arch itect shall review the program , sched ule and construction budget to ascertain the requirement s for the Project and shall aiTive at a mutua l under standing of such requirement s with the Owner and Construction Manager and modi fy if and as required . Based on the cost es timate s, the Archit ect to prepare all nece ssary AlA Document 8132'\"' -2009 (formerly 8141 r\"'CMa- 1992). Copyright \u00a9 19 92 and 2009 by The Ame rican Institute of Architects. All rights reserved. WARNING : This AlA\u00ae Document is protected by U.S. Copyrig ht Law and I nterna tional Treaties . Unau thorized repro d uction or d istribution of this AlA \"' 7 Document, or any portion of it, may r esult In s evere civil and criminal pen alties, and will be prosecuted to the maxim um extent possible under the law. This document was produced by AlA software at 13: 26:47 on 0 8/01/201 7 under Order No. 2341 018896_1 which expires on 01/01/2018, and is not for resale . User Notes: (123209378 1) I nit. drawings. specifications and other documents required for the construction and completion of the Pr ~ject based on the Project ' s budget. \u00a7 3.2.2 The Architect shall prepare a preliminary evaluation of the Owne r's program , schedu le, budget for the Cost of the Work. Project site, and the other Initial Information. each in terms of the other, to ascertai n the requirement s of the Project. The Architect shall notify the Owner of (1) any incon sistencies discovered in the information . and (2) other information or consulting service s that may be reasonably needed for the Project . \u00a7 3.2.3 The Architect shall present its preliminary evaluation to the Owner and Construction Manager and shall discuss with the Owner and Construction Manager alternative approaches to design and construction of the Project, including the feasibi lity of incorporating environmen tally respon sible design approaches. The Architect shall reach an understanding with the Owner regarding the requirem ents of the Project. \u00a7 3.2.4 Based on the Project requirements agreed upon with the Owner , the Architect shall prepare and present to the Owner and Construction Manager , for the Owner 's approval , a preliminar y design illustrating the scale and relationship of the Project compon ents. \u00a7 3.2.5 Based on the Owner's approva l of the preliminary design, the Architect s hall prepare Schemati c Design Documents for the Owner's approval and the Construction Manager's review. The Schematic Design Documents shall consi st of drawings and other documents including a site plan and preliminary building plans , sections and eleva tions; and may include some combination of study model s, perspective sketche s, or digital modeling. The Schematic Design Document shall provide option s for size, location and configuration of the Owner approved prototype design on each site. Preliminary selections of major building systems and construction material s shall be noted on the drawing s or described in writing . Architect shall prepare written description of structura l, mechanical, electrical, pl umbi ng and technology work along with preliminary layouts as needed for cost estimating . \u00a7 3.2.5.1 The Architect s hall consider environmenta lly respon sible desi&'ll alternative s. such as material choice s and building orientation. together with other considerations based on program and aesthetic s, in developing a design that is consistent with the Owner 's program. schedu le and budget for the Cost of the Work . \u00a7 3.2.5.2 The Architect shall consider with the Owner and the Construction Mana ger the value of alternativ e material s. buildin g systems and equipm ent, together with other considerat ions based on program and aesthetics in developin g a design for the Project that is consistent with the Owner 's schedu le and budget for the Cost of the Work . \u00a7 3.2.6 The Architect shall submit the Schematic Design Documents to the Owner and the Cons truction Mana ger. The Architect s hall meet with the Owner and Const ruction Mana ger to review the Schematic Design Document s and the schematic cost est imate prepar ed by the Cons truction Mana ger. If the schematic cost estimate exceeds the Project Budg et, Architect shall discuss with Owner and Construction Mana ger potenti al cost reduction options a nd modi f)' the Schematic Design Docum ents \u00a7 3.2.7 Upon receipt of the Construction Manager 's review comments and Construction Manager 's schematic cost estimate at the concl usion of the Schematic Design Phase , the Architect shall take action as required under Section 6.4, identify agreed upon adjustment s to the Project's size, quality or budget , and reque st the Owner's approval of the Schematic Design Documents. lfrevisions to the Schematic Design Documents are required to comply with the Owner' s budget for the Cost of the Work at the conclu sion of the Schematic Design Phase, the Architect s hall incorporate the requir ed revisions in the Design Development Phase. \u00a7 3.2.8 In the furth er de velopm ent of the Drawin gs and Specifications during this and subsequent phases of design , the Architect shall be entitled to rely on the accuracy of the estimates of the Cost ofthe Work , which are to be provided by the Construction Manager under the Construction Manager's agreement with the Owner. \u00a7 3.3 Design Development Phase Services \u00a7 3.3.1 Based on the Owner's approval of the Schematic Design Docwnents , and on the Owner 's authorization of any adjustment s in the Project requirement s and the budget for the Cost of the Work pursuant to Section 5.4, the Architect shall prepare Design D evelopment Documents for the Owner' s approval and the Construction Mana ger's review. The Design Development Documents s hall be based upon information provided , and estimates prepared by, the Construction Manager and shall illustrate and describe the development of the approved Schematic Design AlA Document 8132\"'-2009 (formerly B141fMCMa -1992). Copyr ight\u00a9 1992 and 2009 by The American Institute of Architects. All rights reserved. WARNING : This A l A ~ ' Document is protected by U.S. Copyright Law and International Treaties. Unauthorized reproduct ion or distribution of this AIAt\u00b7 Document, or any portion of it, may result In severe civil and criminal penalti es, and will be prose cuted to th e maximum extent poss ible under the law. This document was produced by AlA software at 13: 26:47 on 08/01/2017 und er Order No. 2341 018896_1 which exp ires on 01/01/2018, and is not for resale. User Notes: (123209378 1) 8 I nit. Documents and shall consist of drawings and other document s including plans , sectio ns. elevat ions, typical construction details, and diagrammatic layouts of building systems to fix and describe the size and charact er of the Project as to architectural, structuraL mechanical and electrical systems, and such other elements as may be appropriate. The Design Developm ent Documents shall include detailed layout s of the site plans and the floor plan with furniture and equipment. The Design Development Document s shall also include outline specifications that identifY major material s and systems and establish in general their quality levels. Architect's Design Development document s shall include interior and exter ior renderings. \u00a7 3.3.1.1 The Architect shall commence the process to select interior finishes, pattem s and colors for each Project and review with the Owner on a regular basis until the process is comp lete. \u00a7 3.3.1.2 The Architect shall direct the prepa ration of civil , landscape architecture , structural, mechanical , electrical, plumbing and technology work as required for the Proje ct along with required narrative information as needed for estima ting the Cost of the Work . \u00a7 3.3.2 Prior to the conclusion of the Design Development Phase , the Architect shall subm it the Design Development Document s to the Owner and the Construction Manager. The Architect shall meet with the Owner and Construction Manager to review the Design Development Document s and estimate of the Cost of the Work . If the cost estimate exceeds the Project Budget , the Architect shall discuss potential cost reduction options with the Owner and Construction Manager and modifY the Design Development Documents as required. \u00a7 3.3.3 Upon receipt of the Construction Manager's information and estimate at the conclusion of the Design Development Phase, the Architect shall take actio n as required under Sections 6.5 and 6 .6 and request the Owner's approval of the Design Development Documents. \u00a7 3.4 Construction Documents Phase Services \u00a7 3.4.1 Based on the Owne r's approval of the Design Development Documents , and on the Owner's authorization of any adjustment s in the Project requirements and the budget for the Cost of the Work . the Architect shall prepare Construction Documents for the Owner's approval and the Construction Manager's review. The Construction Document s shall illustrate and describe the further develo pment of the approved Design Development Documents and shall consist of Drawin gs and Specifications setting forth in detai l the qualit y level s of material s and systems and other requirements for the construction of the Work . The Owner and Archit ect acknowledge that in order to construct the Work the Contractor will provide additional information , including Shop Draw ings, Product Data , Samp les and other similar submittals , which the Archite ct shall review in accordance with Section 3.6.4. \u00a7 3.4.2 The Architect shall incorporate into the Construction Documents the design requirements of governmental authorities havin g jurisdiction over the Project. \u00a7 3.4.3 Durin g the development of the Construction Document s, if requested by the Owner , the Architect shall assist the Owner and the Construction Manager in the developm ent and preparation of (I) bidding and procurement information that describes the time , place and conditions of bidding , including bidding or proposal form s;",
        "\u00a720-18-2-15). ( 4) Licen sed as a health facility under IC \u00a7 16-21 or IC \u00a7 16-28 . (5) Used as a station for paid firefighters . (6) Used as a station for paid police officers. (7) Licensed as a child care center or child care home or registered as a child care mini stry under IC \u00a7 12-17 .2. (8) Licensed as a hospita l under IC \u00a7I 6-21 or a county hospital subject to IC \u00a7I 6-22 . (9) Used as a provider 's office . (I 0) Schoo l bus (as defined in IC \u00a7 16-41-37-2.3). \u00a7 10.15 Policies Of Employment \u00a7 10.15.1 The Architect , and the Architect 's consu ltants shall comply with all federa l, state, and municipal and local rules, ordinances , rules , regulations , orders , notice s and requirements relatin g to non-discrimin ation in employment , fair emplo yment practices , and equal employment opportunity practice s, without additional charge or expense to the Owner. The Architect, and the Architect ' s consultant' s shall be responsible for and shall correct , at its own cost and expense , any violations of this Section resulting fi\u00b7om, or in connection with, perform ance of the Work at the Project. AlA Docum ent B132 TM-2009 (formerly B141 rMCMa- 1992) . Copyr ight\u00a9 1992 and 2009 by The American Institute of Architects. All rights reserved . WARNING : This AlA\" Document is protec ted by U.S. Copyright Law and Internat ional Treaties . Unauthor ized reprod uction or distribution of this AlA ~ \u00b7 22 Document , or any portio n of it, may result in severe civil and criminal pena lties, and will be prose cuted to the maxim um extent possible under the law. This document was produced by AlA softWare at 13:26:47 on 08/01/2017 under Order No.2341 018896 _1 which expires on 01/01/2018 , and is not for resale. User Notes : (123209378 1) I nit. The Architect shall also, i frequested by the Owner, furnish such proof of its comp liance with the requirements this Section . Upon any alleged violation of this Section, the Architect shall indemnity and hold harmle ss the Owner against any and all claims. losses. costs. damage s and expenses, including attorney s' fees, asserted against the Owne r. \u00a71 0.16 Equal Opportuni ties For Minority, Women And Veteran or Disabled Busin ess Enterprises Improvements under this Agreement are subject to the Owner's initiative concerning equa l oppo rtuniti es for minority business enterprises and women's business enterprises to participate in procurement and contracting proces ses. Architect , has submitted and Owne r accepted Architect's participation levels for mino rity business enterprises, women's busines s enterprises, and veteran or disabled business enterprises in the performance ofthe Work consistent with the goals of delivering the Project on time and within the budgeted amount . The services are subjec t to the provisions of equal opportunitie s for minority business enterpri ses, women 's busine ss en terprises and veteran or disabled business enterprise s to participate in procurement and contracting processes, consistent with the goals of delivering the Project. In connection with the Substantial Completion, Architect shall certify compl iance with those goals and the level of particip ation or minority business enterprises, women 's business enterprises. veteran or disabled busine ss enterpri ses that was achieved in connection with undertaking the services. The Architect , and the Architect ' s consultants shall compl y with any guideline s or compliance program s required by the Owner, including , but not limited to, Owner 's Minorit y, Women, and Veterans or Disabled Business Enterpri ses Project- Wide Participation Program , if any. ARTICLE 11 COMPE NSATION \u00a7 11.1 For the Architect's Basic Services described under Article 3, the Owner shall compensate the Architect as follow s: (Paragraph delet ed) \u00a7 11.2 For Additiona l Services designated in Section 4.1. the Owner shall compensate the Architect as agreed by the parti es and at the attached rates . See attached . \u00a7 11.3 For Addit ional Services that may arise during the course of the Project , including those under Section 4.3. the Owner shall compensate the Architect as agreed by the partie s and at the attached rates. See attached \u00a7 11.4 Compensation for Additiona l Services of the Architect' s consultants when not included in Sections 1 I .2 or 11.3, shall be the amount invoiced to the Architect plus ten percent ( 1 0%), or as otherwi se stated below : NONE \u00a7 11.5 Compensa tion for Basic Service s is based on a stipulated sum, the compensation for each phase of services shall be as follows: Programmin g/Standards I Contractual/Schematic Design Phase percent %) II ( Design Development Phase Ill percent %) ( Construction Documen ts Phase IV percent %) ( Bidding or Contract _ Phase V pe rcent %) ( Construction Admin & Closeout percent %) Phase VI ( AlA Document 8132\"'-2009 (f onnerly B141fMCMa -1992). Copyr ight\u00a9 1992 and 2009 by The Amer ican Institute of Architects. All rights reserved . WARNING : This AlA*' Document is protected by U.S. Copyr ight Law and Internat ional Treaties. Unauthorized reproduction or distri bution of this AlA ~ 23 Document, or any portion of it, may result in severe civil and crimina l pena lties, and will be prosecuted to the maximu m extent poss ible under the law. This document was produced by AlA software at 13:26:47 on 08/01/2017 under Order No.2341018896_1 which expires on 01/01/2018 , and is not for resale . User Notes: (12320937 81) I nit. Total Basic Compen sation (Paragrap h del eted) \u00a7 11.6 [Sn\u00b7icken ]. one hundred percent 100 %) ( \u00a7 11.7 The hourl y billin g rates for services of the Architect and the Architect's consulta nts, if any, shall be attached . The rates sha ll be adjusted in accorda nce with the Architect's and Architect' s consulta nts' norm al review practices. (Paragrap hs deleted) (Table deleted) \u00a7 11.8 Compensation for Reimbursable Expenses \u00a7 11.8.1 Reimbursable Expenses are in addition to compen sation for Basic and Additional Services and include expenses incurred by the Architect and the Architect' s consu ltants directly relat ed to the Project, as tbllows: .1 Trans portation and authorized out-of-town travel and subsistence; .2 Long distance service s. dedicated data and communicati on services, teleconferen ces, Project Web sites, and extranet s; .3 Fees paid for securing approval of authorities having jurisdiction over the Project; .4 Printing . reproduction s, plots, standard form docum ents; .5 Postage, handlin g and delivery; .6 Expense of overtime work requiring higher than regular rates , if authorized in advance by the Owner ; .7 Renderin gs, model s, mock-u ps, profe ssional photograph y, and presentation materials requested by the Owner; .8 Architect's Consultan t's expense of professional liability insurance dedicated exclusively to this Project , or the expense of additi onal insurance coverag e or limit s if the Owner requests such insurance in exces s of that norm ally carried by the Architect's consultant s; .9 A ll taxes levied on professional services and on reimbur sable expenses: .10 Site office expen ses; and .11 Othe r similar Projec t-related expend itures. \u00a7 11.8.2 For Reimbur sable Expen ses the compensation shall be the expenses incurred by the Architect and the Architect's consu ltants plus ten percent ( 1 0%) of the expe nses incurred , with the maximum not to excee d \"$ \" for each elementa ry Project. \u00a7 11.9 Compensation for Use of Architect 's Drawings and Specifications If the Owner terminate s the Architect for its conven ience under Sectio n 9.5, or the Architect terminate s this Agreement under Section 9.3, the Owne r sha ll pay a licens ing fee as compe nsation for the Owner 's continu ed use of the Architect' s Instrum ents of Service solely for purpo ses of comp leting. using and maintaining the Project as follow s: See Article 7 \u00a7 11.10 Payments to the Architect \u00a7 11.10.1 An initial payment of zero dollar s ($0) shall be made upon execution ofthis Agreement and is the minimum payment under this Agreement. It shall be credited to the Oviner's account in the final invoice. \u00a7 11.10.2 Unle ss otherwise agreed, payment s for services shall be made monthl y in proportion to service s performed . Payments are due and payab le within thitty (30) days of presentation of the Architect' s invoice. Amounts unpaid sixty-days (60) days after the invoice date shall not bear intere st, or in the absence thereof at the legal rate prevailing from time to time at the principal place of business of the Archite ct. (Insert rate q( monthly or annual interest agr eed upon.) None \u00a7 11.10.3 The Owner shall not withhold amount s from the Architect's compensation to impose a penalty or liquidated damages on the Architect , or to offset smns requested by or paid to contract ors for the cost of change s in the Work, or to offset or comp ensate the Owner for sums that are claimed by the Owner as loss or damage s caused AlA Document 8132rM -2009 (formerly 8141 TMCMa -1992) . Copyright \u00a9 1992 and 2009 by The American Institute of Architects. All rights reserved . WARN ING: This A l A ~ \u00b7 Document is protected by U.S. Copyright Law and International Treaties . Unautho rized reproduction or distribution of this AlA\" 24 Document , or any portion of it, may result in severe civil and crim inal penalties , and will be prosecuted to the maximum extent poss ible under the law. This document was produced by AlA software al13:26:47 on 08/01/2017 under Order No.2341018896_1 which expires on 01/01/2018 . and is not for resale. User Note s: (1232093781) I nit. by alleged negligence or other purported fault of the Architect unless the Architect agrees or has been found liable to r the amounts in a bindin g dispute resolu tion proceed ing. \u00a7 11.10.4 Record s of Reimbur sable Expenses , expenses pertaining to Addit ional Services. and services performed on the basis of hourly rates shall be available to the Owner at mutuall y conv enient times. ARTICLE 12 SPECIAL TERMS AND CONDITIONS Special te rms and conditions that modify this Agreement are as follows: \u00a7 12.1 ADDIT IONAL PARAMETERS \u00a7 12.1.1 The physical parameters for the Project are as set forth in the prog ram identified in Section 2.2.4. Additiona l parameter s for the Projec t are contained in the Construction Docu ments and any other restriction s on the site available by actua l/constructive knowl edge or notic e. \u00a7 12.2 PROJECT TEAM \u00a7 12.2.1 The Architect agree s and acknowledges that the timel y and cost effective comp letion of the Project is in part depend ent on there being no chan ges in the representative(s) ofthe Agreement. If the Architect contemplates any change s in the representative(s), the Architect shall imme diatel y provide written notice to the Owner of any proposed change . The Owner shall have the right to withhold consent to another individu al serving as a designated representative other than one already designed, which consent shall not be unreasonab ly withheld. If the Owner conse nts to a new representative, the Architect shall ensure that the change in representative shall not have any negative impact on the Architect's Services required unde r this Agreement. The Architect further agrees that it will not charge Owner for any cost, service , expense , or any other item that Architect incurs because of the change in repre sentative other than charges that Owner has already agreed to pay. The Architect shall also reimbur se Owner for any cost, loss, damage (including attorn ey's fees) that Owner incur s because of any change in the desib'llated representativ e(s) and that such obligation shall continue notwithstanding the expiration or termination of this Agreement. ARTICLE 13 SCOPE OF THE AGREEMEN T \u00a7 13.1 This Agree ment represents the entire and integrated agreement between the Owner and the Architect and supersedes all prior negot iation s. represen tations or agreement s, either written or oral. This Agr eement may be amen ded only by written instrument signed by both Owner and Arch itect. \u00a7 13.2 This Agreement is comprised of the followin g document s listed below: .1 This modified AlA D ocument Bl 32\u2122-2 009, Standard Form Agreement Between Owner and Architect, Construction Mana ger as Adviser Edition .2 AlA Document E201 TM-2007, Digital Data Protoco l Exhibit, if comp leted, or the followin g: None .3 AlA Document E202T11C2008 , Building Information Mode ling Protocol Exhibit, if completed , or the following : None .4 Other document s: (List other documents, [{any, including additional scopes ofservicefor ming part oft he Agree ment.) Modified AlA Document A232-2 009, General Conditions of the Contract for Constru ction .5 Project Addenda: Date Title Amount AlA Document B132r\"'- 2009 (formerly B141'\"'CMa -1992) . Copy right\u00a9 1992 and 2009 by The Ameri can Institute of Architects . All rights reserved. WARNING : This AlA ~ Document is protected by U.S. Copy right Law and International Treaties. Unauthorized reproduction or distribution of this AlA\"' Docume nt, or any portion of it, may re sult in severe civil and crimina l penalties , and will be pros ecuted to the maxim um extent possib le under the law. This document was produced by AlA software at 13'26: 47 on 08/01/2017 under Orde r No.2341 018896_1 which expires on 01/01/20 18, and is not for resale . User Notes: (1232 093781) 25 I nit. AlA Document 8132 \"'-2009 (formerly 8141 \"'CMa -1992). Copyright \u00a9 1992 and 2009 by The Amer ican Institute of Architects. All rights reserved . WARNING : This AIA ~t Document is protected by U.S. Copy right Law and International Treaties. Unauthoriz ed reprodu ction or distrib ution of this AlA., Docume nt, or any portion of it, may result in seve re civil and criminal penalties , and will be pros ecuted to the maximum extent possib le under the law. This document was produced by AlA software a\\13:26:47 on 08/01/2017 under Order No.2341018896 _1 wh ich expires on 01/01/2018, and is not for resale . User Notes : (1232093781 ) 26 I nit. This Agre ement is entered into as of the day and year ftrst written above. OWNER (Signatur e) Board President. (Printed name and title) MSD ofWa shington Town ship 8550 Woodfield Cr ossing Blvd. Indianap olis, IN 46240 OWNER (Signature) Board Secretary. (Printed name and title) MSD of Washington Town ship 8550 Woodfie ld Crossing Blvd. Indianapoli s, lN 46240 ARCHITECT (Signature) (Printed name and title) AlA Document B132 \" ' - 2009 (formerly 8141 \u2022wcMa -1992). Copyri ght \u00a9 1992 and 2009 by The A merican In stitute of Architects. All rights reserved . WARNING : This AtA\u2022 Document is protected by U.S. Copyright Law and International Treaties. Unauthor ized reproductio n or distribution of this AtA\u2022 Document, or any portion o f it, may result in severe civil and criminal penalties, and wi ll be prosecuted to the maxim um extent possib le und er the law. Thts docum ent was produced by AlA software at 13: 26:47 on 08/01/ 2017 unde r Orde r No. 2341018896 _1 which expires on 01/01/2018. and is not for resale User Notes : (12320937 81) 27",
        "to be construed as publication in deroga tion of the reserved rights of the Architect and the Architect's consultant s. \u00a7 7.3 Upon execution of this Agreement , the Architect grants to the Owner a none xclusive license and ownershi p to use the Project Drawings and Specification s solely and exclusively for purpo ses of constructing , using, maintaining, altering and adding to the Project. Upon any termination of this Agreement prior to its completion , the Owner shall retain the license and ownership and is permitt ed to make changes, correcti ons or additions to the Drawing s and Specifications for the purposes of comp letin g, using and maintaining the Project , or for future additions or alternations to th e Project ; provided , however , that such use shall be at the Owner' s sole risk and without liability to the Architect and the Architect's consu ltants. Upon payment by the Owner of all fees due and owing Architect for profe ssional services under this Agreement, all right, title and interest in the Drawing s and Specification s and other document s, including those in electronic form , prepared by the Architect and the Architect 's consultant s (\"Drawing s and Specification s\") that become part of this Agreement and whic h are incorporated by reference into the Agreement betwee n Owner and Contractor shall become the property of the Owner. If the information is provided in electronic format, the Architect expressly waives any and all actions or claims against the Owner alleging infringement of any copyrights or patent s by reason of the Owner 's use of the electronic information. The Owner AlA Document 8132TM- 2009 (formerly B14FMCMa -1992). Copyright \u00a9 1992 and 2009 by The American Institute of Architects. All rights reserved . WARNING: This A l A ~ \u00b7 Document is protected by U.S. Copyright Law and International Treaties . Unauthorized reproduction or distribution of this AlA' ' 16 Document , or any portion of it, may result in severe civil and crim inal pena lties, and will be prosecuted to the maximum extent possib le under the Jaw. This documen t was produced by AlA software at 13:26 :47 on 08/01/2017 under Order No.2341018896_1 which expires on 01/01/2018 . and is not for resale . User Notes : (1232093781} I nit. may utilize the Drawing s and Specilications and any ofthe constituent parts thereof in conju nction with a different project improvement. Howe ver. the Owne r's use of the Architect's Drawing s and Specificat ions for any other construction purpo se other than for the Project shall be at Owner's expense and liability. The Architect shall obtain similar none xclusive licenses fi\u00b7om the Architect 's consu ltants consistent with this Agreement. The license granted under this section permit s the Ovvner to authorize the Contractor , Const ruction Manager , Subco ntractors. Sub-subcontractor s, and material or equipment supplier s. as well as the Owner 's consultants and separate contrac tors. to reproduce applicable portions of the Drawing s and Specification s solely and exclusively for use in performing services or construction for the Project. lfthe Architect rightfull y termina tes this Agreement for cause as provided in Section 9.4, the license grante d in this Section 7.3 shall terminate . (Paragrap h deleted) \u00a7 7.3.1 The Architect agrees to indem nity, save and hold harmle ss, and defend at its expense, the Own er, its agents, employee s and anyone else acting for or on behalf of any of them , and any other person or entity for whom any of them may be legally responsib le, fi\u00b7om and against all claim s, suits, actions, damage s, fees, penaltie s and/or liabilities, includin g, without limit ation, couJi costs and reasonable attome ys\u00b7 fees, of any natur e what soeve r which arises out of, or is connect ed with. or are alleged to arise out of or be connected with rights of claims of right s in such Drawing s and Speci fication s or other documents. TI1e Arch itect shall also defend all actions or claim s charging infrin gement of any copyright s or patent s by r eason of the use or adoption of any designs, Drawing s or Specifications suppli ed by it and shall hold the Owner, its agent s and emplo yees harml ess fi\u00b7om claim s, loss, damages , liabili ty, costs and expenses (includin g attomeys' fees) resulting therefr om. The Architect's agreeme nt of indemnity shall survive final payment and the terminati on of this Agreement. \u00a7 7.3.2 The Owner shall be pennitt ed to authorize the Construction Manager , Contractors , Subcont ractors, Sub-subco ntractors and material or equipme nt supplie rs to reproduce applicable portions of the Project Drawings or Spec ifications appropriate to and for use in their execut ion of the Work by licen se granted in this Atiicle . \u00a7 7.3.3 Notwith standing the transfer of ownership set forth in Section 7.3 above , it is abrreed and acknowledged that: .1 Drawings and Specification s prepared by the Arc hitect will contain numerou s design det ails and typical speci fication s (\"Standard Detail s/Specifications\") which , collectively , form a part of the design tor the Project but which. separate ly. are not Project specific . are related to function as compared to design form, are repetitiv e in nature and were not specific ally developed for or identifiable with the Project ; and .2 Given the above , the Standard Detail s/Specifica tions shall remain the property of the Architect and may be used by the Architect on other project s, in other conte xts an d/or for other client s, so long as they are not collectivel y used in a manner which replicates the overall design of the Project. \u00a7 7.4 Except for the licen ses and ownership granted in this Article 7, no other licen se, ownership or right shall be deemed granted or implied under this Agreement. The Owner shall not assign , delegate , sub license, pledge or otherwise transfer any licen se or owner ship granted herein to another party without the prior \\'ll'itten abrree ment of the Arc hitect. Any unauthorized use of the Instrument s of Service shall be at the Owner 's sole risk and without liability to the Architect and the Architect' s consultant s. ARTICLE 8 CLAIMS AND DISPUTES \u00a7 8.1 General \u00a7 8.1.1 The Owner and Architect shall comm ence all claims a nd causes of action , whether in contract, tort, or otherwise , against the other arising out of or related to this Agre ement in accordance with the requireme nts of the meth od of binding dispute resolution selected in this A greemen t within the period specified by applicable law. \u00a7 8.1.2 To the extent damages are covered by property insurance, the Owner and Architect waive all rights against each other and against the contractors , consultant s, agents and employees of the other for damages, except such rights as they may have to the proceed s of such insurance as set forth in the modified AlA Document A232 -2009, General Conditions ofthe Contract for Construction. The Owner or the Architect , as appropriate, shall require of the Construction Manager, contractor s, consultants, agents and employees of any of them similar waivers in favor of the other parties enumerated herei n. AlA Document B132 T\"- 2009 (formerly 8141 r\"CMa -1992) . Copy right \u00a9 1992 and 2009 by The American Institute of Architects. All rights reserved . WARNING : This AlA ~ ' Document is protected by U.S. Copyr ight Law and International Treaties . Unauthorized reprodu ction or distribution of this AlA' 17 Document , or any portion of it, may result in severe civil and criminal penalties , and will be prosecuted to the maximum extent possib le under the law. This docum ent was produced by AlA software at 13:26:47 on 08/01/20 17 under Order No.2341 018896_1 which expires on 01/01/2018. and is not for resale User Notes : (1232093781) I nit. \u00a7 8.1.3 Architect shall, to the fullest extent permitt ed by law. indemnity , defend and hold harml ess Owne r. and its officer s. board members. employee s and represent atives (\"lndemnitees\"). fi\u00b7om and again st all claim s, damages , losses and expenses. including but not limited to attorne y's fees, arising out of or relating to the negligent or willful acts or omis sions of the Architect or those for whom the Architect is respon sible, provided such claim, damage. loss or expense is attTibutab le to bodil y injur y, sickness. disease or death or to injury to or destruction of tangib le propet1y. regard less of whet her caused in pa11 by one or more of the lndemnitee s, and regardle ss of any claim of neglig ence by one or more of the lndemnitee s. The indemnification obligations set forth above shall surviv e completion of the performance and/or termination of this Agreement. With respect to any claim against one or more lndemnite es asserted by an employee of the Architect (or an employee of those for whom the Architect is responsible) , the indemnification obligation set forth herein shall not be reduced or limit ed by any statutory cap or other limita tion on the amount or type of damage s, compensation or other benefits payable by Archit ect (or those for whom Architect is responsible) under worker 's comp ensation acts, disability benefit acts or other employee benefit acts. \u00a7 8.1.4 The pa11i es agree to provide one another with \\\\1'itten notice of a dispute within a reasonable time , not to exceed thirty (30) days, after obta ining knowledge of the same and shall includ e: (I) a state ment spec ifYing that a dispute has occutTed that falls within the scope of this Article , (2) a statement of the pm1y's position and a summar y of evide nce and argument s that supp011 such position, and (3) the name and title of the disputing party's authori zed repre sentative . Within twenty (20) days after receipt of the disputing party's notice , the respondin g party shall submit a written response to the disputing party. The response shall contain : (I ) a statement of the respondin g party 's position and a summa ry of evidence and arguments that support such posit ion; and (2) the name and title of the respondin g party's authorized representat ive. In the absence of an agreeme nt to the contrary, the parties' authorized repre sentatives shall meet in Marion County, Indiana, at a mutuall y acceptable time and place within ten (I 0) days after the disputi ng party recei ves a response and thereafte r as often as they reasonabl y deem necessary to exchange relevant information and to attempt to resolve the dispute . If the dispute has not been resolved within forty (40) days after the disputi ng party receives the response, or if the responding party refuses or fails to comp ly with the provisions of this Section. then the disputing party may comme nce legal action again st the respondi ng party. \u00a7 8.2 Mediatio n \u00a7 8.2.1 Although the parties to the Contract may agree to mediation , mediation as described in Section 8.2 shall not be a condi tion precede nt to litigation by either party. The exclusive venue for all claims , disputes or litigati on arising out of the Contract or the Contract Document s shall be in Marion County , Indiana . \u00a7 8.2.2Ifthe parties do not resolve a dispute through me diation pursuant to this Section 8.2, the method of binding dispute resolution shall be the followin g: (Check the appropriate box. ({the Owner and Construction Manager do not select a me thod of bindin g displlle resolution below, or do not subsequently agree in writing to a binding dispute resolu tion me thod other than litigation the dispute will he resolved in a court of compe tent juris diction.) [ ] Arbitration pursuant to Section 8.3 of this Ahrreement [X] Litigation in a court of competent jurisdiction [ ] Other: (Spec{fy) (Paragrap hs deleted) \u00a7 8.3 Exclusive Venue For Litigation And Attorneys ' Fees \u00a7 8.3.1 Although the pmiie s to the A6rree ment may agree to mediation, mediation shall not be a condition precedent to litigation by either party. The exclu sive venu e for all claim s, dispute s or litigation arising out of the Contrac t or the Contract Document s shall be in Marion County, Indiana. (Paragrap h deleted) \u00a7 8.3.2ln the event that a party default s in its performance or observance of any of the terms, conditions or obligations contained in the Agreement, or in the event that either party has to emplo y attorne ys to enforce any part of the Agreement, the prevaili ng party in any such action shall be entit led to recover fi\u00b7om the other party all reasona ble attorneys ' fees and costs incml'ed in connection therewith, including litigation, post-judgment proceedings and appea ls. For the purpo ses of this Section, \"prevai ling party\" shall mean the party that receives all or AlA Document B1J2TM -2009 (formerly 6141 \"'CMa- 1992) . Copyright\u00a9 1992 and 2009 by The Amer ican Institute of Architects. All rights reserved. WARNING : This AlA\u2022\u00b7 Document is protected by U.S. Co pyright Law and International Treaties . Unauthori zed reproduction or distribut ion of this AlA\u2022 18 Document , or any portion of it, may result in severe civil and criminal penalties , and will be prosecuted to the maximum extent poss ible under the law. This document was produced by AlA software at 13:26: 47 on 08/01/2017 unde r Order No.2341018896_1 which expires on 01/01/2018 , and is not for resale . User Notes : (123209378 1) I nit. substantia lly a II of the rei ief sough t by that party. based upon an assessment of the party's major arguments or positions taken in the suit or proce eding and whether it could fairly be said that party prevailed over the other party's major argume nts or positions on major disputed issues. Any attorneys\u00b7 fees and other costs and expe nses incurred by either pmty in enforcing a judgment in its favor under the Agreement shall be recoverab le sepa rately fi\u00b7om and in addition to any other amount included in such judgment , and such attorneys' fees obligations is intended to be severab le fi\u00b7om the other provisions hereof and to surv ive and not be merged in any such judgment. (Paragrap hs deleted) \u00a7 8.4 Architect's Consultants Bound The Architect shall include in its contract s with its Consultants provisio ns that bind the Consultants to the dispute resolution procedures ofthis Agreement. ARTICLE 9 TERMINATION OR SUSPENSION \u00a7 9.1 If the Owner fails to make payment s to the Architect in accordance with this Agreement, such failure shall be considered substan tial nonperformance and cause for termination or, at the Architect's option, cause for suspe nsion of perform ance of service s under this Agreement. If the Architect elects to suspend services , the Architect shall give seven (7) days' written notice to the Owner before suspending service s. In the event of a suspension of services. the Arch itect shall have no liability to the Owner for delay or damage caused the Ovmer because of such susp ension of services. Before resuming services, the Architect shall be paid all sums due prior to suspension . The Architect's time schedu les for the remaining services shall be equitably adjusted. \u00a7 9.2lfthe Owner suspends the Project for more than thirty (30) consecutive days, the Architect shall be compensated for servi ces performed prior to notic e of such suspension. When the Project is resumed. the Architect shall be compensated for expen ses incurred in the interruption and resumption of the Architect's services. The Architect' s fees for the remaining services and the time sched ules shall be equitably adjusted. \u00a7 9.3 This Agreement may be terminated by the Owner upon not less than seven (7) days' written notice to the Architect in the event that the Project is perm anen tly abando ned. If the Owner suspends the Prqject for more than ninety (90) cumulative days for reasons other than the fault of the Architect, the Architect may termina te this Agreement by giving not less than seven (7) days ' written notice. \u00a7 9.4 Either party may terminate this Agreement upon not less than seven (7) days' written notice should the other party fail substantiall y to perform in accordance with the terms of this Agreement through no fault of the pat1y initiating the tennination. \u00a7 9.5 The Owner may tenninate this Agreem ent upon not less than seven (7) days' written notice to the Architect for the Owner's convenience and without cause. \u00a7 9.6 In the event of termination not the fault of the Architect, the Architect shall be compensated for servi ces performed prior to termination , togeth er with Reimbursab le Expenses then due. \u00a7 9.7 The Owner's rights to use the Architect's Drawings and Specifications in the event of a termination of this Agreement are set forth in Article 7. (Paragraph deleted) ARTICLE 10 MISCELLANEOUS PROVISIONS \u00a7 10.1 This Agreement shall be gove med by the law of the State of Indiana. \u00a7 10.2 Term s in t his Agreement shall have the same meaning as those in the modifi ed AlA Document A232 -2009, General Condition s of the Contract for Construction. \u00a7 10.3 The Owner and Architect, respectively, bind them selves, their agent s, successors , assigns and legal repre sentative s to this Agreement. Neither the Owner nor the Architect shall assign this Agreement, any portion of this Agreement , or any right, interest, privi lege, duty, claim, defen se, chose of action or liability arising out of or relating to this Agreement without the written consent of the other, and any purported assignment in violation of this prohibition shall be void, except that the Owner may assign this Agreement to a separate building corporation if the buildin g corporatio n agrees to assume the Owner's rights and obligations under this Agreement. AlA Document B1J2T M -2009 (formerly 8141 TMCMa -1992) . Copyright\u00a9 1992 and 2009 by The American Institute of Architects. All rights reserved. WARNING : This AIAf> Document is protected by U.S. Copyright Law and Internat ional Treaties . Unauthor ized reproduction or distribution of this AlA ~ \u00b7 19 Document , or any portion of it, may re sult in severe civil and crimina l pena lties, and will be prosecuted to the maxim um extent possible under the law. This document was produced by AlA softWare at 13:26:47 on 08/0112017 under Order No.2341018896_1 which expires on 01/01/2018 . and is not for resale User Notes : (1232093781 ) In it. \u00a7 10.4lfthe Owner requests the Architect to execute certificates, the propo sed language of such certificates shall be submitted to th e Architect for review at least fourteen ( 14) days prior to the requested dates of exec ution . The Architect shall not be required to execute certificates or consents that would requ ire knowledge , services or responsibilities beyond the scope of this Agreement. or ~1at , in the opinion of Architect , might be alleged or construed to impose a duty on the Architect beyond those duties impo sed by this Agreement or subject the Architect to liabiliti es, claims or causes of action other than those that would be available to the Owner under this Agreement. \u00a7 10.5 Nothing contained in this Agreement shall create a contractual relationship with or a cause of action in favor of a third party against either the Owner or Architect. \u00a7 10.6 Unless otherwise required in this A!:,rreement, the Architect shall have no respon sibility for the discovery, presence, handling, removal or dispo sal of, or exposure of persons to, hazardous material s or toxic substances in any form at the Project site. \u00a7 10.7 The Architect shall have the right to include photographic or miistic repre sentations of the design of the Project among the Architect 's promotional and profe ssional material s. The Architect shall be given reasonable access to the completed Project to make such repre sentation s. However , the Architect 's materi als shall not include the Owner's confidential or proprietar y information if the Owner has previously advised the Architect in writing of the specific information considered by the Owner to be confidential or proprietary. The Owner may, if requested by Architect, provide professional credit for the Architect in the Owner's promotional materia ls for the Project. \u00a7 10.8 lfthe Architect or Owner recei ves information specificall y designated by the other party as \"confidentia l\" or \"business proprietary,\" the receiving party shall keep such information strictly confidential and shall not disclose it to any other person except to (1) its employee s, (2) those who need to know the content of such information in order to perform services or construction solely and exclusively for the Project, or (3) its consultants and contractors whose contracts include similar restriction s on the use of confidential information. \u00a7 10.9 E-VERIFY PROVISIONS \u00a7 10.9.1 As required by Indiana Code \u00a722-5 -1.7, as amend ed. Architect will enroll in and verify the work eligibility status of all newly hired emplo yees through theE- VerifY Program for as long as the program remains in existence. The Architect will sign Owner 's affidavit to this effect, as well as certifYing that the Architect does not knowingly employ an unauthorized alien. \u00a7 10.9.2 Architect represents that it is enrolled in and verified the work eligibility status of all newly hired emplo yees of the Architect through the E-Verify Program as defined herein ; however , Architect is not required to verify the work eligibil ity status of all newly hired employees of the Architect throu gh the E-Verify Program if the E-Verify Program no longer exists and Architect signs an Affidavit affirming that the Architectdoes not knowingly employ an unauthorized alien. E-Verify Program means the electronic verification of work authorization program of the Illegal Immigration Reform and Immigr ation Responsibilit y Act of 1996 (P.L. 1 04-208) , Division C, Title IV, s.403(a), as amended, operated by the U nited States Department of Homeland Security or a successor work authorization program designated by the United States Department of Homeland Security or other federal agency authorized to verify the work authorization status of newly hired employees under the Immigration Reform and Control Act of 1986 (P.L. 99-603) (the \"E-VerifY Program\"). \u00a7 10.9.3 Architect and its consultant( s) may not knowingly employ or contract with an unauthorized alien; or retain an employee or contract with a person that the Architect or its consultant subsequentl y learns is an unauthorized alien. lf Architect violates this requirement , the Owner shall require in writing that the Architect remedy the violation not later than thi1iy (30) days after the date the Owner notifies the Architect of the violation. There is a rebuttable presumption that Architect did not knowingly emplo y an unauthorized alien if the Architect verified the work eligibility of the emplo yee through theE- Verify Program . If the Architect fails to remedy the violation within the thi1iy (30) day period , the Owner shall terminate the Agreement with Architect for breach. Howev er, if Owner determine s that tenninat ing the Agreement would be detrimental to the public interest or public property , the Owner may allow the Agreement to remain in effect until the Owner procures a replacement Architect. If the Owner terminate s the Agreement, the Architect shall be liable to the Owner for any and all actual damages incun\u00b7ed, including, but not limited to, attomeys' fees. AlA Document B132TM- 2009 (formerly 6141 TMCMa- 1992). Copyright\u00a9 1992 and 2009 by The American Institute of Architects. All rights reserved. WARNING: This AI At, Document is protected by U.S. Copyright Law and International Treaties . Unauthorized reproduction or distri bution of this AlA ~ 20 Document , or any portion of it, may result in severe civil and crim inal penalties , and will be prosecuted to the maximu m extent possible under the law. ThiS document was produced by AlA softWare at 13:26\"47 on 08/01/2017 under Order No.2341018896_1 which expires on 01/01/2018 . and is not for resale . User Note s: (1232093781) I nit. \u00a7 10.9.4 Architect's consultant{s) shall certifY to Architect in a manner consistent with federal law that the Architect's consultant{ s), at the time of certification , does not knowingly employ or contract with an unauthorized alien; and has enrolled and is participating in the E-Verif)' Program. \u00a7 10.9.5 Architect shall maintain in its files a certification of each of its consultant(s) throughout the duration of the term of this Agreement and the term of Architect's agreement with its consultant(s). \u00a7 10.9.6 Termination of the Agreement for violation ofthis requirement may not be considered by the Architect or its consultant(s) as a breach of contract by the Owner. \u00a7 10.10 BACKGROUND CHECKS \u00a7 10.10.1 The Owner will require the Architect to conduct a background check for criminal history for all workers on the Project in comp liance with Indiana Code \u00a720-26-5 -1 0 and \u00a720-26-5- 11 for the last ten (I 0) years. \u00a7 10.10.2 The Architect shall provide, when awarded the right to provide services under this Agreement, a list of all personnel used by or on behalf of the Architect , whether employed by them or not, who will be engaged in the providing services . The list ofpersons shall be provided written evidence of a criminal record searc h with respect to all persons on the list dated within thirty (30) days of the said date of the Af,>Teement and extending at least ten ( 1 0) years prior. \u00a7 10.10.3 Architect agrees that no person will be providing services who has any criminal conviction for any type of behavior that would place the student s or staff at risk. If evidence of such behavior occurs after this initial search, but during their employment on Project, such worker shall be removed immediately fi\u00b7om the Project and shall be banned for the duration of the Project. Evidence of behavior that is prohibited would includ e, but not limited to, the following : ( 1) Murde r [IC \u00a734-42-1-1]. (2) Causing suicide [IC \u00a735-42-1-2]. (3) Assisting suicide [IC \u00a735-42-1-2 .5]. ( 4) Volun tary manslaughter (IC \u00a735-42- 1-3]. (5) Reckless homi cide [IC \u00a735-42-1 -5]. (6) Battery [IC \u00a735-42-2-1] unless ten ( 1 0) years have elapsed rrom the date the individual was discharged fi\u00b7om probation , impr isonment , or parole, whichever is later. (7) Aggravated batte ry [IC \u00a735-42-2-1 .5]. (8) Kidnapping (IC \u00a735-42-3-2]. (9) Criminal confinement [IC \u00a735-42-3-3]. (I 0) A sex offense under ([IC \u00a735-42-4 ]. (II) Carjacking [IC \u00a735-42-5-2]. {12) Arson [IC \u00a735-43- 1-1] unless ten (10) years have elapsed rrom the date the individual was discharged rrom probation, imprisonment, or parole , whichever is later. {13) Incest [IC \u00a735-46- 1-3]. ( 14) Neglect of a dependent (!C \u00a735- 46-l -4(a)( 1) and IC \u00a735-46-1-4(a)(2)] unless ten (I 0) years have elapsed rrom the date the individual was discharged fi\u00b7om probation, imprisonment or parole , whic hever is later. ( 15) Child selling [IC \u00a735-46-l-4(b)]. (16) Contributing to the delinquency of a minor [IC \u00a735-46- 1-8] unless ten (10) years have elapsed from the date the individual was discharged fi\u00b7om probation, imprisonment, or parole , whichever is later. (17) An offense involving a weapon under IC \u00a735-47 unless ten (10) years have elapsed from the date the individual was discharged from probation, imprisonment, or parole, whichever is later. ( 18) An offense relating to controlling substance s under IC \u00a735-48-4 unless ten (I 0) years have elapsed fi\u00b7om the date the individual was discharge d from probation, imprisonment, or parole, whichever is later. ( 19) An offen se relating to material or a performance that is hannful to minors or obscene under IC 35-49-3 unless ten (1 0) years have elapsed rrom the date the individual was discharged rrom probation, impri sonment , or parole, whichever is later . AlA Document 8132\"'- 2009 (formerly B141'\"CMa -1992) . Copy right\u00a9 1992 and 2009 by The American Institute of Architects. All rights reserved. WARNING : This AlA' ' Document is protected by U.S. Copyright Law and International Treat ies. Unauthoriz ed reproduction or distribution of this AlA' ' 21 Document, or any portion of it, may result in severe civil and criminal penaltie s, and will be prosecuted to the maximum extent possible unde r the law. This document was produced by AlA software at 13:26:47 on 08/0112017 under Order No.2341018896_1 which expires on 01/01/2018 , and is not forresale User Notes : (1232093781) I nit. (20) An oftense relating to operating a motor vehicle while intoxicated under IC \u00a79-30 -5 unless five (5) years have elapsed fi\u00b7om the date the individual was discharged fi\u00b7om probation , impri sonment , or parole. whichever is later. (21) An offense that is substanti al equiva lent to any of the offenses listed in this subsection in which the judgment of conviction was entered under the law of any other jurisdiction. Should the Architect change personnel durin g the existe nce of the Agreement providin g for service s, it shall at least ten (1 0) days prior to using any other personne l other than those previou sly disclo sed, provid e the same information for the new perso nnel as provided for under the tenn s of the provision. \u00a7 10.11 DRUG TESTING \u00a7 10.11.1 The Owner will require the Architect to conduct testing for drugs and alcohol for all workers on the Project. Drugs and alcohol shall be as defined by Indiana Code \u00a735-48 -4-4. The Architect shall provide, when awarded the right to provide services under this Agreement, a list of all personnel used by or on behalf of the Architect, whether employed by them or not, who will be engaged in the providing of services . The list of persons shall be provided written evidence of drug and alcoho l testing with respect to all persons on the list dated within seven (7) days of the said date of the Agreement. Architect agrees that no person will be providin g services who has tested positive to any of the items included and shall be banned fi\u00b701n thejobsite for the duration ofthe Project . Continued testing shall be cond ucted throughout the Project duration every six (6) months maximum. Any persons testing positive shall be removed imm ediately from the site and shall be banned from the jobsite for the duration of the Project. The Architects and their employees shall meet all State and Federal statutor y requirement s. \u00a7 10.12 FIRE ARMS \u00a7 10.12 .1 There shall be no fireann s allowed on the Project site or anywhere within the Project property . Exceptions would be made for law enforcement officials, security forces required elsewhere by these Specifications, or per other requireme nts or allowances specificall y made by the Owner. \u00a7 10.13 NO SMOKING OR TOBACCO \u00a7 10.13.1 There shall be no smoki ng or tobacco use allowed within the Proje ct buildings. on the Project site or anywhere within the Project property. Violator s shall be removed from the Prc~ject immediat ely. Any construction materia ls in contact with or exposure to such tobacc o produc ts shall be removed and replaced with new. at the responsible party' s expense. \u00a7 10.14 ADDITIONAL PROTECTIONS \u00a7 10.14.1Additional requirements and level s of protection are afforded to Public Building s in compliance with Indiana Code \u00a7 16-41-37, and include an enclo sed struc ture or part of an enclosed structure that is one of the following: (I) Occup ied by an agency of state or local governme nt. (2) Used as a classroom building or a dining area at a s tate educational institution (as defined in IC \u00a720-12-0.5- 1 ). (3) Used as a public school (as defined in IC",
        "The responses will be reviewed an evaluation panel consisting of individual s selected by the \nDistrict.   Responding A/E(s) will bear all costs of this RFP and interviews, if any.  \n\nProposals will be reviewed using the following criteria /elements:  \no Conciseness, responsiveness and completeness of the proposal to the inform ation \nrequested, objectives, and deliverables as outline in the RFP  \no Consultant / Supplier Diversity inclusion  \no Fee Proposal / Cost: Overall fee / billing rates  \no Prior experience, Qualifications, References, Past Performance of A/E  \no Experience / Expertise in K -12 School Projects  8 \n o Experience with Sustainable or \u201cGreen\u201d Design  \no Level of Innovation with a Focus on our Educational Vision  \no A/E\u2019s Technological Capabilities (to  manage this project in a paperless or almost \npaperless manner)  \n\nAt the District\u2019s discretion, to further assist in evaluation, some, one, o r all of the responding \nA/E(s) and/or individuals may be requested to participate in an interview proc ess. The inter view \nwill be used as another opportunity to clarify any issues within a given Pr oposal and explore the \napproaches that may be used to satisfy all requirements for the District.  \n\nA/E(s) shall submit fee proposal using the Fee Proposal Form provided with thi s RFP. At the \nDistrict\u2019s discretion, it may directly negotiate with the best qualified A/E on final scope and fee.  \n\nThe District may  also consider alternative proposals to provide A/E services if there is an  \nopportunity for substantive savings (without adv ersely affecting the project timeline or quality) \nand other significant benefits (to be clearly articulated by the proposer and be  measureable) \naccruing to the District.  \n\nThe District may investigate the qualification of any individual or A/E under consideration, \nrequire confirmation of information furnished and require additional evidence of quali fications \nto perform the services described in this RFP. The District also reserves certain rights, including, \nbut not limited to, the following:  \n\na. Reject a ny or all of the proposals  \nb. Issue subsequent Requests for Proposals  \nc. Cancel the entire Request for Proposal  \nd. Remedy technical errors in the Request for Proposal process  \ne. Appoint evaluation committees to review qualifications and proposals  \nf. Seek the assistance o f outside technical experts in evaluation  \ng. Approve or disapprove the use of particular subcontractors  \nh. Establish a short list of A/E(s) eligible for discussions after review of RFP  \ni. Negotiate with any, all, or none of the A/E(s)  \nj. Solicit best and final offers from all, some, or one of the A/E(s)  \nk. Award a contract to one or more A/E(s)  \nl. Waive informalities and irregularities in RFP  \nm. Award without discussion  \n\nSelection will be based upon a determination as to which proposal is in th e best interest of the \nMetropolita n School District of Washington Township. Any decision made by the District,  \nincluding the selection of A/E, shall be final and is NOT subject to appeal.  \n\nThis RFP shall not, in any manner, be construed to be an obligation on the Distri ct to enter into \na contract or result in any claim for reimbursement of cost for any efforts exp ended in \nresponding to the RFP or in anticipation of any contract.  9 \n  \nAward of Agreement.  Upon the completion of the selection process, the  District shall notify all \nA/E(s) of the selection and the successful A/E shall enter into the District\u2019 s AIA Document B132 -\n2009 Standard Form of Agreement Between Owner and Architect, Construction Man ager as \nAdviser Edition, as modified by the District and included in these RFP Documents (the \n\u201cAgreement\u201d).  The Agreement includes AIA Document A232 \u2013 2009 General Conditions of the \nContract for Construction, Construction Manager as Advisor Edition modified  by the District and \nis available for review upon A/E\u2019s request to District.  A/E\u2019s Proposal and Fee  shall be based on \nthe terms of the Agreement as contained herein and the modified General Conditi ons without \nqualification or exception.   \n\n \nX. Submittal Requ irements  "
      ],
      "ground_truth_context": [
        "Upon payment by the Owner of all fees due and owing Architect for professional services under this Agreement, all right, title and interest in the Drawings and Specifications and other documents",
        "shall become the property of the Owner."
      ],
      "metadata": {
        "question_id": 314,
        "RFP_id": "infra_4",
        "RFP_type": "infra",
        "chunks": [
          15
        ],
        "manually_edited": false
      },
      "timing": {
        "retrieve_context": 0.0697639833797108,
        "llm_response": 4.504296779632568,
        "total": 4.574060763012279
      }
    },
    {
      "question": "What are the erosion control requirements for the project design?**",
      "llm_response": "All designs must conform to the latest county and state erosion control and sedimentation rules, regulations, and ordinances, with an approved erosion control and sedimentation plan included in the final approved set of utility plans.",
      "ground_truth_answer": "Designs must comply with County and state erosion control rules, including an approved erosion control plan.",
      "retrieved_context": [
        "B. Assist the Engineer  in obtaining permission to enter upon public and private \nproperty as required for  the Engineer  to perform its services.  The County will \nacquire the necessary easements and/or property.  \n\nC. Examine all studies, test results, reports, sketches, drawings, specifications, and \nproposals, and other documents presented by  the Engineer . \n\nD. Pay all advertising costs necessary to obtain bids for contractors.  \n\nE. Designate a person to act as the County 's representative with respect to the work \nto be performed under this agreement.  Such person shall have the authority to \ntransmit instructions, receive information, interpret and define the County 's \npolicies and decisions with respect to materials, equipment, elements, an d \nsystems pertinent to  the Engineer 's services.  \n\n \nDESIGN CRITERIA FOR ALL COUNTY PROJECTS  \n\n \n All designs shall conform to the latest C ounty, state, and federal regulations or \nstandards.  \n\n All designs shall conform to the latest County and state erosion contr ol and \nsedimentation rules, regulations, and ordinances.  An erosion control and \nsedimentation plan must be approved by the County Erosion and Utility Inspection \nDepartment and included in the final approved set of utility plans.  \n\n The Engineer  shall be res ponsible for coordinating his design and construction work \nwith other Engineer s where the projects connect or are affected by other projects.  \n\n The Engineer  shall furnish a set of as -built project plans (recording drawings) as \nreflected by the inspection reports and field notes prepared on blackline mylar film   8 | Page  \nEngineering Services RFP #2020 -05-21 \n from information furnished by the project inspector at no additional cost to the \nCounty.  \n\n A completion date for submittal of engineering plans shall be established.  ",
        " The Engineer  shall submit plans and  specifications and assist in obtaining approval \nfrom all local, state , and federal regulatory agencies.  \n\n The Engineer  shall furnish the necessary plans and assist in the preparation of the \napplication for Virginia Department of Transportation permits as necessary.  \n\n A letter will be sent in a form approved by the County by the Engineer  to all property \nowners requesting permission to enter their property for surveys.  \n\n No trees or shrubs shall be cut without prior approval of the property owner. \n\n The Engineer  shall prepare all bid documents on forms as approved by the County.  He \nshall furnish the County with four (4) sets of specifications.  The Engineer  shall also \nfurnish four (4) sets of plans to the County 's contractor at no cost.  Additional sets \nwill be furnished at reproduction cost. \n\n The Engineer  shall advertise for bids in local newspaper and furnish plans and \nspecifications at  the Engineer 's sole expense to Dodge Report, Builder 's Exchange , \nand The Association of General Contractors.  Advertisement fo r bids shall be \ncoordinated with the respective County department.  Cost of advertising in newspaper \nwill be paid by the County.  \n\n Monthly progress reports on the construction shall be submitted to the Director of \nPublic Works/ Utilities . \n\n The Engineer  shall  designate in writing a project manager with authority to act on \nbehalf of the firm in technical matter.  \n\n \nSELECTION PROCESS  \n\n \nA. EVALUATION CRITERIA shall include, but are not necessarily limited to: ",
        " \nD. Prepare preliminary design documents consisting of construction plans, survey \nplats , and specifications. \n\n \nE. Based on the information contained in the preliminary design documents, \nsubmit an opinion of probably project cost including, but not limited to, \nconstruction costs and contingencies. \n\nF. Furnish three (3) copies of the preliminary design documents and the  Engineer 's \nopinion of probable project cost to the County , and present and review them \nwith the County.  \n\nG. Furnish all such documents, plans, and design data as may be required for, and \nassist in the preparation of, the required documents so that the County may \nobtain approvals of all such governmental agencies and authorities as have \njurisdiction over design criteria and environmental impact applicable to the \nproject, and assist in obtaining such approvals by participating in submissions to \nand negotiations with appropriate officials and authorities, including \nadministrative hearings involv ing the project .  The Engineer  will attend as many \nhearings and meetings as are necessary to obtain such approval.  \n\n1.3 Final Design Phase.  \n\nUpon completion of the preliminary design phase and notification by the County that the \npreliminary design documents ar e acceptable in all respects to the County and to all \ngovernmental agencies and authorities as have jurisdiction over design criteria and \nenvironmental impact applicable to the project, the Engineer  shall: \n\nA. On the basis of the preliminary design documents as finally approved, prepare \nthe final construction plans and specifications, easements plats, and the \ncontractor documents, which shall include bid forms, notice to bidders, \ninstructions to bidders, advertisement, bid proposals, contract form, bonding \nand insurance requirements and, where applicable, federal compliance \nrequirements, and assist in the preparation of other related documents. \n\nB. Furnish all such documents, plans, and design data as may be required for , and \nassist in the preparation of , the requ ired documents so that the County may \nobtain approval of such from all governmental agencies and authorities as have \njurisdiction over design criteria and environmental impact applicable to the \nproject, and assist in obtaining such approvals by participati ng in submissions to \nand negotiations with appropriate officials and authorities, including \nadministrative hearings involving the project .  The Engineer  will attend as many \nhearings and meetings as are necessary to obtain such approval.  \n   5 | Page  \nEngineering Services RFP #2020 -05-21 \n C. Furnish The County  with a revised opinion of probable project cost based on the \nfinal plans and specifications and other related documents. \n\nD. Prepare any necessary documents for alternate bids requested by the County.  \n\nE. Furnish as required copies of the final plans and specif ication, contract \ndocuments, and all other related documents to the County and present and \nreview all such documents with the County.  ",
        "1.4 Bidding or Negotiating Phase.  \n\nAfter authorization from the Director of Public Works/ Utilities to proceed with the bidding \nor negotiating phase, the Engineer  shall:  \n\nA. Assist The County  in obtaining bids or negotiating proposals for each prime \ncontract for construction.  \n\nB. Consult with and advise t he County  as to the acceptability of subcontractors and \nother persons and organiza tions proposed by the prime contractor.  \n\nC. Consult with and advise t he County  as to the acceptability of substitute \nmaterials and equipment proposed by contractor.  \n\nD. Assist the County  in evaluating bids or proposals and in assembling and \nawarding contracts.  \n\nE. Prepare four (4) sets of all documents necessary for the County and the \nContractor(s) to enter into a Contract for the construction of the project and \nforward all such documents to the C ontractor for execution. \n\n \n1.5 Constructing Phase:  \n\nDuring the construction phase, the Engineer  shall:  \n\nA. Furnish The County  with an additional three sets of plans and furnish The \nCounty 's Contractor(s) with an additional four (4) sets of plans. ",
        "Technical questions concerning this Request for Proposal should be submitted to Joseph \nC. Schiebel at jschiebel@co.caroline.va.us  by no later than 2:00 p.m. on Friday, October   \n16, 2020 .  \n\n \n\n COMMONWEALTH OF VIRGINIA  \nCOUNTY OF CAROLINE    2 | Page  \nEngineering Services RFP #2020 -05-21 \n  \nBACKGROUND INFORMATION \n\nThe County of Caroline requires Professional  Engineering Services related to planning, \ndesign , and construction of potable water and sanitary sewer systems , involving both new \nconstruction and modification/rehabilitation of existing County facilities, and intends to \nconsolidate t hese requirements in to a three (3) year , non-exclusiv e contract for these \nservices, with the option to extend the contract for two (2) additional one (1) year periods, \ncancelable by the County on sixty (60) days notice. \n\nThe County reserves the right to  award contracts to more than one qualified offeror, \ndepending on the expertise of the offering firms and the needs of the County.  Selection  \nwill be as outlined below in the \" Selection Process \" and \"Selection Procedure \" sections.   \nThe selected offeror( s) may be asked to perform a variety of services throughout  the term \nof the contract.  Individual work assignments will be made for specific services from th e \nofferor during the term of the contract.  \n\nWork assignments shall be made on an \"as needed \" basis.  There is no assurance that a \nsuccessful offeror will rece ive any work assignments whatsoever under the contract \nawarded as a result of this Request for Proposals.  CAROLINE COUNTY RESERVES \nTHE RIGHT AT ALL TIMES TO PERFORM WORK IN -HOUSE OR TO \nSEPARATELY BID AND AWARD LARGE PROJECTS ON A COMPETITIVE \nSELECTION BAS IS. \n\n \nSCOPE OF SERVICES  \n\n \nBelow a re the general types  of services  expected to be provided by the consultant , and the \nminimally acceptable standards of performance.  The scope of work for individual  work \nassignment s will be negotiat ed prior to the approval of the specific assignment.  This \noutline is intended as a guide for offerors to describe the nature of the services sought and \nthe qualifications required.  Projects during the term of this contract may be expected to fall \ninto one or more of the following categories:  \n\n Master Planning (Water and Wastewater)  \nWater Supply , including Hydro- geological investigation,  Production, Treatment, \nDistribution, and Storage  \nRiver Intake Permitting  \nRiver Intake Design  \n Wastewater Collection, Conveyance, and Treatment  \n Contract Bidding, Construction Administration, and Inspection Services  \n Plan Review /Local Approval  \n Grading, Erosion, and Sediment Control  \n Surveying  \n Manage and Implement Solid Waste Environmental Monitoring \n Groundwater Monitoring Plan \n Groundwater Sampling, Chemical Analysis, Associating Reporting    3 | Page  \nEngineering Services RFP #2020 -05-21 \n Gas Extraction System and Flare Monitoring  \n Solid Waste Disposal and Collection  \nConstruction of Groundwater Monitoring Wells and Completion Reports  \n Gas Monitoring, Sampling, Analysis , and Reporting \nSolid Was te Master Planning  \n\n "
      ],
      "ground_truth_context": [
        "All designs shall conform to the latest County and state erosion control and sedimentation rules",
        "An erosion control and sedimentation plan must be approved by the County Erosion and Utility Inspection Department."
      ],
      "metadata": {
        "question_id": 72,
        "RFP_id": "infra_1",
        "RFP_type": "infra",
        "chunks": [
          3
        ],
        "manually_edited": true
      },
      "timing": {
        "retrieve_context": 0.0697639833797108,
        "llm_response": 0.668616771697998,
        "total": 0.7383807550777088
      }
    },
    {
      "question": "Who is the designated point of contact for compliance-related inquiries about the Tribune Building project?",
      "llm_response": "Chelsey Mazurek, Tribune Building Project Manager, is the designated point of contact for compliance-related inquiries about the Tribune Building project.",
      "ground_truth_answer": "The designated point of contact is Chelsey Mazurek, Tribune Building Project Manager at Incourage Community Foundation Inc.",
      "retrieved_context": [
        " \nRequest for Proposal (RFP) \u2013 Tribune Building Project  \nIncourage Community Foundation,  Inc. (\u201cIncourage\u201d)  located in rural central Wisconsin, invites proposals  from \ninterested firms  for Construction Management services on the Tribune Building Project (located at 220 First \nAvenue South, Wisconsin Rapids).  \n\nSubmission Deadline:      Friday, February 13, 2015  at 4:0 0 p.m. CST  \n  \nTABLE OF CONTENTS  \n1 Project Information  \n2 Scope of Services \u2013 Construction Manager \u2019s Responsibilities  \n3 Owner\u2019s Responsibilities  \n4 Insurance and Bonds  \n5 Proposal Format  \n6 Proposal Submittal  \n7 Proposer \u2019s Site Visit &  Q&A Session  \n8 Final Selection  \n9 Additional Information Requests  \n  \n1. PROJECT INFORMATION  \n\n1.1   ABOUT INCOURAGE  \nEstablished in 1994, Incourage Community Foundation is a nationally recognized leader in place -based \nphilanthropy and community change efforts.  Incourage operates with a vision of a community that works well for \nall people. To achieve this vision, values of equity, inclusion and opportunity are applied to all work, and to the \nrelationships Incourage fosters to accomplish its work. To this end, Incourage strives to work with vendors and \nsubcontractors who:  \n\n\uf0b7 Are located in the local community or within a 200-mile radius;  \n\uf0b7 Hire qualified, diverse talent, who are equitably paid for their work;  \n\uf0b7 Value learning opportunities or practices, and building capacity of their team or others involved in the work;  \n\uf0b7 Can demonstrate a connection to place;  \n\uf0b7 Have an eye on sustainability (of environment and business) and have demonstrated a commi tment to \ncorporate social responsibility.  \n\nIncourage is seeking proposals to provide Construction Manag ement  services under an AIA A133 contract \nstructure with  a guaranteed maximum price on the major renovation of the Tribune Building, as described in this  \nRFP (the  \u201cProject\u201d  and sometimes the \u201cTribune Building Project\u201d) . The selected Proposer will become the \nConstruction Manager  (CM).  \n\n1.2 DELIVERY METHOD  \nThe delivery method for the Project is \u201c Construction Manager  at Risk\u201d ( CMAR), which consists of a n AIA A133 \nbased contract covering the pre -construction and construction phase.    \n\n1.3 PROJECT BACKGROUND  \nThe Project (tribunebuilding.org) began when Incourage Community Foundati on (incouragecf.org) purchased the \nhistoric Tribune Building  along the Wisconsin River with the intent that residen ts would decide its future use. To \ndate, over 750 community members have invested more than 4,400 hours in this resident -led decision making \nprocess.  As determined through this process, the Tribune Bu ilding is a social enterprise helping to shape a new \neconomy and co mmunity that works well for all.  \nPage 2 \nTo that end, the space will include a number of local entrepreneurial operations with benefit to the local \neconomy, including a culinary kitchen, microbrewe ry, cafe/brewpub, creative workshop, and re creational \nrentals . Further, as Incourage is committed to investing in the people who will inhabit the space as much as the \nfunctional space needed for production of their goods and services, the Tribune Building will effectively grow \nhuman talent simultaneous to the local economy.  \nThe Tribune Building\u2019s operational model is currently being developed to fully realize a space that advances the \nvalue and importance of relationships and human potential; an environment  that fosters and accepts failure; \ncreativity and innovation; and entrepreneurship.  \n1.4 COMMUNITY CONTEXT   \nIn 2000, the south Wood County area was devastated by economic hardships brought about by the sale of \nConsolidated Papers Inc. \u2013 a Fortune 500 paper company that had been headquartered in Wood County for more \nthan a century.  At its operating peak, the mill employed almost half of the region\u2019s workforce.  The dramatic \neconomic shift compelled a shift in community thinking and, in response , residents realized that complacency \nwould not serve their changed circumstances.   The Tribune Building Project seeks to support residents in \ndetermining their own identity.  By reimagining the building\u2019s future, residents are collectively shaping the \ncom munity\u2019s future.   \n\n1.5 PROPERTY SIGNIFICANCE  \nThe Tribune Building is centrally located downtown, beside the Wisconsin River and other community assets.  \nBoth the site and the 20,000 square foot building leverage historic, local significance and distincti veness that are \nalready meaningful and iconic for th e south Wood County area.  The Tribune B uilding is former home to the local \nnewspaper and radio station offices and embodies a unique mid -century modern \u2013 \u201cround \u201d structure design.  \nThe building\u2019s close p roximity to the Wisconsin River is also significant.  The revitalization will undoubtedly alter \nthe deeply rooted historical perspective of the river as a working asset \u2013 positioned to serve the local paper \nindustry. Once complete, the re -envisioned site w ill serve as a gateway for residents to experience the river as an \naccessible and cherished natural resource, public recreation place, and destination location for travelers.  The \nTribune Building\u2019s transformation is paramount to Wisconsin Rapids\u2019 downtown  and riverfront renaissance.   \n\nThe Project site address is 220 First Avenue South, Wisconsin Rapids.  \n\n\uf0b7 The Project Design Documents are provided in Exhibit A.  ",
        "Administration  \nUpon the execution of the Guaranteed Maximum Price Amendment, the Construction Manager  shall prepare and \nsubmit to the Owner and Architect a construction schedule for the Work.  The Construction Manager  shall \nupdate the Owner in writing on the progress of the Project on a monthly basis indicating the percentages of \ncompletion and other information required by the Owner.  \n\nThe Construction Manager  shall develop a system of cost control for the Work, inclu ding regular monitoring of \nactual costs for activities in progress (compared to the Schedule of Values) and estimates for uncompleted tasks \nand proposed changes. The Construction Manager  shall identify variances between actual and estimated costs \nand repor t the variances to the Owner and Architect and shall provide this information in its monthly repo rts to \nthe Owner and Architect.   \n Page 5 \nThe Construction Manager  shall comply with applicable laws, statutes, ordinances, codes, rules and regulations, \nand lawful or ders of public authorities applicable to its performance under this Contract, and with equal \nemployment opportunity programs, and other programs as may be required by governmental and quasi -\ngovernmental authorities for inclusion in the Contract Documents.  \n\n3. OWNER\u2019S  RESPONSIBILITIES  \n\nArchitect  \nThe Owner shall retain an Architect to provide Program Verification, Criteria  Design, Detailed Design, and \nImplementation  Document s related to the Project.  Architect and Engineering fees will be the responsibility of \nthe Owner and not included in the Guaranteed Maximum P rice.  \n\nEnvironme ntal Tests, Surveys and Reports  \nThe O wner shall be responsible for costs related to environmental studies, survey, and geotechnical services \nrelated to the Proj ect.  The Owner shall make  all studies, survey data, and results available to the Construction \nManager .  \n\nOwner\u2019s  Designated  Representative  \nThe Owner has engaged an Owner\u2019s Representative to assist Owner in decision making. When the Owner is \nrequired to act, any such action will be und ertaken by  the Owner\u2019s authorized representative with advice from \nthe Owner\u2019s Representative. The Owner\u2019s representative shall render decisions promptly and furnish information \nexpeditiously, so as to avoid unreasonable delay in the services or Work of the Construction Manager .  \n\n4. INSURANCE  AND  BONDS  \nFor all phases of the Project, the Construction Manager  shall purchase and maintain  the insurance required by \nthe Owner and to be set forth in the Construction Contract.  \n\n \n5. PROPOSAL FORMAT  \nThe proposal shall include the following information in the order indicated:  \na) Proposer Information:   Identify the firm\u2019s name and the address of its principal office and any branch offices, as \nwell as telephone number, e -mail address and website. Identify the single contact who is th e authorized \nrepresentative of the Proposer. Inclu de a brief history of the firm , number of full -time and part -time employees , \nand how you heard about/your interest in the Tribune Building Project . \nb) Organization: Provide an organizational chart graphically indicating how the firm would structure and staff the \nproposed team. Include delegation of responsibility and assignment of authority.  \nc) Personnel:  List specific  management and supervisory  personnel proposed for the project team. Indicate the \nproject assign ment and responsibilities of each  of the  management and supervisory individuals. Provide a \nresume for each proposed team member, specifically stating his or her experience and qualifications. State the \ncurrent and anticipated work assignments for each indi vidual. Include at least three client references, including \ncontact information, for each individual listed.  \nd) Hiring Practices:  Provide example(s) of your commitment to hiring and retaining a diverse workforce and \ncreating equitable working conditions.  Describe an employment practice that supports the growth of your staff. \nExplain how you determine equitable compensation for your staff.  \ne) Qualifications and  Experience:   Provide summaries  of three projects the Proposer has delivered. Include the \nname of the Owner or Developer of the project, its location, approximate budget, and the Proposer\u2019s specific \nrole in the project. Also provi de the name and contact information of a representative of the Owner or \nDeveloper from whom a reference can b e obtained.  \nf) Sustainability Experience: Provide example(s) of advanced sustainability projects the Proposer has been a part \nof. Include the name of the Owner or Developer of the project, its location, approximate budget, and the \nProposer\u2019s specific role in the project. Also provide the name and contact information of a representative of the \nOwner or Developer from whom a reference can be obtained.  \ng) Connection to Place: Provide example(s) of your demonstrated connection to place. If not situated in the local \ncommunity, it is especially important to be able to demonstrate in recent work examples a connection and \ncommitment to the place and people in which  your work was completed.  \nh) Self-Performed Work: Indicate and clearly define which elements of work your firm would propose to self -\nperform with its own forces. Describe your experience at performing this trade work.  Page 6 \ni) Subcontracted Work:  Include names, addr esses and descriptions of key subcontractors which your firm would \nemploy and a description of their relevant experience and past performance. Any subcontractors must be \nidentified in the  proposal. Please remember that after contract signing, Incourage Com munity Foundation \nreserves the right to approve all subcontractors that were not approved during the RFP process . \nj) Ability to Meet Timelines:   Provide a detailed summary of your current workload and future commitments over \nthe proposed timeline assuming a t wo-week turnaround from the submission of this proposal to the \ncommencement of services.  Submit your  expected duration in days for each pha se of the project.   \nk) Tax-Exempt Status: Describe how your firm will manage material purchases to take advantage of the tax exempt \nstatus of the Owner.  \nl) Fees:  \n\uf0b7 Pre-Construction Phase:  Provide the amount of, or basis for, compensation for the Pre Construction  Phase.  \nInclude a list of reimbursable cost items, as applicable.  \n\uf0b7 Construction Phase:   Provide the amount of, or basis for, compensation IN ADDITION to the cost listed in the \nEstimate  of Probable Cost  (Exhibit B).  The Proposer will guarantee to construct  the Project as described in \nthe P roject design documents for the amount specified in the Guaranteed Maximum Price Proposal and the \nfees quoted in this proposal subject to change orders mutually agreed upon by the Proposer and the Owner. \nNote: the Kitchen Equipment (line 11300) and the Brewery Equipment (line 11900) may be purchased \ndirectly by the Owner  from an equipment vendor who will work collaboratively with the  Construction \nManager to coordinate installation . \nm) Optional Additional Information:  Include additional information that may help the Owner more fully understand \nthe qualifications.  \n\n6. PROPOSAL SUBMITTAL  \nProposal s must be submitted and received by Incourage  no later than 4:00 p.m. on Friday, February 13, 2015.   \nProposal s may be s ubmitted by email or hard copy.  Proposal s should be submitted to:  \n\n Incourage Community Foundation  Inc. \n 478 E. Grand Avenue  \n Wisconsin Rapids WI 54494  \n Attention: Chelsey Mazurek  \n tribunebuilding@incouragecf.org   \n  \nIf only hard copy is delivered, Proposer should secure a receipt signed and time stamped by a member of the \nIncourage Community Foundation  staff.  If your proposal is emailed, note that all proposals received by the \ndeadline will be acknowledged via an e mail confirmation recei pt.  If you do not receive  an emailed confirmation \nreceipt, it is the Proposer\u2019s responsibility to ensure successful transmission and delivery via email.   ",
        "7. PROPOSERS SITE  VISIT AND Q&A SESSION  \nThere will be an opportunity for prospective Proposers to participate in a site visit to examine the building and \nthe site on Wednesday, January 28, 2015 from 10:00 a .m. to 12:00 p.m. CST. Please RSVP for the site visit  by \ncontacting Chelsey Mazurek at cmazurek@incouragecf.org  or 715 -423-3863 .   \n\nThere will also be  an opportunity for prospective Proposers to participate  in a Q&A webinar on Tuesday,  \nFebruary 3, 2015 at 2:00 p.m. CST .  The purpose of the webinar is to give Proposers the opportunity to ask \nquestions regarding the Project, as well as the RFP submission requirements. Please RSVP for the webinar by \ncontacting Chelsey Mazurek at cmazurek@incouragecf.org  or 715 -423-3863.  Chelsey will email the log -in \ninformation to the key points of contact at each firm who have RSVP\u2019d for the webinar.  \n\nProposers may also submit questions concerning the P roject in written form via email or fax to the Owner with a \ncopy  to the Architect until 4:30 p.m. CST on Tuesday, February 10, 2015 . Proposers will receive  a reply no later \nthan  4:30 p .m. on Thursday , February 12, 2015.  \n\n8. FINAL SELECTION  \nThe pr oposals will be reviewed by a committee established by Incourage Community Foundation. Selection will be \nbased on the qualifications and experience of the Proposer; its ability to  meet project timelines; the level of \nunderstanding of  and commitment to achi eve the Project\u2019s principles and objectives ; and proposed fees.  Successful Page 7 \nproposals will also demonstrate:  \n\uf0b7 Prior experience with Integrated Project / Construction Management -at-risk delivery methods (completion \nof at least one project over $ 8M in construction costs) ; \n\uf0b7 Prior experience with delivering projects that have achieved sustainability benchmarks (e.g. LEED , Living \nBuilding Challenge ); \n\uf0b7 Qualified personnel  with experience collaborating with Architects and Engineers during Design Phases ; \n\uf0b7 Qualified Cost Estimators on staff.  \nAll Proposers will be notified of their selection  for interviews  no later than February 27, 2015.   \n\nThis Request for Proposal  does not commit Incourage Community Foundation to award a contract, to pay any \ncosts incurred  in the preparation of a proposal or to contract for the goods and/or services offered . Incourage \nCommunity Foundation  reserves the right to accept or reject any or all proposals received as a result of this \nrequest, to negotiate with all qualified Propose rs or to cancel this Request for Proposals, if it is in the best \ninterests of Incourage Community Foundation to do so.  \n\nAfter the selection of a C onstruction Manager,  the schedule should include a period of collaboration between \nIncourage Community Founda tion and the C onstruction Manager  to better define, elaborate upon and fix the \nConstruction Manager \u2019s exact and final scope of Work (the \u201cFinal Scope\u201d) . \n\nThe successful Proposer  should be available to begin work, and should be prepared for project activities to \ncommenc e, immediately upon selection. Please refer to Exhibit C \u2013 Project Timeline.  Your submission of a \nproposal  to this RFP acknowledges your ability to work within this timeline  but also acknowledges that there may \nbe adjustments to the timeline as the Project evolves . Proposers are  asked to carefully review and note all \nconstruction start dates, completion dates, and other notable objectives outlined in the attached t imeline.    \n\nPlease note: non -selection as the Construction Manager under this RFP does not impact the Proposer\u2019s \nopportunity to participate in the Project as a sub -contractor.    \n\n9. ADDITIONAL INFORMATI ON REQUESTS  \nQuestions regard ing the design elements of th e Project should be directed to:  \n  \n Graham Hill, Architect  \n Concordia LLC. \n 504.458.8081  \n ghill@concordia.com  \n\nQuestions regarding the proposal  or oth er general questions about the P roject should be directed to:  \n  \n Chelsey Mazurek, Tribune Building Project Manager  \n Incourage Community Foundation  Inc. \n 715.423.3863  \n cmazurek@incouragecf.org   \n   ",
        "\uf0b7 An Estimate  of Probable Costs is provided in Exhibit B . \n\n\uf0b7 A Project Timeline  is provided  in Exhi bit C.  \n\nAll Exhibits are attached to and made part of this RFP.  \n\n1.6 CONSTRUCTION MANAGEMENT AT RISK PROJECT DELIVERY  BACKGROUND INFORMATION (Source: The American \nInstitute of Architects)  \nConstruction Management at -risk is a process that allows the  Owner  of a Project to choose the Construction \nManager before the design stage is complete. The Construction Manager is chosen based on qualifications, and \nthen the entire operation is centralized under a single contract. The Architect and Construction Manager w ork \ntogether in order to cultivate and assay the design. Then, the Construction Manager gives the client a \nGuaranteed Maximum Price, and coordinates all subcontract work. The Architect/Engineer is hired separately \nfrom the Construction Manager at -risk and the traditional client \u2013 Architect/Engineer relationship is maintained.  \n\n2. SCOPE OF SERVICES \u2013 CONSTRUCTION MANAGER \u2019S RESPONSIBILITIES  \nThe Construction Manager \u2019s Preconstruction Phase responsibi lities are set forth in Section  2.1. The Construction \nManager \u2019s Construction Phase responsibilities are set forth in Section 2.2. The Owner and Construction Manager  \nmay agree, in consultation with the Architect, for the Construction Phase to commence prior to completion of \nthe Preconstruction Phase, in which case, both  phases will proceed concurrently. The Construction Manager  shall \nidentify a representative authorized to act on behalf of the Construction Manager  with respect to the Project.   Page 3 \nThe Construction Manager  will be required to hold a Construction Manager s\u2019 license  (or applicable license)  valid \nfor the State of Wisconsin . \n\n2.1 PRECONSTRUCTION PHASE  \n\n Consultation  \nThe Construction Manager  shall meet with the Architect and Owner to discuss such matters as procedures, \nprogress, coord ination, and scheduling of th e work. The Construction Manager  shall advise the Owner and the \nArchitect on proposed site use and improvements , selection of materials, and building systems and equipment. \nThe Construction Manager  shall also provide recommendations consistent with the Pro ject requirements to the \nOwner and Architect on constructability; availability of materials and labor; time requirements for procurement, \ninstallation and construction; and factors related to construction cos t including, but not limited to:  costs of \naltern ative designs or materials, preliminary budgets, life -cycle data, and possible cost reductions.  \n\nThe Construction Manager  shall provide recommendations with regard to accelerated or fast -track scheduling, \nprocurement, or phased construction. The Construction Manager  shall take into consideration cost reductions, \ncost information, constructability, provisions for temporary facilities and procurement and construction \nscheduling issues.   \n\nPreliminary  Cost  Estimates  \nBased on the preliminary design and  other design criteria, the Architect has prepared an Estimate  of Probable \nCost (Exhibit B). If the Architect or Construction Manager  suggests alternative materials and systems, the \nConstruction Manager  shall provide cost evaluations of those alternative m aterials and systems.  \n\nAs the Architect progresses with the preparation of the Design  Documents, the Construction Manager  shall \nprepare  estimates of the Cost of the Work of increasing detail and refinement and allowing for the further \ndevelopment of the de sign until such time as the Owner and Construction Manager  agree on a Guaranteed \nMaximum Price for the Work. Such estimates shall be provided for the Architect\u2019s review and the Owner\u2019s \napproval  prior to the completion of each phase . The Construction Manage r shall inform the Owner and Architect \nwhen estimates of the Cost of the Work exceed the latest approved Project budget and make recommendations \nfor corrective action.   ",
        "Guaranteed  Maximum  Price  Proposal  and Contract  Time  \nAt a time to be mutually agreed up on by the Owner and the Construction Manager  and in consultation with the \nArchitect, the Construction Manager  shall prepare a detailed line item  Guaranteed Maximum Price Proposal for \nthe Owner\u2019s review and acceptance.  The Guaranteed Maximum Price in the pr oposal shall be the sum of the \nConstruction Manager \u2019s estimate of the Cost of the Work and the Construction Manager \u2019s Fee for the \nConstruction Phase as quoted in the Proposer\u2019s response to this RFP.  \n\nThe Construction Manager  shall include with the Guarant eed Maximum Price proposal a written statement of its \nbasis, which shall include the following:  \n 1. A list of the Drawings and Specifications, including all Addenda thereto, and the Conditions of the \nContract;  \n 2. A list of the clarifications and assumptions made by the Construction Manager  in the preparation of \nthe Guaranteed Maximum Price proposal,  \n 3. A statement of the proposed Guaranteed Maximum Price, including a statement of the estimated \nCost of the Work organized by trade categories or systems, allowances, contingency, and the \nConstruction Manager \u2019s Fee;  \n 4. A schedule of milestones for the comple tion and the anticipated date of Substantial Completion upon \nwhich the proposed Guaranteed Maximum Price is based;  \n 5. A Schedule of Value for each component of work to be undertaken; and \n 6. A date by which the Owner must accept the Guaranteed Maximum Pr ice.  \n\nThe Construction Manager  shall meet with the Owner and Architect to review the Guaranteed Maximum Price \nproposal.  Once a Guaranteed Maximum Price has been agreed upon by all parties, the Owner and Construction \nManager  shall execute the Guaranteed M aximum Price Amendment to the Contract.  The Guaranteed Maximum Page 4 \nPrice Amendment shall set forth the agreed upon Guaranteed Maximum Price with the information and \nassumptions upon which it is based  and shall include a Schedule of Values .  \n\nThe Construction Manager  shall guarantee that the Contract Sum shall not exceed the Guaranteed Maximum \nPrice set forth in the Guaranteed Maximum Price Amendment, as it is amended from time to time.  To the extent \nthe Cost of the Work exceeds the Guaranteed Maximum Price, t he Construction Manager  shall bear such costs in \nexcess of the Guaranteed Maximum Price without reimbursement or additional compensation from the Owner.   \nThe Construction Manager will acknowledge that the Construction Manager is an experienced contractor a nd \nthat (subject to Acts of God) the Project can be completed for Guaranteed Maximum Price.  \n\nSubcontractors  and Suppliers  \nThose portions of the Work that the Construction Manager  does not customarily perform with the Construction \nManager \u2019s own personnel s hall be performed under subcontracts or by other appropriate agreements with the \nConstruction Manager . The Owner may designate specific persons from whom, or entities from which, the \nConstruction Manager  shall obtain bids. Subcontractors must be located 50 miles  or less from the Project site , \nunless a greater distance is approved by the Owner.  The Construction Manager  shall obtain at least three \nproposals from Subcontractors and from suppliers of materials or equipment fabricated especially for the Work \nand shall deliver suc h proposals  to the Owner. The Owner shall then determine, with the advice of the \nConstruction Manager  and the Architect, which bids will be accepted. The Construction Manager  shall not be \nrequired to contract with anyone to whom the Const ruction Manager  has reasonable objection.  \n\nIf the Guaranteed Maximum Price has been established and a specifi c subcontractor or supplier  (1) is \nrecommended to the Owner by the Construction Manager , (2) is qualified to perform that portion of the Work, \nand (3) has submitted a  proposal  that conforms to the requirements of the Contract Documents without \nreservations or exceptions, but the Owner requires that another  proposal  be accepted, then the Construction \nManager  may require that a Change Order be issued t o adjust the Guaranteed Maximum Price by the difference \nbetween the bid of the person or entity recommended to the Owner by the Construction Manager  and the \nproposal  of  the person or entity designated by the Owner.  \n\n2.2 CONSTRUCTION PHASE  \n\nThe Construction Phase shall commence upon the execution of the Guaranteed Maximum Price Amendment or \nthe Owner\u2019s issuance of a Notice to Proceed, whichever occurs earlier.  \n\nChanges  in the Work  \nThe Owner may, without invalidating the Contract, order changes in  the Work within the general scope of the \nContract consisting of additions, deletions or other revisions. The Architect  shall issue such changes in writing  \nand all change orders will be signed and acknowledged by Owner and Construction Manager . The Constru ction \nManager  shall be entitled to an equitable adjustment in the Contract Time as a result of changes in the Work.  \n\nChange orders issued by the Owner subsequent to the execution of the Guaranteed Maximum Price Amendment \nshall constitute adjustments to the  Guaranteed Maximum Price.  "
      ],
      "ground_truth_context": [
        "Chelsey Mazurek, Tribune Building Project Manager Incourage Community Foundation Inc. 715.423.3863 cmazurek@incouragecf.org"
      ],
      "metadata": {
        "question_id": 145,
        "RFP_id": "infra_2",
        "RFP_type": "infra",
        "chunks": [
          5
        ],
        "manually_edited": false
      },
      "timing": {
        "retrieve_context": 0.0697639833797108,
        "llm_response": 0.5302810668945312,
        "total": 0.600045050274242
      }
    },
    {
      "question": "What is the contractor's responsibility regarding subcontractors' work under this RFP?",
      "llm_response": "The contractor is responsible for all the subcontractor's work, including any failures or omissions. The subcontractor will be recognized only in the capacity of an employee or agent of the contractor, and their removal may be required by the Project Manager, similar to that of an employee.",
      "ground_truth_answer": "The contractor is fully responsible to the City for all subcontractor work, including failures or omissions.",
      "retrieved_context": [
        "Scope of Project(s) Completed or Description of Item(s) Sold:_________________________________  \n\n \n Name of Government Organization or Business: ____________________________________________  \n Point of Contact: ___________________________ Phone: ___________________________________  \n\nAddress: __________________________________________ State: ____________ Zip: ___________  \n\nScope of Project(s) Completed or Description of Item(s) Sold:_________________________________  \n\n \n Name of Government Organization or Business: ____________________________________________  \n\nPoint of Contact: ___________________________ Phone: ___________________________________  \n Address: __________________________________________ State: ____________ Zip: ___________  \n\nScope of Project(s) Completed or Description of Item(s) Sold:_________________________________  \n  \n   \n8 | Page  \n  RFP 25 -07 \nALEXANDER CITY, ALABAMA  \nRECYCLING CENTER CONSTRUCTION PROJECT  \n\nSpecifications and Scope of Work  \n1. Introduction:  \nThe City of Alexander City Public Works Department is issuing a request for proposals from qualified \ncontractors for the construction of a new recycling center. This facility will support our commitment to sustainability and waste reduction. The center will serve as a hub for collec ting, processing, and distributing \nrecyclable materials.  \n2. Project Description:  \nThe proposed recycling center will be located at the corner of Railey Road and Joseph Street  in Alexander City. \nThe facility will include the following: \n\u00b7 40 x 60 enclosed blue metal building with a 20 x 60 lean to structure  \n\u2022 6x6 timber posts with in ground protectors  \n\u2022 Posts spaced at 12\u2019 on center  \n\u2022 Steel trusses  \n\u2022 Metal and sides will be 29 -gauge metal  \n\u00b7 2 10\u2019 wide x 12\u2019 tall drum roll up doors  \n\u00b7 2 pedestrian access doors  \n\u00b7 1 exterior window  \n\u00b7 Insulated  \n\u00b7 1 interior office framed and finished with one  window  listed above   \n\u00b7 60-inch post protectors  \n\u00b7 Concrete slab for enclosed portion and lean to  \n\u00b7 No utilities or plumbing will need to be included in the concrete slab  \nGrade work and site prep will be completed by the City of Alexander City prior to the slab construction. Please \nsee attachment \u201cA\u201d.  \n3. Scope of Work:  \nThe scope of work for this project includes, but is not limited to:   \n9 | Page  \n  \u00b7 Concrete slab work.  \n\u00b7 Construction of the metal building and the 20 x 60 lean to structure.  \n\u00b7 Compliance with all local, state, and federal regulations.  \n4. Proposal Requirements:  \nInterested contractors must submit the following information:  \n\u00b7 Company profile and qualifications. \n\u00b7 List of similar projects completed.  \n\u00b7 Proposed project timeline. Must be completed by September 30th, 2025. \n\u00b7 Detailed cost estimate  with total proposal amount listed.  \n\u00b7 List of subcontractors and suppliers. \u00b7 Proof of insurance and bonding. \n\u00b7 Any other required items listed in the RFP. \n5. Bond Requirements:  \n\nBid Bond: Bids shall be accompanied by a Bid Security equal to 5% of the bid price, but no more than $10,000.00. Bid Security shall be in the form of a Bid Bond or a cashier\u2019s check payable to The City of Alexander City. No Bid Security is required on bids less than $10,000.00.) The bid package will not be considered if the bid bond is \nnot included.  Performance  Bond: A performance bond will be due within 15 days of the award date, each in the amount of \n100% of the contract price, with a corporate surety approved by the Owner. The project is not to begin until the \nbond is received by the City Clerk\u2019s office. These will be required for the faithful performance of the contract \nand as provided in the general specifications. Attorneys -in-fact who sign bid bonds, payment bonds and \nperformance bonds must file with each bond a ce rtified and effective dated cop y of their power of attorney.  \n\nLabor and Material Bond: A labor and material bond will be due within 15 days of the award date, in the amount \nof 50% of the contract price, with a corporate surety approved by the Owner. The project is not to begin until the \nbonds are received by the City Clerk\u2019s office. These will be required for the faithful performance of the contract \nand as provided in the general specifications. Attorneys -in-fact who sign bid bonds, payment bonds and \nperformance bonds must file with each bond a certified and effective  dated copy of their power of attorney.  \n Forfeiture of Bid Bonds: Should the successful bidder or bidders to whom a contract is awarded fail to execute a contract(s) and furnish acceptable contract securities and evidence of insurance, as required, within fifteen (15) \ndays after the prescribed fo rms have been presented to him/her, the City may retain from the proposal guaranty, \nif it is a cashier's check or recovered from the principal or the sureties, if the guaranty is a bid bond, the difference \nbetween the amount of the contract as awarded, and  the amount of the proposals of the new lowest bidder. If no  \n10 | Page  \n  other bids are received, the full amount of the proposal guaranty may be so retained and recovered as liquidated \ndamages for such default. Any sum so retained or recovered shall be the property of the awarding authority.  6. Public Works Director\u2019s Authority:  \n The Public Works Director shall give all orders and directions contemplated under this contract and specifications, relative to the execution of the work. The Public Works Director shall determine the amount, quality, acceptability, and fitness of the seve ral kinds of work and materials which are to be paid for under this contract \nand shall decide all questions which may arise in relation to said work and the construction thereof. The Public Works Director's estimates and decisions shall be final and conclusive, except as herein otherwise expressly provided. In case any question shall arise between the parties hereto relative to said contract or specifications, the determination or decision of the Public Works Director's shall be a condition precedent to the  right of the \nContractor to receive any money or payment for work under this contract affected in any manner or to any extent by such question. The Public Works Director shall decide the meaning and intent of any portion of the specifications and of any pl ans or drawings where the same may be found obscure or be in dispute. Any \ndifferences or conflicts regarding their work which may arise between the Contractor under this contract and other Contractors performing work for the Owner shall be adjusted and det ermined by the Public Works Director.  \n 7. Other Information:   Sub- Contractor\u2019s Status: A sub- contractor shall be recognized only in the capacity of an employee or agent of the \ncontractor and the contractor will be responsible to the City for all the subcontractor's work, including failures or \nomissions; and his removal may be required by the Project Manager, as in the case of an employee.",
        "The start date of the contract shall begin on the date of the bid approval by the awarding authority. The \nanticipated award date for this contract is March  3\nrd, 2025.  \n\nPricing for a ll proposed contract services shall be firm for the full length of the project.  \n\nAll Federal, State, and Local License and Fee requirements will be applicable.  \n Freight charges and fees are to be included in the bid  \n\nContractor  must grant the City of Alexander City a 30- day net payment terms without penalty.  \n Invoices  for work completed may be submitted on a monthly basis . Invoices should be submitted to \naccounts payable by email to ap@alexandercityal.gov or by mail to:  \n  \n City of Alexander City \n Attn: Accounts Payable  \n 281 James D. Nabors Drive  \n Alexander City, AL 3501 0 \n The City of Alexander City prefers  contractors  that provide a sole source responsibility for all products \nand services provided under a resulting contract.  If the proposer requires the use of a third -party  dealer, \nreseller or subcontractors to provide products or services, the proposer shall list the third party to be used and address how the products or services will be delivered.  \n No sales  taxes of any kind are to be included in the bid prices. The City of Alexander City will furnish \ntax exemption certificates when necessary.  \n In accordance with the State of Alabama Law, a 5 % variance consideration may be given to those \nvendors located within the City of Alexander City, City Limits and Police Jurisdiction.  \n\nBidders must be enrolled and in full compliance with the E -Verify Program and all requirements of \nAlabama Immigration law, Act 2011 -535 (also referred to as the \u201cBeason- Hammon Alabama Taxpayer \nand Citizen Protection Act\u201d, or H.B. 658), as amended by Act No. 2012- 491, including in part and \neffective January 1, 2012.   \n3 | Page  \n  Proposers  shall state if an indemnity clause will be required of the City by the successful bidder. \nProposers s hall include a sample of any indemnity clause which may be required to be signed. Type of \nindemnity may be justif ication for rejection of the proposal .  \n\nThe City of Alexander City requires that the trade reference form (attached)  be completed . \n By Section 41- 16-5, Code of Alabama 1975, with the submittal of a bid, the prospective vendor represents \nand agrees that it is not currently engaged in, nor will it engage in, any boycott of a person or entity based in or doing business with a jurisdiction with which the State of Alabama can enjoy open trade.  \n If the vendor employs any persons in the State of Alabama, in accordance with Section 31- 13-9, Code of \nAlabama 1975, Proposers shall demonstrate proof of enrollment in the E -Verify  program by completing \nthe enclosed E -Verify  affidavit , or providing some other proof of enrollment. If the proposer employs \npersons (anywhere), the award of the bid is condition on the bidder not knowingly employing, hiring for employment or continuing to employ an unauthorized alien within the State of Alabama. Upon awar ding \nof the contract where a written contract is to be signed, the contract will contain a provision whereby the bidder promises not to violate Federal Immigration Law.     \n  \n\nQuestions and C ommunications Regarding this RFP  \n\nAll questions or communications must be sent by email  to Sasha Stewart , Purchasing Director    \n[sasha.stewart@alexandercityal.gov ] and Drew Meacham , City Engineer & Public Works Director  \n[drew.meacham@alexandercityal.gov ]. The subject line of the email must include Bid 25- 07. All \nquestions must be received no later than February  5th, 2025 3: 30pm CST. \n A running response to all vendors\u2019 questions  will be provided as an addendum  on February 7\nth, 2025. \nThe addendum can be found on the City\u2019s website at [ https://alexandercityal.gov/rfps ].  \n\n   \nSite Survey  \n\n It is highly recommended that any potential bidder conducts a site survey prior to the submittal \nof a proposal. Surveys should be conducted by an appointment. T o arrange a date and time for an \nappointment, please contact Drew Meacham , City Engineer & Public Works Director at  \n[drew.meacham@alexandercityal.gov ]. ",
        "   \n4 | Page  \n  Evaluation  \n\nThe award will be made to the Bidder  whose proposal conforms to all conditions and requirements \nwithin the specifications of this bid. In addition, t he City of Alexander City reserves the right to consider \nthe following during the evaluation period:  \n (a) Award bids by Lump Sum or individual items unless otherwise noted by bidder. NOTE: No purchase will be made on L ump Sum awards until individual unit  prices are furnished. \n(b) Award the bid to the lowest or best bidder, as determined by the Owner to be in the best interest of The \nCity of Alexander City.  Life cycle/maintenance costs will be taken into consideration.  \n(c) The City of Alexander reserves the right to reject any or all proposals, to waive any informality in the \nproposal process, and to award the contract to the proposal deemed to be in the best interest of the City. \n(d) Reject any or all bids and to waive technicalities when in the opinion of the City of Alexander City the \nbest interest of The City of Alexander City will be served.  \n(e) Make null and void the purchase order with the successful bidder if delivery cannot be made at the specified time.  \n(f) In accordance with the State of Alabama Law, a 5 % variance consideration may be given to those \nvendors located within the City of Alexander City, City Limits and Police Jurisdiction.  \n(g) Ability to deliver goods and services in a timely manner.  \n(h) Warranty   \n(i) Suitability for use by the owner.   \n(j) Experience and Qualifications  \n(k) Quality of Past Projects  \n(l) Cost-effectiveness of the proposal  \n(m) Proposed Project Timeline  \n(n) Compliance with the RFP Requirements  \n  \n\nErrors in Bids  \n Bidders  or their authorized agents are expected to examine the maps, drawings, specifications,  and all other \ninstructions pertaining to the work, which will be open to their inspection. Failure to do so will be at the bidder\u2019s  \nown risk. In case of error, in the extension of prices, the unit price will govern.    \n5 | Page  \n  RFP 25 -07 \nALEXANDER CITY, ALABAMA  \nRECYCLING CENTER CONSTRUCTION PROJECT  \n\n \n Proposer  (Vendor or Contractor) Name:  ___________________________________ \nRepresentative:  ______________________________________________________ \nAddress: ____________________________________________________________ \nCity: _______________________________________________________________ \nState, Zip Code: ______________________________________________________ Phone: ______________________________________________________________ Email: _____________________________________________________________ \n\n Total Proposal Amount $____________________ \n\n Bid Bond or Cashier\u2019s Check included Y or N _____ ( Bids shall be accompanied by a Bid Security  equal \nto 5% of the bid price, but no more than $10,000.00. Bid Security shall be in the form of a Bid Bond or a \ncashier\u2019s check payable to The City of Alexander City . No Bid Security is required on bids less than \n$10,000.00.)  \n E-Verify  Affidavit Complete Y or N _____ / Proof of E -Verify  Enrollment Included Y or N _____  \n Trade References Provided Y or N _____  \n(If you are a new Vendor for Alexander City, please fill out the trade reference form.)  \n Proof of General Liability Insurance Included Y or N _____  \n($1,000,000.00 Minimum)  \n Will be able to complete scope of work within _______ days of receipt of order. Must be completed prior \nto September 30th, 2025.  \n Do all items bid meet or exceed the required specifications? ____ Y/N   If no, please highlight and provide documentation detailing the reason for the deviation from the specifications.   Non-Collusion Statement: By signing this bid form the bidder certifies that this bid is made without \nreference to any other bid and without any agreement, understanding, collusion or combination with any other person(s) in reference to the bid.  \n  Signature of Bidder Representative: _________________________________  Date Signed: ____________________      \n6 | Page  \n  STATE OF:     \n\nCOUNTY OF:      \n AFFIDAVIT  \n  Before me, the undersigned authority, personally appeared _____________________________(affiant) \nwho, being by me first duly sworn, doth depose and say as follows:  \n I _____________________________( name), on behalf of ____________________________(business \nentity), and with lawful authority to act in its behalf, attest to the following from personal knowledge:  \n    1.  ______________________________________ (business entity) does not knowingly, hire for \nemployment, or continue to employ any unauthorized aliens in the State of Alabama; and  \n   2. ______________________________________ ( business entity) is enrolled in the E -Verify Program \nas shown by the attached documentation; and  \n   3.  ______________________________________ (business entity) does and will utilize E -Verify \nProgram to verify the employment status of employees and potential employees according to federal rules and regulations; and  \n   4. ______________________________________ (business entity) shall acquire from its subcontractors \nnotarized affidavits that they will not knowingly employ, hire for employment or continue to employ unauthorized aliens, that they will enroll in the E -Verify Program before performing any contract w ork or \nproviding any product, and that they shall attach to the affidavits, documentation establishing their enrollment in E -Verify as required by Act No. 2011- 535. \n  Signature of Affiant  \n I, the undersigned Notary Public, in and for said County and State, hereby certify that               \n        whose name is signed to the foregoing Affidavit, and who is known to me, \nacknowledged before me on this date that, being informed of the contents of the above and foregoing affidavit, he/she as an officer of __________________ (business entity) and with full authority, executed \nthe same voluntarily for and as the act of said company on the day the same bears date.  \n  Given under my hand and official seal of office this  _______________ day of __________, ________. \n       \nNotary Public  \n   \n7 | Page  \n  TRADE REFERENCE FORM  \n\n*The completion of this form is not necessary if you have been awarded contracts or conducted \nbusiness with the City of Alexander City within the last five years.  \n  \nName of Government Organization or Business: ____________________________________________  \n\nPoint of Contact: ___________________________ Phone: ___________________________________  \n\nAddress: __________________________________________ State: ____________ Zip: ___________  ",
        "                          \n11 | Page  \n   \n  \nRFP 25 -07 \nALEXANDER CITY, ALABAMA  \nRECYCLING CENTER CONSTRUCTION PROJECT  \n\nLocally Purchased Material List  \n\n \nAre you a locally owned business or have and/or have an office located within city limits or police jurisdiction? (y/n) ____  Do you intend to purchase the siding from a local vendor? (y/n) ____  \n  If yes, the vendor to be used is ___________________________________________ \n\nIf no, where do you intend to purchase the materials?  \n _______________________________________________________________ \n   \n     Cost of materials? ______________________________ \n Do you intend to purchase the window and doors from a local vendor? (y/n) ____  \n If yes, the vendor to be used is ___________________________________________ \n  \n If no, where do you intend to purchase the materials?  \n\n_______________________________________________________________  \n     Cost of materials? ______________________________ \n  Do you intend to purchase the concrete from a local vendor? (y/n) ____  \n  If yes, the vendor to be used is ___________________________________________ \n  \n If no, where do you intend to purchase the materials?  \n\n_______________________________________________________________  \n     Cost of materials? ______________________________ \n  Do you intend to purchase any other materials from vendors located with Alexander City Limits or Police Jurisdiction? (y/n) ____   \n12 | Page  \n  If yes, the vendor(s) and material to be purchased are: \n__________________________________________________________________________________________\n__________________________________________________________________________________________________________________________________________________________________________________________________________________________________________________________________________________________________________________________________________________________________________________________________________________________________________________________________   If yes, what is the approximate dollar amount of the additional materials to be locally purchased? \n___________________  \n\nGrand Total Amount of All Locally Purchased Materials: ____________________________ \n   (This includes siding, windows, doors, concrete and any other locally purchased material for \nthe project)  \n *A detailed cost estimate is still required outside of this locally purchased material list.  ",
        " \n  \n\n \n\n1 | Page  \n\nP.O. Box 552 \u2022 Alexander City \u2022 Alabama 35011\u20100552 \u2022 (256) 329\u20106700  \nwww.alexandercityal.gov  \n Curtis \u201cWoody\u201d Baird  \n           Mayor  \nStephanie Southerland  \n        City Clerk \n     Romy Stamps  \n   Finance Director  CITY COUNCIL  \nAudrey \u201cBuffy\u201d Colvin  \nCouncil President  \nScott Hardy  \nPresident Pro Tempore  \nBobby L. Tapley  \nJohn Eric Brown  \nChris Brown  \nBrett Phillips  \n\n \nRFP 2 5-07 \nALEXANDER CITY, ALABAMA  \nRECYCLING CENTER CONSTRUCTION PROJECT  \n\nThe City of Alexander City, Alabama, is requesting proposal s for the recycling center construction project \nto be located at the corner of Railey Road  and Joseph Street  in Alexander City, Alabama , per the attached \nspecifications. A full copy of the bid  and all addendums may be obtained at \n[https://alexandercityal.gov/rfps ]. Proposals must be submitted in writing to the Alexander City Clerk\u2019s \noffice no later than  February  17th, 2025 at 2:00pm CST . All proposals bid  number and opening date on \nthe outside of the envelope.  Proposals must be mailed or hand delivered to the address below. No \nproposals will be allowed to be submitted via fax or email.   Pre-Qualifications: All proposals of $50,000.00 and more must be submitted by a general contractor who \nis licensed in the State of Alabama or state of reciprocity.    \n  ADDRESS ALL RETURN ENVELOPES TO:  CITY OF ALEXANDER CITY  \n       CITY CLERK\u2019S OFFICE \n       281 JAMES D NABORS DR  \n       ALEXANDER CITY, ALABAMA 35010  \n\nBID SOLICITATION SCHEDULE  \n\n Public Notice of Bid : January  11\nth, 2025 \n  Question Submission Deadline:  February  5\nth, 2025, 3: 30pm CST   \n  Bid Due Date:  February  17\nth, 2025 2: 00pm CST  \n\n Evaluation Period:  February  17th \u2013 26th, 202 5 \n  Anticipated Award Date:  March  3\nrd, 2025  \n   \n2 | Page  \n   \nContract Terms  and Conditions  \n\nThe City of Alexander City will publicly open and read aloud all bids on the date and time listed above.  \nBids are to be opened by the City Clerk at the Municipal Complex located at 281 James D Nabors Dr, \nAlexander City, Alabama 35010.  Bidders and authorized representatives are invited to be present at any bid opening.   \nBids shall not be modified after the opening. Prices and notations should be in ink or typewritten on the \nform provided by the owner. All bid prices must be fully extended.  Bids must conform to any attached \ndetailed specifications to be eligible for consi deration.   "
      ],
      "ground_truth_context": [
        "A sub-contractor shall be recognized only in the capacity of an employee or agent of the contractor and the contractor will be responsible to the City for all the subcontractor's work, including failures or omissions."
      ],
      "metadata": {
        "question_id": 193,
        "RFP_id": "infra_3",
        "RFP_type": "infra",
        "chunks": [
          4
        ],
        "manually_edited": false
      },
      "timing": {
        "retrieve_context": 0.0697639833797108,
        "llm_response": 0.8390810489654541,
        "total": 0.9088450323451649
      }
    },
    {
      "question": "What must the Owner include in the Project budget if selecting accelerated, phased, or fast-track scheduling?",
      "llm_response": "The Owner must include sufficient contingencies in the Project budget to cover the costs associated with accelerated, phased, or fast-track scheduling, due to the associated risks such as costs for coordinating and redesigning portions of the Project and the removal and replacement of previously installed Work.",
      "ground_truth_answer": "The Owner agrees to include sufficient contingencies in the budget to cover costs incurred by the Architect for coordination/redesign and the Contractor for removing/replacing previously installed Work.",
      "retrieved_context": [
        "I nit. Document 8132\u2122-2009 Standard Form of Agreement Between Owner and Architect, C onstruction Manager as Adviser Edition AGREEMENT made as of the _ _ day of\" ___ \" in the y ear 2017. (in words, indicate day, month and year.) BETWEEN the Architect' s client identified as the Owner: (Nam e, legal status, address and other information) MSD ofWashington Towns hip 8550 Woodfield Crossing Blvd . Indianapo lis, IN 46240 (317) 205-3333 (E>..i 77189) (317)-205-3385 (Fax) and the Arch itect: (Nam e, legal status, address and other it?formation) for the followin g Project: (Nam e, location and detailed descriplilm) The Construct ion Mana ger: (Name, l egal status. address and olher il?formation) The Owner and Architec t agree as follows. ADDITIONS AND DELETIONS : The author of this docume nt has added informat ion needed for its completion. The author may also have revised the text of the or iginal AlA standa rd form. An Additions and Delet ions Report that notes added information as well as revisions to the standard form text is available from the author and should be reviewed . A vertical line in the left margin of this document indicates where the author has adde d necessary informa tion and where the author has added to or deleted from the original AlA text. This docum ent h as important legal consequences . Consultation with an attorney is enco uraged with respect to its complet ion or modif ication. This document is intended to be used in conjunction with AlA Documen ts A 1 32T\"'-2009, Standard Form of Agreemen t Between Owner and Contractor . Cons truction Manage r as Adviser Edition; A232 T\"'-2009 , General Conditions of the Contract for Construction, Cons truction Manager as Adviser Edition; and C132\u2122-2009, Standard Form of Agreement Between Owne r and Construction Manager as Adviser . AlA Document A232\u2122-2009 is adopted in this document by reference. Do not use with other genera l condition s unless this document is modi fied. AlA D ocument B132'M- 2009 (forme rly 8141 TMCMa-1992). Copy right\u00a9 1992 and 2009 by The American Institute of Architects. All rights reserved . WARN ING: This AlA\" Document is protected by U.S. Copy right Law and Internat ional Treaties . Unauthor ized reproduction or distribution of this AIAf, 1 Document, or any portion of it, may result in severe civil and criminal pena lties, and wi ll be prosecuted to the maximum extent possible under the law. This document was produ ced by AlA software at 13:26:47 on 08/01/2017 under Order No.2341018896 _1 which expires on 01/01/2018 , and is not for resale. User Note s: (1232093781) I nit. TABLE OF ARTICLES 1 INITIAL INFORMATION 2 ARCHITECT'S RESPONSIBILITIES 3 SCOPE OF ARCHITECT'S BASIC SERVICES 4 ADDITIONAL SERVICES 5 OWNER 'S RESPONSIBILITIES 6 COST OF THE WORK 7 COPYRIGHTS AND LICENSES 8 CLAIMS AND DISPUTES 9 TERMINATION OR SUSPENSION 10 MISCELLANEOUS PROVISIONS 11 COMPENSATION 12 SPECIAL TERMS AND CONDITIONS 13 SCOPE OF THE AGREEMENT ARTICLE 1 INITIAL INFORMATION \u00a7 1.1 This Agree ment is based on the Initia l Information set forth in this Section 1.1. (Note the disposition for the following items by inserting the requested if!f'ormati on or a s tatemem such as \"not applicable ,\" \"unknown at time of exec ution\" or \"to be determin ed later by mutual agreement.\") \u00a7 1.1.1 The Own er's program for the Project: (Jdent(fy docu ment ation or state the mann er in which the program will be develope d.) \u00a7 1.1.2 The Project's physical characteristics: (Jdent(fy or desc ribe. if appropriat e, size, location, dimensions , or o ther pe rtinent inf ormation , such as geotechni cal reports; site, boundmy and topographi c surveys; traffic and utility studies ; availabili ty of publi c and privat e utilities and services; legal description oft he s ite; etc.) \u00a7 1.1.3 The Own er's budge t for the Cost of the Work, as defined in Section 6.1: (Provide total and, if known , a line item breakd own.) \u00a7 1.1.4 The Owner 's anticipated d esign and construction schedule: .1 Design phase milestone dates, if any: .2 Commence ment of construction: AlA Document 8132 '\"-2009 (formerly B141'\"CMa -1992) . Copyri ght\u00a9 1992 and 2009 by The American Institu te of Architects. All rights reserved . WARNING : This AlA ~ Document is protecte d by U.S. Copyright Law and International Treaties. Unauthori zed reproduc tion or distributio n of this A lA ~ \u00b7 2 Document , or any portion of it, may result In severe civil and crim inal pena lties, and will be prosec uted to the maximum extent poss ible under the law. This document was produced by AlA softwar e a\\13:26:47 on 08/01/2017 under Order No.2341018896 _1 which expires on 01/01/2018, and is not for resale. User Note s: (1232093781) I nit. .3 Substantial Completion date or milestone dates: .4 Other: TBD \u00a7 1.1.5 The Owner intends to retain a Construc tion Manager adviser and: (Note that. if Multiple Prime Contractors are used. the term \"Contractor\" as referr ed to throughou t this Agreement will be as if plural in number.) [) Contractor (which includes other sepa rate Contractors as determined by Owner) [X] Multiple Prime Contractors (\"Contractors\") [ ] Unknown at time of execution \u00a7 1.1.6 The Owner's requirements for accelerated or fast-track scheduling , multiple bid package s, or phased construction are set forth below : (List numb er and type of bid/procurem ent packages.) \u00a7 1.1.7 Other Project information: (!dent!f.i ' special characteristics or needs r!f\"the Project not provided elsewhere. such as environmentally responsibl e design or historic preservation requir emems.) \u00a7 1.1.8 The Owner identifie s the following representative in accordance with Section 5.4: (List name . address and other informa tion. Mr. Marvin Murdock Owners Representative MSD of Washington Towns h ip 8550 Woodfield Crossing Blvd. Indianapoli s, IN 46240 (317) 205-3333 (Ext 77189) (317 205-3385 (Fax) In the event that the Owner's Designated Representative is terminated, or otherwise unavailable, the Owner shall designate a replacement repre sentative in writing. \u00a7 1.1.9 The persons or entities, in addition to the Owner 's representative , who are required to review the Architect's submittals to the Owner are as follows: (List name , address and other information.) CONSTRUCTION MANAGER \u00a7 1.1.1 0 The Owner will retain the following consultant s and shall endeavor to comply with all equal employment opportunity programs and as required by Article I 0.15 herein: (List name, legal status. address and other if1formation.) AlA Document B132TM- 2009 (formerly 8141 \" 'CMa -1992). Copyright\u00a9 1992 and 2009 by The American Institute of Architects. All rights reserved. WARNING : This AlA ~ \u00b7 Document is protected by U.S. Copyright Law and International Treaties . Unauthor ized reproduction or distribution of this AlA\" 3 Document , or any portion of it, may result in severe civil and crimina l penal ties, and will be prosecuted to the maximum extent poss ible under the law. This document was produced by AlA software at 13:26:47 on 08/01/2017 under Order No.2341018896_1 which expires on 01/01/2018 , and is not for resale. User Notes : (1232093781) I nit. .1 Construction Manager: The Construct ion Manager is identified on the cover page . . 2 Cost Consultant (if in additi on to the Construction Manager): ({(a Cost Consu/ta/11 is reta ined, appropriat e references to the Cost Consu ltallf shoul d be in serted in Sections 3.2.6, 3 .2.7, 3.3.2, 3. 3.3. 3 . ./.5, 3.4.6, 5.4. 6.3, 6.3.1, 6 . .f and 1 1.6.) .3 La nd Surveyor: .4 Geotechnical Engineer: .5 Civ il Engineer: .6 Other consultants: (List any other consult ants retained by the Own er, such as a Proje ct or Program Manag er, or sche duling consultant.) \u00a7 1.1.11 The Architec t identifies the following repre sentativ e in accordance with Section 2.3: (List nam e, address and other informa tion.) \u00a7 1.1.12 The Architect w ill retain the consultants identified in Sections 1.1.1 2.1 and 1.1.1 2.2: (List name. legal status, addr ess and other il!/imnation) \u00a7 1.1.12.1 Consultants retained under Basic S ervices: .1 Associate Architect and Interior Design: .2 C ivil Eng ineer: .3 Landscape Architect: .4 Structur al Enginee r .5 Mechanical and Technolo gy Design: .6 Plumbing and Electrical Design: .7 E ducational Programmin g: AlA Document B132 TM-2009 (fonner ly 8141 TMCMa -1992). Copyright\u00a9 1992 and 2009 by The American Institute of Ar chitects. All rights reserved . WARNING: Th is AIAo; Document is protected by U.S. Copyr ight Law and International Treaties. Unauthorized reproduct ion or distr ibution of this AlA\" 4 Document, or any p ortio n of it, may result in severe civ il a nd criminal penalties, and will be prosecuted to the maximum extent poss ible under the law. This docum ent was produ ced by AlA s oftwa re a\\13:26:47 on 0810112017 under Order No.2341 0188 96_1 which expires on 01101/2018, and is not for resale. User Notes: (1232093781) I nit. .8 Food Servi ce Design: \u00a7 1.1.12.2 Consultan ts retained under Additiona l Services: NONE \u00a7 1.1.13 Other Initial Information on which the Agreement is based: TBD \u00a7 1.2 The Owner and Architect may rely on the Initial Information. Both partie s, however , recognize that such information may materially change . The Architect shall be entitled to rely on the accuracy and completene ss of information furni shed by the Owner unless the Architect had cause to not so rely. The Architect shall provide prompt written notice to the Owner if the Architect becom es awar e of any error s, omissions or incon sistenci es in such information . Ifthe Owner observes or otherw ise becom es aware of any defect in the Project , it shall give prompt written notice thereof to the Arch itect. ARTICLE 2 ARCHITECT'S RESPONSIBILITIES \u00a7 2.1 The Architect shall provide the profe ssiona l service s as s et forth in this Agreement and described in The General Condition s of the Contract for Construction as modified and supp lemented AlA Document A232 (2009 Edition) and incorporated by referenc e as if set forth herein in full. \u00a7 2.2 The Architect' s services shall be performed consi stent with professional skill and care ordinari ly provided by Architects with experience with projects similar to these Projects practicing in the s ame or similar localit y and under the same or similar circumstance s and consistent with the orderly progress of the Work. The Architect shall submit for the Owner 's approval and the Construction Manager 's information a schedule for the performance of the Architect's services which may be adjusted as the Project s proceed. and shall include a11owances tor periods of time required to r the Owner and Construction Manager's review and for approval of submi ssions by authorit ies having jurisdiction over the Proje cts. Time limit s established herein shall not. exce pt for reasonable c ause. be excee ded by the Architect. The Own er sha11 be entitled to r easonabl y rely on the accuracy and completeness of services and information provid ed by the Archite ct. \u00a7 2.3 The Archit ect shall provide its services in conjunction with the services of a Construction Manager as described in the modified AlA Document C132nL2009 , Standard Form of Agreement Between Owner and Construction Manage r. The Architect shall not be responsible for action s taken by the Construction Manager. \u00a7 2.4 The Architect shall identi fy a representative authorized to act on beha lf of the Archit ect with respect to the Project. \u00a7 2.5 Except with the Owner ' s knowl edge and consent, the Archit ect shall not engage in any activity, or accept any emplo yment, interest or contribution that would reasonably appear to compromise the Arch itect's profe ssional judgment with respect to this Project . (Paragraph s delete d) \u00a72.61NSURANCE \u00a72.6.1 The Architect shall purcha se and maintain from an insurance compan y or insurance compani es lawfull y authori zed to do business in Indiana policie s of insuranc e acceptab le to the Own er, in a form and substanc e reasonably satisfacto ry to the Ow ner, which affor d the coverages set forth in Section 2.6.2 below . This insurance shall be written for not Jess than the limit s of liability specified in Section 2.6.2 or required by law, whichev er coverage is greater . Certified copie s of all insurance polici es or, with the Owner 's consent, Certificate s of Insurance acceptab le to the Owner shall be gi ven to the Own er prior to comm encement of the services. E ach policy must be endor sed to provide that the policy will not be cancelled or allowed to expire until at least thirty (30) days' prior written notice has been provided to th e Ovvner. \u00a72.6.2 The required coverage s and limits which the Archit ect is required to obtain are as follow s: AlA Document 6132\"'- 2009 (formerly 6141 r\"CMa-1992) . Copyright \u00a9 1992 and 2009 by The Americ an Institute of Ar chitects. All right s reserved. WARN ING: This AlA ~ Document is protected by U.S. Copyright Law and International Treaties . Unauthorized reproduction or distribution of this AlA' 5 Document, or any portion of it, may result In severe civil and criminal penaltie s, and will be prosecuted to the maximum extent possible under the law. This document was produced by AlA software at 13: 26:47 on 08/01/20 17 under Order No.2341 018896 _1 which expires on 01/01/2018 , and is not for resale User Note s: (1232 093781) I nit. .1 COMMERCIAL GENERAL LIABILITY a. b. c. Genera l Aggregate (including Completed Operations) Each occurrence Genera l Aggregate Bodily Injur y & Property Damage (Combin ed Single Limit I Per OccuJTen ce) $ 1 ,000,000.00 Personal I Advert ising Injur y (Per Occun-ence) $2,000,000 .00 $1,000.000.00 $2,000.000 .00 $1,000,000.00 The Commerc ial General Liabi lity Policy must be endorsed to provide that the general aggregate amount applies separa tely to each of Architect 's separate projects. ISO Endor sement CG2503 Per Project Endorsement or its equiva lent shall be used to satisfy this requirement. . . 2 COMME RCIAL AUTO LIABILITY (Owned, Non -Owne d and Hired) Bodil y Injury & Prop erty Dama ge (Per Occurren ce) $1,000 ,000.00 .3 WORK ER'S COMPENSATION AND EMPLOYERS' LIABILITY .4 Cove rage A (Worker's Compensation)- Statutory Minimwn Requirement s Cove rage B (Emp loyers Liability) -$500,000/each acciden t; $500,000 Disease- each employee; $500,000 Disease policy limit. EXCESS LIABILITY (Umbrella Form) Each Occun-enc e $5,000,000.00 .5 PROF ESSIONAL LIABILITY INSURANCE . TI1e Architect shall can-y and maintain during the contin uance of this Agreement , professional liability insurance in the amount of$5.000 ,000 for single limit claims and $5.00 0,000 in the aggregate. The Architect's policy of insurance sha ll contain pri or acts cove rage sufficie nt to cover all services perfo rmed by the Architect for this Project. Upon Owner's request. Architect shall give prompt written notice to Owner of any and all claim s made against this policy during the period in which this polic y is required to be maint ained pursuant to this Agreement. If the insurance is written on a claim s-made basis and cove rage is cancell ed at any time, the Ar chitect will obtain, at its cost, an extended repor ting endor semen t which provide s continuing coverage for claim s based upon alleged acts or omissions durin g the term of the Agreement until all applicable statute of limitation periods have expired. All cove rage provided above shall be endorsed to include the Owner , as Additional Insured excep t for the Worker 's Compen sation/Emp loyer's Liabilit y and Profe ssional Liability policie s. ISO forms CG 2010 07 04 and CG 2037 or equivalent endor sement form s must be used on the comme rcial general liabilit y polic y to provide additional insured st atus to the Owner. and shall include cove rage for comp leted operation s. The policie s for which the Owne r is named as additional insured shall provide primary and non-contributin g coverage and any valid and collect ible insurance cmTied separa tely by the Owner shall be in excess of the limit s provide d by such policie s and shall be non-contributor y. All insurance requirements and limits contained in this Section 2.6 apply to all of Architect's consultants and the Archit ect is responsib le to verify those insuranc e requirements and limit s, or seek approva l throu gh the Architect from the Owner for alternative cove rage or reduced limit s. TI1e commercial general liability, automobil e liabilit y, and workman's compensation policie s must be endor sed to provide a waiver of subrogation in favor of Own er. \u00a72.6.3 The Architect hereby agree s to deliver to the Owner, within ten (1 0) days of the date of the Owner -Archit ect Agreement and prior to bringing any equipment or personnel onto the site of the Work or the Project site, certified copies of all insurance policie s procured by the Arch itect under or pursuant to this Section or, with consent of the Owner , Certificates oflnsurance in form and substance satisfactory to the Own er evidencing the required coverages with limit s not less than those specified in the Agreement. \u00a7 2.6.4 In no event shall any failure of the Owner to recei ve certified copies or certificate s of policie s required under this Sectio n or to demand receipt of such certified copies or certificates prior to the Arch itect's commencing the services be construed as a waiver by the Owner of the Architect's obligation s to obtain insmance pursuant to this AlA Docume nt B132'M -2009 (formerly 8141 TMCMa- 1992). Copyrig ht \u00a9 1992 and 2009 by The American Institute of Architects. All right s reserved . WARNING : This AlA\" Docum ent is protected by U.S. Copyright Law and Internationa l Treaties. Unauthor ized reprod uction or distribution of this AIAfe 6 Document, or any portion of it, may result in seve re civil and criminal pena lties, and will be prosec uted to th e maxim um exte nt possible under the law. This documen t was produ ced by AlA software at 13:26:47 on 08101/2017 under Order No.2341 018896 _1 w hich expires on 01/01120 18, and is not for resale. User Note s: (123209378 1) I nit. Section 2.6. The obligat ion to procure and maintain any insurance required is a s eparate responsibility of the Architect and indepe ndent of the duty to furnish a cettified copy or cetiificate of such insurance policie s. \u00a7 2.6.5 The Architect's policies of insurance shall contain prior acts coverage sufficient to cover all service s performed by the Arcitect for this Project and shall provide primary and non-contributory coverage. Any insurance by the Owner shall be considered excess and non-contributory. Deductibles shall be paid by the Architect. Upon Owner ' s reque st, Architect shall give prompt written notice to Owner of any and all claims made against this polic y during the period in which this polic y is required to be maintained pursuant to this Agreement. (Paragraph delete d) ARTICLE 3 SCOPE OF ARCHITECT'S BASIC SERVICES \u00a7 3.1 The Architect's Basic Services consi st of those described in A1iicle 3 and inclu de usual and customary struc tural, mechanical , and electrical engineer ing services. Service s not set forth in this Article 3 are Additiona l Services. \u00a7 3.1.1 The Architect shall manage the Arch itect's services, consult with the Owner and the Construct ion Mana ger, research applicabl e design criteria, attend Project meetings, communicate with member s of the Proje ct team and repmi prot;,rre ss to the Owner. \u00a7 3.1.2 The Architect shall coordinate its ser vices with those services provided by the Owner, the Construction Manager and the Owner's other consultant s. The Architect shall be entitled to rely on the accuracy and completene ss of services and information furni shed by the Owne r, the Construction Manager , and the Owner ' s other consultant s. The Archi tect shall provide prompt written notice to the Owner ifthe Arch itect become s aware of any error, omission or incon sistency in such services or information . \u00a7 3.1.3 As s oon as practicable after the date ofthis Agreement , the Architect shall submit to the Owner and the Cons truction Manager a schedule ofth e Architect's service s for inclusion in the Project sched ule prepar ed by the Construction Mana ger. The sched ule of the Arch itect' s service s shall include design mile stone dates . anticipated dates when cost estimates or design reviews may occur, and allowance s for period s of time required (I) for the Owner 's review. (2) for the Construction Manager's review. (3) for the performanc e of the Owner's consultant s, and (4) for approval of submi ssions by authorities having jurisdiction over the Proje ct. \u00a7 3.1.4 The Architect shall subm it information to the Construction Manager and participat e in developin g and revising the Proje ct sched ule as it relates to the Archi tect's service s. \u00a7 3.1.5 Once the Own er and the Architect agree to the time limits established by the Project schedule, the Own er and the Archite ct shall not exceed them , except for reasonable cause. \u00a7 3.1.6 The Archi tect shall not be responsible for an Owner 's directive or substitution , or for the Owner 's acceptance of non-conforming Work , made without the Architect's approval. \u00a7 3.1.7 The Architect shall, at appropriat e time s, in coordinat ion w ith the Construction Mana ger, contact the gove rnmental authoriti es required to approve the Construction Documents and the entities providing utility servic es to the Project. In designin g the Project , the Arch itect shall respond to applicable design requ irements impo sed by such governmental authoritie s and by such entities providin g utility services. \u00a7 3.1.8 The Arch itect shall assist the Owner and Construction Manager in connection with the Owner 's responsibilit y for filing document s required for the approval of governmental author ities having jurisdiction over the Project. \u00a7 3.2 Schematic Design Phase Services \u00a7 3.2.1 The Architect shall review and validate the program of space requirement s and other information fumi shed by the Owner and Construction Mana ger, and shall review laws, codes, and regulation s applicable to the Architect's service s. The Arch itect shall review the program , sched ule and construction budget to ascertain the requirement s for the Project and shall aiTive at a mutua l under standing of such requirement s with the Owner and Construction Manager and modi fy if and as required . Based on the cost es timate s, the Archit ect to prepare all nece ssary AlA Document 8132'\"' -2009 (formerly 8141 r\"'CMa- 1992). Copyright \u00a9 19 92 and 2009 by The Ame rican Institute of Architects. All rights reserved. WARNING : This AlA\u00ae Document is protected by U.S. Copyrig ht Law and I nterna tional Treaties . Unau thorized repro d uction or d istribution of this AlA \"' 7 Document, or any portion of it, may r esult In s evere civil and criminal pen alties, and will be prosecuted to the maxim um extent possible under the law. This document was produced by AlA software at 13: 26:47 on 0 8/01/201 7 under Order No. 2341 018896_1 which expires on 01/01/2018, and is not for resale . User Notes: (123209378 1) I nit. drawings. specifications and other documents required for the construction and completion of the Pr ~ject based on the Project ' s budget. \u00a7 3.2.2 The Architect shall prepare a preliminary evaluation of the Owne r's program , schedu le, budget for the Cost of the Work. Project site, and the other Initial Information. each in terms of the other, to ascertai n the requirement s of the Project. The Architect shall notify the Owner of (1) any incon sistencies discovered in the information . and (2) other information or consulting service s that may be reasonably needed for the Project . \u00a7 3.2.3 The Architect shall present its preliminary evaluation to the Owner and Construction Manager and shall discuss with the Owner and Construction Manager alternative approaches to design and construction of the Project, including the feasibi lity of incorporating environmen tally respon sible design approaches. The Architect shall reach an understanding with the Owner regarding the requirem ents of the Project. \u00a7 3.2.4 Based on the Project requirements agreed upon with the Owner , the Architect shall prepare and present to the Owner and Construction Manager , for the Owner 's approval , a preliminar y design illustrating the scale and relationship of the Project compon ents. \u00a7 3.2.5 Based on the Owner's approva l of the preliminary design, the Architect s hall prepare Schemati c Design Documents for the Owner's approval and the Construction Manager's review. The Schematic Design Documents shall consi st of drawings and other documents including a site plan and preliminary building plans , sections and eleva tions; and may include some combination of study model s, perspective sketche s, or digital modeling. The Schematic Design Document shall provide option s for size, location and configuration of the Owner approved prototype design on each site. Preliminary selections of major building systems and construction material s shall be noted on the drawing s or described in writing . Architect shall prepare written description of structura l, mechanical, electrical, pl umbi ng and technology work along with preliminary layouts as needed for cost estimating . \u00a7 3.2.5.1 The Architect s hall consider environmenta lly respon sible desi&'ll alternative s. such as material choice s and building orientation. together with other considerations based on program and aesthetic s, in developing a design that is consistent with the Owner 's program. schedu le and budget for the Cost of the Work . \u00a7 3.2.5.2 The Architect shall consider with the Owner and the Construction Mana ger the value of alternativ e material s. buildin g systems and equipm ent, together with other considerat ions based on program and aesthetics in developin g a design for the Project that is consistent with the Owner 's schedu le and budget for the Cost of the Work . \u00a7 3.2.6 The Architect shall submit the Schematic Design Documents to the Owner and the Cons truction Mana ger. The Architect s hall meet with the Owner and Const ruction Mana ger to review the Schematic Design Document s and the schematic cost est imate prepar ed by the Cons truction Mana ger. If the schematic cost estimate exceeds the Project Budg et, Architect shall discuss with Owner and Construction Mana ger potenti al cost reduction options a nd modi f)' the Schematic Design Docum ents \u00a7 3.2.7 Upon receipt of the Construction Manager 's review comments and Construction Manager 's schematic cost estimate at the concl usion of the Schematic Design Phase , the Architect shall take action as required under Section 6.4, identify agreed upon adjustment s to the Project's size, quality or budget , and reque st the Owner's approval of the Schematic Design Documents. lfrevisions to the Schematic Design Documents are required to comply with the Owner' s budget for the Cost of the Work at the conclu sion of the Schematic Design Phase, the Architect s hall incorporate the requir ed revisions in the Design Development Phase. \u00a7 3.2.8 In the furth er de velopm ent of the Drawin gs and Specifications during this and subsequent phases of design , the Architect shall be entitled to rely on the accuracy of the estimates of the Cost ofthe Work , which are to be provided by the Construction Manager under the Construction Manager's agreement with the Owner. \u00a7 3.3 Design Development Phase Services \u00a7 3.3.1 Based on the Owner's approval of the Schematic Design Docwnents , and on the Owner 's authorization of any adjustment s in the Project requirement s and the budget for the Cost of the Work pursuant to Section 5.4, the Architect shall prepare Design D evelopment Documents for the Owner' s approval and the Construction Mana ger's review. The Design Development Documents s hall be based upon information provided , and estimates prepared by, the Construction Manager and shall illustrate and describe the development of the approved Schematic Design AlA Document 8132\"'-2009 (formerly B141fMCMa -1992). Copyr ight\u00a9 1992 and 2009 by The American Institute of Architects. All rights reserved. WARNING : This A l A ~ ' Document is protected by U.S. Copyright Law and International Treaties. Unauthorized reproduct ion or distribution of this AIAt\u00b7 Document, or any portion of it, may result In severe civil and criminal penalti es, and will be prose cuted to th e maximum extent poss ible under the law. This document was produced by AlA software at 13: 26:47 on 08/01/2017 und er Order No. 2341 018896_1 which exp ires on 01/01/2018, and is not for resale. User Notes: (123209378 1) 8 I nit. Documents and shall consist of drawings and other document s including plans , sectio ns. elevat ions, typical construction details, and diagrammatic layouts of building systems to fix and describe the size and charact er of the Project as to architectural, structuraL mechanical and electrical systems, and such other elements as may be appropriate. The Design Developm ent Documents shall include detailed layout s of the site plans and the floor plan with furniture and equipment. The Design Development Document s shall also include outline specifications that identifY major material s and systems and establish in general their quality levels. Architect's Design Development document s shall include interior and exter ior renderings. \u00a7 3.3.1.1 The Architect shall commence the process to select interior finishes, pattem s and colors for each Project and review with the Owner on a regular basis until the process is comp lete. \u00a7 3.3.1.2 The Architect shall direct the prepa ration of civil , landscape architecture , structural, mechanical , electrical, plumbing and technology work as required for the Proje ct along with required narrative information as needed for estima ting the Cost of the Work . \u00a7 3.3.2 Prior to the conclusion of the Design Development Phase , the Architect shall subm it the Design Development Document s to the Owner and the Construction Manager. The Architect shall meet with the Owner and Construction Manager to review the Design Development Document s and estimate of the Cost of the Work . If the cost estimate exceeds the Project Budget , the Architect shall discuss potential cost reduction options with the Owner and Construction Manager and modifY the Design Development Documents as required. \u00a7 3.3.3 Upon receipt of the Construction Manager's information and estimate at the conclusion of the Design Development Phase, the Architect shall take actio n as required under Sections 6.5 and 6 .6 and request the Owner's approval of the Design Development Documents. \u00a7 3.4 Construction Documents Phase Services \u00a7 3.4.1 Based on the Owne r's approval of the Design Development Documents , and on the Owner's authorization of any adjustment s in the Project requirements and the budget for the Cost of the Work . the Architect shall prepare Construction Documents for the Owner's approval and the Construction Manager's review. The Construction Document s shall illustrate and describe the further develo pment of the approved Design Development Documents and shall consist of Drawin gs and Specifications setting forth in detai l the qualit y level s of material s and systems and other requirements for the construction of the Work . The Owner and Archit ect acknowledge that in order to construct the Work the Contractor will provide additional information , including Shop Draw ings, Product Data , Samp les and other similar submittals , which the Archite ct shall review in accordance with Section 3.6.4. \u00a7 3.4.2 The Architect shall incorporate into the Construction Documents the design requirements of governmental authorities havin g jurisdiction over the Project. \u00a7 3.4.3 Durin g the development of the Construction Document s, if requested by the Owner , the Architect shall assist the Owner and the Construction Manager in the developm ent and preparation of (I) bidding and procurement information that describes the time , place and conditions of bidding , including bidding or proposal form s;",
        "(2) the form of agreement between the Owner and Contracto r; and (3) the Conditions of the Contract for Construction (General, Supplementary and other Conditions); and (4) compi le a project manual that include s the Conditions of the Contract for Construction and may includ e bidding requirements and samp le form s. \u00a7 3.4.4 Prior to the conc lusion of the Construction Document s Phase, the Architect shall submit the Construction Document s to the Owner and the Construction Manager . The Architect shall meet with the Owner and Construction Manager to review the Construction Document s at fifty percent (50%) and ninety-five percent (95%) completion. \u00a7 3.4.5 Upon receipt of the Construction Manager ' s information and estimate at the conclusion of the Construction Document s Phase, the Architect shall take action as required under Section 6. 7 and request the Owner 's approval of the Constr uction Documents. \u00a7 3.4.6 The Architect shall prepare early bidding packag es for each Project in conjunction with Construction Manager 's requirements to includ e site, foundations, structu ral steel and under-sl ab utiliti es. AlA Document 8132\"'- 2009 (formerly B141'MCMa -1992). Copyright\u00a9 1992 and 2009 by The American Institute of Architects. All right s reserved . WARN ING: This AlA ~ \u00b7 Document is protected by U.S. Copyright Law and International Treaties . Unauthorized reproduction or distribution of this A l A ~ \u00b7 9 Document , or any portion of it, may result In severe civil and crimina l penalties , and will be prosecuted to the maximum extent possib le under the law. This document was produced by AlA software at 13:26:47 on 08/01/2017 under Order No.2341018896 _1 which expire s on 01/01 /2018 , and is not for resale. User Notes : (1232093781) I nit. \u00a7 3.5 Bidding Phase Services \u00a7 3.5.1 General Following the Owner's approval ofthe Construction Documents , the Architect shall assist the Owner and Construction Manager in (I) obtaining competitive bids ; (2) confirming responsiveness of bids; (3) determining the successful bidder , if any; and (4) awarding the contracts for construction, including early bidding packages in conjunction with Construction Managers ' requirements. \u00a7 3.5.2 Competitive Bidding \u00a7 3.5.2 .1 Bidding Documents shall consist ofbidding requirements and proposed Contract Documents. \u00a7 3.5.2.2 The Architec t shall assist the Owner and Construction Manager in bidding the Project by .1 facilitating the reproduction of Bidding Documents for distribution to prospective bidders, .2 participating in a pre-bid conference for prospective bidders , and .3 preparing responses to question s fi\u00b7om prospective bidders and providing clarifications and interpretations ofthe Bidding Documents in the form of addenda. \u00a7 3.5.2.3 The Architect shall consider reque sts for substitutions, if the Bidding Documents permit subst itution s, and shall consult with the Construction Manager and prepare and distribute addenda identifYing approved subst itutions to all prospective bidders. (Paragraphs delet ed) \u00a7 3.6 Construction Phase Services \u00a7 3.6.1 General \u00a7 3.6.1.1 The Architect shall provide administration of the Contract between the Owner and the Contractor as set forth below and in the modified AlA Document A232\u2122 -2009, General Conditions of the Contract for Construction, Construction Manager as Adviser Edition. If the Owner and Contrac tor modifY AlA Document 232-2009, those modification s shall not affect the Architect's services under this Agreement, unless the Ovvner and Architect amend this Agreement. \u00a7 3.6.1.2 The Architect shall advise and cons ult with the Owner and Construction Manager during the Construction Phase Services unti I final pa)~nent to the Contractors are due and all punch list item s are complete and the Certification of Substantial Completions for each Project is issue d. The Architect shall have authority to act on behalf of the Owner only to the extent provided in this Agreement. The Architect shall not have control over, charge of, or responsibility for the construction means, methods, techniques, sequences or procedures, or for safety precautions and programs in connection with the Work , nor shall the Architect be responsib le for the Contractor's failure to perform the Work in accordance with the requirement s of the Contract Documents. The Architect shall be responsible for the Archi tect's negligent acts or omissions, but shall not have control over or charge of, and shall not be responsible for, acts or omiss ions of the Construction Manager, or the Contractor or of any other persons or entities performing portions of the Work. \u00a7 3.6.1.3 Subject to Section 4.3, the Architect's responsibility to provide Construction Phase Services commences with the award of the Cont ract for Construction and terminates on the date the Architect issues the final Certificate for Pa~nent and after the one (I) year Contractor Warranty period. \u00a7 3.6.2 Evaluations of the Work \u00a7 3.6.2.1 The Architect shall visit the site at intervals appropriate to the stage of construction, to become generally familiar with the progress and quality of the portion ofthe Work completed, and to determine , in general, if the Work observed is being performed in a manner indicatin g that the Work, when fully completed , will be in accordance with the Contract Documents. The Architect shall also attend the Owner/ Architect /Construction Manager meetings and shall be available with reasonable promptness as needed to address other issues related to the progres s of construction . However , the Architect shall not be required to make exhaustive or continuous on-site inspections to check the quality or quantity of the Work. On the basis of the site visits, the Architect shall keep the Owner informed about the progress and quality of the portion of the Work completed, and report to the Owner and the Construction Manager (I) known deviations from the Contract Documents and from the most recent construction schedule, and (2) defect s and deficiencie s observed in the Work . AlA Document B1321M-2009 (formerly 8141 TMCMa- 1992). Copyright\u00a9 1992 and 2009 by The American Institute of Arch itects . All rights reserved. WARNING: This AlA\"' Document is protected by U.S. Copyr ight Law and Internat ional Treaties . Unauthor ized reproduction or distribution of this AlA ~ 1 O Document , or any portion of it, may result in severe civil and crim inal pena lties, and will be prose cuted to the maximu m extent possible under the Jaw. This document was produced by AlA software at 13:26:47 on 08/01/2017 under Order No.2341018896_1 which expires on 01/01/2018 , and is not for resale. UserNotes: (1232093781) I nit. \u00a7 3.6.2.2 The Architect has the authority to reject Work that does not conform to the Contract Documents and shall notify the Construction Manager about the rejection . Whenever the Architect considers it necessary or advisable for implementing the intent of the Contract Document s, the Architect , upon written authorization from the Owner and notification to the Construction Manager. shall have the authority to require inspection or testing ofthe Work in accordance with the provisions of the Contract Document s, whether or not such Work is fabricated , installed or completed. However , neither this authority of the Architect nor a decision made in good faith either to exercise or not to exercise such authority shall give rise to a duty or responsibility of the Architect to the Contractor, Subcontractors, materia l and equipment suppliers , their agent s or employees or other persons or entitie s performing portions of the Work . \u00a7 3.6.2.3 (Stricken) \u00a7 3.6.2.4 Interpretations and decisions of the Architect shall be consi stent with the intent of and reasonably inferab le fi\u00b7om the Contract Documents and shall be in writing or in the form of drawings approved by the Construction Manager . When making such interpretations and decisions, the Architect shall endeavor to secure faithful performance by both Owner and Contractor , shall not show partiality to either , and shall not be liable for results of interpretations or decisions rendered in good faith. The Architect's decisions on matter s relating to aesthetic effect shall be final if consistent with the intent expressed in the Contract Documents . The Architect shall assist the Owner in matters relating to aesthetic effect and determine what course of action is consistent with the intent expressed in the Conn\u00b7act Documents. The Owner and Consn \u00b7uction Manager , however , shall have final authority on all matter s relating to aesthetic effect. \u00a7 3.6.2.5 The Architect shall render decisions on Claims between the Owner and Contractor as provided in the Conn \u00b7act Documents. \u00a7 3.6.3 Certificates for Paymen t to Contr actor \u00a7 3.6.3.1 The Architect shall review and certify an application tor payment not more fi\u00b7equently than monthly. Within seven (7) days after the Architect receive s an application for pa;ment forwarded rrom the Cons truction Manager , the Architect shall review and certify the application as follows: .1 Where there is only one Cont ractor responsib le for performing the Work, the Architect shall review the Contractor's Application and Certificate for Payment that the Construction Manager has previously reviewed and certified . The Architect shall certify the amount due the Contractor and shall issue a Certificate for Payment in such amount. .2 Where there are Multiple Prime Contracto rs responsible for performing different portion s of the Project, the Architect shall review a Project Application and Project Certificate for Payment , with a Summary ofConn \u00b7actor s' Application s for Payment, that the Construction Manager has previou sly prepar ed, reviewed and certified. The Architect shall certify the amounts due the Contractor s and shall issue a Project Certificate for Payment in the total of such amounts. \u00a7 3.6.3.2 The Architect's certification for payment shall constitute a representation to the Owner , based on (I) the Architect's evaluation of the Work as provided in Section 3.6.2, (2) the data comprisi ng the Contractor 's Application for Payment or the data compri sing the Project Application for Payment , and (3) the recommendation of the Construction Manager, that, to the best of the Architect 's knowledge , information and belief , the Work has progressed to the point indicated and that the quality of the Work is in accordance with the Cont ract Documents. The foregoing representations are subject (I) to an evaluation of the Work for confo rmance with the Contract Documen ts upon Substantial Comp letion, (2) to results of subsequent tests and inspections, (3) to correction of min or deviation s from the Contract Document s prior to comp letion , and ( 4) to specific qualifications expressed by the Architect. The Architect shall maintain a record of the Contractor 's Application s for Payment. \u00a7 3.6.3.3 The issuance of a Certificate for Payment or a Project Certificate for Payment shall not be a representat ion that the Architect has (1) made exhaustive or continuous on-site inspections to check the qualit y or quantity of the Work , (2) reviewed construction mean s, methods, techniques , sequence s or procedure s, (3) reviewed copies of requi sitions received from Subcontractors and material supplier s and other data requested by the Owner to substantiate the Contractor's right to payment , or (4) ascertained how or for what purpose the Contracto r has used money previously paid on account of the Contract Sum. AlA Document 8132\"'- 2009 (formerly 8141 \"'CMa -1992). Copyright \u00a9 1992 and 2009 by The American Institute of Arch itects. All rights reserved. WARNING : This AlA ~ Document is protected by U.S. Copyr ight Law and Internat ional Treaties . Unauthorized reprod uction or distributio n of this A l A ~ \u00b7 11 Document , or any portio n of it, may result in severe civil and criminal penalties, and will be prosecu ted to the maxim um exten t possible under the law. This document was produced by AlA softv.lare at 13:26:47 on 0810112017 under Order No.2341 018896_1 which expires on 0110112018 , and is not for resale. User Notes : (123209378 1) I nit. \u00a7 3.6.3.4 The Architect shall maintain a record of the application s and certificate s for payment. \u00a7 3.6.4 Submittals \u00a7 3.6.4.1 The Architect shall review the Construction Manager ' s Project submittal schedu le and shall not unre asonab ly delay or withhold approval. The Architect ' s action in reviewing submitt als transmitted by the Construction Manager shall be taken in accordance with the approved submittal schedule or, in the absence of an approved submittal schedule , with reasonable promptne ss while allowing sufficient time in the Architect's professional judgment to permit adequate review. \u00a7 3.6.4.2 In accordance with the Architect-approved Project submittal schedule , and after the Construction Manager reviews, approves and transmit s the submittal s, the Architect shall review and approve or take other appropriate action upon the Contractor's submittal s such as Shop Drawing s, Product Data and Samples, but only for the limited purpose of checking for conformance with information given and the design concept expre ssed in the Contract Document s. Review of such submittal s is not for the purpose of determ ining the accuracy and completeness of other in formation such as dimensions, quantiti es, and installation or perfor mance of equipment or systems, which are the Contractor ' s responsibilit y. The Architect' s review shall not constitute approval of safety precautions or. unless otherwise specifica lly stated by the Architect , of any construction mean s, method s, techniques, sequences or proce dures. The Architect's approva l of a spec ific item shall not indicate approval of an assembl y of which the item is a component. \u00a7 3.6.4 .3 If the Contract Document s spec ificall y require the Contractor to provide profess ional design services or certifications by a design profe ssional related to systems , materia ls or equipment , the Architect shall specify the appropriate performance and design criter ia that such services must satisfy. The Architect shall review shop drawings and other submittal s related to the Work designed or certified by the design professional retained by the Contractor that bear such profe ssional 's seal and signature when submitted to the Architect. The Architect shall be entitled to rely upon the adequacy. accuracy and completeness of the services, certifications and approvals performed or provided by such design professional s. \u00a7 3.6.4.4 A Her receipt of the Construction Manager' s recommendation s. the Archi .tect shall review and respond to requests fl.)r information about the Contract Documents. The Architect , in consultat ion with the Construction Manager , sha ll set forth in the Contract Docume nts the requirements for requ ests for information. Requests for information shall include , at a minimum , a detai led written statement that indicate s the specific Drawings or Specifications in need of clarifi cation and the nature of the clarification reque sted. The Architect ' s response to such reque sts sh all be made in writi ng w ithin any time limit s agreed upon, or otherwise with reasona ble promptn ess. If appropria te, the Architect shall prepare and issue supplemen tal Drawings and Specifications in response to reque sts for inform ation. \u00a7 3.6.4.5 The Architect shall maintain a record of submitta ls and copies of submittal s transmitted by the Const ruction Manager in accordance with the requir ements of the Contract Document s. \u00a7 3.6.5 Changes in the Work \u00a7 3.6.5.1 T he Architect shall review and sign, or take other appropria te action, on Change Orders and Construction Chan ge Directives prepared by the Construction Mana ger for the Owner's approval and execution in accordance with the Contract Documents . \u00a7 3.6.5.2 The Architect may autho rize minor change s in the Work that are consistent with the intent of the Contract Documents and do not involve an adjustment in the Contract Sum or an exten sion of the Contract Time. Such chan ges shall be effected by written order issued by the Architect through the Construction Manager . \u00a7 3.6.5.3 The Arch itect shall maintain records relative to changes in the Work. \u00a7 3.6.6 Project Completion \u00a7 3.6.6.1 The Architect , assisted by the Construction Man ager, shall conduct inspections to detennin e the date or dates of Substantial Completion and the date of final comp letion; issue Certificate s of Substantia l Completion prepared by the Construction Manager; receive from the Construction Manager and review written wan\u00b7anties and related documents requ ired by the Contract Document s and assembled by the Contractor; and, after receipt of a final AlA Document 6132\"\u2022- 2009 (formerly 6141 \"'CMa -1992) . Copyright \u00a9 1992 and 2009 by The American Institute of Architects . All rights reserved . WARNING : This AlA! Document is protected by U.S. Copyright Law and International Treaties. Unauthor ized reproductio n or distribution of this AlA' ' 12 Document , or any portion of it, may result in severe civil and criminal penalties , and will be prosecuted to the maximum extent possible under the law. This document was produced by AlA software at 13;26:47 on 08/01/2017 unde r Order No.23410188 96_1 which expires on 01/01/2018 . and is not for resale User Notes: {1232093781) I nit. Contractor's Application and Certificate for Payment or a tina! Project Application and Project Certificate for Payment fi\u00b7mn the Construction Manager , issue a final Certificate for Payment based upon a final inspection indicating the Work comp lies with the requirements of the Contract Documents . \u00a7 3.6.6.2 The Architect 's inspections shall be conducted with the Owner and Construction Manager to check conformance of the Work with the requirements of the Contrac t Documents and to verify the accuracy and completeness of the list submitted by the Construc tion Manager and Contractor of Work to be completed or corrected. \u00a7 3.6.6.3 When the Work is found to be substantially complete by the Construction Manager and Architect, and after certification by the Construction Manager and the Architect, the Architect shall inform the Ow\u00b7ner about the balance of the Contract Sum remaining to be paid the Contractor, including the amount to be retained fi\u00b7om the Contract Sum , if any, for final completion or correction of the Work . \u00a7 3.6.6.4 Upon requ est of the Owner, and prior to the expiration of one (I) year from the date of Substantial Completion, the Architect shall, without additional compensation, conduct a meeting with the Ovvner to review the facilit y operations and performance. ARTICLE 4 ADDITIONAL SERVICES \u00a7 4.1 Unless specifically identified as a Basic Service, any services not included in Basic Services but required for the Project are additional services. The Owner must provide prior written consent before the Architect commences Additional Services. If the Owner provides consent to the Additional Services, the Owner shall compensate the Architect as provided in Section 11.2. Services Responsibility Location of Service Description (Architect, Owner (Section 4.2 below or in an exhibit or allached to this docume111 and Not Provided) ident if/ed below) (Row deleted) (Row deleted) AlA Document B132 TM-2009 (formerly B141fMCMa -1992). Copyright\u00a9 1992 and 2009 by The American Institute of Architects. All rights reserved. WARN ING: This AlA' ' Document is protected by U.S. Copyright Law and Internationa l Treaties . Unauthorized reproduction or distr ibution of this AlA\"' 13 Document , or any portion of it, may result in severe civil and crimina l penalties , and will be prosecuted to the maximum extent poss ible under the law. This document was produced by AlA software at13:26:47 on 08/01 /2017 under Order No.2341018896_1 which expires on 01/01/2018 , and is not for resale. User Notes : (1232093 781) I nit. \u00a7 4.2 Addit ional Service s may be provided after execution of this Agreement , without invalidating the Ag reement. Except for service s required due to th e fault of the Architect, any Additional Servic es provided in accordan ce \u2022.vith this Article 4 shall entitle the Architect to compen sation pursuant to Section 11.3, and an appropriate adjustment in the Archit ect' s schedule . If the Architect believes it is entitled to additional comp ensation for services the Architect believes are needed or for other services reque sted by the Owner, the Arch itect shall notifY the Owner in writing with reasonable promptnes s and ( I) ex plain the basis of the Architecfs belief that such services are outside the scope of Basic Serv ices, and (2) provide an estimate of the probable cost of such service s and probabl e impact , if any, on the Architect ' s schedu le. The Architect shall not provide services for which the Architect believe s it is entit led to additional compensation until the Architect receives the Owner's written authorization , which authorization will either (1) acknowledge that the Architect is entit led to additional compen sation, or (2) deny that the Architect is entitled to additional compensation , and direct the Architect to proceed with the service s, in which case the Architect may pursue a claim for additiona l compe nsation under Article 8. (Para graphs delete d) ARTICLE 5 OWNER 'S RESPONSIBILITIES \u00a7 5.1 U nless otherwise provided for under this Agreeme nt, the Owner shall provid e information in a timel y manner regarding requiremen ts for and limitation s on the Project , including a written program which shall set forth the Owner ' s object ives, sch edule , constraint s and criteria , including space requirement s and relation ships, flexibility, expandabi lity, special equipment, systems and site requirements . \u00a7 5.2 The Owner has retained a Construction Manager to provide services, duties and respon sibilitie s as described in the modified AlA Document C 132-2009 , Standard Form of Agreement Between Owner and Constructio n Manager. The Owner shall provide the Archit ect a copy of the executed agreement between the Owner and the Construct ion Manager. \u00a7 5.3 The Owner shall furnish the service s of a Construction Manager that shall be respon sible for creating the overall Project schedu le. The Owner shall adjust the Project schedule, if necessa ry. as the Project proceed s. \u00a7 5.4 The Owner shall establish and periodically up date the Owner' s budget tor the Project . includin g (I) the budget t o r the Cost of the Work as defined in Section 6.1. (2) the Own er' s other costs, and (3) reasonable contingencie s related to all of these costs. The Owne r sha ll furni sh the services of a Construction Man ager that shall be responsible for preparing all estimates of the Cost of the Work. If the Own er significantly increa ses or decre ases the Owner ' s budget for the Cost of the Work , the Owner shall notify the Archit ect and the Construction Manager . \u00a7 5.4.1 The Own er acknowledge s that accelerated, phased or fast-track schedul ing provid es a benefit , but also carri es with it associated risks. Such risks include the Owner incuJTing costs for the Arch itect to coordinate and redesign portion s of the Project affected by procuring or installing element s of the Project prior to the completion of all relevant Construction Document s. and costs for the Contractor to remove and replace previou sly installed Work . lfthe Owner select s accelerated , phased or fast-track scheduling , the Owne r agree s to include in the budget for the Project sufficient conti ngencies to cover such costs. \u00a7 5.5 The Owner shall identify a representative authorized to act on the Owner' s behalf with respect to the Project. The Owner shall render decisions and approve the Architect's submittals in a timely manner in order to avoid unrea sonable delay in the orderly and sequential progre ss of the Architect's services. \u00a7 5.6 The Owner shall furnish surveys to describe physical characteristics, legal limitation s and utility location s for the site of the Project , and a written legal descript ion of the site. The surveys and legal information shall include, as applicable , grades and lines of street s, alleys, pavements and adjoining property and structure s; designated wetlands; adjacent drainage; rights-of-way, restriction s, easement s, encroachment s, zoning , deed restriction s, boundar ies and contours of the site; locations , dimensions and nece ssary data with respect to existing buildings , other improvement s and trees ; and information concerning available utility services and lines , both public and private , above and below grade, including inverts and depths. All the infonnat ion on the survey shall be referenced to a Project benchmark . \u00a7 5.7 The Owne r shall furni sh services of geotechni cal engineers, which may include but are not limit ed to test boring s, test pits, determination s of soil bearing values, percolation tests, evaluation s of hazardou s materials, seismic evaluation , ground corrosion tests and resistivity tests, including neces sary operation s for anticipating subsoil conditions , with written report s and appropriate recommendation s. The Architect shall assist the Ovme r in AlA Document 8132\"' -2009 (fonnerly 8141 tMCMa -1992). Copyright \u00a9 1992 and 2009 by The American Institute of Architects. All rights reserved. WARN ING: This AlA ~\u00b7 Document is protected by U.S. Copyright Law and International Treaties . Unauthorized reproduction or distribution of this A l A ~ 14 Document , or any portion of it, may result in severe civil and crimina l pena lties, and will be prosecuted to the maximum extent poss ible under the law. This document was produced by AlA software at 13:26:47 on 08/01/2017 under Order No.2341018896_1 which expires on 01/01/2018 , and is not for resale. User Notes : (1232093781) I nit. ascertaining the information nece ssary relative to all geotechnical services and shall. on behalf oft he Owner. solic it quotations for such work. The Architect shall review quotations received and forward them to the Owner with recommendations . \u00a7 5.8 The Owner shall coordinate the services of its own consultants with those services provided by the Architect. Upon the Architect's request , the Owner shall fum ish copies of the scope of services in the contracts between the Owner and the Owner 's consultant s. The Owne r shall furnish the services of consulta nts other than those designated in this Agreement, or authorize the Architect to furnish them as an Additional Service, when the Architect request s such service s and demonstrates that they are reasonabl y required by the scope of the Project . The Owner shall require that its consulta nts maintain professional liability insurance and other liability insurance as appropriate to the services provided. \u00a7 5.9 The Owner shall furnish tests, inspection s and rep01ts required by law or the Contract Document s, such as structural , mechanical, and chemical tests. tests for air and water pollution , and tests for hazardou s materials . \u00a7 5.10 The Owner shall furnish all legal, insurance and accounting service s, including auditing services, that may be reasonably necessary at any time for the Project to meet the Owner's needs and interests. \u00a7 5.11 The Owner shall provide prompt written notice to the Architect and Construct ion Manager ifthe Owner becomes aware of any fault or defect in the Project , including errors, omis sions or incon sistencies in the Architect's Instrument s of Service. \u00a7 5.12 Except as otherwise provid ed in the Contract Document s or when direct communications have been specially authorized , the Owner shall endeavor to communicate with the Contracto rs through the Construction Manager, and shall contemporaneously provide the same communication s to the Architect about matters arising out of or relating to the Contract Documents. Communication s by and with the Architect's consultant s shall be through the Architect. \u00a7 5.13 Before executing the Contracts for Construction , the Owner shall coordinate the Architect's duties and responsibilitie s set forth in the Contract s for Construction with the Architect\"s services set forth in this Agreement. The Owner shall provide the Architect a copy of the exec uted agreement between the Owner and Contractor , including the modified General Condition s of the Contract for Construction. \u00a7 5.14 The Owner shall provide the Architect access to the Project site prior to commencement of the Work and shall obligate the Construction Manager and Contractor to provide the Architect access to the Work wherever it is in preparation or progres s. ARTICLE 6 COST OF THE WORK \u00a7 6.1 For purposes of this A!:,rreement , the Cost ofthe Work shall be the total cost to the Owner of to construct all element s of the Project designed or specified and shall include the Contractors' general conditions costs, overhead and profit; however, all element s composing the Cost oft he Work for the Proje ct may not be coordinated by Architect and may be purchase directly by Owner. The Cost of the Work include s the compensation of the Construction Manager and Construction Manager 's consu ltants during the Construction Phase only, including compensation for reimbur sable expenses at the job site, if any. The Cost of the Work does not include the compensation of the Architect, the costs of the land, rights-of-way , financing, contingencies for changes in the Work or other costs that are the responsibility of the Owner . \u00a7 6.2 The Owner 's budget for the Cost of the Work is provided herein, and may be adjusted throughout the Project as required under Sections 5.4 and 6.4. Evaluations of the Owner's budget for the Cost of the Work represent the Architect 's judgment as a design profe ssional. \u00a7 6.3 The Owner shall require the Construction Man ager to include appropriate contingencies for design , bidding or negotiating , price escalation , and market conditions in estimates of the Cost of the Work . The Architect shall be entitled to rely on the accu racy and completeness of estimates of the Cost of the Work the Construction Manager prepares as the Architect progre sses with its Basic Services. The Architect shall prepare , as an Additional Service, revisions to the Drawings , Specifications or other docu ments required due to the Construction Manager' s inaccuracies or incompleteness in preparin g cost estimates. The Architect may review the Construction Manager 's AlA Document 8132rM- 2009 (formerly 8141 TMCMa -1992) . Copyright\u00a9 1992 and 2009 by The American Institute or Architects. All rights reserved . WARNING : This AlA\" Document is protected by U.S. Copyright Law and International Treaties. Unauthorized reproduction or distribution of this AlA\u2022 15 Document , or any portion of it, may result in severe civil and criminal penalties , and will be prosecuted to the maximum extent possible under the law. This document was produced by AlA sortware at 13:26 :47 on 08/01/2017 under Order No.23410 1889 6_1 which expires on 01/01/2018 , and is notror resale . User Notes : (12320937 81) I nit. estimate s solely for the Architecf s guidance in completion of its services , however. the Archi tect shall report to the Owner any material inaccuracies and incon sistencie s noted during any such review. \u00a7 6.3.1 (Stricken) \u00a7 6.4 If, prior to the conclusion of the Design Development Phase, the Construct ion Manager's estimate ofthe Cost of the Work exceeds the Owner's budget for the Cost of the Work, the Architect, in consultation with the Construction Manager, shall make approp riate recommendations to the Owner to adjust the Project 's size, quality or budget , and the Owner shall cooperate with the Architect in making such adjustments. \u00a7 6.5 If the estimate of the Cost of the Work at the conclusion of the Design Developm ent Phase exceed s the Owner 's budget for the Cost of the Work , the Owner shall .1 give written approval of an increase in the budget for the Cost ofthe Work; .2 in consul tation with the Arch itect and Constr uction Manager, revise the Pr~ject pro&rram , scope, or qualit y as required to reduce the Cost of the Work ; or .3 implement any other mutually acceptable alternative. \u00a7 6.6 If the Owner chooses to proceed under Section 6.5.2, the Architect, without additional compen sation, shall incorporate the required modifica tions in the Construction Documents Phase as nece ssary to comply with the Owner' s budget for the Cost of the Work at the conc lusion of the Design Developm ent Phase Service s, or the budget as adjusted under Section 6.5.1. The Architect' s modification of the Construction Documents shall be the limit of the Architect's respo nsibility as a Basic Service under this Article 6. \u00a7 6.7 After incorporation of modifications under Section 6.6, the Architect shall, make any required revisions to the Drawings , Specificatio ns or other document s nece ssitated by subsequent cost estim ates that exceed the Owner's budget for the Cost of the Work, except when the exce ss is due to changes initiated by the Archite ct in scope. basic systems. or the kinds and quality of material s, finishes or equipment. ARTICLE 7 COPYRIGHTS AND LICENSES \u00a7 7.1 The Architect and the Owner wanant that in transmitting the Drawings and Specitication s, or any other information , the h\u00b7ansmitting party is the copyrig ht owner of such information or has permi ssion fi\u00b7om the copyr ight owner to transmit such informati on for its use on the Project. If the Owner and Architect intend to transmit the Drawing s and Specifications or any other information or documentation in digital form , they shall endeavor to establish nece ssary protocols governing such transmi ssions. \u00a7 7.2 The Architect and the Architect's consultants shall be deemed the author s and owners of their respective the Drawing s and Spec ifications , includin g the Drawing s and Specifications, and shall retain all common law, statutory and other reserved rights, including copyright s. Subm ission or distribution of the Drawin gs and Spec ifications to meet official regulator y requirement s or for similar purpo ses in connection with the Project is not",
        "The final co nstruction documents shall include as a minimum: Site Plan, Landscaping Plan , \nStorm water Management Plan, Roof Plan, Drainage Plan, Floor Plan(s), Exterior E levations, \nBuilding Sections, Foundation Plan, Framing Plan(s), Details, Plumbing Isomet rics, Door  / \nWindow / Room finish / Header / Plumbing / Electrical schedule, HVAC P lans, Electrical \nPlans, Submittal Worksheets and the project manual including specifications i n the CSI \ndivision format.  \n\n \n 5 \n \u2022 Bidding & Contract Award (Phase V)  \nThe A/E will assist the  District and Construction Manager (CM) in bidding the project to \nprospective prime contractors. Services will include assisting the CM with the distribution of \nplans and specifications, assisting with sub -contractor pre -bid meetings, assisting with \nformul ating responses to prospective bidders\u2019 questions, issuing addendums (if neces sary), \nattendance at the bid opening, and providing the District with a recommendation for p rime \ncontract awards.  \n\n\u2022 Construction Administration & Project Closeout (Phase VI)  \nThe A/E shall be a representative of and shall advise and consult with the Dis trict during \nconstruction until the final payment to prime contractors is due and during th e correction \nperiod described in the Contract Documents.  \n\na. Plan Approvals - The A/E is respo nsible for the procurement of ALL plan approvals from \nthe local municipal (ies), Marion County, and the State of Indiana Departmen t of \nCommerce, Safety & Building Division for the building(s) including, but not limited  to, \nStorm water Management, HVAC, Mec hanical , plumbing  and/or Fire Protection.  \n\nb. Construction Related Services - The A/E will provide on the District\u2019s behalf, \nconstruction administration and inspection services. At a minimum, services to b e \nprovided consist of coordinating regular progress meetings, review of  shop drawings, \nassist Dis trict in floor and finish material selection, undertake construction observ ation, \nprocess certificates for payment to prime contractors, and facilitate prepa ration of final \nrecord drawings, warranty follow -up and project closeout.  \n\nThe A/E, in conjunction  with the Construction Manager, shall provide updated budgetary cost \nestimates during each phase of the design process.  \n\nIV. Design Guidelines  \nThe District will require the A/E to integrate sustainable principles/desig n into the District\u2019s \nprojects. The A/E sh all apply/utilize standards found in the Leadership in Energy & \nEnvironmental Design Green Building Rating System, Declare, Cradle to Cradle  or other \nnationally recognized sustainability program/certification. The District may  consider \npursuing LEED or oth er sustainability program/certification. The District may  engage the \nservices on an independent commission agent/authority.  \n\nThe A/E shall integrate District\u2019s vision for teaching & learning concepts in to the program \nand design of all projects.  \nThe A/E sha ll include options in the program and design to expand District\u2019s options for \ncommunity access and use of facilities.  \n\nV. Project Construction Timeline -November 2017 thru August 2021  \n\n 6 \n VI. RFP Timeline  ",
        "VIII. Proposal Response  7 \n  \nRespondents to this RFP shall include the following minimum information in the ir proposal:  \n\na. Describe how A/E will organize and perform the work described in the Scope of Services \nsection. List the names of any sub -consultants that are intended to be used on the \nproject and the specific services to be provided the sub -consultant(s).  \n\nb. Describe A/E\u2019s understanding of the project and the planned approach to achieve the \ngoals of the project. Submittal shall include a listing of contemplated tasks and number \nof estimated hours by personnel classification/discipline for eac h phase of the pro ject.  \n\nc. Describe sustainable or \u201cgreen\u201d design experience as well as experience workin g with \nFocus on Energy.  \n\nd. Include conceptual time schedules and related expectations/obligations of the D istrict \nneeded to complete the scope of work specified based on occupancy for all projects by \nSeptember 2021.  \n\ne. Provide a fee proposal using the attached fee proposal spreadsheet. Fees shall include \nALL meetings needed to successfully complete this project and ALL reimbursabl e costs \nother than plan/document printing cos ts (incurred for this bidding phase of the \nproject) and required plan submittal fees.  \n\nf. Provide a description of any possible additional related costs and/or fees  (not included \nin your base fee) that the District might incur as a result of this design proce ss. \n\ng. Provide a description of monthly status reports, e.g. project timeline, d eliverables, costs \nincurred to date, and costs to project timeline.  \n\nh. Consultant / Supplier Diversity inclusion in the present RFP and past projec ts.  \n\nIX. Proposal Evaluation/Selecti on Process / Agreement Award  ",
        "to be construed as publication in deroga tion of the reserved rights of the Architect and the Architect's consultant s. \u00a7 7.3 Upon execution of this Agreement , the Architect grants to the Owner a none xclusive license and ownershi p to use the Project Drawings and Specification s solely and exclusively for purpo ses of constructing , using, maintaining, altering and adding to the Project. Upon any termination of this Agreement prior to its completion , the Owner shall retain the license and ownership and is permitt ed to make changes, correcti ons or additions to the Drawing s and Specifications for the purposes of comp letin g, using and maintaining the Project , or for future additions or alternations to th e Project ; provided , however , that such use shall be at the Owner' s sole risk and without liability to the Architect and the Architect's consu ltants. Upon payment by the Owner of all fees due and owing Architect for profe ssional services under this Agreement, all right, title and interest in the Drawing s and Specification s and other document s, including those in electronic form , prepared by the Architect and the Architect 's consultant s (\"Drawing s and Specification s\") that become part of this Agreement and whic h are incorporated by reference into the Agreement betwee n Owner and Contractor shall become the property of the Owner. If the information is provided in electronic format, the Architect expressly waives any and all actions or claims against the Owner alleging infringement of any copyrights or patent s by reason of the Owner 's use of the electronic information. The Owner AlA Document 8132TM- 2009 (formerly B14FMCMa -1992). Copyright \u00a9 1992 and 2009 by The American Institute of Architects. All rights reserved . WARNING: This A l A ~ \u00b7 Document is protected by U.S. Copyright Law and International Treaties . Unauthorized reproduction or distribution of this AlA' ' 16 Document , or any portion of it, may result in severe civil and crim inal pena lties, and will be prosecuted to the maximum extent possib le under the Jaw. This documen t was produced by AlA software at 13:26 :47 on 08/01/2017 under Order No.2341018896_1 which expires on 01/01/2018 . and is not for resale . User Notes : (1232093781} I nit. may utilize the Drawing s and Specilications and any ofthe constituent parts thereof in conju nction with a different project improvement. Howe ver. the Owne r's use of the Architect's Drawing s and Specificat ions for any other construction purpo se other than for the Project shall be at Owner's expense and liability. The Architect shall obtain similar none xclusive licenses fi\u00b7om the Architect 's consu ltants consistent with this Agreement. The license granted under this section permit s the Ovvner to authorize the Contractor , Const ruction Manager , Subco ntractors. Sub-subcontractor s, and material or equipment supplier s. as well as the Owner 's consultants and separate contrac tors. to reproduce applicable portions of the Drawing s and Specification s solely and exclusively for use in performing services or construction for the Project. lfthe Architect rightfull y termina tes this Agreement for cause as provided in Section 9.4, the license grante d in this Section 7.3 shall terminate . (Paragrap h deleted) \u00a7 7.3.1 The Architect agrees to indem nity, save and hold harmle ss, and defend at its expense, the Own er, its agents, employee s and anyone else acting for or on behalf of any of them , and any other person or entity for whom any of them may be legally responsib le, fi\u00b7om and against all claim s, suits, actions, damage s, fees, penaltie s and/or liabilities, includin g, without limit ation, couJi costs and reasonable attome ys\u00b7 fees, of any natur e what soeve r which arises out of, or is connect ed with. or are alleged to arise out of or be connected with rights of claims of right s in such Drawing s and Speci fication s or other documents. TI1e Arch itect shall also defend all actions or claim s charging infrin gement of any copyright s or patent s by r eason of the use or adoption of any designs, Drawing s or Specifications suppli ed by it and shall hold the Owner, its agent s and emplo yees harml ess fi\u00b7om claim s, loss, damages , liabili ty, costs and expenses (includin g attomeys' fees) resulting therefr om. The Architect's agreeme nt of indemnity shall survive final payment and the terminati on of this Agreement. \u00a7 7.3.2 The Owner shall be pennitt ed to authorize the Construction Manager , Contractors , Subcont ractors, Sub-subco ntractors and material or equipme nt supplie rs to reproduce applicable portions of the Project Drawings or Spec ifications appropriate to and for use in their execut ion of the Work by licen se granted in this Atiicle . \u00a7 7.3.3 Notwith standing the transfer of ownership set forth in Section 7.3 above , it is abrreed and acknowledged that: .1 Drawings and Specification s prepared by the Arc hitect will contain numerou s design det ails and typical speci fication s (\"Standard Detail s/Specifications\") which , collectively , form a part of the design tor the Project but which. separate ly. are not Project specific . are related to function as compared to design form, are repetitiv e in nature and were not specific ally developed for or identifiable with the Project ; and .2 Given the above , the Standard Detail s/Specifica tions shall remain the property of the Architect and may be used by the Architect on other project s, in other conte xts an d/or for other client s, so long as they are not collectivel y used in a manner which replicates the overall design of the Project. \u00a7 7.4 Except for the licen ses and ownership granted in this Article 7, no other licen se, ownership or right shall be deemed granted or implied under this Agreement. The Owner shall not assign , delegate , sub license, pledge or otherwise transfer any licen se or owner ship granted herein to another party without the prior \\'ll'itten abrree ment of the Arc hitect. Any unauthorized use of the Instrument s of Service shall be at the Owner 's sole risk and without liability to the Architect and the Architect' s consultant s. ARTICLE 8 CLAIMS AND DISPUTES \u00a7 8.1 General \u00a7 8.1.1 The Owner and Architect shall comm ence all claims a nd causes of action , whether in contract, tort, or otherwise , against the other arising out of or related to this Agre ement in accordance with the requireme nts of the meth od of binding dispute resolution selected in this A greemen t within the period specified by applicable law. \u00a7 8.1.2 To the extent damages are covered by property insurance, the Owner and Architect waive all rights against each other and against the contractors , consultant s, agents and employees of the other for damages, except such rights as they may have to the proceed s of such insurance as set forth in the modified AlA Document A232 -2009, General Conditions ofthe Contract for Construction. The Owner or the Architect , as appropriate, shall require of the Construction Manager, contractor s, consultants, agents and employees of any of them similar waivers in favor of the other parties enumerated herei n. AlA Document B132 T\"- 2009 (formerly 8141 r\"CMa -1992) . Copy right \u00a9 1992 and 2009 by The American Institute of Architects. All rights reserved . WARNING : This AlA ~ ' Document is protected by U.S. Copyr ight Law and International Treaties . Unauthorized reprodu ction or distribution of this AlA' 17 Document , or any portion of it, may result in severe civil and criminal penalties , and will be prosecuted to the maximum extent possib le under the law. This docum ent was produced by AlA software at 13:26:47 on 08/01/20 17 under Order No.2341 018896_1 which expires on 01/01/2018. and is not for resale User Notes : (1232093781) I nit. \u00a7 8.1.3 Architect shall, to the fullest extent permitt ed by law. indemnity , defend and hold harml ess Owne r. and its officer s. board members. employee s and represent atives (\"lndemnitees\"). fi\u00b7om and again st all claim s, damages , losses and expenses. including but not limited to attorne y's fees, arising out of or relating to the negligent or willful acts or omis sions of the Architect or those for whom the Architect is respon sible, provided such claim, damage. loss or expense is attTibutab le to bodil y injur y, sickness. disease or death or to injury to or destruction of tangib le propet1y. regard less of whet her caused in pa11 by one or more of the lndemnitee s, and regardle ss of any claim of neglig ence by one or more of the lndemnitee s. The indemnification obligations set forth above shall surviv e completion of the performance and/or termination of this Agreement. With respect to any claim against one or more lndemnite es asserted by an employee of the Architect (or an employee of those for whom the Architect is responsible) , the indemnification obligation set forth herein shall not be reduced or limit ed by any statutory cap or other limita tion on the amount or type of damage s, compensation or other benefits payable by Archit ect (or those for whom Architect is responsible) under worker 's comp ensation acts, disability benefit acts or other employee benefit acts. \u00a7 8.1.4 The pa11i es agree to provide one another with \\\\1'itten notice of a dispute within a reasonable time , not to exceed thirty (30) days, after obta ining knowledge of the same and shall includ e: (I) a state ment spec ifYing that a dispute has occutTed that falls within the scope of this Article , (2) a statement of the pm1y's position and a summar y of evide nce and argument s that supp011 such position, and (3) the name and title of the disputing party's authori zed repre sentative . Within twenty (20) days after receipt of the disputing party's notice , the respondin g party shall submit a written response to the disputing party. The response shall contain : (I ) a statement of the respondin g party 's position and a summa ry of evidence and arguments that support such posit ion; and (2) the name and title of the respondin g party's authorized representat ive. In the absence of an agreeme nt to the contrary, the parties' authorized repre sentatives shall meet in Marion County, Indiana, at a mutuall y acceptable time and place within ten (I 0) days after the disputi ng party recei ves a response and thereafte r as often as they reasonabl y deem necessary to exchange relevant information and to attempt to resolve the dispute . If the dispute has not been resolved within forty (40) days after the disputi ng party receives the response, or if the responding party refuses or fails to comp ly with the provisions of this Section. then the disputing party may comme nce legal action again st the respondi ng party. \u00a7 8.2 Mediatio n \u00a7 8.2.1 Although the parties to the Contract may agree to mediation , mediation as described in Section 8.2 shall not be a condi tion precede nt to litigation by either party. The exclusive venue for all claims , disputes or litigati on arising out of the Contract or the Contract Document s shall be in Marion County , Indiana . \u00a7 8.2.2Ifthe parties do not resolve a dispute through me diation pursuant to this Section 8.2, the method of binding dispute resolution shall be the followin g: (Check the appropriate box. ({the Owner and Construction Manager do not select a me thod of bindin g displlle resolution below, or do not subsequently agree in writing to a binding dispute resolu tion me thod other than litigation the dispute will he resolved in a court of compe tent juris diction.) [ ] Arbitration pursuant to Section 8.3 of this Ahrreement [X] Litigation in a court of competent jurisdiction [ ] Other: (Spec{fy) (Paragrap hs deleted) \u00a7 8.3 Exclusive Venue For Litigation And Attorneys ' Fees \u00a7 8.3.1 Although the pmiie s to the A6rree ment may agree to mediation, mediation shall not be a condition precedent to litigation by either party. The exclu sive venu e for all claim s, dispute s or litigation arising out of the Contrac t or the Contract Document s shall be in Marion County, Indiana. (Paragrap h deleted) \u00a7 8.3.2ln the event that a party default s in its performance or observance of any of the terms, conditions or obligations contained in the Agreement, or in the event that either party has to emplo y attorne ys to enforce any part of the Agreement, the prevaili ng party in any such action shall be entit led to recover fi\u00b7om the other party all reasona ble attorneys ' fees and costs incml'ed in connection therewith, including litigation, post-judgment proceedings and appea ls. For the purpo ses of this Section, \"prevai ling party\" shall mean the party that receives all or AlA Document B1J2TM -2009 (formerly 6141 \"'CMa- 1992) . Copyright\u00a9 1992 and 2009 by The Amer ican Institute of Architects. All rights reserved. WARNING : This AlA\u2022\u00b7 Document is protected by U.S. Co pyright Law and International Treaties . Unauthori zed reproduction or distribut ion of this AlA\u2022 18 Document , or any portion of it, may result in severe civil and criminal penalties , and will be prosecuted to the maximum extent poss ible under the law. This document was produced by AlA software at 13:26: 47 on 08/01/2017 unde r Order No.2341018896_1 which expires on 01/01/2018 , and is not for resale . User Notes : (123209378 1) I nit. substantia lly a II of the rei ief sough t by that party. based upon an assessment of the party's major arguments or positions taken in the suit or proce eding and whether it could fairly be said that party prevailed over the other party's major argume nts or positions on major disputed issues. Any attorneys\u00b7 fees and other costs and expe nses incurred by either pmty in enforcing a judgment in its favor under the Agreement shall be recoverab le sepa rately fi\u00b7om and in addition to any other amount included in such judgment , and such attorneys' fees obligations is intended to be severab le fi\u00b7om the other provisions hereof and to surv ive and not be merged in any such judgment. (Paragrap hs deleted) \u00a7 8.4 Architect's Consultants Bound The Architect shall include in its contract s with its Consultants provisio ns that bind the Consultants to the dispute resolution procedures ofthis Agreement. ARTICLE 9 TERMINATION OR SUSPENSION \u00a7 9.1 If the Owner fails to make payment s to the Architect in accordance with this Agreement, such failure shall be considered substan tial nonperformance and cause for termination or, at the Architect's option, cause for suspe nsion of perform ance of service s under this Agreement. If the Architect elects to suspend services , the Architect shall give seven (7) days' written notice to the Owner before suspending service s. In the event of a suspension of services. the Arch itect shall have no liability to the Owner for delay or damage caused the Ovmer because of such susp ension of services. Before resuming services, the Architect shall be paid all sums due prior to suspension . The Architect's time schedu les for the remaining services shall be equitably adjusted. \u00a7 9.2lfthe Owner suspends the Project for more than thirty (30) consecutive days, the Architect shall be compensated for servi ces performed prior to notic e of such suspension. When the Project is resumed. the Architect shall be compensated for expen ses incurred in the interruption and resumption of the Architect's services. The Architect' s fees for the remaining services and the time sched ules shall be equitably adjusted. \u00a7 9.3 This Agreement may be terminated by the Owner upon not less than seven (7) days' written notice to the Architect in the event that the Project is perm anen tly abando ned. If the Owner suspends the Prqject for more than ninety (90) cumulative days for reasons other than the fault of the Architect, the Architect may termina te this Agreement by giving not less than seven (7) days ' written notice. \u00a7 9.4 Either party may terminate this Agreement upon not less than seven (7) days' written notice should the other party fail substantiall y to perform in accordance with the terms of this Agreement through no fault of the pat1y initiating the tennination. \u00a7 9.5 The Owner may tenninate this Agreem ent upon not less than seven (7) days' written notice to the Architect for the Owner's convenience and without cause. \u00a7 9.6 In the event of termination not the fault of the Architect, the Architect shall be compensated for servi ces performed prior to termination , togeth er with Reimbursab le Expenses then due. \u00a7 9.7 The Owner's rights to use the Architect's Drawings and Specifications in the event of a termination of this Agreement are set forth in Article 7. (Paragraph deleted) ARTICLE 10 MISCELLANEOUS PROVISIONS \u00a7 10.1 This Agreement shall be gove med by the law of the State of Indiana. \u00a7 10.2 Term s in t his Agreement shall have the same meaning as those in the modifi ed AlA Document A232 -2009, General Condition s of the Contract for Construction. \u00a7 10.3 The Owner and Architect, respectively, bind them selves, their agent s, successors , assigns and legal repre sentative s to this Agreement. Neither the Owner nor the Architect shall assign this Agreement, any portion of this Agreement , or any right, interest, privi lege, duty, claim, defen se, chose of action or liability arising out of or relating to this Agreement without the written consent of the other, and any purported assignment in violation of this prohibition shall be void, except that the Owner may assign this Agreement to a separate building corporation if the buildin g corporatio n agrees to assume the Owner's rights and obligations under this Agreement. AlA Document B1J2T M -2009 (formerly 8141 TMCMa -1992) . Copyright\u00a9 1992 and 2009 by The American Institute of Architects. All rights reserved. WARNING : This AIAf> Document is protected by U.S. Copyright Law and Internat ional Treaties . Unauthor ized reproduction or distribution of this AlA ~ \u00b7 19 Document , or any portion of it, may re sult in severe civil and crimina l pena lties, and will be prosecuted to the maxim um extent possible under the law. This document was produced by AlA softWare at 13:26:47 on 08/0112017 under Order No.2341018896_1 which expires on 01/01/2018 . and is not for resale User Notes : (1232093781 ) In it. \u00a7 10.4lfthe Owner requests the Architect to execute certificates, the propo sed language of such certificates shall be submitted to th e Architect for review at least fourteen ( 14) days prior to the requested dates of exec ution . The Architect shall not be required to execute certificates or consents that would requ ire knowledge , services or responsibilities beyond the scope of this Agreement. or ~1at , in the opinion of Architect , might be alleged or construed to impose a duty on the Architect beyond those duties impo sed by this Agreement or subject the Architect to liabiliti es, claims or causes of action other than those that would be available to the Owner under this Agreement. \u00a7 10.5 Nothing contained in this Agreement shall create a contractual relationship with or a cause of action in favor of a third party against either the Owner or Architect. \u00a7 10.6 Unless otherwise required in this A!:,rreement, the Architect shall have no respon sibility for the discovery, presence, handling, removal or dispo sal of, or exposure of persons to, hazardous material s or toxic substances in any form at the Project site. \u00a7 10.7 The Architect shall have the right to include photographic or miistic repre sentations of the design of the Project among the Architect 's promotional and profe ssional material s. The Architect shall be given reasonable access to the completed Project to make such repre sentation s. However , the Architect 's materi als shall not include the Owner's confidential or proprietar y information if the Owner has previously advised the Architect in writing of the specific information considered by the Owner to be confidential or proprietary. The Owner may, if requested by Architect, provide professional credit for the Architect in the Owner's promotional materia ls for the Project. \u00a7 10.8 lfthe Architect or Owner recei ves information specificall y designated by the other party as \"confidentia l\" or \"business proprietary,\" the receiving party shall keep such information strictly confidential and shall not disclose it to any other person except to (1) its employee s, (2) those who need to know the content of such information in order to perform services or construction solely and exclusively for the Project, or (3) its consultants and contractors whose contracts include similar restriction s on the use of confidential information. \u00a7 10.9 E-VERIFY PROVISIONS \u00a7 10.9.1 As required by Indiana Code \u00a722-5 -1.7, as amend ed. Architect will enroll in and verify the work eligibility status of all newly hired emplo yees through theE- VerifY Program for as long as the program remains in existence. The Architect will sign Owner 's affidavit to this effect, as well as certifYing that the Architect does not knowingly employ an unauthorized alien. \u00a7 10.9.2 Architect represents that it is enrolled in and verified the work eligibility status of all newly hired emplo yees of the Architect through the E-Verify Program as defined herein ; however , Architect is not required to verify the work eligibil ity status of all newly hired employees of the Architect throu gh the E-Verify Program if the E-Verify Program no longer exists and Architect signs an Affidavit affirming that the Architectdoes not knowingly employ an unauthorized alien. E-Verify Program means the electronic verification of work authorization program of the Illegal Immigration Reform and Immigr ation Responsibilit y Act of 1996 (P.L. 1 04-208) , Division C, Title IV, s.403(a), as amended, operated by the U nited States Department of Homeland Security or a successor work authorization program designated by the United States Department of Homeland Security or other federal agency authorized to verify the work authorization status of newly hired employees under the Immigration Reform and Control Act of 1986 (P.L. 99-603) (the \"E-VerifY Program\"). \u00a7 10.9.3 Architect and its consultant( s) may not knowingly employ or contract with an unauthorized alien; or retain an employee or contract with a person that the Architect or its consultant subsequentl y learns is an unauthorized alien. lf Architect violates this requirement , the Owner shall require in writing that the Architect remedy the violation not later than thi1iy (30) days after the date the Owner notifies the Architect of the violation. There is a rebuttable presumption that Architect did not knowingly emplo y an unauthorized alien if the Architect verified the work eligibility of the emplo yee through theE- Verify Program . If the Architect fails to remedy the violation within the thi1iy (30) day period , the Owner shall terminate the Agreement with Architect for breach. Howev er, if Owner determine s that tenninat ing the Agreement would be detrimental to the public interest or public property , the Owner may allow the Agreement to remain in effect until the Owner procures a replacement Architect. If the Owner terminate s the Agreement, the Architect shall be liable to the Owner for any and all actual damages incun\u00b7ed, including, but not limited to, attomeys' fees. AlA Document B132TM- 2009 (formerly 6141 TMCMa- 1992). Copyright\u00a9 1992 and 2009 by The American Institute of Architects. All rights reserved. WARNING: This AI At, Document is protected by U.S. Copyright Law and International Treaties . Unauthorized reproduction or distri bution of this AlA ~ 20 Document , or any portion of it, may result in severe civil and crim inal penalties , and will be prosecuted to the maximu m extent possible under the law. ThiS document was produced by AlA softWare at 13:26\"47 on 08/01/2017 under Order No.2341018896_1 which expires on 01/01/2018 . and is not for resale . User Note s: (1232093781) I nit. \u00a7 10.9.4 Architect's consultant{s) shall certifY to Architect in a manner consistent with federal law that the Architect's consultant{ s), at the time of certification , does not knowingly employ or contract with an unauthorized alien; and has enrolled and is participating in the E-Verif)' Program. \u00a7 10.9.5 Architect shall maintain in its files a certification of each of its consultant(s) throughout the duration of the term of this Agreement and the term of Architect's agreement with its consultant(s). \u00a7 10.9.6 Termination of the Agreement for violation ofthis requirement may not be considered by the Architect or its consultant(s) as a breach of contract by the Owner. \u00a7 10.10 BACKGROUND CHECKS \u00a7 10.10.1 The Owner will require the Architect to conduct a background check for criminal history for all workers on the Project in comp liance with Indiana Code \u00a720-26-5 -1 0 and \u00a720-26-5- 11 for the last ten (I 0) years. \u00a7 10.10.2 The Architect shall provide, when awarded the right to provide services under this Agreement, a list of all personnel used by or on behalf of the Architect , whether employed by them or not, who will be engaged in the providing services . The list ofpersons shall be provided written evidence of a criminal record searc h with respect to all persons on the list dated within thirty (30) days of the said date of the Af,>Teement and extending at least ten ( 1 0) years prior. \u00a7 10.10.3 Architect agrees that no person will be providing services who has any criminal conviction for any type of behavior that would place the student s or staff at risk. If evidence of such behavior occurs after this initial search, but during their employment on Project, such worker shall be removed immediately fi\u00b7om the Project and shall be banned for the duration of the Project. Evidence of behavior that is prohibited would includ e, but not limited to, the following : ( 1) Murde r [IC \u00a734-42-1-1]. (2) Causing suicide [IC \u00a735-42-1-2]. (3) Assisting suicide [IC \u00a735-42-1-2 .5]. ( 4) Volun tary manslaughter (IC \u00a735-42- 1-3]. (5) Reckless homi cide [IC \u00a735-42-1 -5]. (6) Battery [IC \u00a735-42-2-1] unless ten ( 1 0) years have elapsed rrom the date the individual was discharged fi\u00b7om probation , impr isonment , or parole, whichever is later. (7) Aggravated batte ry [IC \u00a735-42-2-1 .5]. (8) Kidnapping (IC \u00a735-42-3-2]. (9) Criminal confinement [IC \u00a735-42-3-3]. (I 0) A sex offense under ([IC \u00a735-42-4 ]. (II) Carjacking [IC \u00a735-42-5-2]. {12) Arson [IC \u00a735-43- 1-1] unless ten (10) years have elapsed rrom the date the individual was discharged rrom probation, imprisonment, or parole , whichever is later. {13) Incest [IC \u00a735-46- 1-3]. ( 14) Neglect of a dependent (!C \u00a735- 46-l -4(a)( 1) and IC \u00a735-46-1-4(a)(2)] unless ten (I 0) years have elapsed rrom the date the individual was discharged fi\u00b7om probation, imprisonment or parole , whic hever is later. ( 15) Child selling [IC \u00a735-46-l-4(b)]. (16) Contributing to the delinquency of a minor [IC \u00a735-46- 1-8] unless ten (10) years have elapsed from the date the individual was discharged fi\u00b7om probation, imprisonment, or parole , whichever is later. (17) An offense involving a weapon under IC \u00a735-47 unless ten (10) years have elapsed from the date the individual was discharged from probation, imprisonment, or parole, whichever is later. ( 18) An offense relating to controlling substance s under IC \u00a735-48-4 unless ten (I 0) years have elapsed fi\u00b7om the date the individual was discharge d from probation, imprisonment, or parole, whichever is later. ( 19) An offen se relating to material or a performance that is hannful to minors or obscene under IC 35-49-3 unless ten (1 0) years have elapsed rrom the date the individual was discharged rrom probation, impri sonment , or parole, whichever is later . AlA Document 8132\"'- 2009 (formerly B141'\"CMa -1992) . Copy right\u00a9 1992 and 2009 by The American Institute of Architects. All rights reserved. WARNING : This AlA' ' Document is protected by U.S. Copyright Law and International Treat ies. Unauthoriz ed reproduction or distribution of this AlA' ' 21 Document, or any portion of it, may result in severe civil and criminal penaltie s, and will be prosecuted to the maximum extent possible unde r the law. This document was produced by AlA software at 13:26:47 on 08/0112017 under Order No.2341018896_1 which expires on 01/01/2018 , and is not forresale User Notes : (1232093781) I nit. (20) An oftense relating to operating a motor vehicle while intoxicated under IC \u00a79-30 -5 unless five (5) years have elapsed fi\u00b7om the date the individual was discharged fi\u00b7om probation , impri sonment , or parole. whichever is later. (21) An offense that is substanti al equiva lent to any of the offenses listed in this subsection in which the judgment of conviction was entered under the law of any other jurisdiction. Should the Architect change personnel durin g the existe nce of the Agreement providin g for service s, it shall at least ten (1 0) days prior to using any other personne l other than those previou sly disclo sed, provid e the same information for the new perso nnel as provided for under the tenn s of the provision. \u00a7 10.11 DRUG TESTING \u00a7 10.11.1 The Owner will require the Architect to conduct testing for drugs and alcohol for all workers on the Project. Drugs and alcohol shall be as defined by Indiana Code \u00a735-48 -4-4. The Architect shall provide, when awarded the right to provide services under this Agreement, a list of all personnel used by or on behalf of the Architect, whether employed by them or not, who will be engaged in the providing of services . The list of persons shall be provided written evidence of drug and alcoho l testing with respect to all persons on the list dated within seven (7) days of the said date of the Agreement. Architect agrees that no person will be providin g services who has tested positive to any of the items included and shall be banned fi\u00b701n thejobsite for the duration ofthe Project . Continued testing shall be cond ucted throughout the Project duration every six (6) months maximum. Any persons testing positive shall be removed imm ediately from the site and shall be banned from the jobsite for the duration of the Project. The Architects and their employees shall meet all State and Federal statutor y requirement s. \u00a7 10.12 FIRE ARMS \u00a7 10.12 .1 There shall be no fireann s allowed on the Project site or anywhere within the Project property . Exceptions would be made for law enforcement officials, security forces required elsewhere by these Specifications, or per other requireme nts or allowances specificall y made by the Owner. \u00a7 10.13 NO SMOKING OR TOBACCO \u00a7 10.13.1 There shall be no smoki ng or tobacco use allowed within the Proje ct buildings. on the Project site or anywhere within the Project property. Violator s shall be removed from the Prc~ject immediat ely. Any construction materia ls in contact with or exposure to such tobacc o produc ts shall be removed and replaced with new. at the responsible party' s expense. \u00a7 10.14 ADDITIONAL PROTECTIONS \u00a7 10.14.1Additional requirements and level s of protection are afforded to Public Building s in compliance with Indiana Code \u00a7 16-41-37, and include an enclo sed struc ture or part of an enclosed structure that is one of the following: (I) Occup ied by an agency of state or local governme nt. (2) Used as a classroom building or a dining area at a s tate educational institution (as defined in IC \u00a720-12-0.5- 1 ). (3) Used as a public school (as defined in IC"
      ],
      "ground_truth_context": [
        "If the Owner selects accelerated, phased or fast-track scheduling, the Owner agrees to include in the budget for the Project sufficient contingencies to cover such costs."
      ],
      "metadata": {
        "question_id": 307,
        "RFP_id": "infra_4",
        "RFP_type": "infra",
        "chunks": [
          13
        ],
        "manually_edited": false
      },
      "timing": {
        "retrieve_context": 0.0697639833797108,
        "llm_response": 1.509059190750122,
        "total": 1.5788231741298329
      }
    },
    {
      "question": "When must the Construction Manager provide cost estimates during the design process?**",
      "llm_response": "The Construction Manager must provide estimates of the Cost of the Work as the Architect progresses with the preparation of the Design Documents, until the Owner and Construction Manager agree on a Guaranteed Maximum Price for the Work. These estimates should be reviewed by the Architect and approved by the Owner prior to the completion of each design phase.",
      "ground_truth_answer": "The Construction Manager must provide estimates of the Cost of the Work for the Owner's approval prior to the completion of each design phase.",
      "retrieved_context": [
        "\uf0b7 An Estimate  of Probable Costs is provided in Exhibit B . \n\n\uf0b7 A Project Timeline  is provided  in Exhi bit C.  \n\nAll Exhibits are attached to and made part of this RFP.  \n\n1.6 CONSTRUCTION MANAGEMENT AT RISK PROJECT DELIVERY  BACKGROUND INFORMATION (Source: The American \nInstitute of Architects)  \nConstruction Management at -risk is a process that allows the  Owner  of a Project to choose the Construction \nManager before the design stage is complete. The Construction Manager is chosen based on qualifications, and \nthen the entire operation is centralized under a single contract. The Architect and Construction Manager w ork \ntogether in order to cultivate and assay the design. Then, the Construction Manager gives the client a \nGuaranteed Maximum Price, and coordinates all subcontract work. The Architect/Engineer is hired separately \nfrom the Construction Manager at -risk and the traditional client \u2013 Architect/Engineer relationship is maintained.  \n\n2. SCOPE OF SERVICES \u2013 CONSTRUCTION MANAGER \u2019S RESPONSIBILITIES  \nThe Construction Manager \u2019s Preconstruction Phase responsibi lities are set forth in Section  2.1. The Construction \nManager \u2019s Construction Phase responsibilities are set forth in Section 2.2. The Owner and Construction Manager  \nmay agree, in consultation with the Architect, for the Construction Phase to commence prior to completion of \nthe Preconstruction Phase, in which case, both  phases will proceed concurrently. The Construction Manager  shall \nidentify a representative authorized to act on behalf of the Construction Manager  with respect to the Project.   Page 3 \nThe Construction Manager  will be required to hold a Construction Manager s\u2019 license  (or applicable license)  valid \nfor the State of Wisconsin . \n\n2.1 PRECONSTRUCTION PHASE  \n\n Consultation  \nThe Construction Manager  shall meet with the Architect and Owner to discuss such matters as procedures, \nprogress, coord ination, and scheduling of th e work. The Construction Manager  shall advise the Owner and the \nArchitect on proposed site use and improvements , selection of materials, and building systems and equipment. \nThe Construction Manager  shall also provide recommendations consistent with the Pro ject requirements to the \nOwner and Architect on constructability; availability of materials and labor; time requirements for procurement, \ninstallation and construction; and factors related to construction cos t including, but not limited to:  costs of \naltern ative designs or materials, preliminary budgets, life -cycle data, and possible cost reductions.  \n\nThe Construction Manager  shall provide recommendations with regard to accelerated or fast -track scheduling, \nprocurement, or phased construction. The Construction Manager  shall take into consideration cost reductions, \ncost information, constructability, provisions for temporary facilities and procurement and construction \nscheduling issues.   \n\nPreliminary  Cost  Estimates  \nBased on the preliminary design and  other design criteria, the Architect has prepared an Estimate  of Probable \nCost (Exhibit B). If the Architect or Construction Manager  suggests alternative materials and systems, the \nConstruction Manager  shall provide cost evaluations of those alternative m aterials and systems.  \n\nAs the Architect progresses with the preparation of the Design  Documents, the Construction Manager  shall \nprepare  estimates of the Cost of the Work of increasing detail and refinement and allowing for the further \ndevelopment of the de sign until such time as the Owner and Construction Manager  agree on a Guaranteed \nMaximum Price for the Work. Such estimates shall be provided for the Architect\u2019s review and the Owner\u2019s \napproval  prior to the completion of each phase . The Construction Manage r shall inform the Owner and Architect \nwhen estimates of the Cost of the Work exceed the latest approved Project budget and make recommendations \nfor corrective action.   ",
        "Guaranteed  Maximum  Price  Proposal  and Contract  Time  \nAt a time to be mutually agreed up on by the Owner and the Construction Manager  and in consultation with the \nArchitect, the Construction Manager  shall prepare a detailed line item  Guaranteed Maximum Price Proposal for \nthe Owner\u2019s review and acceptance.  The Guaranteed Maximum Price in the pr oposal shall be the sum of the \nConstruction Manager \u2019s estimate of the Cost of the Work and the Construction Manager \u2019s Fee for the \nConstruction Phase as quoted in the Proposer\u2019s response to this RFP.  \n\nThe Construction Manager  shall include with the Guarant eed Maximum Price proposal a written statement of its \nbasis, which shall include the following:  \n 1. A list of the Drawings and Specifications, including all Addenda thereto, and the Conditions of the \nContract;  \n 2. A list of the clarifications and assumptions made by the Construction Manager  in the preparation of \nthe Guaranteed Maximum Price proposal,  \n 3. A statement of the proposed Guaranteed Maximum Price, including a statement of the estimated \nCost of the Work organized by trade categories or systems, allowances, contingency, and the \nConstruction Manager \u2019s Fee;  \n 4. A schedule of milestones for the comple tion and the anticipated date of Substantial Completion upon \nwhich the proposed Guaranteed Maximum Price is based;  \n 5. A Schedule of Value for each component of work to be undertaken; and \n 6. A date by which the Owner must accept the Guaranteed Maximum Pr ice.  \n\nThe Construction Manager  shall meet with the Owner and Architect to review the Guaranteed Maximum Price \nproposal.  Once a Guaranteed Maximum Price has been agreed upon by all parties, the Owner and Construction \nManager  shall execute the Guaranteed M aximum Price Amendment to the Contract.  The Guaranteed Maximum Page 4 \nPrice Amendment shall set forth the agreed upon Guaranteed Maximum Price with the information and \nassumptions upon which it is based  and shall include a Schedule of Values .  \n\nThe Construction Manager  shall guarantee that the Contract Sum shall not exceed the Guaranteed Maximum \nPrice set forth in the Guaranteed Maximum Price Amendment, as it is amended from time to time.  To the extent \nthe Cost of the Work exceeds the Guaranteed Maximum Price, t he Construction Manager  shall bear such costs in \nexcess of the Guaranteed Maximum Price without reimbursement or additional compensation from the Owner.   \nThe Construction Manager will acknowledge that the Construction Manager is an experienced contractor a nd \nthat (subject to Acts of God) the Project can be completed for Guaranteed Maximum Price.  \n\nSubcontractors  and Suppliers  \nThose portions of the Work that the Construction Manager  does not customarily perform with the Construction \nManager \u2019s own personnel s hall be performed under subcontracts or by other appropriate agreements with the \nConstruction Manager . The Owner may designate specific persons from whom, or entities from which, the \nConstruction Manager  shall obtain bids. Subcontractors must be located 50 miles  or less from the Project site , \nunless a greater distance is approved by the Owner.  The Construction Manager  shall obtain at least three \nproposals from Subcontractors and from suppliers of materials or equipment fabricated especially for the Work \nand shall deliver suc h proposals  to the Owner. The Owner shall then determine, with the advice of the \nConstruction Manager  and the Architect, which bids will be accepted. The Construction Manager  shall not be \nrequired to contract with anyone to whom the Const ruction Manager  has reasonable objection.  \n\nIf the Guaranteed Maximum Price has been established and a specifi c subcontractor or supplier  (1) is \nrecommended to the Owner by the Construction Manager , (2) is qualified to perform that portion of the Work, \nand (3) has submitted a  proposal  that conforms to the requirements of the Contract Documents without \nreservations or exceptions, but the Owner requires that another  proposal  be accepted, then the Construction \nManager  may require that a Change Order be issued t o adjust the Guaranteed Maximum Price by the difference \nbetween the bid of the person or entity recommended to the Owner by the Construction Manager  and the \nproposal  of  the person or entity designated by the Owner.  \n\n2.2 CONSTRUCTION PHASE  \n\nThe Construction Phase shall commence upon the execution of the Guaranteed Maximum Price Amendment or \nthe Owner\u2019s issuance of a Notice to Proceed, whichever occurs earlier.  \n\nChanges  in the Work  \nThe Owner may, without invalidating the Contract, order changes in  the Work within the general scope of the \nContract consisting of additions, deletions or other revisions. The Architect  shall issue such changes in writing  \nand all change orders will be signed and acknowledged by Owner and Construction Manager . The Constru ction \nManager  shall be entitled to an equitable adjustment in the Contract Time as a result of changes in the Work.  \n\nChange orders issued by the Owner subsequent to the execution of the Guaranteed Maximum Price Amendment \nshall constitute adjustments to the  Guaranteed Maximum Price.  ",
        "7. PROPOSERS SITE  VISIT AND Q&A SESSION  \nThere will be an opportunity for prospective Proposers to participate in a site visit to examine the building and \nthe site on Wednesday, January 28, 2015 from 10:00 a .m. to 12:00 p.m. CST. Please RSVP for the site visit  by \ncontacting Chelsey Mazurek at cmazurek@incouragecf.org  or 715 -423-3863 .   \n\nThere will also be  an opportunity for prospective Proposers to participate  in a Q&A webinar on Tuesday,  \nFebruary 3, 2015 at 2:00 p.m. CST .  The purpose of the webinar is to give Proposers the opportunity to ask \nquestions regarding the Project, as well as the RFP submission requirements. Please RSVP for the webinar by \ncontacting Chelsey Mazurek at cmazurek@incouragecf.org  or 715 -423-3863.  Chelsey will email the log -in \ninformation to the key points of contact at each firm who have RSVP\u2019d for the webinar.  \n\nProposers may also submit questions concerning the P roject in written form via email or fax to the Owner with a \ncopy  to the Architect until 4:30 p.m. CST on Tuesday, February 10, 2015 . Proposers will receive  a reply no later \nthan  4:30 p .m. on Thursday , February 12, 2015.  \n\n8. FINAL SELECTION  \nThe pr oposals will be reviewed by a committee established by Incourage Community Foundation. Selection will be \nbased on the qualifications and experience of the Proposer; its ability to  meet project timelines; the level of \nunderstanding of  and commitment to achi eve the Project\u2019s principles and objectives ; and proposed fees.  Successful Page 7 \nproposals will also demonstrate:  \n\uf0b7 Prior experience with Integrated Project / Construction Management -at-risk delivery methods (completion \nof at least one project over $ 8M in construction costs) ; \n\uf0b7 Prior experience with delivering projects that have achieved sustainability benchmarks (e.g. LEED , Living \nBuilding Challenge ); \n\uf0b7 Qualified personnel  with experience collaborating with Architects and Engineers during Design Phases ; \n\uf0b7 Qualified Cost Estimators on staff.  \nAll Proposers will be notified of their selection  for interviews  no later than February 27, 2015.   \n\nThis Request for Proposal  does not commit Incourage Community Foundation to award a contract, to pay any \ncosts incurred  in the preparation of a proposal or to contract for the goods and/or services offered . Incourage \nCommunity Foundation  reserves the right to accept or reject any or all proposals received as a result of this \nrequest, to negotiate with all qualified Propose rs or to cancel this Request for Proposals, if it is in the best \ninterests of Incourage Community Foundation to do so.  \n\nAfter the selection of a C onstruction Manager,  the schedule should include a period of collaboration between \nIncourage Community Founda tion and the C onstruction Manager  to better define, elaborate upon and fix the \nConstruction Manager \u2019s exact and final scope of Work (the \u201cFinal Scope\u201d) . \n\nThe successful Proposer  should be available to begin work, and should be prepared for project activities to \ncommenc e, immediately upon selection. Please refer to Exhibit C \u2013 Project Timeline.  Your submission of a \nproposal  to this RFP acknowledges your ability to work within this timeline  but also acknowledges that there may \nbe adjustments to the timeline as the Project evolves . Proposers are  asked to carefully review and note all \nconstruction start dates, completion dates, and other notable objectives outlined in the attached t imeline.    \n\nPlease note: non -selection as the Construction Manager under this RFP does not impact the Proposer\u2019s \nopportunity to participate in the Project as a sub -contractor.    \n\n9. ADDITIONAL INFORMATI ON REQUESTS  \nQuestions regard ing the design elements of th e Project should be directed to:  \n  \n Graham Hill, Architect  \n Concordia LLC. \n 504.458.8081  \n ghill@concordia.com  \n\nQuestions regarding the proposal  or oth er general questions about the P roject should be directed to:  \n  \n Chelsey Mazurek, Tribune Building Project Manager  \n Incourage Community Foundation  Inc. \n 715.423.3863  \n cmazurek@incouragecf.org   \n   ",
        "Administration  \nUpon the execution of the Guaranteed Maximum Price Amendment, the Construction Manager  shall prepare and \nsubmit to the Owner and Architect a construction schedule for the Work.  The Construction Manager  shall \nupdate the Owner in writing on the progress of the Project on a monthly basis indicating the percentages of \ncompletion and other information required by the Owner.  \n\nThe Construction Manager  shall develop a system of cost control for the Work, inclu ding regular monitoring of \nactual costs for activities in progress (compared to the Schedule of Values) and estimates for uncompleted tasks \nand proposed changes. The Construction Manager  shall identify variances between actual and estimated costs \nand repor t the variances to the Owner and Architect and shall provide this information in its monthly repo rts to \nthe Owner and Architect.   \n Page 5 \nThe Construction Manager  shall comply with applicable laws, statutes, ordinances, codes, rules and regulations, \nand lawful or ders of public authorities applicable to its performance under this Contract, and with equal \nemployment opportunity programs, and other programs as may be required by governmental and quasi -\ngovernmental authorities for inclusion in the Contract Documents.  \n\n3. OWNER\u2019S  RESPONSIBILITIES  \n\nArchitect  \nThe Owner shall retain an Architect to provide Program Verification, Criteria  Design, Detailed Design, and \nImplementation  Document s related to the Project.  Architect and Engineering fees will be the responsibility of \nthe Owner and not included in the Guaranteed Maximum P rice.  \n\nEnvironme ntal Tests, Surveys and Reports  \nThe O wner shall be responsible for costs related to environmental studies, survey, and geotechnical services \nrelated to the Proj ect.  The Owner shall make  all studies, survey data, and results available to the Construction \nManager .  \n\nOwner\u2019s  Designated  Representative  \nThe Owner has engaged an Owner\u2019s Representative to assist Owner in decision making. When the Owner is \nrequired to act, any such action will be und ertaken by  the Owner\u2019s authorized representative with advice from \nthe Owner\u2019s Representative. The Owner\u2019s representative shall render decisions promptly and furnish information \nexpeditiously, so as to avoid unreasonable delay in the services or Work of the Construction Manager .  \n\n4. INSURANCE  AND  BONDS  \nFor all phases of the Project, the Construction Manager  shall purchase and maintain  the insurance required by \nthe Owner and to be set forth in the Construction Contract.  \n\n \n5. PROPOSAL FORMAT  \nThe proposal shall include the following information in the order indicated:  \na) Proposer Information:   Identify the firm\u2019s name and the address of its principal office and any branch offices, as \nwell as telephone number, e -mail address and website. Identify the single contact who is th e authorized \nrepresentative of the Proposer. Inclu de a brief history of the firm , number of full -time and part -time employees , \nand how you heard about/your interest in the Tribune Building Project . \nb) Organization: Provide an organizational chart graphically indicating how the firm would structure and staff the \nproposed team. Include delegation of responsibility and assignment of authority.  \nc) Personnel:  List specific  management and supervisory  personnel proposed for the project team. Indicate the \nproject assign ment and responsibilities of each  of the  management and supervisory individuals. Provide a \nresume for each proposed team member, specifically stating his or her experience and qualifications. State the \ncurrent and anticipated work assignments for each indi vidual. Include at least three client references, including \ncontact information, for each individual listed.  \nd) Hiring Practices:  Provide example(s) of your commitment to hiring and retaining a diverse workforce and \ncreating equitable working conditions.  Describe an employment practice that supports the growth of your staff. \nExplain how you determine equitable compensation for your staff.  \ne) Qualifications and  Experience:   Provide summaries  of three projects the Proposer has delivered. Include the \nname of the Owner or Developer of the project, its location, approximate budget, and the Proposer\u2019s specific \nrole in the project. Also provi de the name and contact information of a representative of the Owner or \nDeveloper from whom a reference can b e obtained.  \nf) Sustainability Experience: Provide example(s) of advanced sustainability projects the Proposer has been a part \nof. Include the name of the Owner or Developer of the project, its location, approximate budget, and the \nProposer\u2019s specific role in the project. Also provide the name and contact information of a representative of the \nOwner or Developer from whom a reference can be obtained.  \ng) Connection to Place: Provide example(s) of your demonstrated connection to place. If not situated in the local \ncommunity, it is especially important to be able to demonstrate in recent work examples a connection and \ncommitment to the place and people in which  your work was completed.  \nh) Self-Performed Work: Indicate and clearly define which elements of work your firm would propose to self -\nperform with its own forces. Describe your experience at performing this trade work.  Page 6 \ni) Subcontracted Work:  Include names, addr esses and descriptions of key subcontractors which your firm would \nemploy and a description of their relevant experience and past performance. Any subcontractors must be \nidentified in the  proposal. Please remember that after contract signing, Incourage Com munity Foundation \nreserves the right to approve all subcontractors that were not approved during the RFP process . \nj) Ability to Meet Timelines:   Provide a detailed summary of your current workload and future commitments over \nthe proposed timeline assuming a t wo-week turnaround from the submission of this proposal to the \ncommencement of services.  Submit your  expected duration in days for each pha se of the project.   \nk) Tax-Exempt Status: Describe how your firm will manage material purchases to take advantage of the tax exempt \nstatus of the Owner.  \nl) Fees:  \n\uf0b7 Pre-Construction Phase:  Provide the amount of, or basis for, compensation for the Pre Construction  Phase.  \nInclude a list of reimbursable cost items, as applicable.  \n\uf0b7 Construction Phase:   Provide the amount of, or basis for, compensation IN ADDITION to the cost listed in the \nEstimate  of Probable Cost  (Exhibit B).  The Proposer will guarantee to construct  the Project as described in \nthe P roject design documents for the amount specified in the Guaranteed Maximum Price Proposal and the \nfees quoted in this proposal subject to change orders mutually agreed upon by the Proposer and the Owner. \nNote: the Kitchen Equipment (line 11300) and the Brewery Equipment (line 11900) may be purchased \ndirectly by the Owner  from an equipment vendor who will work collaboratively with the  Construction \nManager to coordinate installation . \nm) Optional Additional Information:  Include additional information that may help the Owner more fully understand \nthe qualifications.  \n\n6. PROPOSAL SUBMITTAL  \nProposal s must be submitted and received by Incourage  no later than 4:00 p.m. on Friday, February 13, 2015.   \nProposal s may be s ubmitted by email or hard copy.  Proposal s should be submitted to:  \n\n Incourage Community Foundation  Inc. \n 478 E. Grand Avenue  \n Wisconsin Rapids WI 54494  \n Attention: Chelsey Mazurek  \n tribunebuilding@incouragecf.org   \n  \nIf only hard copy is delivered, Proposer should secure a receipt signed and time stamped by a member of the \nIncourage Community Foundation  staff.  If your proposal is emailed, note that all proposals received by the \ndeadline will be acknowledged via an e mail confirmation recei pt.  If you do not receive  an emailed confirmation \nreceipt, it is the Proposer\u2019s responsibility to ensure successful transmission and delivery via email.   ",
        " \nRequest for Proposal (RFP) \u2013 Tribune Building Project  \nIncourage Community Foundation,  Inc. (\u201cIncourage\u201d)  located in rural central Wisconsin, invites proposals  from \ninterested firms  for Construction Management services on the Tribune Building Project (located at 220 First \nAvenue South, Wisconsin Rapids).  \n\nSubmission Deadline:      Friday, February 13, 2015  at 4:0 0 p.m. CST  \n  \nTABLE OF CONTENTS  \n1 Project Information  \n2 Scope of Services \u2013 Construction Manager \u2019s Responsibilities  \n3 Owner\u2019s Responsibilities  \n4 Insurance and Bonds  \n5 Proposal Format  \n6 Proposal Submittal  \n7 Proposer \u2019s Site Visit &  Q&A Session  \n8 Final Selection  \n9 Additional Information Requests  \n  \n1. PROJECT INFORMATION  \n\n1.1   ABOUT INCOURAGE  \nEstablished in 1994, Incourage Community Foundation is a nationally recognized leader in place -based \nphilanthropy and community change efforts.  Incourage operates with a vision of a community that works well for \nall people. To achieve this vision, values of equity, inclusion and opportunity are applied to all work, and to the \nrelationships Incourage fosters to accomplish its work. To this end, Incourage strives to work with vendors and \nsubcontractors who:  \n\n\uf0b7 Are located in the local community or within a 200-mile radius;  \n\uf0b7 Hire qualified, diverse talent, who are equitably paid for their work;  \n\uf0b7 Value learning opportunities or practices, and building capacity of their team or others involved in the work;  \n\uf0b7 Can demonstrate a connection to place;  \n\uf0b7 Have an eye on sustainability (of environment and business) and have demonstrated a commi tment to \ncorporate social responsibility.  \n\nIncourage is seeking proposals to provide Construction Manag ement  services under an AIA A133 contract \nstructure with  a guaranteed maximum price on the major renovation of the Tribune Building, as described in this  \nRFP (the  \u201cProject\u201d  and sometimes the \u201cTribune Building Project\u201d) . The selected Proposer will become the \nConstruction Manager  (CM).  \n\n1.2 DELIVERY METHOD  \nThe delivery method for the Project is \u201c Construction Manager  at Risk\u201d ( CMAR), which consists of a n AIA A133 \nbased contract covering the pre -construction and construction phase.    \n\n1.3 PROJECT BACKGROUND  \nThe Project (tribunebuilding.org) began when Incourage Community Foundati on (incouragecf.org) purchased the \nhistoric Tribune Building  along the Wisconsin River with the intent that residen ts would decide its future use. To \ndate, over 750 community members have invested more than 4,400 hours in this resident -led decision making \nprocess.  As determined through this process, the Tribune Bu ilding is a social enterprise helping to shape a new \neconomy and co mmunity that works well for all.  \nPage 2 \nTo that end, the space will include a number of local entrepreneurial operations with benefit to the local \neconomy, including a culinary kitchen, microbrewe ry, cafe/brewpub, creative workshop, and re creational \nrentals . Further, as Incourage is committed to investing in the people who will inhabit the space as much as the \nfunctional space needed for production of their goods and services, the Tribune Building will effectively grow \nhuman talent simultaneous to the local economy.  \nThe Tribune Building\u2019s operational model is currently being developed to fully realize a space that advances the \nvalue and importance of relationships and human potential; an environment  that fosters and accepts failure; \ncreativity and innovation; and entrepreneurship.  \n1.4 COMMUNITY CONTEXT   \nIn 2000, the south Wood County area was devastated by economic hardships brought about by the sale of \nConsolidated Papers Inc. \u2013 a Fortune 500 paper company that had been headquartered in Wood County for more \nthan a century.  At its operating peak, the mill employed almost half of the region\u2019s workforce.  The dramatic \neconomic shift compelled a shift in community thinking and, in response , residents realized that complacency \nwould not serve their changed circumstances.   The Tribune Building Project seeks to support residents in \ndetermining their own identity.  By reimagining the building\u2019s future, residents are collectively shaping the \ncom munity\u2019s future.   \n\n1.5 PROPERTY SIGNIFICANCE  \nThe Tribune Building is centrally located downtown, beside the Wisconsin River and other community assets.  \nBoth the site and the 20,000 square foot building leverage historic, local significance and distincti veness that are \nalready meaningful and iconic for th e south Wood County area.  The Tribune B uilding is former home to the local \nnewspaper and radio station offices and embodies a unique mid -century modern \u2013 \u201cround \u201d structure design.  \nThe building\u2019s close p roximity to the Wisconsin River is also significant.  The revitalization will undoubtedly alter \nthe deeply rooted historical perspective of the river as a working asset \u2013 positioned to serve the local paper \nindustry. Once complete, the re -envisioned site w ill serve as a gateway for residents to experience the river as an \naccessible and cherished natural resource, public recreation place, and destination location for travelers.  The \nTribune Building\u2019s transformation is paramount to Wisconsin Rapids\u2019 downtown  and riverfront renaissance.   \n\nThe Project site address is 220 First Avenue South, Wisconsin Rapids.  \n\n\uf0b7 The Project Design Documents are provided in Exhibit A.  "
      ],
      "ground_truth_context": [
        "Such estimates shall be provided for the Architect's review and the Owner's approval prior to the completion of each phase."
      ],
      "metadata": {
        "question_id": 138,
        "RFP_id": "infra_2",
        "RFP_type": "infra",
        "chunks": [
          2
        ],
        "manually_edited": false
      },
      "timing": {
        "retrieve_context": 0.0697639833797108,
        "llm_response": 1.0739469528198242,
        "total": 1.143710936199535
      }
    },
    {
      "question": "What documents define the physical and additional parameters for the Project?",
      "llm_response": "Insufficient information to answer question based on given context",
      "ground_truth_answer": "The physical parameters are outlined in the program identified in Section 2.2.4, and additional parameters are specified in the Construction Documents and other site restrictions.",
      "retrieved_context": [
        "I nit. Document 8132\u2122-2009 Standard Form of Agreement Between Owner and Architect, C onstruction Manager as Adviser Edition AGREEMENT made as of the _ _ day of\" ___ \" in the y ear 2017. (in words, indicate day, month and year.) BETWEEN the Architect' s client identified as the Owner: (Nam e, legal status, address and other information) MSD ofWashington Towns hip 8550 Woodfield Crossing Blvd . Indianapo lis, IN 46240 (317) 205-3333 (E>..i 77189) (317)-205-3385 (Fax) and the Arch itect: (Nam e, legal status, address and other it?formation) for the followin g Project: (Nam e, location and detailed descriplilm) The Construct ion Mana ger: (Name, l egal status. address and olher il?formation) The Owner and Architec t agree as follows. ADDITIONS AND DELETIONS : The author of this docume nt has added informat ion needed for its completion. The author may also have revised the text of the or iginal AlA standa rd form. An Additions and Delet ions Report that notes added information as well as revisions to the standard form text is available from the author and should be reviewed . A vertical line in the left margin of this document indicates where the author has adde d necessary informa tion and where the author has added to or deleted from the original AlA text. This docum ent h as important legal consequences . Consultation with an attorney is enco uraged with respect to its complet ion or modif ication. This document is intended to be used in conjunction with AlA Documen ts A 1 32T\"'-2009, Standard Form of Agreemen t Between Owner and Contractor . Cons truction Manage r as Adviser Edition; A232 T\"'-2009 , General Conditions of the Contract for Construction, Cons truction Manager as Adviser Edition; and C132\u2122-2009, Standard Form of Agreement Between Owne r and Construction Manager as Adviser . AlA Document A232\u2122-2009 is adopted in this document by reference. Do not use with other genera l condition s unless this document is modi fied. AlA D ocument B132'M- 2009 (forme rly 8141 TMCMa-1992). Copy right\u00a9 1992 and 2009 by The American Institute of Architects. All rights reserved . WARN ING: This AlA\" Document is protected by U.S. Copy right Law and Internat ional Treaties . Unauthor ized reproduction or distribution of this AIAf, 1 Document, or any portion of it, may result in severe civil and criminal pena lties, and wi ll be prosecuted to the maximum extent possible under the law. This document was produ ced by AlA software at 13:26:47 on 08/01/2017 under Order No.2341018896 _1 which expires on 01/01/2018 , and is not for resale. User Note s: (1232093781) I nit. TABLE OF ARTICLES 1 INITIAL INFORMATION 2 ARCHITECT'S RESPONSIBILITIES 3 SCOPE OF ARCHITECT'S BASIC SERVICES 4 ADDITIONAL SERVICES 5 OWNER 'S RESPONSIBILITIES 6 COST OF THE WORK 7 COPYRIGHTS AND LICENSES 8 CLAIMS AND DISPUTES 9 TERMINATION OR SUSPENSION 10 MISCELLANEOUS PROVISIONS 11 COMPENSATION 12 SPECIAL TERMS AND CONDITIONS 13 SCOPE OF THE AGREEMENT ARTICLE 1 INITIAL INFORMATION \u00a7 1.1 This Agree ment is based on the Initia l Information set forth in this Section 1.1. (Note the disposition for the following items by inserting the requested if!f'ormati on or a s tatemem such as \"not applicable ,\" \"unknown at time of exec ution\" or \"to be determin ed later by mutual agreement.\") \u00a7 1.1.1 The Own er's program for the Project: (Jdent(fy docu ment ation or state the mann er in which the program will be develope d.) \u00a7 1.1.2 The Project's physical characteristics: (Jdent(fy or desc ribe. if appropriat e, size, location, dimensions , or o ther pe rtinent inf ormation , such as geotechni cal reports; site, boundmy and topographi c surveys; traffic and utility studies ; availabili ty of publi c and privat e utilities and services; legal description oft he s ite; etc.) \u00a7 1.1.3 The Own er's budge t for the Cost of the Work, as defined in Section 6.1: (Provide total and, if known , a line item breakd own.) \u00a7 1.1.4 The Owner 's anticipated d esign and construction schedule: .1 Design phase milestone dates, if any: .2 Commence ment of construction: AlA Document 8132 '\"-2009 (formerly B141'\"CMa -1992) . Copyri ght\u00a9 1992 and 2009 by The American Institu te of Architects. All rights reserved . WARNING : This AlA ~ Document is protecte d by U.S. Copyright Law and International Treaties. Unauthori zed reproduc tion or distributio n of this A lA ~ \u00b7 2 Document , or any portion of it, may result In severe civil and crim inal pena lties, and will be prosec uted to the maximum extent poss ible under the law. This document was produced by AlA softwar e a\\13:26:47 on 08/01/2017 under Order No.2341018896 _1 which expires on 01/01/2018, and is not for resale. User Note s: (1232093781) I nit. .3 Substantial Completion date or milestone dates: .4 Other: TBD \u00a7 1.1.5 The Owner intends to retain a Construc tion Manager adviser and: (Note that. if Multiple Prime Contractors are used. the term \"Contractor\" as referr ed to throughou t this Agreement will be as if plural in number.) [) Contractor (which includes other sepa rate Contractors as determined by Owner) [X] Multiple Prime Contractors (\"Contractors\") [ ] Unknown at time of execution \u00a7 1.1.6 The Owner's requirements for accelerated or fast-track scheduling , multiple bid package s, or phased construction are set forth below : (List numb er and type of bid/procurem ent packages.) \u00a7 1.1.7 Other Project information: (!dent!f.i ' special characteristics or needs r!f\"the Project not provided elsewhere. such as environmentally responsibl e design or historic preservation requir emems.) \u00a7 1.1.8 The Owner identifie s the following representative in accordance with Section 5.4: (List name . address and other informa tion. Mr. Marvin Murdock Owners Representative MSD of Washington Towns h ip 8550 Woodfield Crossing Blvd. Indianapoli s, IN 46240 (317) 205-3333 (Ext 77189) (317 205-3385 (Fax) In the event that the Owner's Designated Representative is terminated, or otherwise unavailable, the Owner shall designate a replacement repre sentative in writing. \u00a7 1.1.9 The persons or entities, in addition to the Owner 's representative , who are required to review the Architect's submittals to the Owner are as follows: (List name , address and other information.) CONSTRUCTION MANAGER \u00a7 1.1.1 0 The Owner will retain the following consultant s and shall endeavor to comply with all equal employment opportunity programs and as required by Article I 0.15 herein: (List name, legal status. address and other if1formation.) AlA Document B132TM- 2009 (formerly 8141 \" 'CMa -1992). Copyright\u00a9 1992 and 2009 by The American Institute of Architects. All rights reserved. WARNING : This AlA ~ \u00b7 Document is protected by U.S. Copyright Law and International Treaties . Unauthor ized reproduction or distribution of this AlA\" 3 Document , or any portion of it, may result in severe civil and crimina l penal ties, and will be prosecuted to the maximum extent poss ible under the law. This document was produced by AlA software at 13:26:47 on 08/01/2017 under Order No.2341018896_1 which expires on 01/01/2018 , and is not for resale. User Notes : (1232093781) I nit. .1 Construction Manager: The Construct ion Manager is identified on the cover page . . 2 Cost Consultant (if in additi on to the Construction Manager): ({(a Cost Consu/ta/11 is reta ined, appropriat e references to the Cost Consu ltallf shoul d be in serted in Sections 3.2.6, 3 .2.7, 3.3.2, 3. 3.3. 3 . ./.5, 3.4.6, 5.4. 6.3, 6.3.1, 6 . .f and 1 1.6.) .3 La nd Surveyor: .4 Geotechnical Engineer: .5 Civ il Engineer: .6 Other consultants: (List any other consult ants retained by the Own er, such as a Proje ct or Program Manag er, or sche duling consultant.) \u00a7 1.1.11 The Architec t identifies the following repre sentativ e in accordance with Section 2.3: (List nam e, address and other informa tion.) \u00a7 1.1.12 The Architect w ill retain the consultants identified in Sections 1.1.1 2.1 and 1.1.1 2.2: (List name. legal status, addr ess and other il!/imnation) \u00a7 1.1.12.1 Consultants retained under Basic S ervices: .1 Associate Architect and Interior Design: .2 C ivil Eng ineer: .3 Landscape Architect: .4 Structur al Enginee r .5 Mechanical and Technolo gy Design: .6 Plumbing and Electrical Design: .7 E ducational Programmin g: AlA Document B132 TM-2009 (fonner ly 8141 TMCMa -1992). Copyright\u00a9 1992 and 2009 by The American Institute of Ar chitects. All rights reserved . WARNING: Th is AIAo; Document is protected by U.S. Copyr ight Law and International Treaties. Unauthorized reproduct ion or distr ibution of this AlA\" 4 Document, or any p ortio n of it, may result in severe civ il a nd criminal penalties, and will be prosecuted to the maximum extent poss ible under the law. This docum ent was produ ced by AlA s oftwa re a\\13:26:47 on 0810112017 under Order No.2341 0188 96_1 which expires on 01101/2018, and is not for resale. User Notes: (1232093781) I nit. .8 Food Servi ce Design: \u00a7 1.1.12.2 Consultan ts retained under Additiona l Services: NONE \u00a7 1.1.13 Other Initial Information on which the Agreement is based: TBD \u00a7 1.2 The Owner and Architect may rely on the Initial Information. Both partie s, however , recognize that such information may materially change . The Architect shall be entitled to rely on the accuracy and completene ss of information furni shed by the Owner unless the Architect had cause to not so rely. The Architect shall provide prompt written notice to the Owner if the Architect becom es awar e of any error s, omissions or incon sistenci es in such information . Ifthe Owner observes or otherw ise becom es aware of any defect in the Project , it shall give prompt written notice thereof to the Arch itect. ARTICLE 2 ARCHITECT'S RESPONSIBILITIES \u00a7 2.1 The Architect shall provide the profe ssiona l service s as s et forth in this Agreement and described in The General Condition s of the Contract for Construction as modified and supp lemented AlA Document A232 (2009 Edition) and incorporated by referenc e as if set forth herein in full. \u00a7 2.2 The Architect' s services shall be performed consi stent with professional skill and care ordinari ly provided by Architects with experience with projects similar to these Projects practicing in the s ame or similar localit y and under the same or similar circumstance s and consistent with the orderly progress of the Work. The Architect shall submit for the Owner 's approval and the Construction Manager 's information a schedule for the performance of the Architect's services which may be adjusted as the Project s proceed. and shall include a11owances tor periods of time required to r the Owner and Construction Manager's review and for approval of submi ssions by authorit ies having jurisdiction over the Proje cts. Time limit s established herein shall not. exce pt for reasonable c ause. be excee ded by the Architect. The Own er sha11 be entitled to r easonabl y rely on the accuracy and completeness of services and information provid ed by the Archite ct. \u00a7 2.3 The Archit ect shall provide its services in conjunction with the services of a Construction Manager as described in the modified AlA Document C132nL2009 , Standard Form of Agreement Between Owner and Construction Manage r. The Architect shall not be responsible for action s taken by the Construction Manager. \u00a7 2.4 The Architect shall identi fy a representative authorized to act on beha lf of the Archit ect with respect to the Project. \u00a7 2.5 Except with the Owner ' s knowl edge and consent, the Archit ect shall not engage in any activity, or accept any emplo yment, interest or contribution that would reasonably appear to compromise the Arch itect's profe ssional judgment with respect to this Project . (Paragraph s delete d) \u00a72.61NSURANCE \u00a72.6.1 The Architect shall purcha se and maintain from an insurance compan y or insurance compani es lawfull y authori zed to do business in Indiana policie s of insuranc e acceptab le to the Own er, in a form and substanc e reasonably satisfacto ry to the Ow ner, which affor d the coverages set forth in Section 2.6.2 below . This insurance shall be written for not Jess than the limit s of liability specified in Section 2.6.2 or required by law, whichev er coverage is greater . Certified copie s of all insurance polici es or, with the Owner 's consent, Certificate s of Insurance acceptab le to the Owner shall be gi ven to the Own er prior to comm encement of the services. E ach policy must be endor sed to provide that the policy will not be cancelled or allowed to expire until at least thirty (30) days' prior written notice has been provided to th e Ovvner. \u00a72.6.2 The required coverage s and limits which the Archit ect is required to obtain are as follow s: AlA Document 6132\"'- 2009 (formerly 6141 r\"CMa-1992) . Copyright \u00a9 1992 and 2009 by The Americ an Institute of Ar chitects. All right s reserved. WARN ING: This AlA ~ Document is protected by U.S. Copyright Law and International Treaties . Unauthorized reproduction or distribution of this AlA' 5 Document, or any portion of it, may result In severe civil and criminal penaltie s, and will be prosecuted to the maximum extent possible under the law. This document was produced by AlA software at 13: 26:47 on 08/01/20 17 under Order No.2341 018896 _1 which expires on 01/01/2018 , and is not for resale User Note s: (1232 093781) I nit. .1 COMMERCIAL GENERAL LIABILITY a. b. c. Genera l Aggregate (including Completed Operations) Each occurrence Genera l Aggregate Bodily Injur y & Property Damage (Combin ed Single Limit I Per OccuJTen ce) $ 1 ,000,000.00 Personal I Advert ising Injur y (Per Occun-ence) $2,000,000 .00 $1,000.000.00 $2,000.000 .00 $1,000,000.00 The Commerc ial General Liabi lity Policy must be endorsed to provide that the general aggregate amount applies separa tely to each of Architect 's separate projects. ISO Endor sement CG2503 Per Project Endorsement or its equiva lent shall be used to satisfy this requirement. . . 2 COMME RCIAL AUTO LIABILITY (Owned, Non -Owne d and Hired) Bodil y Injury & Prop erty Dama ge (Per Occurren ce) $1,000 ,000.00 .3 WORK ER'S COMPENSATION AND EMPLOYERS' LIABILITY .4 Cove rage A (Worker's Compensation)- Statutory Minimwn Requirement s Cove rage B (Emp loyers Liability) -$500,000/each acciden t; $500,000 Disease- each employee; $500,000 Disease policy limit. EXCESS LIABILITY (Umbrella Form) Each Occun-enc e $5,000,000.00 .5 PROF ESSIONAL LIABILITY INSURANCE . TI1e Architect shall can-y and maintain during the contin uance of this Agreement , professional liability insurance in the amount of$5.000 ,000 for single limit claims and $5.00 0,000 in the aggregate. The Architect's policy of insurance sha ll contain pri or acts cove rage sufficie nt to cover all services perfo rmed by the Architect for this Project. Upon Owner's request. Architect shall give prompt written notice to Owner of any and all claim s made against this policy during the period in which this polic y is required to be maint ained pursuant to this Agreement. If the insurance is written on a claim s-made basis and cove rage is cancell ed at any time, the Ar chitect will obtain, at its cost, an extended repor ting endor semen t which provide s continuing coverage for claim s based upon alleged acts or omissions durin g the term of the Agreement until all applicable statute of limitation periods have expired. All cove rage provided above shall be endorsed to include the Owner , as Additional Insured excep t for the Worker 's Compen sation/Emp loyer's Liabilit y and Profe ssional Liability policie s. ISO forms CG 2010 07 04 and CG 2037 or equivalent endor sement form s must be used on the comme rcial general liabilit y polic y to provide additional insured st atus to the Owner. and shall include cove rage for comp leted operation s. The policie s for which the Owne r is named as additional insured shall provide primary and non-contributin g coverage and any valid and collect ible insurance cmTied separa tely by the Owner shall be in excess of the limit s provide d by such policie s and shall be non-contributor y. All insurance requirements and limits contained in this Section 2.6 apply to all of Architect's consultants and the Archit ect is responsib le to verify those insuranc e requirements and limit s, or seek approva l throu gh the Architect from the Owner for alternative cove rage or reduced limit s. TI1e commercial general liability, automobil e liabilit y, and workman's compensation policie s must be endor sed to provide a waiver of subrogation in favor of Own er. \u00a72.6.3 The Architect hereby agree s to deliver to the Owner, within ten (1 0) days of the date of the Owner -Archit ect Agreement and prior to bringing any equipment or personnel onto the site of the Work or the Project site, certified copies of all insurance policie s procured by the Arch itect under or pursuant to this Section or, with consent of the Owner , Certificates oflnsurance in form and substance satisfactory to the Own er evidencing the required coverages with limit s not less than those specified in the Agreement. \u00a7 2.6.4 In no event shall any failure of the Owner to recei ve certified copies or certificate s of policie s required under this Sectio n or to demand receipt of such certified copies or certificates prior to the Arch itect's commencing the services be construed as a waiver by the Owner of the Architect's obligation s to obtain insmance pursuant to this AlA Docume nt B132'M -2009 (formerly 8141 TMCMa- 1992). Copyrig ht \u00a9 1992 and 2009 by The American Institute of Architects. All right s reserved . WARNING : This AlA\" Docum ent is protected by U.S. Copyright Law and Internationa l Treaties. Unauthor ized reprod uction or distribution of this AIAfe 6 Document, or any portion of it, may result in seve re civil and criminal pena lties, and will be prosec uted to th e maxim um exte nt possible under the law. This documen t was produ ced by AlA software at 13:26:47 on 08101/2017 under Order No.2341 018896 _1 w hich expires on 01/01120 18, and is not for resale. User Note s: (123209378 1) I nit. Section 2.6. The obligat ion to procure and maintain any insurance required is a s eparate responsibility of the Architect and indepe ndent of the duty to furnish a cettified copy or cetiificate of such insurance policie s. \u00a7 2.6.5 The Architect's policies of insurance shall contain prior acts coverage sufficient to cover all service s performed by the Arcitect for this Project and shall provide primary and non-contributory coverage. Any insurance by the Owner shall be considered excess and non-contributory. Deductibles shall be paid by the Architect. Upon Owner ' s reque st, Architect shall give prompt written notice to Owner of any and all claims made against this polic y during the period in which this polic y is required to be maintained pursuant to this Agreement. (Paragraph delete d) ARTICLE 3 SCOPE OF ARCHITECT'S BASIC SERVICES \u00a7 3.1 The Architect's Basic Services consi st of those described in A1iicle 3 and inclu de usual and customary struc tural, mechanical , and electrical engineer ing services. Service s not set forth in this Article 3 are Additiona l Services. \u00a7 3.1.1 The Architect shall manage the Arch itect's services, consult with the Owner and the Construct ion Mana ger, research applicabl e design criteria, attend Project meetings, communicate with member s of the Proje ct team and repmi prot;,rre ss to the Owner. \u00a7 3.1.2 The Architect shall coordinate its ser vices with those services provided by the Owner, the Construction Manager and the Owner's other consultant s. The Architect shall be entitled to rely on the accuracy and completene ss of services and information furni shed by the Owne r, the Construction Manager , and the Owner ' s other consultant s. The Archi tect shall provide prompt written notice to the Owner ifthe Arch itect become s aware of any error, omission or incon sistency in such services or information . \u00a7 3.1.3 As s oon as practicable after the date ofthis Agreement , the Architect shall submit to the Owner and the Cons truction Manager a schedule ofth e Architect's service s for inclusion in the Project sched ule prepar ed by the Construction Mana ger. The sched ule of the Arch itect' s service s shall include design mile stone dates . anticipated dates when cost estimates or design reviews may occur, and allowance s for period s of time required (I) for the Owner 's review. (2) for the Construction Manager's review. (3) for the performanc e of the Owner's consultant s, and (4) for approval of submi ssions by authorities having jurisdiction over the Proje ct. \u00a7 3.1.4 The Architect shall subm it information to the Construction Manager and participat e in developin g and revising the Proje ct sched ule as it relates to the Archi tect's service s. \u00a7 3.1.5 Once the Own er and the Architect agree to the time limits established by the Project schedule, the Own er and the Archite ct shall not exceed them , except for reasonable cause. \u00a7 3.1.6 The Archi tect shall not be responsible for an Owner 's directive or substitution , or for the Owner 's acceptance of non-conforming Work , made without the Architect's approval. \u00a7 3.1.7 The Architect shall, at appropriat e time s, in coordinat ion w ith the Construction Mana ger, contact the gove rnmental authoriti es required to approve the Construction Documents and the entities providing utility servic es to the Project. In designin g the Project , the Arch itect shall respond to applicable design requ irements impo sed by such governmental authoritie s and by such entities providin g utility services. \u00a7 3.1.8 The Arch itect shall assist the Owner and Construction Manager in connection with the Owner 's responsibilit y for filing document s required for the approval of governmental author ities having jurisdiction over the Project. \u00a7 3.2 Schematic Design Phase Services \u00a7 3.2.1 The Architect shall review and validate the program of space requirement s and other information fumi shed by the Owner and Construction Mana ger, and shall review laws, codes, and regulation s applicable to the Architect's service s. The Arch itect shall review the program , sched ule and construction budget to ascertain the requirement s for the Project and shall aiTive at a mutua l under standing of such requirement s with the Owner and Construction Manager and modi fy if and as required . Based on the cost es timate s, the Archit ect to prepare all nece ssary AlA Document 8132'\"' -2009 (formerly 8141 r\"'CMa- 1992). Copyright \u00a9 19 92 and 2009 by The Ame rican Institute of Architects. All rights reserved. WARNING : This AlA\u00ae Document is protected by U.S. Copyrig ht Law and I nterna tional Treaties . Unau thorized repro d uction or d istribution of this AlA \"' 7 Document, or any portion of it, may r esult In s evere civil and criminal pen alties, and will be prosecuted to the maxim um extent possible under the law. This document was produced by AlA software at 13: 26:47 on 0 8/01/201 7 under Order No. 2341 018896_1 which expires on 01/01/2018, and is not for resale . User Notes: (123209378 1) I nit. drawings. specifications and other documents required for the construction and completion of the Pr ~ject based on the Project ' s budget. \u00a7 3.2.2 The Architect shall prepare a preliminary evaluation of the Owne r's program , schedu le, budget for the Cost of the Work. Project site, and the other Initial Information. each in terms of the other, to ascertai n the requirement s of the Project. The Architect shall notify the Owner of (1) any incon sistencies discovered in the information . and (2) other information or consulting service s that may be reasonably needed for the Project . \u00a7 3.2.3 The Architect shall present its preliminary evaluation to the Owner and Construction Manager and shall discuss with the Owner and Construction Manager alternative approaches to design and construction of the Project, including the feasibi lity of incorporating environmen tally respon sible design approaches. The Architect shall reach an understanding with the Owner regarding the requirem ents of the Project. \u00a7 3.2.4 Based on the Project requirements agreed upon with the Owner , the Architect shall prepare and present to the Owner and Construction Manager , for the Owner 's approval , a preliminar y design illustrating the scale and relationship of the Project compon ents. \u00a7 3.2.5 Based on the Owner's approva l of the preliminary design, the Architect s hall prepare Schemati c Design Documents for the Owner's approval and the Construction Manager's review. The Schematic Design Documents shall consi st of drawings and other documents including a site plan and preliminary building plans , sections and eleva tions; and may include some combination of study model s, perspective sketche s, or digital modeling. The Schematic Design Document shall provide option s for size, location and configuration of the Owner approved prototype design on each site. Preliminary selections of major building systems and construction material s shall be noted on the drawing s or described in writing . Architect shall prepare written description of structura l, mechanical, electrical, pl umbi ng and technology work along with preliminary layouts as needed for cost estimating . \u00a7 3.2.5.1 The Architect s hall consider environmenta lly respon sible desi&'ll alternative s. such as material choice s and building orientation. together with other considerations based on program and aesthetic s, in developing a design that is consistent with the Owner 's program. schedu le and budget for the Cost of the Work . \u00a7 3.2.5.2 The Architect shall consider with the Owner and the Construction Mana ger the value of alternativ e material s. buildin g systems and equipm ent, together with other considerat ions based on program and aesthetics in developin g a design for the Project that is consistent with the Owner 's schedu le and budget for the Cost of the Work . \u00a7 3.2.6 The Architect shall submit the Schematic Design Documents to the Owner and the Cons truction Mana ger. The Architect s hall meet with the Owner and Const ruction Mana ger to review the Schematic Design Document s and the schematic cost est imate prepar ed by the Cons truction Mana ger. If the schematic cost estimate exceeds the Project Budg et, Architect shall discuss with Owner and Construction Mana ger potenti al cost reduction options a nd modi f)' the Schematic Design Docum ents \u00a7 3.2.7 Upon receipt of the Construction Manager 's review comments and Construction Manager 's schematic cost estimate at the concl usion of the Schematic Design Phase , the Architect shall take action as required under Section 6.4, identify agreed upon adjustment s to the Project's size, quality or budget , and reque st the Owner's approval of the Schematic Design Documents. lfrevisions to the Schematic Design Documents are required to comply with the Owner' s budget for the Cost of the Work at the conclu sion of the Schematic Design Phase, the Architect s hall incorporate the requir ed revisions in the Design Development Phase. \u00a7 3.2.8 In the furth er de velopm ent of the Drawin gs and Specifications during this and subsequent phases of design , the Architect shall be entitled to rely on the accuracy of the estimates of the Cost ofthe Work , which are to be provided by the Construction Manager under the Construction Manager's agreement with the Owner. \u00a7 3.3 Design Development Phase Services \u00a7 3.3.1 Based on the Owner's approval of the Schematic Design Docwnents , and on the Owner 's authorization of any adjustment s in the Project requirement s and the budget for the Cost of the Work pursuant to Section 5.4, the Architect shall prepare Design D evelopment Documents for the Owner' s approval and the Construction Mana ger's review. The Design Development Documents s hall be based upon information provided , and estimates prepared by, the Construction Manager and shall illustrate and describe the development of the approved Schematic Design AlA Document 8132\"'-2009 (formerly B141fMCMa -1992). Copyr ight\u00a9 1992 and 2009 by The American Institute of Architects. All rights reserved. WARNING : This A l A ~ ' Document is protected by U.S. Copyright Law and International Treaties. Unauthorized reproduct ion or distribution of this AIAt\u00b7 Document, or any portion of it, may result In severe civil and criminal penalti es, and will be prose cuted to th e maximum extent poss ible under the law. This document was produced by AlA software at 13: 26:47 on 08/01/2017 und er Order No. 2341 018896_1 which exp ires on 01/01/2018, and is not for resale. User Notes: (123209378 1) 8 I nit. Documents and shall consist of drawings and other document s including plans , sectio ns. elevat ions, typical construction details, and diagrammatic layouts of building systems to fix and describe the size and charact er of the Project as to architectural, structuraL mechanical and electrical systems, and such other elements as may be appropriate. The Design Developm ent Documents shall include detailed layout s of the site plans and the floor plan with furniture and equipment. The Design Development Document s shall also include outline specifications that identifY major material s and systems and establish in general their quality levels. Architect's Design Development document s shall include interior and exter ior renderings. \u00a7 3.3.1.1 The Architect shall commence the process to select interior finishes, pattem s and colors for each Project and review with the Owner on a regular basis until the process is comp lete. \u00a7 3.3.1.2 The Architect shall direct the prepa ration of civil , landscape architecture , structural, mechanical , electrical, plumbing and technology work as required for the Proje ct along with required narrative information as needed for estima ting the Cost of the Work . \u00a7 3.3.2 Prior to the conclusion of the Design Development Phase , the Architect shall subm it the Design Development Document s to the Owner and the Construction Manager. The Architect shall meet with the Owner and Construction Manager to review the Design Development Document s and estimate of the Cost of the Work . If the cost estimate exceeds the Project Budget , the Architect shall discuss potential cost reduction options with the Owner and Construction Manager and modifY the Design Development Documents as required. \u00a7 3.3.3 Upon receipt of the Construction Manager's information and estimate at the conclusion of the Design Development Phase, the Architect shall take actio n as required under Sections 6.5 and 6 .6 and request the Owner's approval of the Design Development Documents. \u00a7 3.4 Construction Documents Phase Services \u00a7 3.4.1 Based on the Owne r's approval of the Design Development Documents , and on the Owner's authorization of any adjustment s in the Project requirements and the budget for the Cost of the Work . the Architect shall prepare Construction Documents for the Owner's approval and the Construction Manager's review. The Construction Document s shall illustrate and describe the further develo pment of the approved Design Development Documents and shall consist of Drawin gs and Specifications setting forth in detai l the qualit y level s of material s and systems and other requirements for the construction of the Work . The Owner and Archit ect acknowledge that in order to construct the Work the Contractor will provide additional information , including Shop Draw ings, Product Data , Samp les and other similar submittals , which the Archite ct shall review in accordance with Section 3.6.4. \u00a7 3.4.2 The Architect shall incorporate into the Construction Documents the design requirements of governmental authorities havin g jurisdiction over the Project. \u00a7 3.4.3 Durin g the development of the Construction Document s, if requested by the Owner , the Architect shall assist the Owner and the Construction Manager in the developm ent and preparation of (I) bidding and procurement information that describes the time , place and conditions of bidding , including bidding or proposal form s;",
        "The final co nstruction documents shall include as a minimum: Site Plan, Landscaping Plan , \nStorm water Management Plan, Roof Plan, Drainage Plan, Floor Plan(s), Exterior E levations, \nBuilding Sections, Foundation Plan, Framing Plan(s), Details, Plumbing Isomet rics, Door  / \nWindow / Room finish / Header / Plumbing / Electrical schedule, HVAC P lans, Electrical \nPlans, Submittal Worksheets and the project manual including specifications i n the CSI \ndivision format.  \n\n \n 5 \n \u2022 Bidding & Contract Award (Phase V)  \nThe A/E will assist the  District and Construction Manager (CM) in bidding the project to \nprospective prime contractors. Services will include assisting the CM with the distribution of \nplans and specifications, assisting with sub -contractor pre -bid meetings, assisting with \nformul ating responses to prospective bidders\u2019 questions, issuing addendums (if neces sary), \nattendance at the bid opening, and providing the District with a recommendation for p rime \ncontract awards.  \n\n\u2022 Construction Administration & Project Closeout (Phase VI)  \nThe A/E shall be a representative of and shall advise and consult with the Dis trict during \nconstruction until the final payment to prime contractors is due and during th e correction \nperiod described in the Contract Documents.  \n\na. Plan Approvals - The A/E is respo nsible for the procurement of ALL plan approvals from \nthe local municipal (ies), Marion County, and the State of Indiana Departmen t of \nCommerce, Safety & Building Division for the building(s) including, but not limited  to, \nStorm water Management, HVAC, Mec hanical , plumbing  and/or Fire Protection.  \n\nb. Construction Related Services - The A/E will provide on the District\u2019s behalf, \nconstruction administration and inspection services. At a minimum, services to b e \nprovided consist of coordinating regular progress meetings, review of  shop drawings, \nassist Dis trict in floor and finish material selection, undertake construction observ ation, \nprocess certificates for payment to prime contractors, and facilitate prepa ration of final \nrecord drawings, warranty follow -up and project closeout.  \n\nThe A/E, in conjunction  with the Construction Manager, shall provide updated budgetary cost \nestimates during each phase of the design process.  \n\nIV. Design Guidelines  \nThe District will require the A/E to integrate sustainable principles/desig n into the District\u2019s \nprojects. The A/E sh all apply/utilize standards found in the Leadership in Energy & \nEnvironmental Design Green Building Rating System, Declare, Cradle to Cradle  or other \nnationally recognized sustainability program/certification. The District may  consider \npursuing LEED or oth er sustainability program/certification. The District may  engage the \nservices on an independent commission agent/authority.  \n\nThe A/E shall integrate District\u2019s vision for teaching & learning concepts in to the program \nand design of all projects.  \nThe A/E sha ll include options in the program and design to expand District\u2019s options for \ncommunity access and use of facilities.  \n\nV. Project Construction Timeline -November 2017 thru August 2021  \n\n 6 \n VI. RFP Timeline  ",
        "The responses will be reviewed an evaluation panel consisting of individual s selected by the \nDistrict.   Responding A/E(s) will bear all costs of this RFP and interviews, if any.  \n\nProposals will be reviewed using the following criteria /elements:  \no Conciseness, responsiveness and completeness of the proposal to the inform ation \nrequested, objectives, and deliverables as outline in the RFP  \no Consultant / Supplier Diversity inclusion  \no Fee Proposal / Cost: Overall fee / billing rates  \no Prior experience, Qualifications, References, Past Performance of A/E  \no Experience / Expertise in K -12 School Projects  8 \n o Experience with Sustainable or \u201cGreen\u201d Design  \no Level of Innovation with a Focus on our Educational Vision  \no A/E\u2019s Technological Capabilities (to  manage this project in a paperless or almost \npaperless manner)  \n\nAt the District\u2019s discretion, to further assist in evaluation, some, one, o r all of the responding \nA/E(s) and/or individuals may be requested to participate in an interview proc ess. The inter view \nwill be used as another opportunity to clarify any issues within a given Pr oposal and explore the \napproaches that may be used to satisfy all requirements for the District.  \n\nA/E(s) shall submit fee proposal using the Fee Proposal Form provided with thi s RFP. At the \nDistrict\u2019s discretion, it may directly negotiate with the best qualified A/E on final scope and fee.  \n\nThe District may  also consider alternative proposals to provide A/E services if there is an  \nopportunity for substantive savings (without adv ersely affecting the project timeline or quality) \nand other significant benefits (to be clearly articulated by the proposer and be  measureable) \naccruing to the District.  \n\nThe District may investigate the qualification of any individual or A/E under consideration, \nrequire confirmation of information furnished and require additional evidence of quali fications \nto perform the services described in this RFP. The District also reserves certain rights, including, \nbut not limited to, the following:  \n\na. Reject a ny or all of the proposals  \nb. Issue subsequent Requests for Proposals  \nc. Cancel the entire Request for Proposal  \nd. Remedy technical errors in the Request for Proposal process  \ne. Appoint evaluation committees to review qualifications and proposals  \nf. Seek the assistance o f outside technical experts in evaluation  \ng. Approve or disapprove the use of particular subcontractors  \nh. Establish a short list of A/E(s) eligible for discussions after review of RFP  \ni. Negotiate with any, all, or none of the A/E(s)  \nj. Solicit best and final offers from all, some, or one of the A/E(s)  \nk. Award a contract to one or more A/E(s)  \nl. Waive informalities and irregularities in RFP  \nm. Award without discussion  \n\nSelection will be based upon a determination as to which proposal is in th e best interest of the \nMetropolita n School District of Washington Township. Any decision made by the District,  \nincluding the selection of A/E, shall be final and is NOT subject to appeal.  \n\nThis RFP shall not, in any manner, be construed to be an obligation on the Distri ct to enter into \na contract or result in any claim for reimbursement of cost for any efforts exp ended in \nresponding to the RFP or in anticipation of any contract.  9 \n  \nAward of Agreement.  Upon the completion of the selection process, the  District shall notify all \nA/E(s) of the selection and the successful A/E shall enter into the District\u2019 s AIA Document B132 -\n2009 Standard Form of Agreement Between Owner and Architect, Construction Man ager as \nAdviser Edition, as modified by the District and included in these RFP Documents (the \n\u201cAgreement\u201d).  The Agreement includes AIA Document A232 \u2013 2009 General Conditions of the \nContract for Construction, Construction Manager as Advisor Edition modified  by the District and \nis available for review upon A/E\u2019s request to District.  A/E\u2019s Proposal and Fee  shall be based on \nthe terms of the Agreement as contained herein and the modified General Conditi ons without \nqualification or exception.   \n\n \nX. Submittal Requ irements  ",
        "VIII. Proposal Response  7 \n  \nRespondents to this RFP shall include the following minimum information in the ir proposal:  \n\na. Describe how A/E will organize and perform the work described in the Scope of Services \nsection. List the names of any sub -consultants that are intended to be used on the \nproject and the specific services to be provided the sub -consultant(s).  \n\nb. Describe A/E\u2019s understanding of the project and the planned approach to achieve the \ngoals of the project. Submittal shall include a listing of contemplated tasks and number \nof estimated hours by personnel classification/discipline for eac h phase of the pro ject.  \n\nc. Describe sustainable or \u201cgreen\u201d design experience as well as experience workin g with \nFocus on Energy.  \n\nd. Include conceptual time schedules and related expectations/obligations of the D istrict \nneeded to complete the scope of work specified based on occupancy for all projects by \nSeptember 2021.  \n\ne. Provide a fee proposal using the attached fee proposal spreadsheet. Fees shall include \nALL meetings needed to successfully complete this project and ALL reimbursabl e costs \nother than plan/document printing cos ts (incurred for this bidding phase of the \nproject) and required plan submittal fees.  \n\nf. Provide a description of any possible additional related costs and/or fees  (not included \nin your base fee) that the District might incur as a result of this design proce ss. \n\ng. Provide a description of monthly status reports, e.g. project timeline, d eliverables, costs \nincurred to date, and costs to project timeline.  \n\nh. Consultant / Supplier Diversity inclusion in the present RFP and past projec ts.  \n\nIX. Proposal Evaluation/Selecti on Process / Agreement Award  ",
        "to be construed as publication in deroga tion of the reserved rights of the Architect and the Architect's consultant s. \u00a7 7.3 Upon execution of this Agreement , the Architect grants to the Owner a none xclusive license and ownershi p to use the Project Drawings and Specification s solely and exclusively for purpo ses of constructing , using, maintaining, altering and adding to the Project. Upon any termination of this Agreement prior to its completion , the Owner shall retain the license and ownership and is permitt ed to make changes, correcti ons or additions to the Drawing s and Specifications for the purposes of comp letin g, using and maintaining the Project , or for future additions or alternations to th e Project ; provided , however , that such use shall be at the Owner' s sole risk and without liability to the Architect and the Architect's consu ltants. Upon payment by the Owner of all fees due and owing Architect for profe ssional services under this Agreement, all right, title and interest in the Drawing s and Specification s and other document s, including those in electronic form , prepared by the Architect and the Architect 's consultant s (\"Drawing s and Specification s\") that become part of this Agreement and whic h are incorporated by reference into the Agreement betwee n Owner and Contractor shall become the property of the Owner. If the information is provided in electronic format, the Architect expressly waives any and all actions or claims against the Owner alleging infringement of any copyrights or patent s by reason of the Owner 's use of the electronic information. The Owner AlA Document 8132TM- 2009 (formerly B14FMCMa -1992). Copyright \u00a9 1992 and 2009 by The American Institute of Architects. All rights reserved . WARNING: This A l A ~ \u00b7 Document is protected by U.S. Copyright Law and International Treaties . Unauthorized reproduction or distribution of this AlA' ' 16 Document , or any portion of it, may result in severe civil and crim inal pena lties, and will be prosecuted to the maximum extent possib le under the Jaw. This documen t was produced by AlA software at 13:26 :47 on 08/01/2017 under Order No.2341018896_1 which expires on 01/01/2018 . and is not for resale . User Notes : (1232093781} I nit. may utilize the Drawing s and Specilications and any ofthe constituent parts thereof in conju nction with a different project improvement. Howe ver. the Owne r's use of the Architect's Drawing s and Specificat ions for any other construction purpo se other than for the Project shall be at Owner's expense and liability. The Architect shall obtain similar none xclusive licenses fi\u00b7om the Architect 's consu ltants consistent with this Agreement. The license granted under this section permit s the Ovvner to authorize the Contractor , Const ruction Manager , Subco ntractors. Sub-subcontractor s, and material or equipment supplier s. as well as the Owner 's consultants and separate contrac tors. to reproduce applicable portions of the Drawing s and Specification s solely and exclusively for use in performing services or construction for the Project. lfthe Architect rightfull y termina tes this Agreement for cause as provided in Section 9.4, the license grante d in this Section 7.3 shall terminate . (Paragrap h deleted) \u00a7 7.3.1 The Architect agrees to indem nity, save and hold harmle ss, and defend at its expense, the Own er, its agents, employee s and anyone else acting for or on behalf of any of them , and any other person or entity for whom any of them may be legally responsib le, fi\u00b7om and against all claim s, suits, actions, damage s, fees, penaltie s and/or liabilities, includin g, without limit ation, couJi costs and reasonable attome ys\u00b7 fees, of any natur e what soeve r which arises out of, or is connect ed with. or are alleged to arise out of or be connected with rights of claims of right s in such Drawing s and Speci fication s or other documents. TI1e Arch itect shall also defend all actions or claim s charging infrin gement of any copyright s or patent s by r eason of the use or adoption of any designs, Drawing s or Specifications suppli ed by it and shall hold the Owner, its agent s and emplo yees harml ess fi\u00b7om claim s, loss, damages , liabili ty, costs and expenses (includin g attomeys' fees) resulting therefr om. The Architect's agreeme nt of indemnity shall survive final payment and the terminati on of this Agreement. \u00a7 7.3.2 The Owner shall be pennitt ed to authorize the Construction Manager , Contractors , Subcont ractors, Sub-subco ntractors and material or equipme nt supplie rs to reproduce applicable portions of the Project Drawings or Spec ifications appropriate to and for use in their execut ion of the Work by licen se granted in this Atiicle . \u00a7 7.3.3 Notwith standing the transfer of ownership set forth in Section 7.3 above , it is abrreed and acknowledged that: .1 Drawings and Specification s prepared by the Arc hitect will contain numerou s design det ails and typical speci fication s (\"Standard Detail s/Specifications\") which , collectively , form a part of the design tor the Project but which. separate ly. are not Project specific . are related to function as compared to design form, are repetitiv e in nature and were not specific ally developed for or identifiable with the Project ; and .2 Given the above , the Standard Detail s/Specifica tions shall remain the property of the Architect and may be used by the Architect on other project s, in other conte xts an d/or for other client s, so long as they are not collectivel y used in a manner which replicates the overall design of the Project. \u00a7 7.4 Except for the licen ses and ownership granted in this Article 7, no other licen se, ownership or right shall be deemed granted or implied under this Agreement. The Owner shall not assign , delegate , sub license, pledge or otherwise transfer any licen se or owner ship granted herein to another party without the prior \\'ll'itten abrree ment of the Arc hitect. Any unauthorized use of the Instrument s of Service shall be at the Owner 's sole risk and without liability to the Architect and the Architect' s consultant s. ARTICLE 8 CLAIMS AND DISPUTES \u00a7 8.1 General \u00a7 8.1.1 The Owner and Architect shall comm ence all claims a nd causes of action , whether in contract, tort, or otherwise , against the other arising out of or related to this Agre ement in accordance with the requireme nts of the meth od of binding dispute resolution selected in this A greemen t within the period specified by applicable law. \u00a7 8.1.2 To the extent damages are covered by property insurance, the Owner and Architect waive all rights against each other and against the contractors , consultant s, agents and employees of the other for damages, except such rights as they may have to the proceed s of such insurance as set forth in the modified AlA Document A232 -2009, General Conditions ofthe Contract for Construction. The Owner or the Architect , as appropriate, shall require of the Construction Manager, contractor s, consultants, agents and employees of any of them similar waivers in favor of the other parties enumerated herei n. AlA Document B132 T\"- 2009 (formerly 8141 r\"CMa -1992) . Copy right \u00a9 1992 and 2009 by The American Institute of Architects. All rights reserved . WARNING : This AlA ~ ' Document is protected by U.S. Copyr ight Law and International Treaties . Unauthorized reprodu ction or distribution of this AlA' 17 Document , or any portion of it, may result in severe civil and criminal penalties , and will be prosecuted to the maximum extent possib le under the law. This docum ent was produced by AlA software at 13:26:47 on 08/01/20 17 under Order No.2341 018896_1 which expires on 01/01/2018. and is not for resale User Notes : (1232093781) I nit. \u00a7 8.1.3 Architect shall, to the fullest extent permitt ed by law. indemnity , defend and hold harml ess Owne r. and its officer s. board members. employee s and represent atives (\"lndemnitees\"). fi\u00b7om and again st all claim s, damages , losses and expenses. including but not limited to attorne y's fees, arising out of or relating to the negligent or willful acts or omis sions of the Architect or those for whom the Architect is respon sible, provided such claim, damage. loss or expense is attTibutab le to bodil y injur y, sickness. disease or death or to injury to or destruction of tangib le propet1y. regard less of whet her caused in pa11 by one or more of the lndemnitee s, and regardle ss of any claim of neglig ence by one or more of the lndemnitee s. The indemnification obligations set forth above shall surviv e completion of the performance and/or termination of this Agreement. With respect to any claim against one or more lndemnite es asserted by an employee of the Architect (or an employee of those for whom the Architect is responsible) , the indemnification obligation set forth herein shall not be reduced or limit ed by any statutory cap or other limita tion on the amount or type of damage s, compensation or other benefits payable by Archit ect (or those for whom Architect is responsible) under worker 's comp ensation acts, disability benefit acts or other employee benefit acts. \u00a7 8.1.4 The pa11i es agree to provide one another with \\\\1'itten notice of a dispute within a reasonable time , not to exceed thirty (30) days, after obta ining knowledge of the same and shall includ e: (I) a state ment spec ifYing that a dispute has occutTed that falls within the scope of this Article , (2) a statement of the pm1y's position and a summar y of evide nce and argument s that supp011 such position, and (3) the name and title of the disputing party's authori zed repre sentative . Within twenty (20) days after receipt of the disputing party's notice , the respondin g party shall submit a written response to the disputing party. The response shall contain : (I ) a statement of the respondin g party 's position and a summa ry of evidence and arguments that support such posit ion; and (2) the name and title of the respondin g party's authorized representat ive. In the absence of an agreeme nt to the contrary, the parties' authorized repre sentatives shall meet in Marion County, Indiana, at a mutuall y acceptable time and place within ten (I 0) days after the disputi ng party recei ves a response and thereafte r as often as they reasonabl y deem necessary to exchange relevant information and to attempt to resolve the dispute . If the dispute has not been resolved within forty (40) days after the disputi ng party receives the response, or if the responding party refuses or fails to comp ly with the provisions of this Section. then the disputing party may comme nce legal action again st the respondi ng party. \u00a7 8.2 Mediatio n \u00a7 8.2.1 Although the parties to the Contract may agree to mediation , mediation as described in Section 8.2 shall not be a condi tion precede nt to litigation by either party. The exclusive venue for all claims , disputes or litigati on arising out of the Contract or the Contract Document s shall be in Marion County , Indiana . \u00a7 8.2.2Ifthe parties do not resolve a dispute through me diation pursuant to this Section 8.2, the method of binding dispute resolution shall be the followin g: (Check the appropriate box. ({the Owner and Construction Manager do not select a me thod of bindin g displlle resolution below, or do not subsequently agree in writing to a binding dispute resolu tion me thod other than litigation the dispute will he resolved in a court of compe tent juris diction.) [ ] Arbitration pursuant to Section 8.3 of this Ahrreement [X] Litigation in a court of competent jurisdiction [ ] Other: (Spec{fy) (Paragrap hs deleted) \u00a7 8.3 Exclusive Venue For Litigation And Attorneys ' Fees \u00a7 8.3.1 Although the pmiie s to the A6rree ment may agree to mediation, mediation shall not be a condition precedent to litigation by either party. The exclu sive venu e for all claim s, dispute s or litigation arising out of the Contrac t or the Contract Document s shall be in Marion County, Indiana. (Paragrap h deleted) \u00a7 8.3.2ln the event that a party default s in its performance or observance of any of the terms, conditions or obligations contained in the Agreement, or in the event that either party has to emplo y attorne ys to enforce any part of the Agreement, the prevaili ng party in any such action shall be entit led to recover fi\u00b7om the other party all reasona ble attorneys ' fees and costs incml'ed in connection therewith, including litigation, post-judgment proceedings and appea ls. For the purpo ses of this Section, \"prevai ling party\" shall mean the party that receives all or AlA Document B1J2TM -2009 (formerly 6141 \"'CMa- 1992) . Copyright\u00a9 1992 and 2009 by The Amer ican Institute of Architects. All rights reserved. WARNING : This AlA\u2022\u00b7 Document is protected by U.S. Co pyright Law and International Treaties . Unauthori zed reproduction or distribut ion of this AlA\u2022 18 Document , or any portion of it, may result in severe civil and criminal penalties , and will be prosecuted to the maximum extent poss ible under the law. This document was produced by AlA software at 13:26: 47 on 08/01/2017 unde r Order No.2341018896_1 which expires on 01/01/2018 , and is not for resale . User Notes : (123209378 1) I nit. substantia lly a II of the rei ief sough t by that party. based upon an assessment of the party's major arguments or positions taken in the suit or proce eding and whether it could fairly be said that party prevailed over the other party's major argume nts or positions on major disputed issues. Any attorneys\u00b7 fees and other costs and expe nses incurred by either pmty in enforcing a judgment in its favor under the Agreement shall be recoverab le sepa rately fi\u00b7om and in addition to any other amount included in such judgment , and such attorneys' fees obligations is intended to be severab le fi\u00b7om the other provisions hereof and to surv ive and not be merged in any such judgment. (Paragrap hs deleted) \u00a7 8.4 Architect's Consultants Bound The Architect shall include in its contract s with its Consultants provisio ns that bind the Consultants to the dispute resolution procedures ofthis Agreement. ARTICLE 9 TERMINATION OR SUSPENSION \u00a7 9.1 If the Owner fails to make payment s to the Architect in accordance with this Agreement, such failure shall be considered substan tial nonperformance and cause for termination or, at the Architect's option, cause for suspe nsion of perform ance of service s under this Agreement. If the Architect elects to suspend services , the Architect shall give seven (7) days' written notice to the Owner before suspending service s. In the event of a suspension of services. the Arch itect shall have no liability to the Owner for delay or damage caused the Ovmer because of such susp ension of services. Before resuming services, the Architect shall be paid all sums due prior to suspension . The Architect's time schedu les for the remaining services shall be equitably adjusted. \u00a7 9.2lfthe Owner suspends the Project for more than thirty (30) consecutive days, the Architect shall be compensated for servi ces performed prior to notic e of such suspension. When the Project is resumed. the Architect shall be compensated for expen ses incurred in the interruption and resumption of the Architect's services. The Architect' s fees for the remaining services and the time sched ules shall be equitably adjusted. \u00a7 9.3 This Agreement may be terminated by the Owner upon not less than seven (7) days' written notice to the Architect in the event that the Project is perm anen tly abando ned. If the Owner suspends the Prqject for more than ninety (90) cumulative days for reasons other than the fault of the Architect, the Architect may termina te this Agreement by giving not less than seven (7) days ' written notice. \u00a7 9.4 Either party may terminate this Agreement upon not less than seven (7) days' written notice should the other party fail substantiall y to perform in accordance with the terms of this Agreement through no fault of the pat1y initiating the tennination. \u00a7 9.5 The Owner may tenninate this Agreem ent upon not less than seven (7) days' written notice to the Architect for the Owner's convenience and without cause. \u00a7 9.6 In the event of termination not the fault of the Architect, the Architect shall be compensated for servi ces performed prior to termination , togeth er with Reimbursab le Expenses then due. \u00a7 9.7 The Owner's rights to use the Architect's Drawings and Specifications in the event of a termination of this Agreement are set forth in Article 7. (Paragraph deleted) ARTICLE 10 MISCELLANEOUS PROVISIONS \u00a7 10.1 This Agreement shall be gove med by the law of the State of Indiana. \u00a7 10.2 Term s in t his Agreement shall have the same meaning as those in the modifi ed AlA Document A232 -2009, General Condition s of the Contract for Construction. \u00a7 10.3 The Owner and Architect, respectively, bind them selves, their agent s, successors , assigns and legal repre sentative s to this Agreement. Neither the Owner nor the Architect shall assign this Agreement, any portion of this Agreement , or any right, interest, privi lege, duty, claim, defen se, chose of action or liability arising out of or relating to this Agreement without the written consent of the other, and any purported assignment in violation of this prohibition shall be void, except that the Owner may assign this Agreement to a separate building corporation if the buildin g corporatio n agrees to assume the Owner's rights and obligations under this Agreement. AlA Document B1J2T M -2009 (formerly 8141 TMCMa -1992) . Copyright\u00a9 1992 and 2009 by The American Institute of Architects. All rights reserved. WARNING : This AIAf> Document is protected by U.S. Copyright Law and Internat ional Treaties . Unauthor ized reproduction or distribution of this AlA ~ \u00b7 19 Document , or any portion of it, may re sult in severe civil and crimina l pena lties, and will be prosecuted to the maxim um extent possible under the law. This document was produced by AlA softWare at 13:26:47 on 08/0112017 under Order No.2341018896_1 which expires on 01/01/2018 . and is not for resale User Notes : (1232093781 ) In it. \u00a7 10.4lfthe Owner requests the Architect to execute certificates, the propo sed language of such certificates shall be submitted to th e Architect for review at least fourteen ( 14) days prior to the requested dates of exec ution . The Architect shall not be required to execute certificates or consents that would requ ire knowledge , services or responsibilities beyond the scope of this Agreement. or ~1at , in the opinion of Architect , might be alleged or construed to impose a duty on the Architect beyond those duties impo sed by this Agreement or subject the Architect to liabiliti es, claims or causes of action other than those that would be available to the Owner under this Agreement. \u00a7 10.5 Nothing contained in this Agreement shall create a contractual relationship with or a cause of action in favor of a third party against either the Owner or Architect. \u00a7 10.6 Unless otherwise required in this A!:,rreement, the Architect shall have no respon sibility for the discovery, presence, handling, removal or dispo sal of, or exposure of persons to, hazardous material s or toxic substances in any form at the Project site. \u00a7 10.7 The Architect shall have the right to include photographic or miistic repre sentations of the design of the Project among the Architect 's promotional and profe ssional material s. The Architect shall be given reasonable access to the completed Project to make such repre sentation s. However , the Architect 's materi als shall not include the Owner's confidential or proprietar y information if the Owner has previously advised the Architect in writing of the specific information considered by the Owner to be confidential or proprietary. The Owner may, if requested by Architect, provide professional credit for the Architect in the Owner's promotional materia ls for the Project. \u00a7 10.8 lfthe Architect or Owner recei ves information specificall y designated by the other party as \"confidentia l\" or \"business proprietary,\" the receiving party shall keep such information strictly confidential and shall not disclose it to any other person except to (1) its employee s, (2) those who need to know the content of such information in order to perform services or construction solely and exclusively for the Project, or (3) its consultants and contractors whose contracts include similar restriction s on the use of confidential information. \u00a7 10.9 E-VERIFY PROVISIONS \u00a7 10.9.1 As required by Indiana Code \u00a722-5 -1.7, as amend ed. Architect will enroll in and verify the work eligibility status of all newly hired emplo yees through theE- VerifY Program for as long as the program remains in existence. The Architect will sign Owner 's affidavit to this effect, as well as certifYing that the Architect does not knowingly employ an unauthorized alien. \u00a7 10.9.2 Architect represents that it is enrolled in and verified the work eligibility status of all newly hired emplo yees of the Architect through the E-Verify Program as defined herein ; however , Architect is not required to verify the work eligibil ity status of all newly hired employees of the Architect throu gh the E-Verify Program if the E-Verify Program no longer exists and Architect signs an Affidavit affirming that the Architectdoes not knowingly employ an unauthorized alien. E-Verify Program means the electronic verification of work authorization program of the Illegal Immigration Reform and Immigr ation Responsibilit y Act of 1996 (P.L. 1 04-208) , Division C, Title IV, s.403(a), as amended, operated by the U nited States Department of Homeland Security or a successor work authorization program designated by the United States Department of Homeland Security or other federal agency authorized to verify the work authorization status of newly hired employees under the Immigration Reform and Control Act of 1986 (P.L. 99-603) (the \"E-VerifY Program\"). \u00a7 10.9.3 Architect and its consultant( s) may not knowingly employ or contract with an unauthorized alien; or retain an employee or contract with a person that the Architect or its consultant subsequentl y learns is an unauthorized alien. lf Architect violates this requirement , the Owner shall require in writing that the Architect remedy the violation not later than thi1iy (30) days after the date the Owner notifies the Architect of the violation. There is a rebuttable presumption that Architect did not knowingly emplo y an unauthorized alien if the Architect verified the work eligibility of the emplo yee through theE- Verify Program . If the Architect fails to remedy the violation within the thi1iy (30) day period , the Owner shall terminate the Agreement with Architect for breach. Howev er, if Owner determine s that tenninat ing the Agreement would be detrimental to the public interest or public property , the Owner may allow the Agreement to remain in effect until the Owner procures a replacement Architect. If the Owner terminate s the Agreement, the Architect shall be liable to the Owner for any and all actual damages incun\u00b7ed, including, but not limited to, attomeys' fees. AlA Document B132TM- 2009 (formerly 6141 TMCMa- 1992). Copyright\u00a9 1992 and 2009 by The American Institute of Architects. All rights reserved. WARNING: This AI At, Document is protected by U.S. Copyright Law and International Treaties . Unauthorized reproduction or distri bution of this AlA ~ 20 Document , or any portion of it, may result in severe civil and crim inal penalties , and will be prosecuted to the maximu m extent possible under the law. ThiS document was produced by AlA softWare at 13:26\"47 on 08/01/2017 under Order No.2341018896_1 which expires on 01/01/2018 . and is not for resale . User Note s: (1232093781) I nit. \u00a7 10.9.4 Architect's consultant{s) shall certifY to Architect in a manner consistent with federal law that the Architect's consultant{ s), at the time of certification , does not knowingly employ or contract with an unauthorized alien; and has enrolled and is participating in the E-Verif)' Program. \u00a7 10.9.5 Architect shall maintain in its files a certification of each of its consultant(s) throughout the duration of the term of this Agreement and the term of Architect's agreement with its consultant(s). \u00a7 10.9.6 Termination of the Agreement for violation ofthis requirement may not be considered by the Architect or its consultant(s) as a breach of contract by the Owner. \u00a7 10.10 BACKGROUND CHECKS \u00a7 10.10.1 The Owner will require the Architect to conduct a background check for criminal history for all workers on the Project in comp liance with Indiana Code \u00a720-26-5 -1 0 and \u00a720-26-5- 11 for the last ten (I 0) years. \u00a7 10.10.2 The Architect shall provide, when awarded the right to provide services under this Agreement, a list of all personnel used by or on behalf of the Architect , whether employed by them or not, who will be engaged in the providing services . The list ofpersons shall be provided written evidence of a criminal record searc h with respect to all persons on the list dated within thirty (30) days of the said date of the Af,>Teement and extending at least ten ( 1 0) years prior. \u00a7 10.10.3 Architect agrees that no person will be providing services who has any criminal conviction for any type of behavior that would place the student s or staff at risk. If evidence of such behavior occurs after this initial search, but during their employment on Project, such worker shall be removed immediately fi\u00b7om the Project and shall be banned for the duration of the Project. Evidence of behavior that is prohibited would includ e, but not limited to, the following : ( 1) Murde r [IC \u00a734-42-1-1]. (2) Causing suicide [IC \u00a735-42-1-2]. (3) Assisting suicide [IC \u00a735-42-1-2 .5]. ( 4) Volun tary manslaughter (IC \u00a735-42- 1-3]. (5) Reckless homi cide [IC \u00a735-42-1 -5]. (6) Battery [IC \u00a735-42-2-1] unless ten ( 1 0) years have elapsed rrom the date the individual was discharged fi\u00b7om probation , impr isonment , or parole, whichever is later. (7) Aggravated batte ry [IC \u00a735-42-2-1 .5]. (8) Kidnapping (IC \u00a735-42-3-2]. (9) Criminal confinement [IC \u00a735-42-3-3]. (I 0) A sex offense under ([IC \u00a735-42-4 ]. (II) Carjacking [IC \u00a735-42-5-2]. {12) Arson [IC \u00a735-43- 1-1] unless ten (10) years have elapsed rrom the date the individual was discharged rrom probation, imprisonment, or parole , whichever is later. {13) Incest [IC \u00a735-46- 1-3]. ( 14) Neglect of a dependent (!C \u00a735- 46-l -4(a)( 1) and IC \u00a735-46-1-4(a)(2)] unless ten (I 0) years have elapsed rrom the date the individual was discharged fi\u00b7om probation, imprisonment or parole , whic hever is later. ( 15) Child selling [IC \u00a735-46-l-4(b)]. (16) Contributing to the delinquency of a minor [IC \u00a735-46- 1-8] unless ten (10) years have elapsed from the date the individual was discharged fi\u00b7om probation, imprisonment, or parole , whichever is later. (17) An offense involving a weapon under IC \u00a735-47 unless ten (10) years have elapsed from the date the individual was discharged from probation, imprisonment, or parole, whichever is later. ( 18) An offense relating to controlling substance s under IC \u00a735-48-4 unless ten (I 0) years have elapsed fi\u00b7om the date the individual was discharge d from probation, imprisonment, or parole, whichever is later. ( 19) An offen se relating to material or a performance that is hannful to minors or obscene under IC 35-49-3 unless ten (1 0) years have elapsed rrom the date the individual was discharged rrom probation, impri sonment , or parole, whichever is later . AlA Document 8132\"'- 2009 (formerly B141'\"CMa -1992) . Copy right\u00a9 1992 and 2009 by The American Institute of Architects. All rights reserved. WARNING : This AlA' ' Document is protected by U.S. Copyright Law and International Treat ies. Unauthoriz ed reproduction or distribution of this AlA' ' 21 Document, or any portion of it, may result in severe civil and criminal penaltie s, and will be prosecuted to the maximum extent possible unde r the law. This document was produced by AlA software at 13:26:47 on 08/0112017 under Order No.2341018896_1 which expires on 01/01/2018 , and is not forresale User Notes : (1232093781) I nit. (20) An oftense relating to operating a motor vehicle while intoxicated under IC \u00a79-30 -5 unless five (5) years have elapsed fi\u00b7om the date the individual was discharged fi\u00b7om probation , impri sonment , or parole. whichever is later. (21) An offense that is substanti al equiva lent to any of the offenses listed in this subsection in which the judgment of conviction was entered under the law of any other jurisdiction. Should the Architect change personnel durin g the existe nce of the Agreement providin g for service s, it shall at least ten (1 0) days prior to using any other personne l other than those previou sly disclo sed, provid e the same information for the new perso nnel as provided for under the tenn s of the provision. \u00a7 10.11 DRUG TESTING \u00a7 10.11.1 The Owner will require the Architect to conduct testing for drugs and alcohol for all workers on the Project. Drugs and alcohol shall be as defined by Indiana Code \u00a735-48 -4-4. The Architect shall provide, when awarded the right to provide services under this Agreement, a list of all personnel used by or on behalf of the Architect, whether employed by them or not, who will be engaged in the providing of services . The list of persons shall be provided written evidence of drug and alcoho l testing with respect to all persons on the list dated within seven (7) days of the said date of the Agreement. Architect agrees that no person will be providin g services who has tested positive to any of the items included and shall be banned fi\u00b701n thejobsite for the duration ofthe Project . Continued testing shall be cond ucted throughout the Project duration every six (6) months maximum. Any persons testing positive shall be removed imm ediately from the site and shall be banned from the jobsite for the duration of the Project. The Architects and their employees shall meet all State and Federal statutor y requirement s. \u00a7 10.12 FIRE ARMS \u00a7 10.12 .1 There shall be no fireann s allowed on the Project site or anywhere within the Project property . Exceptions would be made for law enforcement officials, security forces required elsewhere by these Specifications, or per other requireme nts or allowances specificall y made by the Owner. \u00a7 10.13 NO SMOKING OR TOBACCO \u00a7 10.13.1 There shall be no smoki ng or tobacco use allowed within the Proje ct buildings. on the Project site or anywhere within the Project property. Violator s shall be removed from the Prc~ject immediat ely. Any construction materia ls in contact with or exposure to such tobacc o produc ts shall be removed and replaced with new. at the responsible party' s expense. \u00a7 10.14 ADDITIONAL PROTECTIONS \u00a7 10.14.1Additional requirements and level s of protection are afforded to Public Building s in compliance with Indiana Code \u00a7 16-41-37, and include an enclo sed struc ture or part of an enclosed structure that is one of the following: (I) Occup ied by an agency of state or local governme nt. (2) Used as a classroom building or a dining area at a s tate educational institution (as defined in IC \u00a720-12-0.5- 1 ). (3) Used as a public school (as defined in IC"
      ],
      "ground_truth_context": [
        "The physical parameters for the Project are as set forth in the program identified in Section 2.2.4. Additional parameters for the Project are contained in the Construction Documents and any other restrictions on the site available by actual/constructive knowledge or notice."
      ],
      "metadata": {
        "question_id": 343,
        "RFP_id": "infra_4",
        "RFP_type": "infra",
        "chunks": [
          22
        ],
        "manually_edited": false
      },
      "timing": {
        "retrieve_context": 0.0697639833797108,
        "llm_response": 0.8188738822937012,
        "total": 0.888637865673412
      }
    },
    {
      "question": "What contract document must the selected A/E enter into?**",
      "llm_response": "The selected A/E must enter into the District\u2019s AIA Document B132-2009 Standard Form of Agreement Between Owner and Architect, Construction Manager as Adviser Edition, as modified by the District and included in these RFP Documents.",
      "ground_truth_answer": "The selected A/E must enter into the District's modified AIA Document B132-2009 Standard Form of Agreement Between Owner and Architect, Construction Manager as Adviser Edition.",
      "retrieved_context": [
        "The responses will be reviewed an evaluation panel consisting of individual s selected by the \nDistrict.   Responding A/E(s) will bear all costs of this RFP and interviews, if any.  \n\nProposals will be reviewed using the following criteria /elements:  \no Conciseness, responsiveness and completeness of the proposal to the inform ation \nrequested, objectives, and deliverables as outline in the RFP  \no Consultant / Supplier Diversity inclusion  \no Fee Proposal / Cost: Overall fee / billing rates  \no Prior experience, Qualifications, References, Past Performance of A/E  \no Experience / Expertise in K -12 School Projects  8 \n o Experience with Sustainable or \u201cGreen\u201d Design  \no Level of Innovation with a Focus on our Educational Vision  \no A/E\u2019s Technological Capabilities (to  manage this project in a paperless or almost \npaperless manner)  \n\nAt the District\u2019s discretion, to further assist in evaluation, some, one, o r all of the responding \nA/E(s) and/or individuals may be requested to participate in an interview proc ess. The inter view \nwill be used as another opportunity to clarify any issues within a given Pr oposal and explore the \napproaches that may be used to satisfy all requirements for the District.  \n\nA/E(s) shall submit fee proposal using the Fee Proposal Form provided with thi s RFP. At the \nDistrict\u2019s discretion, it may directly negotiate with the best qualified A/E on final scope and fee.  \n\nThe District may  also consider alternative proposals to provide A/E services if there is an  \nopportunity for substantive savings (without adv ersely affecting the project timeline or quality) \nand other significant benefits (to be clearly articulated by the proposer and be  measureable) \naccruing to the District.  \n\nThe District may investigate the qualification of any individual or A/E under consideration, \nrequire confirmation of information furnished and require additional evidence of quali fications \nto perform the services described in this RFP. The District also reserves certain rights, including, \nbut not limited to, the following:  \n\na. Reject a ny or all of the proposals  \nb. Issue subsequent Requests for Proposals  \nc. Cancel the entire Request for Proposal  \nd. Remedy technical errors in the Request for Proposal process  \ne. Appoint evaluation committees to review qualifications and proposals  \nf. Seek the assistance o f outside technical experts in evaluation  \ng. Approve or disapprove the use of particular subcontractors  \nh. Establish a short list of A/E(s) eligible for discussions after review of RFP  \ni. Negotiate with any, all, or none of the A/E(s)  \nj. Solicit best and final offers from all, some, or one of the A/E(s)  \nk. Award a contract to one or more A/E(s)  \nl. Waive informalities and irregularities in RFP  \nm. Award without discussion  \n\nSelection will be based upon a determination as to which proposal is in th e best interest of the \nMetropolita n School District of Washington Township. Any decision made by the District,  \nincluding the selection of A/E, shall be final and is NOT subject to appeal.  \n\nThis RFP shall not, in any manner, be construed to be an obligation on the Distri ct to enter into \na contract or result in any claim for reimbursement of cost for any efforts exp ended in \nresponding to the RFP or in anticipation of any contract.  9 \n  \nAward of Agreement.  Upon the completion of the selection process, the  District shall notify all \nA/E(s) of the selection and the successful A/E shall enter into the District\u2019 s AIA Document B132 -\n2009 Standard Form of Agreement Between Owner and Architect, Construction Man ager as \nAdviser Edition, as modified by the District and included in these RFP Documents (the \n\u201cAgreement\u201d).  The Agreement includes AIA Document A232 \u2013 2009 General Conditions of the \nContract for Construction, Construction Manager as Advisor Edition modified  by the District and \nis available for review upon A/E\u2019s request to District.  A/E\u2019s Proposal and Fee  shall be based on \nthe terms of the Agreement as contained herein and the modified General Conditi ons without \nqualification or exception.   \n\n \nX. Submittal Requ irements  ",
        "Address:   ____________________________________________________________  \n\n   ____________________________________________________________  \n\nContact:   ____________________________________________________________  \n\nTelephone:   ____________________________________________________________  \n\nFax:   ____________________________________________________________   \n  \nE-mail:    ____________________________________________________________  \n  \n\nPlease state the fees for this project below:  \n      \nFEE FOR ALL PHASES OF PROJECT \u2013 Vision and Pre -Design (Phase 1), Conceptual / Schematic Design \n(Phase II), Design Development (Phase III), C onstruction Documents (Phase IV), Bidding and Contract \nAward (Phase V) and Construction Administration, Project Closeout and Warranty  (Phase VI).  The Fee \nshall be expressed as a flat dollar of total construction costs for the Project (the only allowable \nreimbursable will be plan submittal fees and plan printing costs in the Bidding & Con tract Award phase \n\u2013 all other costs are within the Fee of:  $_________________  \n\nThe undersigned attests that the information contained within the proposal i s accurate to the  best of \nhis/her knowledge, and that the A/E he/she represents. If selected, agrees to incorporate the \nrequirement of this RFP in the final contract with the District.  \n\nSignature of Person  Authorized to Submit Proposal:  ____________________________________  \n\nTyped Name of Signature Above:    ____________________________________   \n\n ",
        "\u00a720-18-2-15). ( 4) Licen sed as a health facility under IC \u00a7 16-21 or IC \u00a7 16-28 . (5) Used as a station for paid firefighters . (6) Used as a station for paid police officers. (7) Licensed as a child care center or child care home or registered as a child care mini stry under IC \u00a7 12-17 .2. (8) Licensed as a hospita l under IC \u00a7I 6-21 or a county hospital subject to IC \u00a7I 6-22 . (9) Used as a provider 's office . (I 0) Schoo l bus (as defined in IC \u00a7 16-41-37-2.3). \u00a7 10.15 Policies Of Employment \u00a7 10.15.1 The Architect , and the Architect 's consu ltants shall comply with all federa l, state, and municipal and local rules, ordinances , rules , regulations , orders , notice s and requirements relatin g to non-discrimin ation in employment , fair emplo yment practices , and equal employment opportunity practice s, without additional charge or expense to the Owner. The Architect, and the Architect ' s consultant' s shall be responsible for and shall correct , at its own cost and expense , any violations of this Section resulting fi\u00b7om, or in connection with, perform ance of the Work at the Project. AlA Docum ent B132 TM-2009 (formerly B141 rMCMa- 1992) . Copyr ight\u00a9 1992 and 2009 by The American Institute of Architects. All rights reserved . WARNING : This AlA\" Document is protec ted by U.S. Copyright Law and Internat ional Treaties . Unauthor ized reprod uction or distribution of this AlA ~ \u00b7 22 Document , or any portio n of it, may result in severe civil and criminal pena lties, and will be prose cuted to the maxim um extent possible under the law. This document was produced by AlA softWare at 13:26:47 on 08/01/2017 under Order No.2341 018896 _1 which expires on 01/01/2018 , and is not for resale. User Notes : (123209378 1) I nit. The Architect shall also, i frequested by the Owner, furnish such proof of its comp liance with the requirements this Section . Upon any alleged violation of this Section, the Architect shall indemnity and hold harmle ss the Owner against any and all claims. losses. costs. damage s and expenses, including attorney s' fees, asserted against the Owne r. \u00a71 0.16 Equal Opportuni ties For Minority, Women And Veteran or Disabled Busin ess Enterprises Improvements under this Agreement are subject to the Owner's initiative concerning equa l oppo rtuniti es for minority business enterprises and women's business enterprises to participate in procurement and contracting proces ses. Architect , has submitted and Owne r accepted Architect's participation levels for mino rity business enterprises, women's busines s enterprises, and veteran or disabled business enterprises in the performance ofthe Work consistent with the goals of delivering the Project on time and within the budgeted amount . The services are subjec t to the provisions of equal opportunitie s for minority business enterpri ses, women 's busine ss en terprises and veteran or disabled business enterprise s to participate in procurement and contracting processes, consistent with the goals of delivering the Project. In connection with the Substantial Completion, Architect shall certify compl iance with those goals and the level of particip ation or minority business enterprises, women 's business enterprises. veteran or disabled busine ss enterpri ses that was achieved in connection with undertaking the services. The Architect , and the Architect ' s consultants shall compl y with any guideline s or compliance program s required by the Owner, including , but not limited to, Owner 's Minorit y, Women, and Veterans or Disabled Business Enterpri ses Project- Wide Participation Program , if any. ARTICLE 11 COMPE NSATION \u00a7 11.1 For the Architect's Basic Services described under Article 3, the Owner shall compensate the Architect as follow s: (Paragraph delet ed) \u00a7 11.2 For Additiona l Services designated in Section 4.1. the Owner shall compensate the Architect as agreed by the parti es and at the attached rates . See attached . \u00a7 11.3 For Addit ional Services that may arise during the course of the Project , including those under Section 4.3. the Owner shall compensate the Architect as agreed by the partie s and at the attached rates. See attached \u00a7 11.4 Compensation for Additiona l Services of the Architect' s consultants when not included in Sections 1 I .2 or 11.3, shall be the amount invoiced to the Architect plus ten percent ( 1 0%), or as otherwi se stated below : NONE \u00a7 11.5 Compensa tion for Basic Service s is based on a stipulated sum, the compensation for each phase of services shall be as follows: Programmin g/Standards I Contractual/Schematic Design Phase percent %) II ( Design Development Phase Ill percent %) ( Construction Documen ts Phase IV percent %) ( Bidding or Contract _ Phase V pe rcent %) ( Construction Admin & Closeout percent %) Phase VI ( AlA Document 8132\"'-2009 (f onnerly B141fMCMa -1992). Copyr ight\u00a9 1992 and 2009 by The Amer ican Institute of Architects. All rights reserved . WARNING : This AlA*' Document is protected by U.S. Copyr ight Law and Internat ional Treaties. Unauthorized reproduction or distri bution of this AlA ~ 23 Document, or any portion of it, may result in severe civil and crimina l pena lties, and will be prosecuted to the maximu m extent poss ible under the law. This document was produced by AlA software at 13:26:47 on 08/01/2017 under Order No.2341018896_1 which expires on 01/01/2018 , and is not for resale . User Notes: (12320937 81) I nit. Total Basic Compen sation (Paragrap h del eted) \u00a7 11.6 [Sn\u00b7icken ]. one hundred percent 100 %) ( \u00a7 11.7 The hourl y billin g rates for services of the Architect and the Architect's consulta nts, if any, shall be attached . The rates sha ll be adjusted in accorda nce with the Architect's and Architect' s consulta nts' norm al review practices. (Paragrap hs deleted) (Table deleted) \u00a7 11.8 Compensation for Reimbursable Expenses \u00a7 11.8.1 Reimbursable Expenses are in addition to compen sation for Basic and Additional Services and include expenses incurred by the Architect and the Architect' s consu ltants directly relat ed to the Project, as tbllows: .1 Trans portation and authorized out-of-town travel and subsistence; .2 Long distance service s. dedicated data and communicati on services, teleconferen ces, Project Web sites, and extranet s; .3 Fees paid for securing approval of authorities having jurisdiction over the Project; .4 Printing . reproduction s, plots, standard form docum ents; .5 Postage, handlin g and delivery; .6 Expense of overtime work requiring higher than regular rates , if authorized in advance by the Owner ; .7 Renderin gs, model s, mock-u ps, profe ssional photograph y, and presentation materials requested by the Owner; .8 Architect's Consultan t's expense of professional liability insurance dedicated exclusively to this Project , or the expense of additi onal insurance coverag e or limit s if the Owner requests such insurance in exces s of that norm ally carried by the Architect's consultant s; .9 A ll taxes levied on professional services and on reimbur sable expenses: .10 Site office expen ses; and .11 Othe r similar Projec t-related expend itures. \u00a7 11.8.2 For Reimbur sable Expen ses the compensation shall be the expenses incurred by the Architect and the Architect's consu ltants plus ten percent ( 1 0%) of the expe nses incurred , with the maximum not to excee d \"$ \" for each elementa ry Project. \u00a7 11.9 Compensation for Use of Architect 's Drawings and Specifications If the Owner terminate s the Architect for its conven ience under Sectio n 9.5, or the Architect terminate s this Agreement under Section 9.3, the Owne r sha ll pay a licens ing fee as compe nsation for the Owner 's continu ed use of the Architect' s Instrum ents of Service solely for purpo ses of comp leting. using and maintaining the Project as follow s: See Article 7 \u00a7 11.10 Payments to the Architect \u00a7 11.10.1 An initial payment of zero dollar s ($0) shall be made upon execution ofthis Agreement and is the minimum payment under this Agreement. It shall be credited to the Oviner's account in the final invoice. \u00a7 11.10.2 Unle ss otherwise agreed, payment s for services shall be made monthl y in proportion to service s performed . Payments are due and payab le within thitty (30) days of presentation of the Architect' s invoice. Amounts unpaid sixty-days (60) days after the invoice date shall not bear intere st, or in the absence thereof at the legal rate prevailing from time to time at the principal place of business of the Archite ct. (Insert rate q( monthly or annual interest agr eed upon.) None \u00a7 11.10.3 The Owner shall not withhold amount s from the Architect's compensation to impose a penalty or liquidated damages on the Architect , or to offset smns requested by or paid to contract ors for the cost of change s in the Work, or to offset or comp ensate the Owner for sums that are claimed by the Owner as loss or damage s caused AlA Document 8132rM -2009 (formerly 8141 TMCMa -1992) . Copyright \u00a9 1992 and 2009 by The American Institute of Architects. All rights reserved . WARN ING: This A l A ~ \u00b7 Document is protected by U.S. Copyright Law and International Treaties . Unautho rized reproduction or distribution of this AlA\" 24 Document , or any portion of it, may result in severe civil and crim inal penalties , and will be prosecuted to the maximum extent poss ible under the law. This document was produced by AlA software al13:26:47 on 08/01/2017 under Order No.2341018896_1 which expires on 01/01/2018 . and is not for resale. User Note s: (1232093781) I nit. by alleged negligence or other purported fault of the Architect unless the Architect agrees or has been found liable to r the amounts in a bindin g dispute resolu tion proceed ing. \u00a7 11.10.4 Record s of Reimbur sable Expenses , expenses pertaining to Addit ional Services. and services performed on the basis of hourly rates shall be available to the Owner at mutuall y conv enient times. ARTICLE 12 SPECIAL TERMS AND CONDITIONS Special te rms and conditions that modify this Agreement are as follows: \u00a7 12.1 ADDIT IONAL PARAMETERS \u00a7 12.1.1 The physical parameters for the Project are as set forth in the prog ram identified in Section 2.2.4. Additiona l parameter s for the Projec t are contained in the Construction Docu ments and any other restriction s on the site available by actua l/constructive knowl edge or notic e. \u00a7 12.2 PROJECT TEAM \u00a7 12.2.1 The Architect agree s and acknowledges that the timel y and cost effective comp letion of the Project is in part depend ent on there being no chan ges in the representative(s) ofthe Agreement. If the Architect contemplates any change s in the representative(s), the Architect shall imme diatel y provide written notice to the Owner of any proposed change . The Owner shall have the right to withhold consent to another individu al serving as a designated representative other than one already designed, which consent shall not be unreasonab ly withheld. If the Owner conse nts to a new representative, the Architect shall ensure that the change in representative shall not have any negative impact on the Architect's Services required unde r this Agreement. The Architect further agrees that it will not charge Owner for any cost, service , expense , or any other item that Architect incurs because of the change in repre sentative other than charges that Owner has already agreed to pay. The Architect shall also reimbur se Owner for any cost, loss, damage (including attorn ey's fees) that Owner incur s because of any change in the desib'llated representativ e(s) and that such obligation shall continue notwithstanding the expiration or termination of this Agreement. ARTICLE 13 SCOPE OF THE AGREEMEN T \u00a7 13.1 This Agree ment represents the entire and integrated agreement between the Owner and the Architect and supersedes all prior negot iation s. represen tations or agreement s, either written or oral. This Agr eement may be amen ded only by written instrument signed by both Owner and Arch itect. \u00a7 13.2 This Agreement is comprised of the followin g document s listed below: .1 This modified AlA D ocument Bl 32\u2122-2 009, Standard Form Agreement Between Owner and Architect, Construction Mana ger as Adviser Edition .2 AlA Document E201 TM-2007, Digital Data Protoco l Exhibit, if comp leted, or the followin g: None .3 AlA Document E202T11C2008 , Building Information Mode ling Protocol Exhibit, if completed , or the following : None .4 Other document s: (List other documents, [{any, including additional scopes ofservicefor ming part oft he Agree ment.) Modified AlA Document A232-2 009, General Conditions of the Contract for Constru ction .5 Project Addenda: Date Title Amount AlA Document B132r\"'- 2009 (formerly B141'\"'CMa -1992) . Copy right\u00a9 1992 and 2009 by The Ameri can Institute of Architects . All rights reserved. WARNING : This AlA ~ Document is protected by U.S. Copy right Law and International Treaties. Unauthorized reproduction or distribution of this AlA\"' Docume nt, or any portion of it, may re sult in severe civil and crimina l penalties , and will be pros ecuted to the maxim um extent possib le under the law. This document was produced by AlA software at 13'26: 47 on 08/01/2017 under Orde r No.2341 018896_1 which expires on 01/01/20 18, and is not for resale . User Notes: (1232 093781) 25 I nit. AlA Document 8132 \"'-2009 (formerly 8141 \"'CMa -1992). Copyright \u00a9 1992 and 2009 by The Amer ican Institute of Architects. All rights reserved . WARNING : This AIA ~t Document is protected by U.S. Copy right Law and International Treaties. Unauthoriz ed reprodu ction or distrib ution of this AlA., Docume nt, or any portion of it, may result in seve re civil and criminal penalties , and will be pros ecuted to the maximum extent possib le under the law. This document was produced by AlA software a\\13:26:47 on 08/01/2017 under Order No.2341018896 _1 wh ich expires on 01/01/2018, and is not for resale . User Notes : (1232093781 ) 26 I nit. This Agre ement is entered into as of the day and year ftrst written above. OWNER (Signatur e) Board President. (Printed name and title) MSD ofWa shington Town ship 8550 Woodfield Cr ossing Blvd. Indianap olis, IN 46240 OWNER (Signature) Board Secretary. (Printed name and title) MSD of Washington Town ship 8550 Woodfie ld Crossing Blvd. Indianapoli s, lN 46240 ARCHITECT (Signature) (Printed name and title) AlA Document B132 \" ' - 2009 (formerly 8141 \u2022wcMa -1992). Copyri ght \u00a9 1992 and 2009 by The A merican In stitute of Architects. All rights reserved . WARNING : This AtA\u2022 Document is protected by U.S. Copyright Law and International Treaties. Unauthor ized reproductio n or distribution of this AtA\u2022 Document, or any portion o f it, may result in severe civil and criminal penalties, and wi ll be prosecuted to the maxim um extent possib le und er the law. Thts docum ent was produced by AlA software at 13: 26:47 on 08/01/ 2017 unde r Orde r No. 2341018896 _1 which expires on 01/01/2018. and is not for resale User Notes : (12320937 81) 27",
        "The final co nstruction documents shall include as a minimum: Site Plan, Landscaping Plan , \nStorm water Management Plan, Roof Plan, Drainage Plan, Floor Plan(s), Exterior E levations, \nBuilding Sections, Foundation Plan, Framing Plan(s), Details, Plumbing Isomet rics, Door  / \nWindow / Room finish / Header / Plumbing / Electrical schedule, HVAC P lans, Electrical \nPlans, Submittal Worksheets and the project manual including specifications i n the CSI \ndivision format.  \n\n \n 5 \n \u2022 Bidding & Contract Award (Phase V)  \nThe A/E will assist the  District and Construction Manager (CM) in bidding the project to \nprospective prime contractors. Services will include assisting the CM with the distribution of \nplans and specifications, assisting with sub -contractor pre -bid meetings, assisting with \nformul ating responses to prospective bidders\u2019 questions, issuing addendums (if neces sary), \nattendance at the bid opening, and providing the District with a recommendation for p rime \ncontract awards.  \n\n\u2022 Construction Administration & Project Closeout (Phase VI)  \nThe A/E shall be a representative of and shall advise and consult with the Dis trict during \nconstruction until the final payment to prime contractors is due and during th e correction \nperiod described in the Contract Documents.  \n\na. Plan Approvals - The A/E is respo nsible for the procurement of ALL plan approvals from \nthe local municipal (ies), Marion County, and the State of Indiana Departmen t of \nCommerce, Safety & Building Division for the building(s) including, but not limited  to, \nStorm water Management, HVAC, Mec hanical , plumbing  and/or Fire Protection.  \n\nb. Construction Related Services - The A/E will provide on the District\u2019s behalf, \nconstruction administration and inspection services. At a minimum, services to b e \nprovided consist of coordinating regular progress meetings, review of  shop drawings, \nassist Dis trict in floor and finish material selection, undertake construction observ ation, \nprocess certificates for payment to prime contractors, and facilitate prepa ration of final \nrecord drawings, warranty follow -up and project closeout.  \n\nThe A/E, in conjunction  with the Construction Manager, shall provide updated budgetary cost \nestimates during each phase of the design process.  \n\nIV. Design Guidelines  \nThe District will require the A/E to integrate sustainable principles/desig n into the District\u2019s \nprojects. The A/E sh all apply/utilize standards found in the Leadership in Energy & \nEnvironmental Design Green Building Rating System, Declare, Cradle to Cradle  or other \nnationally recognized sustainability program/certification. The District may  consider \npursuing LEED or oth er sustainability program/certification. The District may  engage the \nservices on an independent commission agent/authority.  \n\nThe A/E shall integrate District\u2019s vision for teaching & learning concepts in to the program \nand design of all projects.  \nThe A/E sha ll include options in the program and design to expand District\u2019s options for \ncommunity access and use of facilities.  \n\nV. Project Construction Timeline -November 2017 thru August 2021  \n\n 6 \n VI. RFP Timeline  ",
        "VIII. Proposal Response  7 \n  \nRespondents to this RFP shall include the following minimum information in the ir proposal:  \n\na. Describe how A/E will organize and perform the work described in the Scope of Services \nsection. List the names of any sub -consultants that are intended to be used on the \nproject and the specific services to be provided the sub -consultant(s).  \n\nb. Describe A/E\u2019s understanding of the project and the planned approach to achieve the \ngoals of the project. Submittal shall include a listing of contemplated tasks and number \nof estimated hours by personnel classification/discipline for eac h phase of the pro ject.  \n\nc. Describe sustainable or \u201cgreen\u201d design experience as well as experience workin g with \nFocus on Energy.  \n\nd. Include conceptual time schedules and related expectations/obligations of the D istrict \nneeded to complete the scope of work specified based on occupancy for all projects by \nSeptember 2021.  \n\ne. Provide a fee proposal using the attached fee proposal spreadsheet. Fees shall include \nALL meetings needed to successfully complete this project and ALL reimbursabl e costs \nother than plan/document printing cos ts (incurred for this bidding phase of the \nproject) and required plan submittal fees.  \n\nf. Provide a description of any possible additional related costs and/or fees  (not included \nin your base fee) that the District might incur as a result of this design proce ss. \n\ng. Provide a description of monthly status reports, e.g. project timeline, d eliverables, costs \nincurred to date, and costs to project timeline.  \n\nh. Consultant / Supplier Diversity inclusion in the present RFP and past projec ts.  \n\nIX. Proposal Evaluation/Selecti on Process / Agreement Award  "
      ],
      "ground_truth_context": [
        "The successful A/E shall enter into the District's AIA Document B132 - 2009 Standard Form of Agreement",
        "modified by the District and included in these RFP Documents (the 'Agreement')."
      ],
      "metadata": {
        "question_id": 272,
        "RFP_id": "infra_4",
        "RFP_type": "infra",
        "chunks": [
          3
        ],
        "manually_edited": false
      },
      "timing": {
        "retrieve_context": 0.0697639833797108,
        "llm_response": 0.8256127834320068,
        "total": 0.8953767668117176
      }
    },
    {
      "question": "What steps are involved in the County's selection procedure for offerors?**",
      "llm_response": "1. Offerors submit written proposals detailing their qualifications and understanding of the request.\n2. The County evaluates the proposals and holds discussions with fully qualified offerors to elaborate on qualifications and answer questions.\n3. The County selects offerors in order of preference based on evaluation factors and information gathered.\n4. Negotiations are conducted with the top-ranked offeror in each category; if unsuccessful, negotiations proceed with the next-ranked offeror until a fair contract is agreed upon.",
      "ground_truth_answer": "Steps include written proposals, discussions with qualified offerors, preference ranking, and contract negotiations.",
      "retrieved_context": [
        "a. description of facilities and production capabilities  \n\n9. At the discussion stage, the County may di scuss with the offeror non- binding \nestimates of total project costs, including, but not limited to, life -cycle costing \nand, where appropriate, non- binding estimates of price for services.  \n\n \nB. SELECTION PROCEDURE  \n\nCaroline County may make final award to multi ple offerors depending upon expertise of \nthe offeror and County needs for different types of Engineering Services.  Assignment of \nwork to successful offerors shall be as previously described in the section entitled \n\"Background Information.\"  Selection of th e successful offerors shall be as follows:  \n\n1. Offerors should make written proposals offering their qualifications and \nunderstanding of the request as presented.  Proposals should be specific as to the \nability to perform Engineering Services and surveying re lated to design and   10 | Page  \nEngineering Services RFP #2020 -05-21 \n operation of water and sewer, solid waste,  capital projects , and other county \ndepartments.  \n\n2. Following evaluation of the written proposals as submitted, the County shall \nengage in individual discussions with the offeror or offerors deeme d fully \nqualified, responsible, and suitable on the basis of the written proposals and \nwith emphasis on professional competence.  Such offerors shall be encouraged \nto elaborate on their qualifications, as well as alternative concepts, and to \nanswer questio ns from evaluation team members.  \n\n3. Following these discussions, on the basis of the evaluation factors listed in this \nrequest and all information developed in the selection process to this point, the \nCounty shall select in the order of preference those offe rors whose professional \nqualifications and proposed services are deemed most meritorious. \n\n4. Negotiations shall then be conducted with the offeror ranked first in each \ncategory of services identified by the County as being needed.  If a satisfactory \ncontract  cannot be successfully negotiated with the offeror ranked first in each \nsuch category, then negotiations with that offeror shall be formally terminated , \nand negotiations shall be conducted with the offeror ranked second, and so on \nuntil such a contract can be negotiated at a fair and reasonable price.  \n\n \nINFORMATION TO BE FURNISHED BY THE OFFEROR  \n\nOfferors are to make written proposals which present the offeror 's qualifications and \nunderstanding of the work to be performed.  Offerors are asked to address ea ch evaluation \ncriterion and to be specific in presenting their qualifications.  Your proposal should include  \nall information which you consider pertinent to your qualifications for this request . ",
        "1. Priority assigned to Caroline County projects by offeror;  \n\n2. Depth and variety of staff expertise, including without limitation:  \n\na. resumes of key individuals  \nb. education  \nc. staff size  \nd. expertise \ne. location of and availability of key personnel and staff (Virginia office)    9 | Page  \nEngineering Services RFP #2020 -05-21 \n  \n3. Managerial capabilities:  \n\na. ability to manage several projects simultaneously and expeditiously  \nb. approach to problem/task resolution \nc. management staff and amount of direct participation \ni. demonstrated interest of consultant  \nii. firm's principals and direct participation in proposed projects  \nd. means of controlling proje ct scope  \ne. evaluation techniques  \nf. data gathering methods  \ng. communication procedures  \nh. team organization and amount of experience as a team  \n\n4. Familiarity with federal, state and local codes, conditions, and ordinances were \nessential to proper performance;  \n\n5. Past per formance record and relevant experience;  \n\na. references \u2013 showing names, addresses, and phone numbers (the County \nreserves the right to contact previous clients and inspect both on- site and \ndesign work)  \nb. quality of work, timeliness, diligence, ability to meet budget  \n\n6. Fiscal stability;  \n\n7. Overall quality of firm and proposal (includes reputation and integrity within \nthe engineering community);  \n\n8. Technical capabilities  ",
        " The Engineer  shall submit plans and  specifications and assist in obtaining approval \nfrom all local, state , and federal regulatory agencies.  \n\n The Engineer  shall furnish the necessary plans and assist in the preparation of the \napplication for Virginia Department of Transportation permits as necessary.  \n\n A letter will be sent in a form approved by the County by the Engineer  to all property \nowners requesting permission to enter their property for surveys.  \n\n No trees or shrubs shall be cut without prior approval of the property owner. \n\n The Engineer  shall prepare all bid documents on forms as approved by the County.  He \nshall furnish the County with four (4) sets of specifications.  The Engineer  shall also \nfurnish four (4) sets of plans to the County 's contractor at no cost.  Additional sets \nwill be furnished at reproduction cost. \n\n The Engineer  shall advertise for bids in local newspaper and furnish plans and \nspecifications at  the Engineer 's sole expense to Dodge Report, Builder 's Exchange , \nand The Association of General Contractors.  Advertisement fo r bids shall be \ncoordinated with the respective County department.  Cost of advertising in newspaper \nwill be paid by the County.  \n\n Monthly progress reports on the construction shall be submitted to the Director of \nPublic Works/ Utilities . \n\n The Engineer  shall  designate in writing a project manager with authority to act on \nbehalf of the firm in technical matter.  \n\n \nSELECTION PROCESS  \n\n \nA. EVALUATION CRITERIA shall include, but are not necessarily limited to: ",
        "1.4 Bidding or Negotiating Phase.  \n\nAfter authorization from the Director of Public Works/ Utilities to proceed with the bidding \nor negotiating phase, the Engineer  shall:  \n\nA. Assist The County  in obtaining bids or negotiating proposals for each prime \ncontract for construction.  \n\nB. Consult with and advise t he County  as to the acceptability of subcontractors and \nother persons and organiza tions proposed by the prime contractor.  \n\nC. Consult with and advise t he County  as to the acceptability of substitute \nmaterials and equipment proposed by contractor.  \n\nD. Assist the County  in evaluating bids or proposals and in assembling and \nawarding contracts.  \n\nE. Prepare four (4) sets of all documents necessary for the County and the \nContractor(s) to enter into a Contract for the construction of the project and \nforward all such documents to the C ontractor for execution. \n\n \n1.5 Constructing Phase:  \n\nDuring the construction phase, the Engineer  shall:  \n\nA. Furnish The County  with an additional three sets of plans and furnish The \nCounty 's Contractor(s) with an additional four (4) sets of plans. ",
        "B. Assist the Engineer  in obtaining permission to enter upon public and private \nproperty as required for  the Engineer  to perform its services.  The County will \nacquire the necessary easements and/or property.  \n\nC. Examine all studies, test results, reports, sketches, drawings, specifications, and \nproposals, and other documents presented by  the Engineer . \n\nD. Pay all advertising costs necessary to obtain bids for contractors.  \n\nE. Designate a person to act as the County 's representative with respect to the work \nto be performed under this agreement.  Such person shall have the authority to \ntransmit instructions, receive information, interpret and define the County 's \npolicies and decisions with respect to materials, equipment, elements, an d \nsystems pertinent to  the Engineer 's services.  \n\n \nDESIGN CRITERIA FOR ALL COUNTY PROJECTS  \n\n \n All designs shall conform to the latest C ounty, state, and federal regulations or \nstandards.  \n\n All designs shall conform to the latest County and state erosion contr ol and \nsedimentation rules, regulations, and ordinances.  An erosion control and \nsedimentation plan must be approved by the County Erosion and Utility Inspection \nDepartment and included in the final approved set of utility plans.  \n\n The Engineer  shall be res ponsible for coordinating his design and construction work \nwith other Engineer s where the projects connect or are affected by other projects.  \n\n The Engineer  shall furnish a set of as -built project plans (recording drawings) as \nreflected by the inspection reports and field notes prepared on blackline mylar film   8 | Page  \nEngineering Services RFP #2020 -05-21 \n from information furnished by the project inspector at no additional cost to the \nCounty.  \n\n A completion date for submittal of engineering plans shall be established.  "
      ],
      "ground_truth_context": [
        "1. Offerors should make written proposals",
        "2. Following evaluation",
        "3.",
        "select in the order of preference",
        "4. Negotiations shall then be conducted with the offeror ranked first."
      ],
      "metadata": {
        "question_id": 81,
        "RFP_id": "infra_1",
        "RFP_type": "infra",
        "chunks": [
          4
        ],
        "manually_edited": false
      },
      "timing": {
        "retrieve_context": 0.0697639833797108,
        "llm_response": 1.9069581031799316,
        "total": 1.9767220865596424
      }
    },
    {
      "question": "How do the design criteria and warranty requirements align for compliance?",
      "llm_response": "Insufficient information to answer question based on given context.",
      "ground_truth_answer": "Designs must conform to County, state, and federal regulations (Excerpt 1, \"Design Criteria\"), while warranties for materials/services under (Section 4) must match the \"most favorable warranties\" provided by the contractor. Non-compliant designs or breached warranties could trigger liability.",
      "retrieved_context": [
        "B. Assist the Engineer  in obtaining permission to enter upon public and private \nproperty as required for  the Engineer  to perform its services.  The County will \nacquire the necessary easements and/or property.  \n\nC. Examine all studies, test results, reports, sketches, drawings, specifications, and \nproposals, and other documents presented by  the Engineer . \n\nD. Pay all advertising costs necessary to obtain bids for contractors.  \n\nE. Designate a person to act as the County 's representative with respect to the work \nto be performed under this agreement.  Such person shall have the authority to \ntransmit instructions, receive information, interpret and define the County 's \npolicies and decisions with respect to materials, equipment, elements, an d \nsystems pertinent to  the Engineer 's services.  \n\n \nDESIGN CRITERIA FOR ALL COUNTY PROJECTS  \n\n \n All designs shall conform to the latest C ounty, state, and federal regulations or \nstandards.  \n\n All designs shall conform to the latest County and state erosion contr ol and \nsedimentation rules, regulations, and ordinances.  An erosion control and \nsedimentation plan must be approved by the County Erosion and Utility Inspection \nDepartment and included in the final approved set of utility plans.  \n\n The Engineer  shall be res ponsible for coordinating his design and construction work \nwith other Engineer s where the projects connect or are affected by other projects.  \n\n The Engineer  shall furnish a set of as -built project plans (recording drawings) as \nreflected by the inspection reports and field notes prepared on blackline mylar film   8 | Page  \nEngineering Services RFP #2020 -05-21 \n from information furnished by the project inspector at no additional cost to the \nCounty.  \n\n A completion date for submittal of engineering plans shall be established.  ",
        " \nD. Prepare preliminary design documents consisting of construction plans, survey \nplats , and specifications. \n\n \nE. Based on the information contained in the preliminary design documents, \nsubmit an opinion of probably project cost including, but not limited to, \nconstruction costs and contingencies. \n\nF. Furnish three (3) copies of the preliminary design documents and the  Engineer 's \nopinion of probable project cost to the County , and present and review them \nwith the County.  \n\nG. Furnish all such documents, plans, and design data as may be required for, and \nassist in the preparation of, the required documents so that the County may \nobtain approvals of all such governmental agencies and authorities as have \njurisdiction over design criteria and environmental impact applicable to the \nproject, and assist in obtaining such approvals by participating in submissions to \nand negotiations with appropriate officials and authorities, including \nadministrative hearings involv ing the project .  The Engineer  will attend as many \nhearings and meetings as are necessary to obtain such approval.  \n\n1.3 Final Design Phase.  \n\nUpon completion of the preliminary design phase and notification by the County that the \npreliminary design documents ar e acceptable in all respects to the County and to all \ngovernmental agencies and authorities as have jurisdiction over design criteria and \nenvironmental impact applicable to the project, the Engineer  shall: \n\nA. On the basis of the preliminary design documents as finally approved, prepare \nthe final construction plans and specifications, easements plats, and the \ncontractor documents, which shall include bid forms, notice to bidders, \ninstructions to bidders, advertisement, bid proposals, contract form, bonding \nand insurance requirements and, where applicable, federal compliance \nrequirements, and assist in the preparation of other related documents. \n\nB. Furnish all such documents, plans, and design data as may be required for , and \nassist in the preparation of , the requ ired documents so that the County may \nobtain approval of such from all governmental agencies and authorities as have \njurisdiction over design criteria and environmental impact applicable to the \nproject, and assist in obtaining such approvals by participati ng in submissions to \nand negotiations with appropriate officials and authorities, including \nadministrative hearings involving the project .  The Engineer  will attend as many \nhearings and meetings as are necessary to obtain such approval.  \n   5 | Page  \nEngineering Services RFP #2020 -05-21 \n C. Furnish The County  with a revised opinion of probable project cost based on the \nfinal plans and specifications and other related documents. \n\nD. Prepare any necessary documents for alternate bids requested by the County.  \n\nE. Furnish as required copies of the final plans and specif ication, contract \ndocuments, and all other related documents to the County and present and \nreview all such documents with the County.  ",
        "13.   Liability Coverage  \n\n Unless otherwise expressly excepted in the procurement announcement documents prepared by the \nCounty, the Contractor shall take out and maintain during the life of the Contract such bodily injury, liability \nand property damage liability insurance as shall protect it and the County from claims for damages for \npersonal injury, including death, as  well as from claims for property damage, which may arise from its \nactivities under this agreement.  Such insurance shall at least have the coverages and be in the amounts set \nforth in section 15 \"Insurance and Bond Requirements \" set forth below and shall name the Board of \nSupervisors and the County as  Additional Insureds.  Such insurance must be issued by a company admitted \nwithin the Commonwealth of Virginia and with at least a Best 's Key Rating of A:V1.  The Contractor shall \nprovide the County with a ce rtificate of insurance showing such insurance to be in force and providing that \nthe insurer shall give the County at least 30 days ' notice prior to cancellation or other termination of such \ninsurance.  \n\n14.   Loss or Damage in Transit  \n\n Delivery by a contractor t o a common carrier does not constitute delivery to state agencies or \npolitical subdivisions.  Any claim for loss or damage incurred during delivery shall be between the contractor \nand the carrier.  The state accepts title only when goods are received regar dless of the F.O.B. point.  The \nreceiving agency will note all apparent damages in transit on the freight bill and notify the contractor.  \nDiscovery of concealed damages or loss will be reported by the receiving agency to the carrier and the \ncontractor wit hin seven days of receipt and prior to removal from the point of delivery if possible.  The \ncontractor shall make immediate replacement of the damaged or lost merchandise or be in default of the \ncontract.  It shall be the contractor 's responsibility to file a claim against the carrier.  If damage is to a small \nquantity, with the approval of the agency, the contractor may deduct the amount of damage or loss from his \nor her invoice to the agency in lieu of replacement.  \n\n15.   Freight  \n\n By signing an I .F.B. the bidd er certifies that the bid price(s) offered for F.O.B. destination include \nonly the actual freight charges at the lowest and best rate and is based upon the actual weight of the goods to \nbe shipped.  Freight charges are, therefore, established for each indi vidual purchase.  If a requirement is bid \nF.O.B. origin, the contractor shall prepay the charges and add the amount to the invoice.  A copy of the \nfreight bill should be attached to all invoices that include freight charges.  In a solicitation specifying F .O.B. \norigin the state will consider freight cost in the evaluation of bids.  \n\n16.   Termination for Default    \n\nIn case of default by a contractor for failure to deliver or perform in accordance with the contract \nspecifications or terms and conditions, the County  may procure the articles or services from other sources and \nhold the defaulting contractor responsible for any resulting additional purchase and administrative costs.  The \nCounty will normally repurchase from the next low bidder or purchase competitively by resolicitation.  If the \nrepurchase results in increased costs to the County, a letter will be sent to the defaulted contractor required \npayment for additional costs.  When repayment is requested, the contractor will be removed from future \nbidding until the repayment has occurred.  Contractors shall not be liable for any excess cost if the failure to \nperform arises out of any act of war, order of legal authority, strikes, act of God, or other unavoidable causes   3 | Page  \nEngineering Services RFP #2020 -05-21 \n not attributed to their fault or negligence.   Failure of a contractor 's source to deliver is generally not \nconsidered to be an unavoidable cause.  The burden of proof rests with the contract.  \n\nRemainder of this page left blank.  \n\n ",
        " \n\n \n\n \n\n \n\n \n\n   4 | Page  \nEngineering Services RFP #2020 -05-21 \n 17.   Insurance and Bond Requirements  \n\n The Contractor shall maintain the following insurance to protect it from claims under the Workmen 's \nCompensation Act, and from any other claims for personal injury, including death, and for damage to \nproperty that may arise from operations under the Contract, whether such operations be by itself or by any \nsubcontractor, or anyone directly or indirectly employed by either of them.  \n\n TYPE OF COVERAGE   LIMITS  \n\nWorkers ' Compensation and Employer 's Liability \nincluding coverage under United State s \nLongshoremen' s and Harbor Worker 's Act where \napplicable  Statutory, including Employer 's Liability of  \n$100,000.00 Each Accident  \n$500,000.00 Disease -Policy Limit  \n$100,000.00 Disease -Each Employee  \n\nComprehensive General Liability endorsement \ncoverages.  Including the Broad Form C.G.L.  ",
        " The Contractor hereby agrees to retain all books, records, and other documents relative to this \ncontract for five (5) years after final payment or after all other pending matters are closed, whichever is \nlonger.  The County and its authorized agents, state auditors, the grantor of the funds to the County, the \nComptroller of Virginia or of the United States, or any of their duly authorized representatives shall have \naccess to any books, documents, papers , and records of the Contractor which are directly pertinent to the \nspecific contract for the purpose of making audits, examinations, excerpts or transcriptions.  \n\n10.   Ownership of Documents  \n\n Any reports, studies, photographs, negatives, or other documents prepared by Contractor in the \nperformance of its obligations under any resulting contract shall be remitted to the County by the Contractor \nupon completion, termination or cancellation of this Contract.  Contractor shall not use, willingly allow or \ncause to have su ch materials used for any purpose other than performance of Contractor 's obligations under \nthis contract without the prior written consent of the County.  The County shall own the intellectual property \nrights to all materials produced under this contract.  \n\n11.   Payment and Performance Bond \n\n For any Contract for construction, the amount of which exceeds $100,000, the Contractor shall \nfurnish to the County the bonds required under Sections 2.2 -4336 and 2.2- 4337 of the Code and shall \notherwise fully comply with the requirements of such sections of the Code.  The County reserves the right to \nrequire payment and/or performance bonds in the amount of the Contract for any other Contracts, whether or \nnot required by such sections of the Code.  \n\n12.   Required Payment  \n\n Pursua nt to Section 2.2 -4354 of the Code, the Contractor covenants and agrees to:  \n\nA. within seven (7) days after receipt of any amounts paid to the Contractor under the \nContract, (i) pay any subcontractor for its proportionate share of the total payment receive d \nfrom the County attributable to the work under the Contract performed by such \nsubcontractor, or (ii) notify the County and the subcontractor, in writing, of its intention to \nwithhold all or a part of the subcontractor 's payment and the reason therefore;  \n   2 | Page  \nEngineering Services RFP #2020 -05-21 \n B. provide its federal employer identification number or social security number, as applicable, \nbefore any payment is made to the Contractor under the Contract; and  \n\nC. pay interest at the legal rate or such other rate as may be agreed to in writing by th e \nsubcontractor and the Contractor on all amounts owed by the Contractor that remain unpaid \nafter seven (7) days following receipt by the Contractor of payment from the County for \nwork performed by the subcontractor under the Contract, except for amounts w ithheld \npursuant to subparagraph 12a. above.  \n\nd. Include in its contracts with any and all subcontractors the requirements of a, b, and, c \nabove.  "
      ],
      "ground_truth_context": [
        "All designs shall conform to the latest County, state, and federal regulations or standards.",
        "Goods or services",
        "covered by the most favorable warranties",
        "Contractor will pay the full contract price if warranties are breached."
      ],
      "metadata": {
        "question_id": 179,
        "RFP_id": "infra_1",
        "RFP_type": "infra",
        "chunks": [
          3,
          6
        ],
        "manually_edited": true
      },
      "timing": {
        "retrieve_context": 0.0697639833797108,
        "llm_response": 0.5633459091186523,
        "total": 0.6331098924983631
      }
    },
    {
      "question": "What contact information must be included when submitting compliance documentation for the Tribune Building project?",
      "llm_response": "Insufficient information to answer question based on given context",
      "ground_truth_answer": "Submissions must include Chelsey Mazurek's phone number (715.423.3863) and email address (cmazurek@incouragecf.org).",
      "retrieved_context": [
        "Administration  \nUpon the execution of the Guaranteed Maximum Price Amendment, the Construction Manager  shall prepare and \nsubmit to the Owner and Architect a construction schedule for the Work.  The Construction Manager  shall \nupdate the Owner in writing on the progress of the Project on a monthly basis indicating the percentages of \ncompletion and other information required by the Owner.  \n\nThe Construction Manager  shall develop a system of cost control for the Work, inclu ding regular monitoring of \nactual costs for activities in progress (compared to the Schedule of Values) and estimates for uncompleted tasks \nand proposed changes. The Construction Manager  shall identify variances between actual and estimated costs \nand repor t the variances to the Owner and Architect and shall provide this information in its monthly repo rts to \nthe Owner and Architect.   \n Page 5 \nThe Construction Manager  shall comply with applicable laws, statutes, ordinances, codes, rules and regulations, \nand lawful or ders of public authorities applicable to its performance under this Contract, and with equal \nemployment opportunity programs, and other programs as may be required by governmental and quasi -\ngovernmental authorities for inclusion in the Contract Documents.  \n\n3. OWNER\u2019S  RESPONSIBILITIES  \n\nArchitect  \nThe Owner shall retain an Architect to provide Program Verification, Criteria  Design, Detailed Design, and \nImplementation  Document s related to the Project.  Architect and Engineering fees will be the responsibility of \nthe Owner and not included in the Guaranteed Maximum P rice.  \n\nEnvironme ntal Tests, Surveys and Reports  \nThe O wner shall be responsible for costs related to environmental studies, survey, and geotechnical services \nrelated to the Proj ect.  The Owner shall make  all studies, survey data, and results available to the Construction \nManager .  \n\nOwner\u2019s  Designated  Representative  \nThe Owner has engaged an Owner\u2019s Representative to assist Owner in decision making. When the Owner is \nrequired to act, any such action will be und ertaken by  the Owner\u2019s authorized representative with advice from \nthe Owner\u2019s Representative. The Owner\u2019s representative shall render decisions promptly and furnish information \nexpeditiously, so as to avoid unreasonable delay in the services or Work of the Construction Manager .  \n\n4. INSURANCE  AND  BONDS  \nFor all phases of the Project, the Construction Manager  shall purchase and maintain  the insurance required by \nthe Owner and to be set forth in the Construction Contract.  \n\n \n5. PROPOSAL FORMAT  \nThe proposal shall include the following information in the order indicated:  \na) Proposer Information:   Identify the firm\u2019s name and the address of its principal office and any branch offices, as \nwell as telephone number, e -mail address and website. Identify the single contact who is th e authorized \nrepresentative of the Proposer. Inclu de a brief history of the firm , number of full -time and part -time employees , \nand how you heard about/your interest in the Tribune Building Project . \nb) Organization: Provide an organizational chart graphically indicating how the firm would structure and staff the \nproposed team. Include delegation of responsibility and assignment of authority.  \nc) Personnel:  List specific  management and supervisory  personnel proposed for the project team. Indicate the \nproject assign ment and responsibilities of each  of the  management and supervisory individuals. Provide a \nresume for each proposed team member, specifically stating his or her experience and qualifications. State the \ncurrent and anticipated work assignments for each indi vidual. Include at least three client references, including \ncontact information, for each individual listed.  \nd) Hiring Practices:  Provide example(s) of your commitment to hiring and retaining a diverse workforce and \ncreating equitable working conditions.  Describe an employment practice that supports the growth of your staff. \nExplain how you determine equitable compensation for your staff.  \ne) Qualifications and  Experience:   Provide summaries  of three projects the Proposer has delivered. Include the \nname of the Owner or Developer of the project, its location, approximate budget, and the Proposer\u2019s specific \nrole in the project. Also provi de the name and contact information of a representative of the Owner or \nDeveloper from whom a reference can b e obtained.  \nf) Sustainability Experience: Provide example(s) of advanced sustainability projects the Proposer has been a part \nof. Include the name of the Owner or Developer of the project, its location, approximate budget, and the \nProposer\u2019s specific role in the project. Also provide the name and contact information of a representative of the \nOwner or Developer from whom a reference can be obtained.  \ng) Connection to Place: Provide example(s) of your demonstrated connection to place. If not situated in the local \ncommunity, it is especially important to be able to demonstrate in recent work examples a connection and \ncommitment to the place and people in which  your work was completed.  \nh) Self-Performed Work: Indicate and clearly define which elements of work your firm would propose to self -\nperform with its own forces. Describe your experience at performing this trade work.  Page 6 \ni) Subcontracted Work:  Include names, addr esses and descriptions of key subcontractors which your firm would \nemploy and a description of their relevant experience and past performance. Any subcontractors must be \nidentified in the  proposal. Please remember that after contract signing, Incourage Com munity Foundation \nreserves the right to approve all subcontractors that were not approved during the RFP process . \nj) Ability to Meet Timelines:   Provide a detailed summary of your current workload and future commitments over \nthe proposed timeline assuming a t wo-week turnaround from the submission of this proposal to the \ncommencement of services.  Submit your  expected duration in days for each pha se of the project.   \nk) Tax-Exempt Status: Describe how your firm will manage material purchases to take advantage of the tax exempt \nstatus of the Owner.  \nl) Fees:  \n\uf0b7 Pre-Construction Phase:  Provide the amount of, or basis for, compensation for the Pre Construction  Phase.  \nInclude a list of reimbursable cost items, as applicable.  \n\uf0b7 Construction Phase:   Provide the amount of, or basis for, compensation IN ADDITION to the cost listed in the \nEstimate  of Probable Cost  (Exhibit B).  The Proposer will guarantee to construct  the Project as described in \nthe P roject design documents for the amount specified in the Guaranteed Maximum Price Proposal and the \nfees quoted in this proposal subject to change orders mutually agreed upon by the Proposer and the Owner. \nNote: the Kitchen Equipment (line 11300) and the Brewery Equipment (line 11900) may be purchased \ndirectly by the Owner  from an equipment vendor who will work collaboratively with the  Construction \nManager to coordinate installation . \nm) Optional Additional Information:  Include additional information that may help the Owner more fully understand \nthe qualifications.  \n\n6. PROPOSAL SUBMITTAL  \nProposal s must be submitted and received by Incourage  no later than 4:00 p.m. on Friday, February 13, 2015.   \nProposal s may be s ubmitted by email or hard copy.  Proposal s should be submitted to:  \n\n Incourage Community Foundation  Inc. \n 478 E. Grand Avenue  \n Wisconsin Rapids WI 54494  \n Attention: Chelsey Mazurek  \n tribunebuilding@incouragecf.org   \n  \nIf only hard copy is delivered, Proposer should secure a receipt signed and time stamped by a member of the \nIncourage Community Foundation  staff.  If your proposal is emailed, note that all proposals received by the \ndeadline will be acknowledged via an e mail confirmation recei pt.  If you do not receive  an emailed confirmation \nreceipt, it is the Proposer\u2019s responsibility to ensure successful transmission and delivery via email.   ",
        " \nRequest for Proposal (RFP) \u2013 Tribune Building Project  \nIncourage Community Foundation,  Inc. (\u201cIncourage\u201d)  located in rural central Wisconsin, invites proposals  from \ninterested firms  for Construction Management services on the Tribune Building Project (located at 220 First \nAvenue South, Wisconsin Rapids).  \n\nSubmission Deadline:      Friday, February 13, 2015  at 4:0 0 p.m. CST  \n  \nTABLE OF CONTENTS  \n1 Project Information  \n2 Scope of Services \u2013 Construction Manager \u2019s Responsibilities  \n3 Owner\u2019s Responsibilities  \n4 Insurance and Bonds  \n5 Proposal Format  \n6 Proposal Submittal  \n7 Proposer \u2019s Site Visit &  Q&A Session  \n8 Final Selection  \n9 Additional Information Requests  \n  \n1. PROJECT INFORMATION  \n\n1.1   ABOUT INCOURAGE  \nEstablished in 1994, Incourage Community Foundation is a nationally recognized leader in place -based \nphilanthropy and community change efforts.  Incourage operates with a vision of a community that works well for \nall people. To achieve this vision, values of equity, inclusion and opportunity are applied to all work, and to the \nrelationships Incourage fosters to accomplish its work. To this end, Incourage strives to work with vendors and \nsubcontractors who:  \n\n\uf0b7 Are located in the local community or within a 200-mile radius;  \n\uf0b7 Hire qualified, diverse talent, who are equitably paid for their work;  \n\uf0b7 Value learning opportunities or practices, and building capacity of their team or others involved in the work;  \n\uf0b7 Can demonstrate a connection to place;  \n\uf0b7 Have an eye on sustainability (of environment and business) and have demonstrated a commi tment to \ncorporate social responsibility.  \n\nIncourage is seeking proposals to provide Construction Manag ement  services under an AIA A133 contract \nstructure with  a guaranteed maximum price on the major renovation of the Tribune Building, as described in this  \nRFP (the  \u201cProject\u201d  and sometimes the \u201cTribune Building Project\u201d) . The selected Proposer will become the \nConstruction Manager  (CM).  \n\n1.2 DELIVERY METHOD  \nThe delivery method for the Project is \u201c Construction Manager  at Risk\u201d ( CMAR), which consists of a n AIA A133 \nbased contract covering the pre -construction and construction phase.    \n\n1.3 PROJECT BACKGROUND  \nThe Project (tribunebuilding.org) began when Incourage Community Foundati on (incouragecf.org) purchased the \nhistoric Tribune Building  along the Wisconsin River with the intent that residen ts would decide its future use. To \ndate, over 750 community members have invested more than 4,400 hours in this resident -led decision making \nprocess.  As determined through this process, the Tribune Bu ilding is a social enterprise helping to shape a new \neconomy and co mmunity that works well for all.  \nPage 2 \nTo that end, the space will include a number of local entrepreneurial operations with benefit to the local \neconomy, including a culinary kitchen, microbrewe ry, cafe/brewpub, creative workshop, and re creational \nrentals . Further, as Incourage is committed to investing in the people who will inhabit the space as much as the \nfunctional space needed for production of their goods and services, the Tribune Building will effectively grow \nhuman talent simultaneous to the local economy.  \nThe Tribune Building\u2019s operational model is currently being developed to fully realize a space that advances the \nvalue and importance of relationships and human potential; an environment  that fosters and accepts failure; \ncreativity and innovation; and entrepreneurship.  \n1.4 COMMUNITY CONTEXT   \nIn 2000, the south Wood County area was devastated by economic hardships brought about by the sale of \nConsolidated Papers Inc. \u2013 a Fortune 500 paper company that had been headquartered in Wood County for more \nthan a century.  At its operating peak, the mill employed almost half of the region\u2019s workforce.  The dramatic \neconomic shift compelled a shift in community thinking and, in response , residents realized that complacency \nwould not serve their changed circumstances.   The Tribune Building Project seeks to support residents in \ndetermining their own identity.  By reimagining the building\u2019s future, residents are collectively shaping the \ncom munity\u2019s future.   \n\n1.5 PROPERTY SIGNIFICANCE  \nThe Tribune Building is centrally located downtown, beside the Wisconsin River and other community assets.  \nBoth the site and the 20,000 square foot building leverage historic, local significance and distincti veness that are \nalready meaningful and iconic for th e south Wood County area.  The Tribune B uilding is former home to the local \nnewspaper and radio station offices and embodies a unique mid -century modern \u2013 \u201cround \u201d structure design.  \nThe building\u2019s close p roximity to the Wisconsin River is also significant.  The revitalization will undoubtedly alter \nthe deeply rooted historical perspective of the river as a working asset \u2013 positioned to serve the local paper \nindustry. Once complete, the re -envisioned site w ill serve as a gateway for residents to experience the river as an \naccessible and cherished natural resource, public recreation place, and destination location for travelers.  The \nTribune Building\u2019s transformation is paramount to Wisconsin Rapids\u2019 downtown  and riverfront renaissance.   \n\nThe Project site address is 220 First Avenue South, Wisconsin Rapids.  \n\n\uf0b7 The Project Design Documents are provided in Exhibit A.  ",
        "7. PROPOSERS SITE  VISIT AND Q&A SESSION  \nThere will be an opportunity for prospective Proposers to participate in a site visit to examine the building and \nthe site on Wednesday, January 28, 2015 from 10:00 a .m. to 12:00 p.m. CST. Please RSVP for the site visit  by \ncontacting Chelsey Mazurek at cmazurek@incouragecf.org  or 715 -423-3863 .   \n\nThere will also be  an opportunity for prospective Proposers to participate  in a Q&A webinar on Tuesday,  \nFebruary 3, 2015 at 2:00 p.m. CST .  The purpose of the webinar is to give Proposers the opportunity to ask \nquestions regarding the Project, as well as the RFP submission requirements. Please RSVP for the webinar by \ncontacting Chelsey Mazurek at cmazurek@incouragecf.org  or 715 -423-3863.  Chelsey will email the log -in \ninformation to the key points of contact at each firm who have RSVP\u2019d for the webinar.  \n\nProposers may also submit questions concerning the P roject in written form via email or fax to the Owner with a \ncopy  to the Architect until 4:30 p.m. CST on Tuesday, February 10, 2015 . Proposers will receive  a reply no later \nthan  4:30 p .m. on Thursday , February 12, 2015.  \n\n8. FINAL SELECTION  \nThe pr oposals will be reviewed by a committee established by Incourage Community Foundation. Selection will be \nbased on the qualifications and experience of the Proposer; its ability to  meet project timelines; the level of \nunderstanding of  and commitment to achi eve the Project\u2019s principles and objectives ; and proposed fees.  Successful Page 7 \nproposals will also demonstrate:  \n\uf0b7 Prior experience with Integrated Project / Construction Management -at-risk delivery methods (completion \nof at least one project over $ 8M in construction costs) ; \n\uf0b7 Prior experience with delivering projects that have achieved sustainability benchmarks (e.g. LEED , Living \nBuilding Challenge ); \n\uf0b7 Qualified personnel  with experience collaborating with Architects and Engineers during Design Phases ; \n\uf0b7 Qualified Cost Estimators on staff.  \nAll Proposers will be notified of their selection  for interviews  no later than February 27, 2015.   \n\nThis Request for Proposal  does not commit Incourage Community Foundation to award a contract, to pay any \ncosts incurred  in the preparation of a proposal or to contract for the goods and/or services offered . Incourage \nCommunity Foundation  reserves the right to accept or reject any or all proposals received as a result of this \nrequest, to negotiate with all qualified Propose rs or to cancel this Request for Proposals, if it is in the best \ninterests of Incourage Community Foundation to do so.  \n\nAfter the selection of a C onstruction Manager,  the schedule should include a period of collaboration between \nIncourage Community Founda tion and the C onstruction Manager  to better define, elaborate upon and fix the \nConstruction Manager \u2019s exact and final scope of Work (the \u201cFinal Scope\u201d) . \n\nThe successful Proposer  should be available to begin work, and should be prepared for project activities to \ncommenc e, immediately upon selection. Please refer to Exhibit C \u2013 Project Timeline.  Your submission of a \nproposal  to this RFP acknowledges your ability to work within this timeline  but also acknowledges that there may \nbe adjustments to the timeline as the Project evolves . Proposers are  asked to carefully review and note all \nconstruction start dates, completion dates, and other notable objectives outlined in the attached t imeline.    \n\nPlease note: non -selection as the Construction Manager under this RFP does not impact the Proposer\u2019s \nopportunity to participate in the Project as a sub -contractor.    \n\n9. ADDITIONAL INFORMATI ON REQUESTS  \nQuestions regard ing the design elements of th e Project should be directed to:  \n  \n Graham Hill, Architect  \n Concordia LLC. \n 504.458.8081  \n ghill@concordia.com  \n\nQuestions regarding the proposal  or oth er general questions about the P roject should be directed to:  \n  \n Chelsey Mazurek, Tribune Building Project Manager  \n Incourage Community Foundation  Inc. \n 715.423.3863  \n cmazurek@incouragecf.org   \n   ",
        "\uf0b7 An Estimate  of Probable Costs is provided in Exhibit B . \n\n\uf0b7 A Project Timeline  is provided  in Exhi bit C.  \n\nAll Exhibits are attached to and made part of this RFP.  \n\n1.6 CONSTRUCTION MANAGEMENT AT RISK PROJECT DELIVERY  BACKGROUND INFORMATION (Source: The American \nInstitute of Architects)  \nConstruction Management at -risk is a process that allows the  Owner  of a Project to choose the Construction \nManager before the design stage is complete. The Construction Manager is chosen based on qualifications, and \nthen the entire operation is centralized under a single contract. The Architect and Construction Manager w ork \ntogether in order to cultivate and assay the design. Then, the Construction Manager gives the client a \nGuaranteed Maximum Price, and coordinates all subcontract work. The Architect/Engineer is hired separately \nfrom the Construction Manager at -risk and the traditional client \u2013 Architect/Engineer relationship is maintained.  \n\n2. SCOPE OF SERVICES \u2013 CONSTRUCTION MANAGER \u2019S RESPONSIBILITIES  \nThe Construction Manager \u2019s Preconstruction Phase responsibi lities are set forth in Section  2.1. The Construction \nManager \u2019s Construction Phase responsibilities are set forth in Section 2.2. The Owner and Construction Manager  \nmay agree, in consultation with the Architect, for the Construction Phase to commence prior to completion of \nthe Preconstruction Phase, in which case, both  phases will proceed concurrently. The Construction Manager  shall \nidentify a representative authorized to act on behalf of the Construction Manager  with respect to the Project.   Page 3 \nThe Construction Manager  will be required to hold a Construction Manager s\u2019 license  (or applicable license)  valid \nfor the State of Wisconsin . \n\n2.1 PRECONSTRUCTION PHASE  \n\n Consultation  \nThe Construction Manager  shall meet with the Architect and Owner to discuss such matters as procedures, \nprogress, coord ination, and scheduling of th e work. The Construction Manager  shall advise the Owner and the \nArchitect on proposed site use and improvements , selection of materials, and building systems and equipment. \nThe Construction Manager  shall also provide recommendations consistent with the Pro ject requirements to the \nOwner and Architect on constructability; availability of materials and labor; time requirements for procurement, \ninstallation and construction; and factors related to construction cos t including, but not limited to:  costs of \naltern ative designs or materials, preliminary budgets, life -cycle data, and possible cost reductions.  \n\nThe Construction Manager  shall provide recommendations with regard to accelerated or fast -track scheduling, \nprocurement, or phased construction. The Construction Manager  shall take into consideration cost reductions, \ncost information, constructability, provisions for temporary facilities and procurement and construction \nscheduling issues.   \n\nPreliminary  Cost  Estimates  \nBased on the preliminary design and  other design criteria, the Architect has prepared an Estimate  of Probable \nCost (Exhibit B). If the Architect or Construction Manager  suggests alternative materials and systems, the \nConstruction Manager  shall provide cost evaluations of those alternative m aterials and systems.  \n\nAs the Architect progresses with the preparation of the Design  Documents, the Construction Manager  shall \nprepare  estimates of the Cost of the Work of increasing detail and refinement and allowing for the further \ndevelopment of the de sign until such time as the Owner and Construction Manager  agree on a Guaranteed \nMaximum Price for the Work. Such estimates shall be provided for the Architect\u2019s review and the Owner\u2019s \napproval  prior to the completion of each phase . The Construction Manage r shall inform the Owner and Architect \nwhen estimates of the Cost of the Work exceed the latest approved Project budget and make recommendations \nfor corrective action.   ",
        "Guaranteed  Maximum  Price  Proposal  and Contract  Time  \nAt a time to be mutually agreed up on by the Owner and the Construction Manager  and in consultation with the \nArchitect, the Construction Manager  shall prepare a detailed line item  Guaranteed Maximum Price Proposal for \nthe Owner\u2019s review and acceptance.  The Guaranteed Maximum Price in the pr oposal shall be the sum of the \nConstruction Manager \u2019s estimate of the Cost of the Work and the Construction Manager \u2019s Fee for the \nConstruction Phase as quoted in the Proposer\u2019s response to this RFP.  \n\nThe Construction Manager  shall include with the Guarant eed Maximum Price proposal a written statement of its \nbasis, which shall include the following:  \n 1. A list of the Drawings and Specifications, including all Addenda thereto, and the Conditions of the \nContract;  \n 2. A list of the clarifications and assumptions made by the Construction Manager  in the preparation of \nthe Guaranteed Maximum Price proposal,  \n 3. A statement of the proposed Guaranteed Maximum Price, including a statement of the estimated \nCost of the Work organized by trade categories or systems, allowances, contingency, and the \nConstruction Manager \u2019s Fee;  \n 4. A schedule of milestones for the comple tion and the anticipated date of Substantial Completion upon \nwhich the proposed Guaranteed Maximum Price is based;  \n 5. A Schedule of Value for each component of work to be undertaken; and \n 6. A date by which the Owner must accept the Guaranteed Maximum Pr ice.  \n\nThe Construction Manager  shall meet with the Owner and Architect to review the Guaranteed Maximum Price \nproposal.  Once a Guaranteed Maximum Price has been agreed upon by all parties, the Owner and Construction \nManager  shall execute the Guaranteed M aximum Price Amendment to the Contract.  The Guaranteed Maximum Page 4 \nPrice Amendment shall set forth the agreed upon Guaranteed Maximum Price with the information and \nassumptions upon which it is based  and shall include a Schedule of Values .  \n\nThe Construction Manager  shall guarantee that the Contract Sum shall not exceed the Guaranteed Maximum \nPrice set forth in the Guaranteed Maximum Price Amendment, as it is amended from time to time.  To the extent \nthe Cost of the Work exceeds the Guaranteed Maximum Price, t he Construction Manager  shall bear such costs in \nexcess of the Guaranteed Maximum Price without reimbursement or additional compensation from the Owner.   \nThe Construction Manager will acknowledge that the Construction Manager is an experienced contractor a nd \nthat (subject to Acts of God) the Project can be completed for Guaranteed Maximum Price.  \n\nSubcontractors  and Suppliers  \nThose portions of the Work that the Construction Manager  does not customarily perform with the Construction \nManager \u2019s own personnel s hall be performed under subcontracts or by other appropriate agreements with the \nConstruction Manager . The Owner may designate specific persons from whom, or entities from which, the \nConstruction Manager  shall obtain bids. Subcontractors must be located 50 miles  or less from the Project site , \nunless a greater distance is approved by the Owner.  The Construction Manager  shall obtain at least three \nproposals from Subcontractors and from suppliers of materials or equipment fabricated especially for the Work \nand shall deliver suc h proposals  to the Owner. The Owner shall then determine, with the advice of the \nConstruction Manager  and the Architect, which bids will be accepted. The Construction Manager  shall not be \nrequired to contract with anyone to whom the Const ruction Manager  has reasonable objection.  \n\nIf the Guaranteed Maximum Price has been established and a specifi c subcontractor or supplier  (1) is \nrecommended to the Owner by the Construction Manager , (2) is qualified to perform that portion of the Work, \nand (3) has submitted a  proposal  that conforms to the requirements of the Contract Documents without \nreservations or exceptions, but the Owner requires that another  proposal  be accepted, then the Construction \nManager  may require that a Change Order be issued t o adjust the Guaranteed Maximum Price by the difference \nbetween the bid of the person or entity recommended to the Owner by the Construction Manager  and the \nproposal  of  the person or entity designated by the Owner.  \n\n2.2 CONSTRUCTION PHASE  \n\nThe Construction Phase shall commence upon the execution of the Guaranteed Maximum Price Amendment or \nthe Owner\u2019s issuance of a Notice to Proceed, whichever occurs earlier.  \n\nChanges  in the Work  \nThe Owner may, without invalidating the Contract, order changes in  the Work within the general scope of the \nContract consisting of additions, deletions or other revisions. The Architect  shall issue such changes in writing  \nand all change orders will be signed and acknowledged by Owner and Construction Manager . The Constru ction \nManager  shall be entitled to an equitable adjustment in the Contract Time as a result of changes in the Work.  \n\nChange orders issued by the Owner subsequent to the execution of the Guaranteed Maximum Price Amendment \nshall constitute adjustments to the  Guaranteed Maximum Price.  "
      ],
      "ground_truth_context": [
        "Chelsey Mazurek, Tribune Building Project Manager Incourage Community Foundation Inc. 715.423.3863 cmazurek@incouragecf.org"
      ],
      "metadata": {
        "question_id": 146,
        "RFP_id": "infra_2",
        "RFP_type": "infra",
        "chunks": [
          5
        ],
        "manually_edited": false
      },
      "timing": {
        "retrieve_context": 0.0697639833797108,
        "llm_response": 3.4402990341186523,
        "total": 3.5100630174983634
      }
    },
    {
      "question": "What indemnification obligations does the Architect have under Section 7.3.1?**",
      "llm_response": "The Architect agrees to indemnify, save and hold harmless, and defend at its expense, the Owner and related parties from claims, suits, actions, damages, fees, penalties, and liabilities arising out of rights or claims of rights in the Drawings and Specifications or other documents. The Architect shall also defend against claims charging infringement of copyrights or patents due to the use of any designs, Drawings, or Specifications supplied by it and shall hold the Owner harmless from related claims, losses, damages, liability",
      "ground_truth_answer": "The Architect must defend and indemnify the Owner against claims related to copyright/patent infringement or disputes over ownership of the Drawings.",
      "retrieved_context": [
